,id,date,tweet,hashtags,user_id,username,name,link,urls,nlikes,nretweets,nreplies
0,1392183157001048073,2021-05-11 23:51:44,"The farmers' protest against the Farm Bills has been going on at the Tikri border for several months now. The victim had come all the way from Bengal to participate in this protest, where the communist leaders under the garb of farmers, assaulted her sexually.",[],301382741,ABVPVoice,ABVP,https://twitter.com/ABVPVoice/status/1392183157001048073,[],18,7,1
1,1392149785940054016,2021-05-11 21:39:08,"Thank you, @ACC_National!  I’m proud to cosponsor the bipartisan Growing Climate Solutions Act. I have no doubt this bill will open doors for South Carolina’s farmers and foresters, and I look forward to passing it in the Senate.",[],217543151,SenatorTimScott,Tim Scott,https://twitter.com/SenatorTimScott/status/1392149785940054016,[],408,61,30
2,1392096185889042433,2021-05-11 18:06:09,"With around 25,000 farms in Northern Ireland, most of which are small and family-run, it is important we support our farmers to transition to sustainable farming systems. Speaking on the Climate Change Bill, this is what @JohnBlairMLA had to say.👇  https://t.co/KtoisiVnhw",[],22997097,allianceparty,Alliance Party,https://twitter.com/allianceparty/status/1392096185889042433,[],31,12,3
3,1392071998914838530,2021-05-11 16:30:02,Listen as I call on farmers to bring forward their concerns regarding the Climate Change Bill &amp; help shape the changes this piece of legislation is trying to affect. We need to ensure farming practices are sustainable in the long term &amp; their input will be invaluable. @SDLPlive  https://t.co/wM3zb01gtS,[],2842541319,SineadBradleySD,Sinéad Bradley MLA,https://twitter.com/SineadBradleySD/status/1392071998914838530,[],7,0,0
4,1392070200573546498,2021-05-11 16:22:53,"A bill that would legalize medical marijuana in South Carolina is on the calendar for debate at the State House.  If passed, I take a look at who would be able to get medical marijuana and how hundreds of farmers in SC could be ready to grow it. @Live5News  https://t.co/TXkhgwaOyA",[],1912145172,MichalHigdon,Michal Higdon,https://twitter.com/MichalHigdon/status/1392070200573546498,['https://www.live5news.com/2021/05/10/medical-marijuana-steps-away-legalization-south-carolina/'],0,1,0
0,1392126206485610497,2021-05-11 20:05:26,The Joint Committee on Agriculture and the Marine meets to discuss the Sea Fisheries Bill with Sea Fisheries Protection Authority and Fishing Organisations from across the country #seeforyourself   https://t.co/EP0QExhuQg  https://t.co/HdIG2eH3m5,['seeforyourself'],46627286,OireachtasNews,Houses of the Oireachtas - Tithe an Oireachtais,https://twitter.com/OireachtasNews/status/1392126206485610497,"['https://www.oireachtas.ie/en/oireachtas-tv/cr3-live/', 'https://twitter.com/i/broadcasts/1ZkJzermrVgGv']",0,0,0
0,1392100003762642945,2021-05-11 18:21:19,"Disappointing that all of the complaints are on the side of reducing the revenue.  That said, there is a bit difference between ditching this policies and tinkering with them.  Corp rate of 26%, capita gains rate of 30%, and carry-over basis for farms would still get lots of $$.",[],420034061,MarcGoldwein,Marc Goldwein - GET VAXXED!,https://twitter.com/MarcGoldwein/status/1392100003762642945,[],7,1,1
1,1392075284652961793,2021-05-11 16:43:06,"It speaks volumes that there was nothing in the Government's #QueensSpeech about supporting British farming.  Conservatives have abandoned farmers, and their policies have put the future of hundreds of small family farms at risk.  Only @LibDems will stand up for British farming.",['queensspeech'],80021045,timfarron,Tim Farron,https://twitter.com/timfarron/status/1392075284652961793,[],238,84,7
0,1392208190679310337,2021-05-12 01:31:13,Samyukta Kisan Morcha says farmers returning to protest sites after harvest season   https://t.co/WaDdrPf8ND #FarmersProtest,['farmersprotest'],18159588,Oneindia,Oneindia News,https://twitter.com/Oneindia/status/1392208190679310337,['http://www.oneindia.com/india/samyukta-kisan-morcha-says-farmers-returning-to-protest-sites-after-harvest-season-3258017.html'],1,0,0
1,1392200546753282050,2021-05-12 01:00:50,போராட்டத்தில் ஈடுபட்டுள்ள விவசாயிகள் திக்ரி எல்லையை விட்டு வெளியேற வேண்டும் - பா.ஜனதா வலியுறுத்தல் #Tikri #FarmersProtest #BJP    https://t.co/Lq1qb5b1jw,"['tikri', 'farmersprotest', 'bjp']",233899475,dinathanthi,DailyThanthi,https://twitter.com/dinathanthi/status/1392200546753282050,['https://www.dailythanthi.com/News/India/2021/05/12005607/Protesting-farmers-should-vacate-Tikri-site-BJPs-Kisan.vpf'],7,2,1
2,1392166903049764869,2021-05-11 22:47:09,@thegentlemansho Do you read what you write ? You need a psychiatrist mate !  Go and consult one !  Kehnda technology ki baat karte ho n #farmersprotest ko support karte ho hahahaha  Are you serious ? Nice entertainment reading your tweets lol 😂,['farmersprotest'],865862801385865216,Armaan_Bedil_,Armaan Bedil,https://twitter.com/Armaan_Bedil_/status/1392166903049764869,[],0,0,1
3,1392160478122573829,2021-05-11 22:21:37,"ಲೈಂಗಿಕ ದೌರ್ಜನ್ಯ: ಯೋಗೇಂದ್ರ ಯಾದವ್, ಉಗ್ರಾಹಾನ್‌ಗೆ ಮಹಿಳಾ ಆಯೋಗದಿಂದ ನೋಟಿಸ್  #FarmersProtest  https://t.co/WELp5Z5w4J",['farmersprotest'],199202745,prajavani,Prajavani,https://twitter.com/prajavani/status/1392160478122573829,['https://www.prajavani.net/india-news/ncw-issues-notices-to-yogendra-yadav-ugrahan-over-reports-of-sexual-assault-on-woman-activist-829793.html'],4,0,0
4,1392121062691721216,2021-05-11 19:45:00,#OLMag | Farmers in Punjab welcome direct payment for their produce bypassing commission agents. Their protest against the new farm laws is no deterrent. @RakeshTikaitBKU @OfficialBKU By @guisingh | Read for ₹ 2/- #Punjab #FarmersProtest #FarmLaws  https://t.co/1VsV6jU8HN,"['olmag', 'punjab', 'farmersprotest', 'farmlaws']",22763833,Outlookindia,Outlook Magazine,https://twitter.com/Outlookindia/status/1392121062691721216,['https://magazine.outlookindia.com/story/india-news-market-shifts-middle-ground/304518'],1,1,0
5,1392113841828352000,2021-05-11 19:16:18,JAP chief Pappu Yadav held for flouting lockdown rules in Bihar     https://t.co/HyOeW3LVVW #FarmersProtest,['farmersprotest'],18159588,Oneindia,Oneindia News,https://twitter.com/Oneindia/status/1392113841828352000,['http://www.oneindia.com/india/jap-chief-pappu-yadav-held-for-flouting-lockdown-rules-in-bihar-3257858.html'],1,0,0
6,1392096929962553353,2021-05-11 18:09:06,"किसान आंदोलन: कोरोना से बचने के लिए बंट रहा काढ़ा, प्रदर्शनकारी बोले- सरकार ने कुछ नहीं किया  https://t.co/bQ3iS9oX0t #farmersprotest #coronavirusvaccine #farmer #delhi #ghaziabad #haryana #coronavirus #किसानआंदोलन #किसान #कोरोनावायरस","['farmersprotest', 'coronavirusvaccine', 'farmer', 'delhi', 'ghaziabad', 'haryana', 'coronavirus', 'किसानआंदोलन', 'किसान', 'कोरोनावायरस']",18186549,oneindiaHindi,Oneindia Hindi,https://twitter.com/oneindiaHindi/status/1392096929962553353,['https://hindi.oneindia.com/news/delhi/to-improve-the-immunity-of-farmers-protesters-langars-serve-them-kadha-mask-sanitizer-617339.html'],3,0,0
7,1392089620913946625,2021-05-11 17:40:04,कोरोना का खौफ: प्रदर्शन कर रहे किसानों को लंगर के साथ दिया जा रहा काढ़ा  https://t.co/oNd88nnMYy  #nationalnews #farmersprotest #coronavirus #Infectionfreecampaign #covid9vaccine  https://t.co/lub4OnwcGn,"['nationalnews', 'farmersprotest', 'coronavirus', 'infectionfreecampaign', 'covid9vaccine']",80304808,punjabkesari,Punjab Kesari,https://twitter.com/punjabkesari/status/1392089620913946625,['https://m.punjabkesari.in/national/news/farmers-protest-langer-corona-virus-1382323?utm_source=twitterbot&utm_medium=social'],11,0,0
8,1392088882426957825,2021-05-11 17:37:07,COVID 19: What Not To Do In A Pandemic Ft. Covidiots @nabilajamal_   #NewsMo #Covid19 #Coronavirus #Covidiots #Eid #Gujarat #KumbhMela #Birthday #TRS #Hyderabad #FarmersProtest #Vertical  https://t.co/ojkBSbaErz,"['newsmo', 'covid19', 'coronavirus', 'covidiots', 'eid', 'gujarat', 'kumbhmela', 'birthday', 'trs', 'hyderabad', 'farmersprotest', 'vertical']",19897138,IndiaToday,IndiaToday,https://twitter.com/IndiaToday/status/1392088882426957825,[],33,14,12
9,1392087347718606848,2021-05-11 17:31:02,किसान आंदोलन में रेप केस के 6 आरोपियों के खिलाफ एफआईआर दर्ज की गई। #FarmersProtest   https://t.co/lVC2mBQgcA,['farmersprotest'],108852592,Live_Hindustan,Hindustan,https://twitter.com/Live_Hindustan/status/1392087347718606848,['https://www.livehindustan.com/ncr/story-haryana-police-sit-formed-to-investigate-rape-case-in-farmers-protest-at-tikri-border-police-sent-notices-to-all-accused-including-yogendra-yadav-4024728.html'],70,4,4
10,1392065382559539205,2021-05-11 16:03:45,ਕਿਸਾਨ ਅੰਦੋਲਨ ਦੇ ਕੁੱਝ ਆਗੂ ਨੂੰ ਸੀ ਪੀੜਤ ਮਹਿਲਾ ਦੇ ਜਿਨਸੀ ਸ਼ੋਸ਼ਣ ਦੀ ਜਾਣਕਾਰੀ ? ਹੁਣ ਸੰਯੁਕਤ ਕਿਸਾਨ ਮੋਰਚਾ ਕਰੇਗਾ ਜਾਂਚ   #FarmersProtest #FarmLaws #IndiaNews #SexualAbuse  ਇੱਥੇ ਪੜ੍ਹੋ ਪੂਰੀ ਖ਼ਬਰ:  https://t.co/LV9LYnNmBY,"['farmersprotest', 'farmlaws', 'indianews', 'sexualabuse']",1037022253,abpsanjha,ABP Sanjha,https://twitter.com/abpsanjha/status/1392065382559539205,['https://punjabi.abplive.com/news/india/some-leaders-of-the-peasant-movement-know-about-the-sexual-abuse-of-the-victim-now-the-sanyukt-kisan-morcha-will-investigate-the-matter-621561'],0,0,0
11,1392045564662063105,2021-05-11 14:45:00,#OLMag | Farmers in Punjab welcome direct payment for their produce bypassing commission agents. Their protest against the new farm laws is no deterrent. @RakeshTikaitBKU @OfficialBKU By @guisingh | Read for ₹ 2/- #Punjab #FarmersProtest #FarmLaws  https://t.co/1VsV6kbK6n,"['olmag', 'punjab', 'farmersprotest', 'farmlaws']",22763833,Outlookindia,Outlook Magazine,https://twitter.com/Outlookindia/status/1392045564662063105,['https://magazine.outlookindia.com/story/india-news-market-shifts-middle-ground/304518'],1,0,0
12,1392023776120897537,2021-05-11 13:18:25,A Delhi - based trust seeks SC intervention to clear blockades put up due to farmers' protest at New Delhi's borders due to Covid-19.  https://t.co/SFb0rnYxxC  #FarmersProtest  #COVID19India  #Covid,"['farmersprotest', 'covid19india', 'covid']",938800345236439040,ieDelhi,Express Delhi-NCR 😷,https://twitter.com/ieDelhi/status/1392023776120897537,['https://indianexpress.com/article/cities/delhi/plea-seeks-sc-intervention-to-clear-blockades-put-up-due-to-farmers-protest-7310069/'],12,3,1
13,1392020807967141888,2021-05-11 13:06:37,ರೈತ ಪ್ರತಿಭಟನೆಗೆ ಬಂಗಾಳದಿಂದ ಬಂದವಳ ಮೇಲೆ ರೇಪ್‌: ಸಾವು #FarmBill #FarmersProtest #Covid19 #WestBengal  https://t.co/7YQPZdXdBV,"['farmbill', 'farmersprotest', 'covid19', 'westbengal']",291585081,AsianetNewsSN,Asianet Suvarna News,https://twitter.com/AsianetNewsSN/status/1392020807967141888,['http://kannada.asianetnews.com/india-news/activist-from-bengal-raped-on-way-to-join-farmers-protest-at-tikri-later-dies-due-to-covid-pod-qsxi1k'],4,0,2
14,1392019353206345730,2021-05-11 13:00:50,Haryana police have registered an FIR against six people for the alleged gangrape of a 26-year-old woman who was participating in the farmers' protest at the Tikri border.  @sakshi_dayal reports  https://t.co/6Gzh8Rosi2  #FarmersProtest  #COVID19India #Covid,"['farmersprotest', 'covid19india', 'covid']",938800345236439040,ieDelhi,Express Delhi-NCR 😷,https://twitter.com/ieDelhi/status/1392019353206345730,['https://indianexpress.com/article/cities/delhi/fir-names-six-in-gangrape-of-26-year-old-at-tikri-protest-site-7309577/'],23,10,3
15,1392018271537221650,2021-05-11 12:56:33,ಟಿಕ್ರಿ ಗಡಿಯಲ್ಲಿ ಮಹಿಳಾ ಕಾರ್ಯಕರ್ತೆಯೊಬ್ಬರ ಮೇಲೆ ನಡೆದಿರುವ ಲೈಂಗಿಕ ದೌರ್ಜನ್ಯದ ಬಗ್ಗೆ ಕೆಲವು ರೈತ ನಾಯಕರಿಗೆ ತಿಳಿದಿತ್ತು ಎಂಬ ಆರೋಪದ ಕುರಿತು ತನಿಖೆ ನಡೆಸುವುದಾಗಿ ಸಂಯುಕ್ತ ಕಿಸಾನ್ ಮೋರ್ಚಾ (ಎಸ್‌ಕೆಎಂ) ಸೋಮವಾರ ತಿಳಿಸಿದೆ.  #Farmersprotest #SKM #Covid19  https://t.co/BRTGTThKMW,"['farmersprotest', 'skm', 'covid19']",199202745,prajavani,Prajavani,https://twitter.com/prajavani/status/1392018271537221650,['https://www.prajavani.net/india-news/skm-to-probe-allegation-that-farmers-protest-leaders-were-aware-of-sexual-assault-of-woman-activist-829676.html'],5,0,0
16,1392007342548406275,2021-05-11 12:13:07,"मेरे सभी किसान भाईयों को #हाली_अमावस्या की ढेर सारी शुभकामनाएँ, राम राम सा 🙏  #आंदोलन_किसानों_की_मजबूरी #FarmersProtest #JaiKisan","['हाली_अमावस्या', 'आंदोलन_किसानों_की_मजबूरी', 'farmersprotest', 'jaikisan']",1029019642965184512,MahipalMahla,Mahipal Mahla,https://twitter.com/MahipalMahla/status/1392007342548406275,[],330,14,5
17,1392007045017071617,2021-05-11 12:11:56,"ਕਿਸਾਨਾਂ ਨੇ ਅੰਬਾਨੀ ਦੇ 5G ਨੈਟਵਰਕ ਦਾ ਕੰਮ ਕਰਵਾਇਆ ਬੰਦ, ਘੇਰੀ ਮਸ਼ੀਨ  #FarmersProtest #MukeshAmbani #PunjabNews #Sangrur  ਇੱਥੇ ਪੜ੍ਹੋ ਪੂਰੀ ਖ਼ਬਰ:  https://t.co/nkO3LRYtOn","['farmersprotest', 'mukeshambani', 'punjabnews', 'sangrur']",1037022253,abpsanjha,ABP Sanjha,https://twitter.com/abpsanjha/status/1392007045017071617,['https://punjabi.abplive.com/news/punjab/farmers-suspends-ambanis-5g-network-work-captured-machine-621532'],1,0,0
18,1391991929450098693,2021-05-11 11:11:52,"देश में ऐसी घटना होने पर तुरंत केंद्र के खिलाफ आवाज़ उठाने वाले आज खुद के किए रेप पर चुप्पी साधे हुए हैं।  इतनी शर्मनाक घटना आपके आंदोलन के दौरान हुई ,और ये जानते हुए भी आप सभी किसान नेता चुप रहे। शायद यहाँ आवाज़ उठाना आपके अजेंडे के खिलाफ हो जाता ?  #FarmersProtest  https://t.co/PGdCMf3aDS",['farmersprotest'],874157452391993344,MundaNilkanth,Nilkanth Singh Munda,https://twitter.com/MundaNilkanth/status/1391991929450098693,[],7,2,0
19,1391975100447133698,2021-05-11 10:05:00,किसान-मजदूर घमंडी सरकार के घुटने टिका कर रहेगा: नफे सिंह नैन  #Haryana #farmersprotest #KisanAndolan    https://t.co/MwwbgBYuxi,"['haryana', 'farmersprotest', 'kisanandolan']",64639742,JagranNews,Dainik Jagran,https://twitter.com/JagranNews/status/1391975100447133698,['https://www.jagran.com/haryana/jind-farmer-laborers-will-remain-on-the-knees-of-the-arrogant-government-21633646.html'],48,1,2
2,1392183161329643521,2021-05-11 23:51:45,"ABVP demands immediate action and severe punishment to the perpetrators.  National General Secretary Nidhi Tripathi said, ""This so called farmers' protest is being used as a shield to assault women, and it is happening under the evil protection of the Leftists leaders...”",[],301382741,ABVPVoice,ABVP,https://twitter.com/ABVPVoice/status/1392183161329643521,[],86,19,1
4,1392183153620488192,2021-05-11 23:51:43,ABVP condemns the gruesome gangrape of a participant by leftist and separatist leaders in the guise of farmers' protest. We reiterate our demand of strict punishment according to Indian Penal Code for the perpetrators.,[],301382741,ABVPVoice,ABVP,https://twitter.com/ABVPVoice/status/1392183153620488192,[],14,6,1
5,1392183151519141888,2021-05-11 23:51:43,"ABVP demands a high level enquiry into the gangrape &amp; death of the 25 year old woman who had gone to participate in farmers' protest.Covid is being cited as the alleged reason behind her death, this claim &amp; attempt of hiding the incident by political persons must be investigated.",[],301382741,ABVPVoice,ABVP,https://twitter.com/ABVPVoice/status/1392183151519141888,[],14,8,1
8,1392151920224071682,2021-05-11 21:47:37,"The Samyukta Kisan Morcha (SKM), an umbrella body of over 40 farmer unions, on Tuesday said that farmers were returning to Singhu and Tikri border protest sites after finishing harvesting their crops    https://t.co/ns8Bbcs008",[],39743812,EconomicTimes,Economic Times,https://twitter.com/EconomicTimes/status/1392151920224071682,['https://economictimes.indiatimes.com/news/politics-and-nation/farmers-returning-to-protest-sites-after-harvest-season-samyukta-kisan-morcha/articleshow/82552300.cms?utm_source=contentofinterest&utm_medium=text&utm_campaign=cppst'],25,3,1
9,1392135413720961025,2021-05-11 20:42:01,Farmers returning to protest sites after harvest season: Samyukta Kisan Morcha  https://t.co/OrG76kkaOY,[],1066972567943053312,HindustanTimes,Hindustan Times,https://twitter.com/HindustanTimes/status/1392135413720961025,['https://www.hindustantimes.com/india-news/farmers-returning-to-protest-sites-after-harvest-season-samyukta-kisan-morcha-101620745102269.html'],1,0,0
10,1392134876162256903,2021-05-11 20:39:53,The BJP's 'Kisan Morcha' on Tuesday questioned the alleged silence of Delhi Chief Minister Arvind Kejriwal and the leaders of protesting farmer unions over the alleged sexual assault on a woman activist at the Tikri border protest site.  https://t.co/73q3oiHMQa,[],39743812,EconomicTimes,Economic Times,https://twitter.com/EconomicTimes/status/1392134876162256903,['https://economictimes.indiatimes.com/news/politics-and-nation/protesting-farmers-should-vacate-tikri-site-bjps-kisan-morcha/articleshow/82549844.cms?utm_source=contentofinterest&utm_medium=text&utm_campaign=cppst'],262,113,6
12,1392115616262332423,2021-05-11 19:23:21,Data Story: Did The 'Farmers' Protest' Cause The Second Wave Of Covid-19 In India?  https://t.co/N5KsTl5Iav,[],77509999,sunandavashisht,Sunanda Vashisht,https://twitter.com/sunandavashisht/status/1392115616262332423,['https://swarajyamag.com/politics/data-story-did-the-farmers-protest-cause-the-second-wave-of-covid-19-in-india'],189,74,13
14,1392112951012831236,2021-05-11 19:12:46,"This revelation in itself tantamount to an assault on Indian sovereignty. We must WORK towards stopping flow of students going to UK for studies. Explosion of UK variant,farmer protest &amp; Khalistani terror are all interrelated &amp; attempts to colonise by backdoor won’t succeed!",[],198030688,alok_bhatt,Alok Bhatt,https://twitter.com/alok_bhatt/status/1392112951012831236,[],23,11,1
15,1392112254242467841,2021-05-11 19:10:00,"There is now clear evidence that India's hugely damaging second covid wave had its origins in the farmer protests of Punjab, Haryana and western UP.   Data Story: Did The 'Farmers' Protest' Cause The Second Wave Of Covid-19 In India? |   https://t.co/HNW2hZFW4w",[],143776014,TheJaggi,R Jagannathan,https://twitter.com/TheJaggi/status/1392112254242467841,['https://swarajyamag.com/politics/data-story-did-the-farmers-protest-cause-the-second-wave-of-covid-19-in-india'],1574,1057,91
17,1392095849803440133,2021-05-11 18:04:49,Data Story: Did The 'Farmers' Protest' Cause The Second Wave Of Covid-19 In India?  https://t.co/sZZeCpqEnm via @swarajyamag,[],198030688,alok_bhatt,Alok Bhatt,https://twitter.com/alok_bhatt/status/1392095849803440133,['https://swarajyamag.com/politics/data-story-did-the-farmers-protest-cause-the-second-wave-of-covid-19-in-india'],76,52,7
21,1392067736256360454,2021-05-11 16:13:06,Coming up  ➡️Cork poultry farmer on the demand for ducklings as part of the latest Tik Tok craze ➡️Expectant mums speak from the protests taking place at maternity hospitals today ➡️@GarygannonTD on 2 year swimming pool closures ➡️@SiofraMulqueen reports from the @CliffsofMoherIE  https://t.co/C9xBuFss5X,[],525133847,LunchtimeLiveNT,Lunchtime Live,https://twitter.com/LunchtimeLiveNT/status/1392067736256360454,[],2,2,0
24,1392034903768846336,2021-05-11 14:02:38,Angry farmers yesterday forced the suspension of Lilongwe Auction Floors in protest against high rejection rate and delays by some tobacco buyers to enter the market. @NationOnlineMw  https://t.co/DWzWoSzxoa,[],196079682,NationOnlineMw,NationOnline,https://twitter.com/NationOnlineMw/status/1392034903768846336,['https://www.mwnation.com/ll-tobacco-floors-suspended/'],4,3,0
29,1392017636909715457,2021-05-11 12:54:01,"Thanks to the social media outreach of those supporting the farmers’ cause, farm protests have found a high resonance across the country.   Whether it be farmers or others, those living in villages or cities, very few said they were unaware of this issue.   https://t.co/lBydkbu6PB  https://t.co/VglIlo0p6b",[],17673635,livemint,Mint,https://twitter.com/livemint/status/1392017636909715457,['https://www.livemint.com/news/india/why-the-bjp-may-choose-to-bury-the-controversial-farm-laws-now-11620626484918.html'],4,2,0
30,1392017565321359361,2021-05-11 12:53:44,Here are the full contents of the FIR filed by father of a 25-year-old woman who was allegedly raped at Tikri farmer protest site and later died. The woman from Bengal came to Tikri on 12 April to join protests. She died on 30 April in hospital  My report:  https://t.co/QbnVn9tmKx,[],1121554471,swati_gs,Swati Goel Sharma,https://twitter.com/swati_gs/status/1392017565321359361,['https://swarajyamag.com/politics/here-are-the-full-contents-of-the-fir-filed-in-gangrape-death-and-its-cover-up-at-tikri-farmer-protest-site'],1325,762,37
31,1392016329369001987,2021-05-11 12:48:49,"Here Are The Full Contents Of The FIR Filed In Gangrape, Death And Its Cover Up At Tikri Farmer Protest Site  https://t.co/QXltrGYPzb via @swarajyamag",[],29398579,prasannavishy,Prasanna Viswanathan,https://twitter.com/prasannavishy/status/1392016329369001987,['https://swarajyamag.com/politics/here-are-the-full-contents-of-the-fir-filed-in-gangrape-death-and-its-cover-up-at-tikri-farmer-protest-site'],47,33,0
32,1392013812635627524,2021-05-11 12:38:49,"#MintPlainFacts | While the farmers protesting on Delhi’s outskirts earlier this year were largely from Punjab and Haryana, the issue seems to have widespread resonance. And the appeal of the farmers’ protests is not limited just to the poor.   https://t.co/lBydkbu6PB  https://t.co/GipTVyxQln",['mintplainfacts'],17673635,livemint,Mint,https://twitter.com/livemint/status/1392013812635627524,['https://www.livemint.com/news/india/why-the-bjp-may-choose-to-bury-the-controversial-farm-laws-now-11620626484918.html'],9,0,2
34,1392007085102010368,2021-05-11 12:12:05,Q: Where and when the second wave begin?   A: Data suggests it began in districts of Punjab and adjoining areas in January 2021; its spread mirroring the movement of the 'farmers protest'.    https://t.co/9TwfUZv3Hz,[],2451476942,SwarajyaMag,Swarajya,https://twitter.com/SwarajyaMag/status/1392007085102010368,['https://swarajyamag.com/politics/data-story-did-the-farmers-protest-cause-the-second-wave-of-covid-19-in-india'],130,50,6
36,1392006372691124226,2021-05-11 12:09:16,"The data is publicly available—origins of the second wave can be traced to the heart of the so-called farmers’ agitation, from early January 2021.  Additionally, the spread of the second wave mirrors the movement of the protests.   https://t.co/9TwfUZv3Hz",[],2451476942,SwarajyaMag,Swarajya,https://twitter.com/SwarajyaMag/status/1392006372691124226,['https://swarajyamag.com/politics/data-story-did-the-farmers-protest-cause-the-second-wave-of-covid-19-in-india'],352,179,5
37,1392000517924999171,2021-05-11 11:46:00,"The Samyukta Kisan Morcha  declared zero tolerance for incidents like the sexual assault that has come to light at the Tikri border protest site, calling it a test case for the ongoing farmers’ movement that has drawn wide participation from women.   https://t.co/hvefxe0TS5",[],141080858,ttindia,The Telegraph,https://twitter.com/ttindia/status/1392000517924999171,['https://www.telegraphindia.com/india/farmer-protest-samyukta-kisan-morcha-claims-zero-tolerance-towards-cases-of-sexual-assault/cid/1815211?utm_source=twitter&utm_medium=social&utm_campaign=tt_daily_twit'],13,3,2
39,1391986265726222337,2021-05-11 10:49:22,"When a gangrape at a supposedly farmers' protest doesn't evoke a fraction of the outrage that a frivolous #RippedJeans comment did, it shows the obnoxious clout of the liberal mafia..#andolanjeevi","['rippedjeans', 'andolanjeevi']",28187659,tuhins,Tuhin A. Sinha तुहिन सिन्हा,https://twitter.com/tuhins/status/1391986265726222337,[],7,5,0
