,id,conversation_id,created_at,date,timezone,place,tweet,language,hashtags,cashtags,user_id,user_id_str,username,name,day,hour,link,urls,photos,video,thumbnail,retweet,nlikes,nreplies,nretweets,quote_url,search,near,geo,source,user_rt_id,user_rt,retweet_id,reply_to,retweet_date,translate,trans_src,trans_dest
0,1359904969265197056,1359903800543358976,1613061585000.0,2021-02-11 22:09:45,+0530,,"Asked about agriculture taxes, Gov. Noem said she's following the bills through the legislative session.",en,[],[],16472218,16472218,keloland,KELOLAND News,4,22,https://twitter.com/keloland/status/1359904969265197056,[],[],0,,False,0,1,0,,agriculture bills,,,,,,,[],,,,
1,1359873982355410945,1359873599289651203,1613054197000.0,2021-02-11 20:06:37,+0530,,"This decision will increase heating/fuel costs for families/businesses and disrupt other industries (agriculture, transportation, manufacturing, &amp; consumer goods). Americans will foot the bill in higher prices, lost jobs, and less security.  MORE ➡️  https://t.co/lTy8jh8zvr",en,[],[],234400240,234400240,Georgia_AG,GA AG Chris Carr,4,20,https://twitter.com/Georgia_AG/status/1359873982355410945,['https://video.foxnews.com/v/6231162623001#sp=show-clips'],[],0,,False,1,3,2,,agriculture bills,,,,,,,[],,,,
2,1359873394565652483,1359873394565652483,1613054057000.0,2021-02-11 20:04:17,+0530,,How Will Sen. Amy Klobuchar’s Antitrust Bill Affect Agriculture?  https://t.co/GXnZnHeeNC,en,[],[],944467345,944467345,ModFarm,Modern Farmer,4,20,https://twitter.com/ModFarm/status/1359873394565652483,['https://modernfarmer.com/2021/02/how-will-sen-amy-klobuchars-antitrust-bill-affect-agriculture/'],[],0,,False,2,0,1,,agriculture bills,,,,,,,[],,,,
3,1359865843849588743,1359865842259943424,1613052256000.0,2021-02-11 19:34:16,+0530,,"The current draft of Rep. Pingree's Agriculture Resilience Act,  https://t.co/qfmgHz7ome (refer to Sec. 304: State Assistance for Soil Health) has the requirement for a state soil health program:  NDGOP Senators of Ag Committee could have not killed bill on Day 1 but amended-Dang!",en,[],[],2345212308,2345212308,shelleyjlenz,Dr. Shelley Lenz,4,19,https://twitter.com/shelleyjlenz/status/1359865843849588743,['https://www.congress.gov/bill/116th-congress/house-bill/5861/text?r=1&s=2'],[],0,,False,0,0,0,,agriculture bills,,,,,,,[],,,,
4,1359714144803512320,1359714144803512320,1613016089000.0,2021-02-11 09:31:29,+0530,,🚨 Republican Leader @CongressmanGT's statement following today's passage of the Agriculture Committee's portion of the FY21 Budget Reconciliation Bill.  Full Statement 👉  https://t.co/637pFba1zA  https://t.co/UeXc5ga24N,en,[],[],234573331,234573331,HouseAgGOP,House Ag GOP,4,09,https://twitter.com/HouseAgGOP/status/1359714144803512320,['https://republicans-agriculture.house.gov/news/documentsingle.aspx?DocumentID=6799'],['https://pbs.twimg.com/media/Et6se35XYAEeAAR.jpg'],1,https://pbs.twimg.com/media/Et6se35XYAEeAAR.jpg,False,6,4,3,,agriculture bills,,,,,,,[],,,,
