,id,conversation_id,created_at,date,timezone,place,tweet,language,hashtags,cashtags,user_id,user_id_str,username,name,day,hour,link,urls,photos,video,thumbnail,retweet,nlikes,nreplies,nretweets,quote_url,search,near,geo,source,user_rt_id,user_rt,retweet_id,reply_to,retweet_date,translate,trans_src,trans_dest
0,1344691034387697667,1344691034387697667,1609434300000.0,2020-12-31 22:35:00,+0530,,Centre vs farmers over agri laws: Is the ice finally melting?   WATCH ON:   #FarmersProstests #FarmLaws2020  https://t.co/gVH8i34UG3  https://t.co/pEF4CPqDA1,en,"['farmersprostests', 'farmlaws2020']",[],43855487,43855487,bsindia,Business Standard,4,22,https://twitter.com/bsindia/status/1344691034387697667,['https://youtu.be/liXfUHwmvS4'],['https://pbs.twimg.com/media/Eqkysp3UwAAK0nn.jpg'],1,https://pbs.twimg.com/media/Eqkysp3UwAAK0nn.jpg,False,10,0,1,,#farmersprostests,,,,,,,[],,,,
1,1344669156180807685,1344669156180807685,1609429084000.0,2020-12-31 21:08:04,+0530,,रोटियां और दादियां  गुजरते साल के आखिरी दिन की तस्वीर... #FarmersProtests #FarmerProtest #FarmersProstests #Farmers #food  #Year2020  https://t.co/Uwf8ptZFva,hi,"['farmersprotests', 'farmerprotest', 'farmersprostests', 'farmers', 'food', 'year2020']",[],2473925244,2473925244,AShukkla,Arvind Shukla,4,21,https://twitter.com/AShukkla/status/1344669156180807685,[],['https://pbs.twimg.com/media/Eqk5ddxVEAIyzWz.jpg'],1,https://pbs.twimg.com/media/Eqk5ddxVEAIyzWz.jpg,False,143,1,10,,#farmersprostests,,,,,,,[],,,,
2,1344664419670736896,1344664419670736896,1609427954000.0,2020-12-31 20:49:14,+0530,,Haryana’s Yashasvi CM ML Khattar ji and his eminent  deputy Dushyant Chautala promise they will quit politics “if anyone tries to end MSP.”  Farmers should end their protests now!   #FarmersProstests,en,['farmersprostests'],[],50573483,50573483,Ms_Aflatoon,Ms_Aflatoon-THE DIALOGUE,4,20,https://twitter.com/Ms_Aflatoon/status/1344664419670736896,[],[],0,,False,6,0,2,,#farmersprostests,,,,,,,[],,,,
3,1344657471940427778,1344657471940427778,1609426298000.0,2020-12-31 20:21:38,+0530,,Centre vs farmers over agri laws: Is the ice finally melting?   WATCH ON:   #FarmersProstests #FarmLaws2020  https://t.co/gVH8i34UG3,en,"['farmersprostests', 'farmlaws2020']",[],43855487,43855487,bsindia,Business Standard,4,20,https://twitter.com/bsindia/status/1344657471940427778,['https://youtu.be/liXfUHwmvS4'],[],0,,False,2,0,0,,#farmersprostests,,,,,,,[],,,,
4,1344655559627165698,1344655559627165698,1609425842000.0,2020-12-31 20:14:02,+0530,,"Farmers and soldiers are the unsung heroes of our civilization. Where one has worked relentlessly to provide for the nation, the other has guarded our territory with bravery and valor. We always think first of our citizens and expect trust from their end.  #FarmersProstests  https://t.co/0dCAsHdV0m",en,['farmersprostests'],[],886916924323446784,886916924323446784,TendulkarBJP,Vinay Tendulkar,4,20,https://twitter.com/TendulkarBJP/status/1344655559627165698,[],"['https://pbs.twimg.com/media/EqktF9OVgAE5KDU.jpg', 'https://pbs.twimg.com/media/EqktGrnUUAAYT32.jpg']",1,https://pbs.twimg.com/media/EqktF9OVgAE5KDU.jpg,False,16,2,3,,#farmersprostests,,,,,,,[],,,,
5,1344644644848738304,1344644644848738304,1609423240000.0,2020-12-31 19:30:40,+0530,,"ఒకరోజు ధర్నా అంటే 11 గంటలకు మొదలై 3 గంటలకు ముగిసే తంతుగా మారిపోయిన కాలంలో.. ఇంత మంది రైతులు, ఇంత కాలం పాటు ఉద్యమాన్ని ఎలా నడుపుతున్నారు? వీరికి తాగునీరు, ఆహారం, దుప్పట్లు, ఇతర సౌకర్యాలు ఎలా అందుతున్నాయి? #FarmersProstests #FarmLaws #Delhi    https://t.co/6B1VjtsI8n",te,"['farmersprostests', 'farmlaws', 'delhi']",[],826117446050381826,826117446050381826,bbcnewstelugu,BBC News Telugu,4,19,https://twitter.com/bbcnewstelugu/status/1344644644848738304,['https://www.bbc.com/telugu/india-55479056'],[],0,,False,27,3,2,,#farmersprostests,,,,,,,[],,,,
6,1344638186157445120,1344638186157445120,1609421700000.0,2020-12-31 19:05:00,+0530,,"From #DelhiRiots, #SushanthSinghRajput's death, #IndiaChinaFaceOff to #FarmLaws &amp; #FarmersProstests: Here's all the important non #COVID19 news in India that happened in 2020.  #NewYear @bored_queer_AF #Goodbye2020  https://t.co/MtUSelitmi",en,"['delhiriots', 'sushanthsinghrajput', 'indiachinafaceoff', 'farmlaws', 'farmersprostests', 'covid19', 'newyear', 'goodbye2020']",[],94761188,94761188,NewIndianXpress,The New Indian Express,4,19,https://twitter.com/NewIndianXpress/status/1344638186157445120,['https://www.newindianexpress.com/nation/2020/dec/31/2020-wasnt-just-about-covid-19-these-events-also-hit-the-headlines-2243604.html'],[],0,,False,5,1,5,,#farmersprostests,,,,,,,[],,,,
7,1344636930382696448,1344636930382696448,1609421401000.0,2020-12-31 19:00:01,+0530,,#FarmersProstests  LIVE | A group of agitating farmers breaks through police barricades to enter Haryana; No New Year celebrations until govt accepts our demands: Farmers protesting at Singhu border   Track latest updates:   https://t.co/ZpH6UDIulF,en,['farmersprostests'],[],43855487,43855487,bsindia,Business Standard,4,19,https://twitter.com/bsindia/status/1344636930382696448,['https://mybs.in/2YSjRlg?8889'],[],0,,False,5,1,0,,#farmersprostests,,,,,,,[],,,,
8,1344634929565470721,1344634929565470721,1609420923000.0,2020-12-31 18:52:03,+0530,,दक्षिण के इस राज्य में BJP के एकमात्र विधायक ने कृषि कानूनों के खिलाफ किया प्रस्ताव का समर्थन #FarmersProstests   https://t.co/DGHtMBs4yi,hi,['farmersprostests'],[],123171317,123171317,NavbharatTimes,NBT Hindi News,4,18,https://twitter.com/NavbharatTimes/status/1344634929565470721,['https://navbharattimes.indiatimes.com/state/other-states/other-cities/bill-passed-against-agricultural-laws-in-kerala-assembly-bjp-mla-also-supported/articleshow/80043804.cms'],[],0,,False,31,0,4,,#farmersprostests,,,,,,,[],,,,
9,1344629658390650885,1344629658390650885,1609419667000.0,2020-12-31 18:31:07,+0530,,#जागरणजनमत  क्या दो मांगों पर सहमति बनने के बाद कृषि कानूनों पर गतिरोध टूटने की संभावना बढ़ी है? #FarmersProstests  #FarmLaws,hi,"['जागरणजनमत', 'farmersprostests', 'farmlaws']",[],64639742,64639742,JagranNews,Dainik Jagran,4,18,https://twitter.com/JagranNews/status/1344629658390650885,[],[],0,,False,24,1,4,,#farmersprostests,,,,,,,[],,,,
10,1344629123558199296,1344629123558199296,1609419539000.0,2020-12-31 18:28:59,+0530,,"O Rajagopal, BJP member of Kerala Assembly, went against his party's stand and supported the protesting farmers' cause to repeal the farm laws.  @BJPRajagopal #BJP #FarmersProstests #FarmLaws   https://t.co/sUx1q8pUBr",en,"['bjp', 'farmersprostests', 'farmlaws']",[],3991108098,3991108098,dt_next,DT Next,4,18,https://twitter.com/dt_next/status/1344629123558199296,['https://www.dtnext.in/News/National/2020/12/31164934/1269101/Lone-BJP-member-in-Kerala-Assembly-supports-resolution-.vpf'],[],0,,False,1,0,1,,#farmersprostests,,,,,,,[],,,,
11,1344623694140694528,1344623694140694528,1609418245000.0,2020-12-31 18:07:25,+0530,,10-15 ट्रैक्टर बैरियर हटा कर निकले दिल्ली की तरफ...  https://t.co/0qtqtqOu2P #Jaipur #FarmersProstests #Haryana #Delhi #FarmersBill2020,hi,"['jaipur', 'farmersprostests', 'haryana', 'delhi', 'farmersbill2020']",[],1587915768,1587915768,zeerajasthan_,ZEE Rajasthan,4,18,https://twitter.com/zeerajasthan_/status/1344623694140694528,['https://zeenews.india.com/hindi/india/rajasthan/haryana-police-rained-lathis-on-shahjahanpur-border-as-farmers-went-towards-delhi/819142'],[],0,,False,29,0,2,,#farmersprostests,,,,,,,[],,,,
12,1344621495587229698,1344621495587229698,1609417721000.0,2020-12-31 17:58:41,+0530,,Protesting farmers to welcome New Year without celebrations as part of their protest against the farm laws.  @IndianFarmers_ #FarmersProstests #FarmLaws #NewYear #NewYearWithFarmers  https://t.co/PhdUOrMsyi,en,"['farmersprostests', 'farmlaws', 'newyear', 'newyearwithfarmers']",[],3991108098,3991108098,dt_next,DT Next,4,17,https://twitter.com/dt_next/status/1344621495587229698,['https://www.dtnext.in/News/National/2020/12/31173836/1269111/Protesting-farmers-say-no-to-New-Year-celebrations-.vpf'],[],0,,False,3,0,0,,#farmersprostests,,,,,,,[],,,,
13,1344618656714481664,1344618656714481664,1609417044000.0,2020-12-31 17:47:24,+0530,,കർഷക പ്രക്ഷോഭം: കേന്ദ്രമന്ത്രിമാരുമായി കർഷകസംഘടനാ പ്രതിനിധികളുടെ കൂടിക്കാഴ്ച- ചിത്രങ്ങൾ #FarmersProtest #FarmBill2020 #FarmersProstests   https://t.co/rkhnqvFPtN,ml,"['farmersprotest', 'farmbill2020', 'farmersprostests']",[],18186688,18186688,thatsMalayalam,OneIndia Malayalam,4,17,https://twitter.com/thatsMalayalam/status/1344618656714481664,['https://www.oneindia.com/photos/farmers-representatives-meets-union-ministers-over-new-farm-law-in-new-delhi-59178.html?src=ml-oi'],[],0,,False,0,0,0,,#farmersprostests,,,,,,,[],,,,
14,1344614280272859137,1344614280272859137,1609416000000.0,2020-12-31 17:30:00,+0530,,#FarmersProstests | No New Year celebrations until govt accepts our demands: Farmers protesting at Singhu border; A group of agitating farmers breaks through police barricades to enter #Haryana   Latest updates here:   https://t.co/me0pS5YSHv,en,"['farmersprostests', 'haryana']",[],43855487,43855487,bsindia,Business Standard,4,17,https://twitter.com/bsindia/status/1344614280272859137,['https://mybs.in/2YSjRlg?8988'],[],0,,False,4,0,2,,#farmersprostests,,,,,,,[],,,,
15,1344614100375117824,1344614100375117824,1609415957000.0,2020-12-31 17:29:17,+0530,,#FarmersProstests Call/ Tweet your #MP Repeal Farm Laws  आपल्या खासदारांना फोन करा/ ट्विट करा शेती कायदे रद्द करा @VBAforIndia  https://t.co/JKavrxWPed,mr,"['farmersprostests', 'mp']",[],158814703,158814703,priyadarshi07,Adv Priyadarshi Telang,4,17,https://twitter.com/priyadarshi07/status/1344614100375117824,[],['https://pbs.twimg.com/media/EqkHZeBUUAIHbUk.jpg'],1,https://pbs.twimg.com/media/EqkHZeBUUAIHbUk.jpg,False,16,2,4,,#farmersprostests,,,,,,,[],,,,
16,1344609532903714816,1344609532903714816,1609414868000.0,2020-12-31 17:11:08,+0530,,"अभी सिर्फ पूंछ निकली है, हाथी अभी बाकी है।  किसान नेताओं और सरकार के बीच छठे दौर हो गुई, सरकार ने एक बार फ़िर समिति बनाने का ही प्रस्ताव दोहराया जो किसानों द्वारा कई बार खारिज कर दिया गया है।  #FarmersProstests | #IndiaWithFarmers   https://t.co/7xIU9M0DCc",hi,"['farmersprostests', 'indiawithfarmers']",[],782439160388972544,782439160388972544,_SwarajIndia,Swaraj India,4,17,https://twitter.com/_SwarajIndia/status/1344609532903714816,['https://www.livehindustan.com/national/story-kisan-government-meeting-on-kisan-andolan-centre-proposes-committee-to-review-farm-laws-rules-out-repeal-3714859.html'],[],0,,False,20,0,9,,#farmersprostests,,,,,,,[],,,,
17,1344609140895748099,1344609140895748099,1609414775000.0,2020-12-31 17:09:35,+0530,,"Same time last year, people's anger simmered, we had the anti CAA and NRC protests around the country. This was after Jamia campus was attacked and after JNU attacks. We thought the govt cant be indifferent to people's opinion #lestweforget #CAA #FarmersProstests",en,"['lestweforget', 'caa', 'farmersprostests']",[],86876120,86876120,swagata_y,Swagata Yadavar,4,17,https://twitter.com/swagata_y/status/1344609140895748099,[],[],0,,False,7,0,0,,#farmersprostests,,,,,,,[],,,,
18,1344608080848273408,1344608080848273408,1609414522000.0,2020-12-31 17:05:22,+0530,,"#Rajasthan -#Haryana  बॉर्डर पर टकराव! किसानों ने तोड़ी बैरिकेडिंग, पुलिस ने आंसू गैस के गोले छोड़े #FarmersProstests #FarmLaws   https://t.co/BGnGKYECSP",hi,"['rajasthan', 'haryana', 'farmersprostests', 'farmlaws']",[],884388810108182528,884388810108182528,navjivanindia,Navjivan,4,17,https://twitter.com/navjivanindia/status/1344608080848273408,['https://www.navjivanindia.com/news/kisan-andolan-against-against-new-farm-laws-live-updates-farmers-protest-at-delhi-borders-continuous?cardId=a935bdb6-05c4-4c40-8517-67e8922076ed'],[],0,,False,20,0,8,,#farmersprostests,,,,,,,[],,,,
19,1344604709596721152,1344604709596721152,1609413718000.0,2020-12-31 16:51:58,+0530,,Godi Media has never been brutalized so bad - already humiliated &amp; disgraced by the #FarmersProstests - now getting whiplashed as the #BengalElections approach. 2021 is going to be painful for these B&amp;D anchors &amp; editors!  #Thakur nahi #Tagore!🤦🏽‍♂️,en,"['farmersprostests', 'bengalelections', 'thakur', 'tagore']",[],24338525,24338525,TheDeshBhakt,The DeshBhakt 🇮🇳,4,16,https://twitter.com/TheDeshBhakt/status/1344604709596721152,[],[],0,,False,1717,62,298,https://twitter.com/zoo_bear/status/1344551881054404610,#farmersprostests,,,,,,,[],,,,
