,id,conversation_id,created_at,date,timezone,place,tweet,language,hashtags,cashtags,user_id,user_id_str,username,name,day,hour,link,urls,photos,video,thumbnail,retweet,nlikes,nreplies,nretweets,quote_url,search,near,geo,source,user_rt_id,user_rt,retweet_id,reply_to,retweet_date,translate,trans_src,trans_dest
0,1356347302189826048,1356347302189826048,1612213371000.0,2021-02-02 02:32:51,+0530,,"Farmer Protest: 6 फरवरी को किसान फिर करेंगे भारत बंद, बलबीर सिंह राजेवाल ने किया ऐलान  https://t.co/kYTgXfmkbf #farmer #किसान #भारतबंद #farmersprotest",hi,"['farmer', 'किसान', 'भारतबंद', 'farmersprotest']",[],18186549,18186549,oneindiaHindi,Oneindia Hindi,2,02,https://twitter.com/oneindiaHindi/status/1356347302189826048,['https://hindi.oneindia.com/news/india/there-will-be-a-country-wide-agitation-on-february-6-says-balbir-singh-rajewal-bhartiya-kisan-union-601672.html'],[],0,,False,2,0,0,,#किसान,,,,,,,[],,,,
1,1356211153655877634,1356211153655877634,1612180910000.0,2021-02-01 17:31:50,+0530,,"साफ शब्दों में कह देते की हम पूंजीपतियों के लिए बजट पेश करने जा रहें है ताकि देश का #किसान कमेरा एक उम्मीद लगाकर ना बैठता। शिक्षा, स्वास्थ्य और किसान के कुछ भी पर्याप्त नहीं है सिर्फ मित्रों को खुश करने के लिए #बजट है ||",hi,"['किसान', 'बजट']",[],779282123437903872,779282123437903872,AbhaySChautala,Abhay Singh Chautala,1,17,https://twitter.com/AbhaySChautala/status/1356211153655877634,[],[],0,,False,1155,27,234,,#किसान,,,,,,,[],,,,
2,1356183238989934595,1356183238989934595,1612174255000.0,2021-02-01 15:40:55,+0530,,"""अमीरो का बजट है, इस #बजट की दिशा ठीक नहीं है। #किसान के लिए कुछ नहीं किया। शिक्षा और स्वास्थ्य के लिए पर्याप्त नहीं किया, सिर्फ उद्योगपतियों को फायदा पहुंचाने का बजट है""- @KapilSibal to @ABPNews",hi,"['बजट', 'किसान']",[],231422245,231422245,AshishSinghLIVE,Ashish Kumar Singh (ABP News),1,15,https://twitter.com/AshishSinghLIVE/status/1356183238989934595,[],[],0,,False,597,4,103,,#किसान,,,,,,,[],,,,
3,1356158614830891010,1356158614830891010,1612168384000.0,2021-02-01 14:03:04,+0530,,"Farmers Protest: गाजीपुर, सिंघु, टिकरी बॉर्डर पर इंटरनेट बैन 2 फरवरी तक बढ़ाया गया  https://t.co/bi4KXnJRij #internet #delhipolice #farmersprotest #farmer #किसान #delhi #homeministry",hi,"['internet', 'delhipolice', 'farmersprotest', 'farmer', 'किसान', 'delhi', 'homeministry']",[],18186549,18186549,oneindiaHindi,Oneindia Hindi,1,14,https://twitter.com/oneindiaHindi/status/1356158614830891010,['https://hindi.oneindia.com/news/india/farmers-protest-govt-extends-suspension-of-internet-till-2nd-february-singhu-ghazipur-tikri-border-601578.html'],[],0,,False,0,0,0,,#किसान,,,,,,,[],,,,
4,1356157897986568201,1356157897986568201,1612168213000.0,2021-02-01 14:00:13,+0530,,"हरियाणा के 14 जिलों में इंटरनेट सेवाएं अभी बंद ही रखेगी सरकार, 3 में से पाबंदियां हटाईं  https://t.co/TEqzrO3YGj #haryana #haryanagovernment #manoharlalkhattar #pressrelease #sonipat #gurugram #इंटरनेट #हरियाणा #मनोहरलालखट्टर #सोनीपत #गुरुग्राम #किसान",hi,"['haryana', 'haryanagovernment', 'manoharlalkhattar', 'pressrelease', 'sonipat', 'gurugram', 'इंटरनेट', 'हरियाणा', 'मनोहरलालखट्टर', 'सोनीपत', 'गुरुग्राम', 'किसान']",[],18186549,18186549,oneindiaHindi,Oneindia Hindi,1,14,https://twitter.com/oneindiaHindi/status/1356157897986568201,['https://hindi.oneindia.com/press-release/suspension-of-internet-services-in-haryana-s-14-districts-extended-for-24-hours-601575.html'],[],0,,False,2,0,1,,#किसान,,,,,,,[],,,,
5,1356153737757089797,1356153737757089797,1612167221000.0,2021-02-01 13:43:41,+0530,,#किसान हैं साहब.....#आतंकवादी नही।  https://t.co/k1fskUiZxk,hi,"['किसान', 'आतंकवादी']",[],711917879596359680,711917879596359680,aneesrajasp,Anees Raja انیس راجا,1,13,https://twitter.com/aneesrajasp/status/1356153737757089797,[],"['https://pbs.twimg.com/media/EtIGoLcUYAQkKRi.jpg', 'https://pbs.twimg.com/media/EtIGoVDVoAEMvUf.jpg']",1,https://pbs.twimg.com/media/EtIGoLcUYAQkKRi.jpg,False,153,5,43,,#किसान,,,,,,,[],,,,
6,1356146106313420800,1356146106313420800,1612165402000.0,2021-02-01 13:13:22,+0530,,"#किसान हितों के लिए समर्पित @narendramodi सरकार| APMC को एग्री इंफ्रा फंड के दायरे मे लाया जाएगा, ई-नाम से 1000 और मंडियां जुड़ेंगी, ऑपरेशन ग्रीन स्कीम में टमाटर,प्याज और आलू के अलावा 22 पेरिशेबल क्रॉप्स होंगे शामिल, वित्त वर्ष 2022 में फार्म क्रेडिट लक्ष्य 16.5 लाख करोड़",hi,['किसान'],[],733687317580251136,733687317580251136,maheshpoddarmp,Mahesh Poddar,1,13,https://twitter.com/maheshpoddarmp/status/1356146106313420800,[],[],0,,False,11,2,4,,#किसान,,,,,,,[],,,,
7,1356128986791702529,1356128986791702529,1612161320000.0,2021-02-01 12:05:20,+0530,,"#किसान आन्दोलन को केवल #पंजाब के किसानों का आन्दोलन कहकर बात को सीमित करने की कोशिश की जाती रही है लेकिन #हरियाणा, #उत्तरप्रदेश, #मध्यप्रदेश आदि राज्यों के किसान भी बड़ी संख्या में शामिल हो गए हैं। सरकार को झुकना होगा और तीनों काले कानूनों को रद्द करना होगा  #Budget2021 #Farmer  https://t.co/Sep0tHrtlk",hi,"['किसान', 'पंजाब', 'हरियाणा', 'उत्तरप्रदेश', 'मध्यप्रदेश', 'budget2021', 'farmer']",[],2259119828,2259119828,F_Ansari_Godda,Furkan Ansari,1,12,https://twitter.com/F_Ansari_Godda/status/1356128986791702529,[],[],1,https://pbs.twimg.com/ext_tw_video_thumb/1356128417029124098/pu/img/kAlqiYXMWh0ynfNu.jpg,False,12,0,2,,#किसान,,,,,,,[],,,,
8,1356113087233839111,1356113087233839111,1612157530000.0,2021-02-01 11:02:10,+0530,,क्या किसी लोकतांत्रिक सरकार को अपनी ही जनता का सामना करने में इतना डर होनी चाहिए ?   यह डर तो किसी तानाशाह को ही सकता है !!   #किसान_एकता_जिंदाबाद #Farmers #Budget2021 #Budget4Corporate  #BudgetForCorporate #किसान  https://t.co/p56sG2ED2F,hi,"['किसान_एकता_जिंदाबाद', 'farmers', 'budget2021', 'budget4corporate', 'budgetforcorporate', 'किसान']",[],933622354277646336,933622354277646336,Chhotu_Vasava,Chhotubhai Vasava,1,11,https://twitter.com/Chhotu_Vasava/status/1356113087233839111,[],['https://pbs.twimg.com/media/EtHhqS4XAAMFT10.jpg'],1,https://pbs.twimg.com/media/EtHhqS4XAAMFT10.jpg,False,64,0,17,,#किसान,,,,,,,[],,,,
