,id,conversation_id,created_at,date,timezone,place,tweet,language,hashtags,cashtags,user_id,user_id_str,username,name,day,hour,link,urls,photos,video,thumbnail,retweet,nlikes,nreplies,nretweets,quote_url,search,near,geo,source,user_rt_id,user_rt,retweet_id,reply_to,retweet_date,translate,trans_src,trans_dest
0,1383180410482491396,1383180410482491396,1618610882000.0,2021-04-17 03:38:02,+0530,,"I want to wish a happy #KhalsaSajnaDiwas to all who celebrated this week and a happy #Vaisakhi to our Sikh community here and abroad, as they start the harvest season.  We stand in solidarity with the #FarmersProtest in India. Deregulation is NEVER the answer.",en,"['khalsasajnadiwas', 'vaisakhi', 'farmersprotest']",[],19834403,19834403,NYCMayor,Mayor Eric Adams,6,03,https://twitter.com/NYCMayor/status/1383180410482491396,[],[],0,,False,98,21,36,,#farmersprotest,,,,,,,[],,,,
1,1383108982823276545,1383108982823276545,1618593853000.0,2021-04-16 22:54:13,+0530,,देश में कुंभ मेला और रैलियां हो सकती हैं तो किसान आंदोलन भी हो सकता है। कोरोना नियमों की आड़ मे किसान आंदोलन खत्म करने की साजिश ना करे केंद्र सरकार। इसके परिणाम गंभीर हो सकते हैं। हरियाणा-पंजाब और पश्चिमी उतरप्रदेश में हालात खराब हो सकते हैं। #FarmersProtest @Kisanektamorcha,hi,['farmersprotest'],[],900215263034998785,900215263034998785,kkc_india,KKC INDIA,5,22,https://twitter.com/kkc_india/status/1383108982823276545,[],[],0,,False,8,0,7,,#farmersprotest,,,,,,,[],,,,
2,1383100178375135232,1383100178375135232,1618591753000.0,2021-04-16 22:19:13,+0530,,दिल्ली बॉर्डर से किसान हटेंगे या जमे रहेंगे?  #FarmersProtest  https://t.co/5SDBqMKBHI,hi,['farmersprotest'],[],249643872,249643872,ndtvvideos,NDTV Videos,5,22,https://twitter.com/ndtvvideos/status/1383100178375135232,[],[],1,https://pbs.twimg.com/media/EzHCK7DVcAMtXx3.jpg,False,33,0,6,,#farmersprotest,,,,,,,[],,,,
3,1383063068779835395,1383063068779835395,1618582906000.0,2021-04-16 19:51:46,+0530,,લોકડાઉન થશે તો પણ ખેડૂત આંદોલન તો શરુ જ રહેશે : રાકેશ ટિકૈત #Lockdown #FarmersProtest #Farmers #RakeshTikait  https://t.co/y6rcia6Sp9,gu,"['lockdown', 'farmersprotest', 'farmers', 'rakeshtikait']",[],167345502,167345502,gujratsamachar,Gujarat Samachar,5,19,https://twitter.com/gujratsamachar/status/1383063068779835395,['https://gsamachar.page.link/h2QH8B2AnHk7yuE19'],[],0,,False,56,5,5,,#farmersprotest,,,,,,,[],,,,
4,1383055364233449477,1383055364233449477,1618581069000.0,2021-04-16 19:21:09,+0530,,तेज हवाओं और बारिश से टिकरी बार्डर पर  आंदोलन कर रहे किसानों के टेंट उखड़े   #FarmersProtest @vinayjournlist  https://t.co/6OM0SwbL08,hi,['farmersprotest'],[],34206701,34206701,news24tvchannel,News24,5,19,https://twitter.com/news24tvchannel/status/1383055364233449477,[],[],1,https://pbs.twimg.com/ext_tw_video_thumb/1383055269219815424/pu/img/BcfBNgax8OXwDGvT.jpg,False,638,19,123,,#farmersprotest,,,,,,,[],,,,
5,1383050220297023489,1383050220297023489,1618579843000.0,2021-04-16 19:00:43,+0530,,#Kisan_Balidan_Smarak #KisanAndolan #FarmersProtest,und,"['kisan_balidan_smarak', 'kisanandolan', 'farmersprotest']",[],1943792382,1943792382,RLDparty,Rashtriya Lok Dal,5,19,https://twitter.com/RLDparty/status/1383050220297023489,[],[],0,,False,143,2,27,https://twitter.com/jayantrld/status/1383049823289368576,#farmersprotest,,,,,,,[],,,,
6,1383035197017387014,1383035197017387014,1618576261000.0,2021-04-16 18:01:01,+0530,,"CM खट्टर की प्रदर्शनकारियों से अपील, बोले- मानवता के आधार पर वापस लें किसान आंदोलन @mlkhattar @cmohry @DiprHaryana  https://t.co/zzShC1aSyY #haryana #manoharlalkhattar #farmersprotest #coronavirus #farmer #हरियाणा #किसानआंदोलन #किसान #कोरोनावायरस",hi,"['haryana', 'manoharlalkhattar', 'farmersprotest', 'coronavirus', 'farmer', 'हरियाणा', 'किसानआंदोलन', 'किसान', 'कोरोनावायरस']",[],18186549,18186549,oneindiaHindi,Oneindia Hindi,5,18,https://twitter.com/oneindiaHindi/status/1383035197017387014,['https://hindi.oneindia.com/news/haryana/cm-manohar-lal-khattar-appealed-to-protesters-said-withdraw-farmer-protest-due-to-covid-613567.html'],[],0,,False,0,0,0,,#farmersprotest,,,,,,,[],,,,
7,1383017919660007430,1383017919660007430,1618572141000.0,2021-04-16 16:52:21,+0530,,Delhi Traffic Police has taken this move amid the ongoing farmers protest and the sudden surge in the deadly coronavirus cases. #delhi #DelhiBorders #FarmersProtest #COVID19India  #COVID19    https://t.co/pAJc5aBd1i,en,"['delhi', 'delhiborders', 'farmersprotest', 'covid19india', 'covid19']",[],22793955,22793955,indiacom,India.com,5,16,https://twitter.com/indiacom/status/1383017919660007430,['https://www.india.com/news/delhi/delhi-covid19-travel-update-5-borders-closed-no-vehicles-allowed-details-inside-4590260/'],[],0,,False,2,0,1,,#farmersprotest,,,,,,,[],,,,
8,1383011736479956993,1383011736479956993,1618570667000.0,2021-04-16 16:27:47,+0530,,ਹੁਣ ਬਾਰਦਾਨੇ ਦੇ ਕਮੀ ਤੋਂ ਅੱਕੇ ਕਿਸਾਨਾਂ ਨੇ ਕਰ ਦਿੱਤੇ ਰੋਡ ਜਾਮ  #FarmersProtest #FarmLaws #PunjabNews  #India   ਇੱਥੇ ਪੜ੍ਹੋ ਪੂਰੀ ਖ਼ਬਰ:   https://t.co/qFcq9v0OHB,pa,"['farmersprotest', 'farmlaws', 'punjabnews', 'india']",[],1037022253,1037022253,abpsanjha,ABP Sanjha,5,16,https://twitter.com/abpsanjha/status/1383011736479956993,['https://punjabi.abplive.com/news/punjab/now-due-to-the-shortage-of-bags-the-farmers-blocked-roads-619587'],[],0,,False,1,0,0,,#farmersprotest,,,,,,,[],,,,
9,1383008640949313537,1383008640949313537,1618569929000.0,2021-04-16 16:15:29,+0530,,Look What Farmers have Built in the Jungle at Singhu Border 😲😲  #FarmersProtest #singhuborder #KisanAndolan    https://t.co/SGvW0S8AR4,en,"['farmersprotest', 'singhuborder', 'kisanandolan']",[],2713734486,2713734486,PTC_Network,PTC Punjabi,5,16,https://twitter.com/PTC_Network/status/1383008640949313537,['https://youtu.be/MJIqiCl1vAo'],[],0,,False,4,0,0,,#farmersprotest,,,,,,,[],,,,
10,1383006552748040192,1383006552748040192,1618569431000.0,2021-04-16 16:07:11,+0530,,"प्रतापपुर, मिदनापुर (पश्चिम बंगाल)  जय किसान आंदोलन के साथियों ने @aviksahaindia के साथ आज मिदनापुर में स्थानीय किसानो से बात की व उनसे भाजपा को उसकी भाषा में समझाने का आग्रह किया।  किसान इस बार भाजपा को वोट न देकर उसके अहंकार को तोड़ेगा।  #FarmersProtest  https://t.co/ZMKn0TfVTB",hi,['farmersprotest'],[],3132907921,3132907921,swaraj_abhiyan,Swaraj Abhiyan,5,16,https://twitter.com/swaraj_abhiyan/status/1383006552748040192,[],"['https://pbs.twimg.com/media/EzFtICGUcAkvtka.jpg', 'https://pbs.twimg.com/media/EzFtIUDVoAIZyzG.jpg']",1,https://pbs.twimg.com/media/EzFtICGUcAkvtka.jpg,False,8,2,6,,#farmersprotest,,,,,,,[],,,,
11,1383005939477868551,1383005939477868551,1618569285000.0,2021-04-16 16:04:45,+0530,,"हरियाणा: धरनास्थल पर झोपड़ियां जलीं, सामान भी खाक, किसान बोले- हमें जबरन हटाने में जुटी सरकार  https://t.co/5ruFNR9BTp #haryana #farmersprotest #bjp #newdelhi #delhi #farmer #coronavirus #किसानआंदोलन #हरियाणा #दिल्ली",hi,"['haryana', 'farmersprotest', 'bjp', 'newdelhi', 'delhi', 'farmer', 'coronavirus', 'किसानआंदोलन', 'हरियाणा', 'दिल्ली']",[],18186549,18186549,oneindiaHindi,Oneindia Hindi,5,16,https://twitter.com/oneindiaHindi/status/1383005939477868551,['https://hindi.oneindia.com/news/haryana/haryana-govt-operation-clean-to-remove-farmers-gathering-protesters-says-bjp-is-worst-government-613531.html'],[],0,,False,2,0,1,,#farmersprotest,,,,,,,[],,,,
12,1383005811501264896,1383005811501264896,1618569255000.0,2021-04-16 16:04:15,+0530,,"ਤਿੰਨ ਕਾਲ਼ੇ ਖ਼ੇਤੀ ਕਾਨੂੰਨਾਂ ਕਾਰਨ ਪਰੇਸ਼ਾਨੀ ਝੇਲ੍ਹਦੇ ਤਿੰਨ ਹੋਰ ਕਿਸਾਨ ਦੁਨੀਆਂ ਤੋਂ ਚੱਲ ਵੱਸੇ! ਹੁਣ ਤੱਕ ਸੈਂਕੜੇ ਤੋਂ ਵੱਧ ਕਿਸਾਨ ਪਰਿਵਾਰ ਆਪਣੇ ਜੀਆਂ ਦੇ ਵਿਛੋੜੇ ਦਾ ਦੁੱਖ ਹੰਢਾ ਰਹੇ ਹਨ, ਪਰ ਹੰਕਾਰ 'ਚ ਮਗਰੂਰ ਕੇਂਦਰ ਦੀ ਸਰਕਾਰ ਨੂੰ ਕੋਈ ਫ਼ਰਕ ਨਹੀਂ ਪਿਆ! ਨਿਰਦਈ ਕੇਂਦਰ ਸਰਕਾਰ! #FarmersProtest #AntiFarmerActs  https://t.co/IYMpaslE1h",pa,"['farmersprotest', 'antifarmeracts']",[],3186496375,3186496375,Akali_Dal_,Shiromani Akali Dal,5,16,https://twitter.com/Akali_Dal_/status/1383005811501264896,[],['https://pbs.twimg.com/media/EzFsLExVgAANqQf.jpg'],1,https://pbs.twimg.com/media/EzFsLExVgAANqQf.jpg,False,28,2,18,,#farmersprotest,,,,,,,[],,,,
13,1382988630759600128,1382988630759600128,1618565158000.0,2021-04-16 14:55:58,+0530,,"तानाशाह सरकार को अपने अहम् और फायदे के सामने और कुछ नहीं दिखाई देता। फिर चाहे वो आम आदमी की जान हो, या हक़ के लिए लड़ रहे किसानों की माँग। #FarmersProtest #COVIDEmergency",hi,"['farmersprotest', 'covidemergency']",[],804364597373190144,804364597373190144,officekiran,Kiran Choudhry,5,14,https://twitter.com/officekiran/status/1382988630759600128,[],[],0,,False,174,5,52,,#farmersprotest,,,,,,,[],,,,
14,1382983036535332867,1382983036535332867,1618563825000.0,2021-04-16 14:33:45,+0530,,"प्रतापपुर, मिदनापुर (पश्चिम बंगाल)  जय किसान आंदोलन के साथियों ने @aviksahaindia के साथ आज मिदनापुर में स्थानीय किसानो से बात की व उनसे भाजपा को उसकी भाषा में समझाने का आग्रह किया।  किसान इस बार भाजपा को वोट न देकर उसके अहंकार को तोड़ेगा।  #FarmersProtest  https://t.co/GHMbHcJWfm",hi,['farmersprotest'],[],782439160388972544,782439160388972544,_SwarajIndia,Swaraj India,5,14,https://twitter.com/_SwarajIndia/status/1382983036535332867,[],"['https://pbs.twimg.com/media/EzFXvPLUYAMTD4Y.jpg', 'https://pbs.twimg.com/media/EzFXverUUAcOayQ.jpg']",1,https://pbs.twimg.com/media/EzFXvPLUYAMTD4Y.jpg,False,12,1,4,,#farmersprotest,,,,,,,[],,,,
15,1382970939445448706,1382970939445448706,1618560940000.0,2021-04-16 13:45:40,+0530,,"The Samyukta Kisan Morcha has now announced fresh plans, including a march to Parliament from all all border points.  #FarmersProtest   https://t.co/2Y6CG9uBme",en,['farmersprotest'],[],53000919,53000919,frontline_india,Frontline,5,13,https://twitter.com/frontline_india/status/1382970939445448706,['https://frontline.thehindu.com/the-nation/agriculture/four-months-on-the-farmers-protest-continues-unabated-delhi-borders-ghazipur/article34229527.ece?homepage=true'],[],0,,False,4,1,0,,#farmersprotest,,,,,,,[],,,,
16,1382967272189222918,1382967272189222918,1618560066000.0,2021-04-16 13:31:06,+0530,,मानवीयता के नाते काले कानून वापिस ले सरकार!! #FarmersProtest    https://t.co/wHAWoCZfYb,hi,['farmersprotest'],[],59084426,59084426,KuldeepKadyan,कुलदीप कादयान 🚜,5,13,https://twitter.com/KuldeepKadyan/status/1382967272189222918,[],['https://pbs.twimg.com/media/EzFCuoMVkAADSSj.jpg'],1,https://pbs.twimg.com/media/EzFCuoMVkAADSSj.jpg,False,30,1,13,,#farmersprotest,,,,,,,[],,,,
17,1382967078399971328,1382967078399971328,1618560020000.0,2021-04-16 13:30:20,+0530,,Advocates representing the family said they need time to seek experts’ evaluation of the material provided to them by the police which included post mortem report and video and X-ray report of the deceased. #RepublicDay #FarmersProtest   https://t.co/fAk3tPBOcv,en,"['republicday', 'farmersprotest']",[],1064102493662044160,1064102493662044160,TheMornStandard,TheMorningStandard,5,13,https://twitter.com/TheMornStandard/status/1382967078399971328,['https://www.newindianexpress.com/nation/2021/apr/16/r-day-violence-hc-allows-farmers-kin-to-seek-experts-view-on-autopsy-report-2290634.html'],[],0,,False,0,0,0,,#farmersprotest,,,,,,,[],,,,
18,1382962757029355527,1382962757029355527,1618558990000.0,2021-04-16 13:13:10,+0530,,ਕੀ ਹੋ ਗਈ ਦੀਪ ਸਿੱਧੂ ਦੀ ਜ਼ਮਾਨਤ? ਦਲਜੀਤ ਕਲਸੀ ਤੋਂ ਜਾਣੋ ਸੱਚਾਈ (ਵੀਡੀਓ)   https://t.co/osG81PuBWL  #DaljeetKalsi #DeepSidhu #Bail #YaadGrewal #FarmersProtest #FarmLaws  https://t.co/86nINJo0R7,pa,"['daljeetkalsi', 'deepsidhu', 'bail', 'yaadgrewal', 'farmersprotest', 'farmlaws']",[],222394250,222394250,JagbaniOnline,Jagbani,5,13,https://twitter.com/JagbaniOnline/status/1382962757029355527,['https://jagbani.punjabkesari.in/entertainment/news/daljeet-kalsi-video-on-deep-sidhu-fake-bail-news-1280314'],['https://pbs.twimg.com/media/EzFFP4WVEAEkBJW.jpg'],1,https://pbs.twimg.com/media/EzFFP4WVEAEkBJW.jpg,False,2,0,1,,#farmersprotest,,,,,,,[],,,,
19,1382955934452895748,1382955934452895748,1618557363000.0,2021-04-16 12:46:03,+0530,,"Beyond any arguments and debates, let's rely on facts. Those sitting on protests risking their all are doing so because they know without fighting this fight, they will lose everything anyhow.  Being an agrarian economy, we must put our famers/labour first #FarmersProtest",en,['farmersprotest'],[],29950358,29950358,arfilaamba,Arfi Laamba,5,12,https://twitter.com/arfilaamba/status/1382955934452895748,[],[],0,,False,1,0,0,https://twitter.com/Devinder_Sharma/status/1382701856472887318,#farmersprotest,,,,,,,[],,,,
20,1382945793569550337,1382945793569550337,1618554945000.0,2021-04-16 12:05:45,+0530,,"Dear .@narendramodi ji, Stop playing politics with our farmers!  #मोदी_खेतीकानून_वापिस_लो #FarmersProtest  https://t.co/fjA7b7RpfD",en,"['मोदी_खेतीकानून_वापिस_लो', 'farmersprotest']",[],998654223851106304,998654223851106304,SevadalDNH,Dadra and Nagar Haveli Congress Sevadal,5,12,https://twitter.com/SevadalDNH/status/1382945793569550337,[],['https://pbs.twimg.com/media/EzEi-1HUUAMS_3D.jpg'],1,https://pbs.twimg.com/media/EzEi-1HUUAMS_3D.jpg,False,16,0,14,,#farmersprotest,,,,,,,[],,,,
21,1382944815491391492,1382944815491391492,1618554712000.0,2021-04-16 12:01:52,+0530,," https://t.co/b0nDSJPcE4  ਸੌਖਾ ਨਹੀਂ ਕਿਸਾਨਾਂ ਦੇ ਮੋਰਚੇ ਚੁਕਾਉਣਾ, ਕਣਕ ਦੇ ਸੀਜ਼ਨ 'ਚ ਨਵੀਂ ਰਣਨੀਤੀ ਨੇ ਕੀਤਾ ਕਮਾਲ  #Farmersprotest #Kisanandolan #Farmlaws",pa,"['farmersprotest', 'kisanandolan', 'farmlaws']",[],1037022253,1037022253,abpsanjha,ABP Sanjha,5,12,https://twitter.com/abpsanjha/status/1382944815491391492,['https://punjabi.abplive.com/news/agriculture/women-farmers-increased-in-farmers-protest-due-wheat-procurement-season-619551'],[],0,,False,0,0,0,,#farmersprotest,,,,,,,[],,,,
22,1382944731647266817,1382944731647266817,1618554692000.0,2021-04-16 12:01:32,+0530,,Once again central government has a nefarious agenda in its mind - confronting 'Jawan' and 'Kisan'. #FarmersProtest   https://t.co/VLGz7tOhxK,en,['farmersprotest'],[],1464627522,1464627522,PSBrarOfficial,Parminder Singh Brar,5,12,https://twitter.com/PSBrarOfficial/status/1382944731647266817,['https://www.jagran.com/delhi/new-delhi-city-ncr-kisan-andolan-government-formulated-new-strategy-to-remove-farmers-deposited-on-the-border-aerial-survey-operation-to-be-done-soon-jagran-special-21562105.html'],[],0,,False,8,0,2,,#farmersprotest,,,,,,,[],,,,
23,1382931390392528896,1382931390392528896,1618551511000.0,2021-04-16 11:08:31,+0530,,#FarmersProtest : Haryana talks tough as COVID-19 cases surge across states   https://t.co/IzfYOfwUSr,en,['farmersprotest'],[],50279781,50279781,FinancialXpress,Financial Express,5,11,https://twitter.com/FinancialXpress/status/1382931390392528896,['https://www.financialexpress.com/india-news/farmers-protest-haryana-talks-tough-as-covid-19-cases-surge-across-states/2234163/'],[],0,,False,7,0,0,,#farmersprotest,,,,,,,[],,,,
24,1382929500753723393,1382929500753723393,1618551061000.0,2021-04-16 11:01:01,+0530,, https://t.co/3sTLWwGrzi  ਦਿੱਲੀ ਦੇ ਬਾਰਡਰਾਂ ਤੋਂ ਕਿਸਾਨਾਂ ਨੂੰ ਹਟਾਏਗੀ ਸਰਕਾਰ? ਕੋਰੋਨਾ ਕਰਕੇ ਇੰਝ ਬਣ ਰਹੀ ਰਣਨੀਤੀ  #FarmersProtest  #Farmers  #Delhi,pa,"['farmersprotest', 'farmers', 'delhi']",[],1037022253,1037022253,abpsanjha,ABP Sanjha,5,11,https://twitter.com/abpsanjha/status/1382929500753723393,['https://punjabi.abplive.com/news/india/government-planning-to-remove-farmers-protest-due-to-corona-virus-619539'],[],0,,False,0,0,0,,#farmersprotest,,,,,,,[],,,,
25,1382927332361469959,1382927332361469959,1618550544000.0,2021-04-16 10:52:24,+0530,,"BJP वाले पूरे देश में हिंसा करवाते हैं, वो देश को बांटते हैं- Rakesh Tikait (किसान नेता)  @RakeshTikaitBKU #FarmersProtest  https://t.co/GoywgKWArY",hi,['farmersprotest'],[],34206701,34206701,news24tvchannel,News24,5,10,https://twitter.com/news24tvchannel/status/1382927332361469959,[],[],1,https://pbs.twimg.com/amplify_video_thumb/1382926964499968002/img/gjYM7TYfI1Ku4qiT.jpg,False,3695,113,1015,,#farmersprotest,,,,,,,[],,,,
26,1382926651760136192,1382926651760136192,1618550381000.0,2021-04-16 10:49:41,+0530,,"At the rulers doors, his nights spent on the streets, will take stock of his reputation....  He went to wake up the oppressor, His resistance will surely awaken the generation...!  #FarmersProtest  #मोदी_खेतीकानून_वापिस_लो  https://t.co/m0WOx6A0gz",en,"['farmersprotest', 'मोदी_खेतीकानून_वापिस_लो']",[],1008266337888550912,1008266337888550912,iyctripura,Tripura Pradesh Youth Congress,5,10,https://twitter.com/iyctripura/status/1382926651760136192,[],['https://pbs.twimg.com/media/EzEkcuWVIAAWSb0.jpg'],1,https://pbs.twimg.com/media/EzEkcuWVIAAWSb0.jpg,False,14,0,17,,#farmersprotest,,,,,,,[],,,,
27,1382925517901340673,1382925517901340673,1618550111000.0,2021-04-16 10:45:11,+0530,,"ਕੋਰੋਨਾ ਦੇ ਕਹਿਰ 'ਚ ਅੰਦੋਲਨ ਖਤਮ ਕਰਾਉਣ ਦੀ ਤਿਆਰੀ, ਸਰਕਾਰ ਦੀ ਹਿੱਲਜੁੱਲ ਵੇਖ ਕਿਸਾਨਾਂ ਦਾ ਵੱਡਾ ਐਲਾਨ  https://t.co/04odp2j9TD #coronavirus #COVID19 #coronaviruscases #FarmersProtest",pa,"['coronavirus', 'covid19', 'coronaviruscases', 'farmersprotest']",[],1037022253,1037022253,abpsanjha,ABP Sanjha,5,10,https://twitter.com/abpsanjha/status/1382925517901340673,['https://punjabi.abplive.com/news/india/rumors-in-the-media-that-the-government-is-preparing-to-end-farmers-protest-due-to-coronavirus-wrath-619540'],[],0,,False,1,0,0,,#farmersprotest,,,,,,,[],,,,
28,1382925031743713280,1382925031743713280,1618549995000.0,2021-04-16 10:43:15,+0530,,"Dear .@narendramodi ji, Stop playing politics with our farmers!  #मोदी_खेतीकानून_वापिस_लो #FarmersProtest  https://t.co/gbVBrgFa4k",en,"['मोदी_खेतीकानून_वापिस_लो', 'farmersprotest']",[],1008266337888550912,1008266337888550912,iyctripura,Tripura Pradesh Youth Congress,5,10,https://twitter.com/iyctripura/status/1382925031743713280,[],['https://pbs.twimg.com/media/EzEi-1HUUAMS_3D.jpg'],1,https://pbs.twimg.com/media/EzEi-1HUUAMS_3D.jpg,False,13,0,14,,#farmersprotest,,,,,,,[],,,,
29,1382913085443248128,1382913085443248128,1618547147000.0,2021-04-16 09:55:47,+0530,,अब किसानों की सुनो प्रधानमंत्री मोदी बहुत हो गया बंगाल में  दीदी ओ दीदी  #मोदी_सरकार_ध्यान_दो  #मोदीजी_चुनाव_छोड़िए_देश_बचाइए  #FarmersProtest,hi,"['मोदी_सरकार_ध्यान_दो', 'मोदीजी_चुनाव_छोड़िए_देश_बचाइए', 'farmersprotest']",[],55993926,55993926,shaileshINC,Shailesh Trivedi,5,09,https://twitter.com/shaileshINC/status/1382913085443248128,[],[],0,,False,39,2,17,https://twitter.com/Nikhil4INDI/status/1382890660718542853,#farmersprotest,,,,,,,[],,,,
30,1382911591906217985,1382911591906217985,1618546791000.0,2021-04-16 09:49:51,+0530,,ਜਲੰਧਰ ਦੇ ਕੁਝ ਕਿਸਾਨ ਸਿੰਘੂ ਬਾਰਡਰ ’ਤੇ ਜਾਰੀ ਕਿਸਾਨ ਅੰਦੋਲਨ ਲਈ ਡੀਜ਼ਲ ਦੀਆਂ ਵਧਦੀਆਂ ਕੀਮਤਾਂ ਦਾ ਤੋੜ ਲੱਭਣ ਦੀ ਕੋਸ਼ਿਸ਼ ਕਰ ਰਹੇ ਹਨ ਇਸ ਲਈ ਉਹ ਸੌਰ ਊਰਜਾ ਦਾ ਸਹਾਰਾ ਲੈ ਰਹੇ ਹਨ ਰਿਪੋਰਟ-ਪਰਦੀਪ ਪੰਡਿਤ #FarmersProtest #Protest #SinghuBorder  https://t.co/VF1PnIAgQe,pa,"['farmersprotest', 'protest', 'singhuborder']",[],826091183491387394,826091183491387394,bbcnewspunjabi,BBC News Punjabi,5,09,https://twitter.com/bbcnewspunjabi/status/1382911591906217985,[],[],1,https://pbs.twimg.com/media/EzEWwgCWEAIjvuJ.jpg,False,48,2,6,,#farmersprotest,,,,,,,[],,,,
31,1382895271336628232,1382895271336628232,1618542900000.0,2021-04-16 08:45:00,+0530,,बॉर्डर पर जमा किसानों को हटाने के लिए सरकार ने बनाई नई रणनीति !  #KisanAndolan #FarmersProtest   https://t.co/JkrwNqwzN7,hi,"['kisanandolan', 'farmersprotest']",[],64639742,64639742,JagranNews,Dainik Jagran,5,08,https://twitter.com/JagranNews/status/1382895271336628232,['https://www.jagran.com/delhi/new-delhi-city-kisan-andolan-government-formulated-new-strategy-to-remove-farmers-deposited-on-the-border-aerial-survey-operation-to-be-done-soon-jagran-special-21562105.html'],[],0,,False,78,4,11,,#farmersprotest,,,,,,,[],,,,
32,1382893903368523779,1382893903368523779,1618542574000.0,2021-04-16 08:39:34,+0530,,"#KisanAndolan : बॉर्डर पर जमा किसानों को हटाने के लिए सरकार ने बनाई नई रणनीति, कराया हवाई सर्वे, जल्द होगा ऑपरेशन क्लीन #FarmersProtest   https://t.co/JkrwNqOaEF",hi,"['kisanandolan', 'farmersprotest']",[],64639742,64639742,JagranNews,Dainik Jagran,5,08,https://twitter.com/JagranNews/status/1382893903368523779,['https://www.jagran.com/delhi/new-delhi-city-kisan-andolan-government-formulated-new-strategy-to-remove-farmers-deposited-on-the-border-aerial-survey-operation-to-be-done-soon-jagran-special-21562105.html'],[],0,,False,296,14,34,,#farmersprotest,,,,,,,[],,,,
33,1382887721216118786,1382887721216118786,1618541100000.0,2021-04-16 08:15:00,+0530,,"कुंडली और टीकरी बॉर्डर के साथ यूपी गेट से भी किसानों के लिए बुरी खबर, पंजाब का एक किसान भी गायब !  #KisanAndolan #FarmersProtest    https://t.co/AYpv0yhWfE",hi,"['kisanandolan', 'farmersprotest']",[],64639742,64639742,JagranNews,Dainik Jagran,5,08,https://twitter.com/JagranNews/status/1382887721216118786,['https://www.jagran.com/delhi/new-delhi-city-ncr-bad-news-for-protesters-farmers-from-up-gate-along-with-singhu-and-tikri-border-also-21562942.html'],[],0,,False,39,2,5,,#farmersprotest,,,,,,,[],,,,
34,1382887707173539840,1382887707173539840,1618541096000.0,2021-04-16 08:14:56,+0530,,The campaigns are being spearheaded by representatives of the Bharatiya Kisan Union (BKU Asli). | @abhishekanandji #FarmersProtest #BJP #PanchayatPolls #UttarPradesh   https://t.co/cEh1lCuUow,en,"['farmersprotest', 'bjp', 'panchayatpolls', 'uttarpradesh']",[],19897138,19897138,IndiaToday,IndiaToday,5,08,https://twitter.com/IndiaToday/status/1382887707173539840,['https://www.indiatoday.in/elections/story/up-farmer-union-leaders-campaign-against-bjp-candidates-1791447-2021-04-16'],[],0,,False,10,0,4,,#farmersprotest,,,,,,,[],,,,
