,id,conversation_id,created_at,date,timezone,place,tweet,language,hashtags,cashtags,user_id,user_id_str,username,name,day,hour,link,urls,photos,video,thumbnail,retweet,nlikes,nreplies,nretweets,quote_url,search,near,geo,source,user_rt_id,user_rt,retweet_id,reply_to,retweet_date,translate,trans_src,trans_dest
0,1365072120082915328,1365072120082915328,1614293529000.0,2021-02-26 04:22:09,+0530,,3.4L farmers pay up power bill arrears of Rs 312 crore  https://t.co/dKOlZXD3DK,en,[],[],30859231,30859231,TOIMumbai,TOI Mumbai,5,04,https://twitter.com/TOIMumbai/status/1365072120082915328,['http://toi.in/Vd8ubZ'],[],0,,False,3,0,1,,farmers' bill,,,,,,,[],,,,
1,1365014444510744580,1365014444510744580,1614279778000.0,2021-02-26 00:32:58,+0530,,"Congratulations to Conservative MP Philip Lawrence for his work on Bill C-205 and passing second reading in the House!  If passed, it would exempt our farmers from paying the carbon tax on their hard work.  Conservatives continue to stand up for our hard-working Canadian farmers!  https://t.co/5zCy9FGSK1",en,[],[],176207343,176207343,bobzimmermp,Bob Zimmer MP,5,00,https://twitter.com/bobzimmermp/status/1365014444510744580,[],['https://pbs.twimg.com/media/EvGBPO4XAAIyqaq.jpg'],1,https://pbs.twimg.com/media/EvGBPO4XAAIyqaq.jpg,False,17,0,1,,farmers' bill,,,,,,,[],,,,
2,1365002966546145281,1365002966546145281,1614277042000.0,2021-02-25 23:47:22,+0530,,"The carbon tax caused farm energy bills to skyrocket. In response, @PLawrenceMP introduced Bill C-206 to exempt farmers from paying the carbon tax on gasoline, propane, and natural gas. Despite the Liberals opposition, the Bill passed &amp; is off to committee. A big win for #CdnAg!  https://t.co/4BRlriPrqX",en,['cdnag'],[],2733595406,2733595406,TracyGrayKLC,Tracy Gray,4,23,https://twitter.com/TracyGrayKLC/status/1365002966546145281,[],['https://pbs.twimg.com/media/EvFz4dFWQAorjEw.jpg'],1,https://pbs.twimg.com/media/EvFz4dFWQAorjEw.jpg,False,1,1,0,,farmers' bill,,,,,,,[],,,,
3,1364993060812292100,1364993060812292100,1614274680000.0,2021-02-25 23:08:00,+0530,,Liberals vote against Bill to exempt farmers from the carbon tax on fuels used in farming. Liberals don't support farmers. #cdnpoli #agriculture #farmers #carbontax #C206  https://t.co/nl80tnuIbK,en,"['cdnpoli', 'agriculture', 'farmers', 'carbontax', 'c206']",[],1198299741060239360,1198299741060239360,kyleseeback,kyleseeback,4,23,https://twitter.com/kyleseeback/status/1364993060812292100,[],[],1,https://pbs.twimg.com/ext_tw_video_thumb/1364992468077453314/pu/img/5DaJSXrKJlDGyCAm.jpg,False,7,1,1,,farmers' bill,,,,,,,[],,,,
4,1364993020844777482,1364993020844777482,1614274671000.0,2021-02-25 23:07:51,+0530,,"Last night, the HoC passed @PLawrenceMP's Bill C-206 to exempt farmers from the Liberal Carbon Tax. Despite the Liberals' best efforts to continue penalizing farmers for performing essential on-farm processes, I'm thrilled that all opposition parties came together to help #CdnAg.  https://t.co/0sSnw5FsUN",en,['cdnag'],[],876849435820474368,876849435820474368,Lianne_Rood,Lianne Rood,4,23,https://twitter.com/Lianne_Rood/status/1364993020844777482,[],['https://pbs.twimg.com/media/EvFtCuiWYAkuxOQ.jpg'],1,https://pbs.twimg.com/media/EvFtCuiWYAkuxOQ.jpg,False,60,2,19,,farmers' bill,,,,,,,[],,,,
5,1364983707145281536,1364983707145281536,1614272450000.0,2021-02-25 22:30:50,+0530,,"A #nelg bill targeted to ensuring Nebraska’s farmers, ranchers, and independent repair technicians have access to information, diagnostic equipment, and parts to repair farm equipment and machinery has received support from the NEFB. Full story:  https://t.co/xFJR87kePl  https://t.co/qZNw6M2gp4",en,['nelg'],[],21231796,21231796,NEFarmBureau,Nebraska Farm Bureau,4,22,https://twitter.com/NEFarmBureau/status/1364983707145281536,['http://ow.ly/r1Lp50DJULY'],['https://pbs.twimg.com/media/EvFlcsdXIAA8Kuz.jpg'],1,https://pbs.twimg.com/media/EvFlcsdXIAA8Kuz.jpg,False,0,1,1,,farmers' bill,,,,,,,[],,,,
6,1364970492063584281,1364970492063584281,1614269299000.0,2021-02-25 21:38:19,+0530,,"In #Maharashtra, 3.42 lakh farmers have paid pending electricity bill arrears to the tune of Rs 312 crore: Energy minister Nitin Raut",en,['maharashtra'],[],30859231,30859231,TOIMumbai,TOI Mumbai,4,21,https://twitter.com/TOIMumbai/status/1364970492063584281,[],[],0,,False,197,2,14,,farmers' bill,,,,,,,[],,,,
7,1364960853783683078,1364960853783683078,1614267001000.0,2021-02-25 21:00:01,+0530,,Farmers are closely reviewing the bill that would bump up sales tax on farm equipment from 1.5 to 4 percent.  https://t.co/MDnlls5bhk,en,[],[],16081037,16081037,WLBT,WLBT 3 On Your Side,4,21,https://twitter.com/WLBT/status/1364960853783683078,['https://www.wlbt.com/2021/02/25/mixed-reaction-tax-reform-proposal-moving-through-legislative-process/?utm_source=twitter&utm_medium=social&utm_campaign=snd&utm_content=wlbt'],[],0,,False,0,3,1,,farmers' bill,,,,,,,[],,,,
8,1364955504150249474,1364955504150249474,1614265726000.0,2021-02-25 20:38:46,+0530,,"The govt will not procure farmers crops if 'mandis' are closed due to the three agri laws enacted by the Centre. If that happens, the farmers will be devastated.  That's why the agitation will continue until the govt repeals all the bills.  @_YogendraYadav  https://t.co/Vp6uTPP8Zb",en,[],[],782439160388972544,782439160388972544,_SwarajIndia,Swaraj India,4,20,https://twitter.com/_SwarajIndia/status/1364955504150249474,['https://www.business-standard.com/article/current-affairs/punjab-haryana-farmers-will-be-ruined-if-mandis-are-shut-yogendra-yadav-121022301428_1.html'],[],0,,False,19,0,9,,farmers' bill,,,,,,,[],,,,
9,1364954003021443077,1364954003021443077,1614265368000.0,2021-02-25 20:32:48,+0530,,"Economic development, property tax, and crop insurance are just a few of the many topics I discussed with NE's farmers and producers. I look forward to bringing these concerns to the Ag Committee and crafting bipartisan bills that help NE's Ag community.  https://t.co/S5ieC0aXk9",en,[],[],818975124460335106,818975124460335106,RepDonBacon,Rep. Don Bacon 🇺🇸🇺🇦,4,20,https://twitter.com/RepDonBacon/status/1364954003021443077,['https://www.suntelegraph.com/story/2021/02/24/news/sen-bacon-tours-western-nebraska/15573.html'],[],0,,False,14,15,4,,farmers' bill,,,,,,,[],,,,
10,1364920516306468868,1364920516306468868,1614257384000.0,2021-02-25 18:19:44,+0530,,"🦙🐑💥🐕New, updated legislation– which seeks to address the increasing levels of livestock attacks across Scotland has passed Stage 2. My Bill, which has the backing of Scottish farmers, outdoor access interest groups and dog walkers alike  https://t.co/mPViiCYYy8 @NSA_Scotland",en,[],[],2900791232,2900791232,EmmaHarperMSP,Emma Harper MSP,4,18,https://twitter.com/EmmaHarperMSP/status/1364920516306468868,['https://www.dgwgo.com/rural-farming-news/harpers-livestock-protection-bill-passes-stage-2'],[],0,,False,9,1,3,,farmers' bill,,,,,,,[],,,,
11,1364904150769803268,1364903142412935169,1614253482000.0,2021-02-25 17:14:42,+0530,,@conorsen @RyanDezember @vipalmonga Foreign factory villains? 5th generation tree farmers? Local hardware store misunderstandings? Huge tax bills? It's a novel.,en,[],[],62633125,62633125,MylesUdland,Myles Udland,4,17,https://twitter.com/MylesUdland/status/1364904150769803268,[],[],0,,False,2,0,0,,farmers' bill,,,,,,,"[{'screen_name': 'conorsen', 'name': 'Conor Sen', 'id': '70778344'}, {'screen_name': 'RyanDezember', 'name': 'Ryan Dezember', 'id': '326415590'}, {'screen_name': 'vipalmonga', 'name': 'Vipal Monga', 'id': '122704362'}]",,,,
12,1364782004273782784,1364782004273782784,1614224360000.0,2021-02-25 09:09:20,+0530,,India's agriculture sector is in urgent need of reform. Will the farm bills actually resolve the long-standing issues for India's farmers?   https://t.co/7oCkOeE4Ca,en,[],[],6134882,6134882,dwnews,DW News,4,09,https://twitter.com/dwnews/status/1364782004273782784,['https://p.dw.com/p/3pkrk'],[],0,,False,6,1,3,,farmers' bill,,,,,,,[],,,,
13,1364774527939534849,1364773776185905154,1614222578000.0,2021-02-25 08:39:38,+0530,,"Of the ₹1.5 lakh I received, we purchased gloves and books for ₹1.30 lakh that we distributed at the Singhu and Tikri border [sites of farmer protests]. ₹12,000 was spent on petrol for my two vehicles and the remaining ₹8,000 is with me. I showed them the bills,” he said.",en,[],[],28114735,28114735,vijaita,Vijaita Singh,4,08,https://twitter.com/vijaita/status/1364774527939534849,[],[],0,,False,3,1,1,,farmers' bill,,,,,,,[],,,,
14,1364765538883432458,1364765538883432458,1614220435000.0,2021-02-25 08:03:55,+0530,,"Lol, dare you to say this to farmers, Bill.",en,[],[],21359504,21359504,joshvisser,Josh Visser,4,08,https://twitter.com/joshvisser/status/1364765538883432458,[],[],0,,False,3,0,1,https://twitter.com/AnneGaviola/status/1364765298826559490,farmers' bill,,,,,,,[],,,,
15,1364765074515255313,1364765074515255313,1614220324000.0,2021-02-25 08:02:04,+0530,,Sad to see this. @RepFeenstra’s bipartisan amendment would provide much needed relief for farmers impacted by the derecho. There’s no justifiable reason for this to be stripped from the bill. #IA01,en,['ia01'],[],1340783304304410625,1340783304304410625,RepAshleyHinson,Ashley Hinson,4,08,https://twitter.com/RepAshleyHinson/status/1364765074515255313,[],[],0,,False,62,41,26,https://twitter.com/ChuckGrassley/status/1364710514455117824,farmers' bill,,,,,,,[],,,,
16,1364765050787876864,1364752468890902529,1614220318000.0,2021-02-25 08:01:58,+0530,,Hanging out with Bill Gates in the @joinClubhouse . Wow I didn’t realize he is a farmer now  https://t.co/JMzVtBnMUo,en,[],[],3840981,3840981,momblogger,Noemi L. Dado,4,08,https://twitter.com/momblogger/status/1364765050787876864,[],['https://pbs.twimg.com/media/EvCejxuVEAEelzO.jpg'],1,https://pbs.twimg.com/media/EvCejxuVEAEelzO.jpg,False,0,1,0,,farmers' bill,,,,,,,[],,,,
17,1364749550968258569,1364749550968258569,1614216623000.0,2021-02-25 07:00:23,+0530,,Farm Reforms in India: Online Interaction between Students and Consul General @randhir_jk    https://t.co/yayDUp06Py #farmlaws2020 #farmlaws @MEAIndia @IndianDiplomacy #farmersbill #farmersbill2020 #atmanirbharkrishi @mygovindia @AgriGoI @icarindia @nstomar,en,"['farmlaws2020', 'farmlaws', 'farmersbill', 'farmersbill2020', 'atmanirbharkrishi']",[],2811605677,2811605677,IndiainNewYork,India in New York,4,07,https://twitter.com/IndiainNewYork/status/1364749550968258569,['https://www.facebook.com/indiainnewyork/videos/769255197021173/?vh=e&d=n'],[],0,,False,6,0,0,,farmers' bill,,,,,,,[],,,,
18,1364743618959917056,1364743618959917056,1614215209000.0,2021-02-25 06:36:49,+0530,,"I was glad to vote in favour of Bill C-206 to support our Farmers, this evening in virtual Parliament. Special thanks to my Conservative colleague @PLawrenceMP for sponsoring it.  https://t.co/77u7lvCG4u",en,[],[],1104590774,1104590774,RichardBragdon,Richard Bragdon MP,4,06,https://twitter.com/RichardBragdon/status/1364743618959917056,[],['https://pbs.twimg.com/media/EvCLFcnUUAE2Ktg.jpg'],1,https://pbs.twimg.com/media/EvCLFcnUUAE2Ktg.jpg,False,5,1,0,,farmers' bill,,,,,,,[],,,,
19,1364740399307382784,1364740399307382784,1614214441000.0,2021-02-25 06:24:01,+0530,,"Great news for farmers even though the Trudeau Party voted against it, @CPC_HQ MP @PLawrenceMP bill passes 2nd reading and will now go to Committee to exempt farmers from paying the carbon tax on gasoline, propane, and natural gas. #FarmsFeedFamilies #Barrie #Innisfil  https://t.co/8E5lvcWXBY",en,"['farmsfeedfamilies', 'barrie', 'innisfil']",[],38100599,38100599,JohnBrassardCPC,John Brassard,4,06,https://twitter.com/JohnBrassardCPC/status/1364740399307382784,[],['https://pbs.twimg.com/media/EvCHikbU4AExzMh.jpg'],1,https://pbs.twimg.com/media/EvCHikbU4AExzMh.jpg,False,322,0,130,,farmers' bill,,,,,,,[],,,,
20,1364737920574255108,1364737920574255108,1614213850000.0,2021-02-25 06:14:10,+0530,,Nikita Khanna ex JNU and a bright young girl from Bhopal. Must hear her explain why we should oppose Anti Farmer Bills.  https://t.co/cVNLx3l3CH,en,[],[],371730289,371730289,digvijaya_28,digvijaya singh,4,06,https://twitter.com/digvijaya_28/status/1364737920574255108,[],[],1,https://pbs.twimg.com/ext_tw_video_thumb/1364737819004997632/pu/img/xSGiCFiFEG_ty0Hd.jpg,False,816,74,217,,farmers' bill,,,,,,,[],,,,
21,1364736073679708161,1364736073679708161,1614213410000.0,2021-02-25 06:06:50,+0530,,"Great news for farmers, thanks to a solid Conservative PMB by @PLawrenceMP!! I can't believe the Liberal government voted against this bill, which is a vote against farmers. Extra taxes on farm inputs only increases the costs of food production.  https://t.co/yhoKaGWAtt",en,[],[],44718864,44718864,jamesbezan,James Bezan,4,06,https://twitter.com/jamesbezan/status/1364736073679708161,[],['https://pbs.twimg.com/media/EvCEMPDVkAEQhFj.jpg'],1,https://pbs.twimg.com/media/EvCEMPDVkAEQhFj.jpg,False,340,13,96,,farmers' bill,,,,,,,[],,,,
22,1364730892732801036,1364730892732801036,1614212174000.0,2021-02-25 05:46:14,+0530,,"We have just passed a Conservative bill at 2nd reading to exempt farmers from paying the carbon tax on gasoline, propane and natural gas.  This is great news for Canadian farmers.",en,[],[],324555383,324555383,MBDan7,Dan Mazier,4,05,https://twitter.com/MBDan7/status/1364730892732801036,[],[],0,,False,4435,216,752,,farmers' bill,,,,,,,[],,,,
