,id,conversation_id,created_at,date,timezone,place,tweet,language,hashtags,cashtags,user_id,user_id_str,username,name,day,hour,link,urls,photos,video,thumbnail,retweet,nlikes,nreplies,nretweets,quote_url,search,near,geo,source,user_rt_id,user_rt,retweet_id,reply_to,retweet_date,translate,trans_src,trans_dest
0,1364995851022524420,1364995851022524420,1614275345000.0,2021-02-25 23:19:05,+0530,,"Vijayan slams Rahul over tractor rally, says Cong's policies responsible for farm sector crisis   https://t.co/6GktOedcE8 #PinarayiVijayan",en,['pinarayivijayan'],[],18159588,18159588,Oneindia,Oneindia News,4,23,https://twitter.com/Oneindia/status/1364995851022524420,['http://www.oneindia.com/india/vijayan-slams-rahul-over-tractor-rally-says-cong-s-policies-responsible-for-farm-sector-crisis-3222248.html'],[],0,,False,1,0,0,,farm policies,,,,,,,[],,,,
1,1364983504526663685,1364983504526663685,1614272402000.0,2021-02-25 22:30:02,+0530,,"Kerala CM Vijayan slams Rahul over tractor rally, says Cong's policies responsible for farm sector crisis  https://t.co/eT2vrCLpcp",en,[],[],29958928,29958928,TOIIndiaNews,TOI India,4,22,https://twitter.com/TOIIndiaNews/status/1364983504526663685,['http://toi.in/6RPFrZ'],[],0,,False,12,6,2,,farm policies,,,,,,,[],,,,
2,1364983503172042752,1364983503172042752,1614272401000.0,2021-02-25 22:30:01,+0530,,LIVE NOW: @MexicoInstitute gathers a panel of experts to discuss policies and practices to improve protections for farm workers.,en,[],[],382129509,382129509,TheWilsonCenter,The Wilson Center,4,22,https://twitter.com/TheWilsonCenter/status/1364983503172042752,[],[],0,,False,2,0,2,,farm policies,,,,,,,[],,,,
3,1364983157544656898,1364983157544656898,1614272319000.0,2021-02-25 22:28:39,+0530,,"#Kerala CM Pinarayi Vijayan holds Congress' neo-liberal policies in 1990s responsible for farm-sector crisis, demands apology from Rahul Gandhi",en,['kerala'],[],245687754,245687754,PTI_News,Press Trust of India,4,22,https://twitter.com/PTI_News/status/1364983157544656898,[],[],0,,False,118,4,22,,farm policies,,,,,,,[],,,,
4,1364918613392699395,1364095582344773632,1614256931000.0,2021-02-25 18:12:11,+0530,,Anja Gassner: The disincentives of applying #forest regulations to #trees on farms cannot be exaggerated. We need #agroforestry policies that clarify the responsibilities of both ministries of environment &amp; forestry as well as ministries of #agriculture. #ReforestationConference  https://t.co/9cR8Vbt0xm,en,"['forest', 'trees', 'agroforestry', 'agriculture', 'reforestationconference']",[],65339733,65339733,ICRAF,World Agroforestry,4,18,https://twitter.com/ICRAF/status/1364918613392699395,[],['https://pbs.twimg.com/media/EvEpts8XAAcYH6X.jpg'],1,https://pbs.twimg.com/media/EvEpts8XAAcYH6X.jpg,False,3,1,0,,farm policies,,,,,,,[],,,,
