,id,conversation_id,created_at,date,timezone,place,tweet,language,hashtags,cashtags,user_id,user_id_str,username,name,day,hour,link,urls,photos,video,thumbnail,retweet,nlikes,nreplies,nretweets,quote_url,search,near,geo,source,user_rt_id,user_rt,retweet_id,reply_to,retweet_date,translate,trans_src,trans_dest
0,1484161412364910596,1484161412364910596,1642686629000.0,2022-01-20 19:20:29,+0530,,"नवा रायपुर किसान आंदोलन:इंतजार करते रहे मंत्री ,किसान नहीं पहुंचे वार्ता मे ! #chhattisgarh #farmersprotest #raipur #किसानआंदोलन #रायपुर #छत्तीसगढ़  https://t.co/Yo6z3QckU5",hi,"['chhattisgarh', 'farmersprotest', 'raipur', 'किसानआंदोलन', 'रायपुर', 'छत्तीसगढ़']",[],18186549,18186549,oneindiaHindi,Oneindia Hindi,4,19,https://twitter.com/oneindiaHindi/status/1484161412364910596,['https://hindi.oneindia.com/news/raipur/nava-raipur-kisan-andolan-ministers-kept-waiting-farmers-did-not-talk-659417.html'],[],0,,False,5,0,1,,#farmersprotest,,,,,,,[],,,,
1,1484160500577738752,1484160500577738752,1642686412000.0,2022-01-20 19:16:52,+0530,,"पश्चिमी यूपी में बीजेपी के लिए बहुत मुश्किलें हैं  मुजफ्फरनगर के बुढ़ाना विधानसभा के विधायक जिनको भाजपा ने दोबारा टिकट दिया है, उन्हें गांव सिसौली में दौरे के समय किसानों का विरोध झेलना पड़ा था, हाथापाई भी हो गई थी.  #FarmersProtest #Muzaffarnagar #Budhana #UPElection2022 #BJP",hi,"['farmersprotest', 'muzaffarnagar', 'budhana', 'upelection2022', 'bjp']",[],65519909,65519909,MadhawTiwari,Madhaw Tiwari,4,19,https://twitter.com/MadhawTiwari/status/1484160500577738752,[],[],0,,False,5,1,0,,#farmersprotest,,,,,,,[],,,,
2,1484109990256611336,1484109990256611336,1642674369000.0,2022-01-20 15:56:09,+0530,,"किसानों से कब वापस होंगे मुकदमे? अदालतों से पहुंच रहे हैं सम्मन, सरकार ने बताए कुल इतने मामले #haryana #farmersprotest #manoharlalkhattar #हरियाणा #किसानआंदोलन #किसान #मनोहरलालखट्टर #farmer #haryananews #haryanagovernment #haryanapolice  https://t.co/qhgXLDO9cC",hi,"['haryana', 'farmersprotest', 'manoharlalkhattar', 'हरियाणा', 'किसानआंदोलन', 'किसान', 'मनोहरलालखट्टर', 'farmer', 'haryananews', 'haryanagovernment', 'haryanapolice']",[],18186549,18186549,oneindiaHindi,Oneindia Hindi,4,15,https://twitter.com/oneindiaHindi/status/1484109990256611336,['https://hindi.oneindia.com/news/haryana/gurnam-singh-chaduni-said-farmers-need-no-panic-govt-says-276-firs-are-registered-in-haryana-659346.html'],[],0,,False,1,0,0,,#farmersprotest,,,,,,,[],,,,
3,1484105036519321601,1484105036519321601,1642673188000.0,2022-01-20 15:36:28,+0530,,क्या किसानों की हालत सुधारने का तरीका कर्जमाफी ही है ? #FarmersProtest #farmer  #RajasthanWithNews18 #वैक्सीन_कवच_को_ना_नहीं,hi,"['farmersprotest', 'farmer', 'rajasthanwithnews18', 'वैक्सीन_कवच_को_ना_नहीं']",[],462902673,462902673,News18Rajasthan,News18 Rajasthan,4,15,https://twitter.com/News18Rajasthan/status/1484105036519321601,[],[],0,,False,10,3,2,,#farmersprotest,,,,,,,[],,,,
4,1484069963740553216,1484069963740553216,1642664826000.0,2022-01-20 13:17:06,+0530,,"Dr Sahib your idealism, which manifested in your medical services during #FarmersProtest, is shared by me &amp; all members of @SSPmanch. Even AAP has seen a revolt when moneyed persons were favoured in some places. Punjab indeed deserves better.",en,['farmersprotest'],[],1401726968,1401726968,ambkcsingh,K. C. Singh,4,13,https://twitter.com/ambkcsingh/status/1484069963740553216,[],[],0,,False,30,7,5,https://twitter.com/SinghSwaiman/status/1484067505086013442,#farmersprotest,,,,,,,[],,,,
5,1484063629628428289,1484063629628428289,1642663316000.0,2022-01-20 12:51:56,+0530,,किसानों का cm आवास पर हल्ला बोल !  https://t.co/KiTpFxrAij via @YouTube @INCIndia @BJP4Rajasthan @BJP4India @Son_of_farmer1 #FarmersProtest,hi,['farmersprotest'],[],741205833548058624,741205833548058624,sharatjpr,Sharat,4,12,https://twitter.com/sharatjpr/status/1484063629628428289,['https://youtu.be/s_h5YRCluv0'],[],0,,False,257,5,37,,#farmersprotest,,,,,,,[],,,,
6,1484040249768833025,1484040249768833025,1642657742000.0,2022-01-20 11:19:02,+0530,,"सरकार द्वारा किसानों से वादाखिलाफी के खिलाफ 31 जनवरी को SKM की तरफ से देशव्यापी ""विश्वासघात दिवस"" का ऐलान।  लखीमपुर खीरी हत्याकांड में बीजेपी की बेशर्मी और संवेदनहीनता के विरुद्ध SKM पक्का मोर्चा लगाएगा, मिशन उत्तर प्रदेश जारी रहेगा।  #FarmersProtest | @_YogendraYadav  https://t.co/yuirNG21lW",hi,['farmersprotest'],[],782439160388972544,782439160388972544,_SwarajIndia,Swaraj India,4,11,https://twitter.com/_SwarajIndia/status/1484040249768833025,[],"['https://pbs.twimg.com/media/FJhevJgaAAE9zEO.jpg', 'https://pbs.twimg.com/media/FJhevb4agAE-r20.jpg']",1,https://pbs.twimg.com/media/FJhevJgaAAE9zEO.jpg,False,15,1,9,,#farmersprotest,,,,,,,[],,,,
7,1484023674466631682,1484023674466631682,1642653790000.0,2022-01-20 10:13:10,+0530,,"लखीमपुर खीरी हत्याकांड में बीजेपी की बेशर्मी और संवेदनहीनता के विरुद्ध 21 जनवरी से लखीमपुर खीरी में ""पक्का मोर्चा"" की शुरुआत।  जब तक किसान की मांगे नही मानी जाती, तब तक संघर्ष जारी रहेगा   @_JaiKisan | #FarmersProtest  https://t.co/DnXYg36uNk",hi,['farmersprotest'],[],886647512,886647512,aviksahaindia,Avik Saha,4,10,https://twitter.com/aviksahaindia/status/1484023674466631682,[],['https://pbs.twimg.com/media/FJhPqqOVgAAxpba.jpg'],1,https://pbs.twimg.com/media/FJhPqqOVgAAxpba.jpg,False,24,0,17,,#farmersprotest,,,,,,,[],,,,
8,1484023161855561730,1484023161855561730,1642653668000.0,2022-01-20 10:11:08,+0530,,"लखीमपुर खीरी हत्याकांड में बीजेपी की बेशर्मी और संवेदनहीनता के विरुद्ध 21 जनवरी से लखीमपुर खीरी में ""पक्का मोर्चा"" की शुरुआत।  जब तक किसान की मांगे नही मानी जाती, तब तक संघर्ष जारी रहेगा   @_JaiKisan | #FarmersProtest  https://t.co/2IPpCowGCN",hi,['farmersprotest'],[],782439160388972544,782439160388972544,_SwarajIndia,Swaraj India,4,10,https://twitter.com/_SwarajIndia/status/1484023161855561730,[],['https://pbs.twimg.com/media/FJhPMx5UUAAJ2Xi.jpg'],1,https://pbs.twimg.com/media/FJhPMx5UUAAJ2Xi.jpg,False,21,0,13,,#farmersprotest,,,,,,,[],,,,
