,id,date,tweet,hashtags,user_id,username,name,link,urls,nlikes,nretweets,nreplies
0,1484297401313624064,2022-01-21 04:20:52,Rep. Chew has filed a bill to require discussion about agriculture fences to be included in OHV and hunting education courses:  https://t.co/P7IiAx8TIF @fox13 #utpol #utleg,"['utpol', 'utleg']",18493702,BenWinslow,Ben Winslow,https://twitter.com/BenWinslow/status/1484297401313624064,['https://le.utah.gov/~2022/bills/static/HB0206.html'],1,0,0
1,1484281095118106631,2022-01-21 03:16:04,A bill that would assist ranchers by classifying more areas as grasslands to feed cattle and other livestock passed the initial review Thursday in the House Agriculture and Natural Resources Committee by a 10-3 vote.  https://t.co/TTf732Duyv,[],19209569,RCJournal,Rapid City Journal,https://twitter.com/RCJournal/status/1484281095118106631,['https://rapidcityjournal.com/news/local/grassland-protection-bill-passes-house-committee/article_c380d83b-bbac-5ba2-a548-bee75b9f7319.html?utm_campaign=snd-autopilot&utm_medium=social&utm_source=twitter_RCJournal'],0,0,0
2,1484262178165346311,2022-01-21 02:00:54,Yesterday I co-led a bicameral letter to the Corps of Engineers asking that they prioritize funding from bipartisan infrastructure bill I supported for the Lower Missouri River for both flood protection &amp; navigation This investment is important for Western Iowa &amp; agriculture,[],10615232,ChuckGrassley,ChuckGrassley,https://twitter.com/ChuckGrassley/status/1484262178165346311,[],97,18,60
3,1484166046789611530,2022-01-20 19:38:54,"One of the best steps we can take toward environmental stewardship is supporting those who work mostly closely with it. That is why I filed Senate Bill 864 which rewards those in agriculture, shellfish aquaculture, and timber  for the environmental services they provide.  https://t.co/ZtivSTQhtm",[],36632865,LoranneAusley,Loranne Ausley,https://twitter.com/LoranneAusley/status/1484166046789611530,[],11,6,1
0,1484161412364910596,2022-01-20 19:20:29,"नवा रायपुर किसान आंदोलन:इंतजार करते रहे मंत्री ,किसान नहीं पहुंचे वार्ता मे ! #chhattisgarh #farmersprotest #raipur #किसानआंदोलन #रायपुर #छत्तीसगढ़  https://t.co/Yo6z3QckU5","['chhattisgarh', 'farmersprotest', 'raipur', 'किसानआंदोलन', 'रायपुर', 'छत्तीसगढ़']",18186549,oneindiaHindi,Oneindia Hindi,https://twitter.com/oneindiaHindi/status/1484161412364910596,['https://hindi.oneindia.com/news/raipur/nava-raipur-kisan-andolan-ministers-kept-waiting-farmers-did-not-talk-659417.html'],5,1,0
1,1484160500577738752,2022-01-20 19:16:52,"पश्चिमी यूपी में बीजेपी के लिए बहुत मुश्किलें हैं  मुजफ्फरनगर के बुढ़ाना विधानसभा के विधायक जिनको भाजपा ने दोबारा टिकट दिया है, उन्हें गांव सिसौली में दौरे के समय किसानों का विरोध झेलना पड़ा था, हाथापाई भी हो गई थी.  #FarmersProtest #Muzaffarnagar #Budhana #UPElection2022 #BJP","['farmersprotest', 'muzaffarnagar', 'budhana', 'upelection2022', 'bjp']",65519909,MadhawTiwari,Madhaw Tiwari,https://twitter.com/MadhawTiwari/status/1484160500577738752,[],5,0,1
2,1484109990256611336,2022-01-20 15:56:09,"किसानों से कब वापस होंगे मुकदमे? अदालतों से पहुंच रहे हैं सम्मन, सरकार ने बताए कुल इतने मामले #haryana #farmersprotest #manoharlalkhattar #हरियाणा #किसानआंदोलन #किसान #मनोहरलालखट्टर #farmer #haryananews #haryanagovernment #haryanapolice  https://t.co/qhgXLDO9cC","['haryana', 'farmersprotest', 'manoharlalkhattar', 'हरियाणा', 'किसानआंदोलन', 'किसान', 'मनोहरलालखट्टर', 'farmer', 'haryananews', 'haryanagovernment', 'haryanapolice']",18186549,oneindiaHindi,Oneindia Hindi,https://twitter.com/oneindiaHindi/status/1484109990256611336,['https://hindi.oneindia.com/news/haryana/gurnam-singh-chaduni-said-farmers-need-no-panic-govt-says-276-firs-are-registered-in-haryana-659346.html'],1,0,0
3,1484105036519321601,2022-01-20 15:36:28,क्या किसानों की हालत सुधारने का तरीका कर्जमाफी ही है ? #FarmersProtest #farmer  #RajasthanWithNews18 #वैक्सीन_कवच_को_ना_नहीं,"['farmersprotest', 'farmer', 'rajasthanwithnews18', 'वैक्सीन_कवच_को_ना_नहीं']",462902673,News18Rajasthan,News18 Rajasthan,https://twitter.com/News18Rajasthan/status/1484105036519321601,[],10,2,3
4,1484069963740553216,2022-01-20 13:17:06,"Dr Sahib your idealism, which manifested in your medical services during #FarmersProtest, is shared by me &amp; all members of @SSPmanch. Even AAP has seen a revolt when moneyed persons were favoured in some places. Punjab indeed deserves better.",['farmersprotest'],1401726968,ambkcsingh,K. C. Singh,https://twitter.com/ambkcsingh/status/1484069963740553216,[],30,5,7
5,1484063629628428289,2022-01-20 12:51:56,किसानों का cm आवास पर हल्ला बोल !  https://t.co/KiTpFxrAij via @YouTube @INCIndia @BJP4Rajasthan @BJP4India @Son_of_farmer1 #FarmersProtest,['farmersprotest'],741205833548058624,sharatjpr,Sharat,https://twitter.com/sharatjpr/status/1484063629628428289,['https://youtu.be/s_h5YRCluv0'],257,37,5
6,1484040249768833025,2022-01-20 11:19:02,"सरकार द्वारा किसानों से वादाखिलाफी के खिलाफ 31 जनवरी को SKM की तरफ से देशव्यापी ""विश्वासघात दिवस"" का ऐलान।  लखीमपुर खीरी हत्याकांड में बीजेपी की बेशर्मी और संवेदनहीनता के विरुद्ध SKM पक्का मोर्चा लगाएगा, मिशन उत्तर प्रदेश जारी रहेगा।  #FarmersProtest | @_YogendraYadav  https://t.co/yuirNG21lW",['farmersprotest'],782439160388972544,_SwarajIndia,Swaraj India,https://twitter.com/_SwarajIndia/status/1484040249768833025,[],15,9,1
7,1484023674466631682,2022-01-20 10:13:10,"लखीमपुर खीरी हत्याकांड में बीजेपी की बेशर्मी और संवेदनहीनता के विरुद्ध 21 जनवरी से लखीमपुर खीरी में ""पक्का मोर्चा"" की शुरुआत।  जब तक किसान की मांगे नही मानी जाती, तब तक संघर्ष जारी रहेगा   @_JaiKisan | #FarmersProtest  https://t.co/DnXYg36uNk",['farmersprotest'],886647512,aviksahaindia,Avik Saha,https://twitter.com/aviksahaindia/status/1484023674466631682,[],24,17,0
8,1484023161855561730,2022-01-20 10:11:08,"लखीमपुर खीरी हत्याकांड में बीजेपी की बेशर्मी और संवेदनहीनता के विरुद्ध 21 जनवरी से लखीमपुर खीरी में ""पक्का मोर्चा"" की शुरुआत।  जब तक किसान की मांगे नही मानी जाती, तब तक संघर्ष जारी रहेगा   @_JaiKisan | #FarmersProtest  https://t.co/2IPpCowGCN",['farmersprotest'],782439160388972544,_SwarajIndia,Swaraj India,https://twitter.com/_SwarajIndia/status/1484023161855561730,[],21,13,0
0,1484067143691894784,2022-01-20 13:05:54,High Water &amp; Electricity Bills &amp; Increase in Prices of Essential Commodities resulted in collapse of every Household Budget in Goa.  #GhaatkiPaatkiBJP #DefeatBJP  https://t.co/etdo4fOPlA,"['ghaatkipaatkibjp', 'defeatbjp']",700386453944139776,digambarkamat,Digambar Kamat,https://twitter.com/digambarkamat/status/1484067143691894784,[],69,22,3
0,1484168586646081541,2022-01-20 19:49:00,The 2018 Farm Bill was enacted on 12/20/18 and continues its strong support for conservation efforts of America’s farmers/ranchers through reauthorization &amp; flexibility of NRCS conservation programs. Learn more about what programs may help your operation:  https://t.co/Ai0HbHhvfz  https://t.co/hdFKDvTeDX,[],299803861,IndianaNRCS,NRCS-Indiana,https://twitter.com/IndianaNRCS/status/1484168586646081541,['https://bit.ly/3tDQVSQ'],1,0,0
1,1484151772931313669,2022-01-20 18:42:11,"Arvind Kejriwal's Guarantees for Farmers : ⚠️Free electricity ⚠️All old Electricity Bills &amp; Loans Waived off ⚠️Guaranteed Minimum Support Price ⚠️Sugarcane, Crop &amp; Pending payments within 24 hours ⚠️All False cases to be withdrawn  #KejriwalKiKisanGuarantee",['kejriwalkikisanguarantee'],1016786527,aartic02,Aarti,https://twitter.com/aartic02/status/1484151772931313669,[],154,68,3
2,1484144451279015938,2022-01-20 18:13:05,"#KejriwalKiKisanGuarantee .@ArvindKejriwal's Guarantees for Farmers: Free electricity All old electricity bills &amp; loans waived off Guaranteed Minimum Support Price Sugarcane, crop &amp; pending payments  within 24 hours All false cases to be taken back .@AamAadmiParty @Vaibhav_AAP  https://t.co/m6qntmfTSf",['kejriwalkikisanguarantee'],1358545946,AAPTELANGANA,AAP TELANGANA,https://twitter.com/AAPTELANGANA/status/1484144451279015938,[],9,14,0
0,1484250007096422404,2022-01-21 01:12:32,Agriculture Laws Farmer protests SAD-BJP going separate ways SAD-BSP alliance Capt Amarinder leaving Congress Agriculture laws repealed Capt-BJP alliance Farmer Unions forming a political party PM Security breach AAP fielding Bhagwant Mann Khalistani elements poking around,[],17490137,LekhakAnurag,Anurag,https://twitter.com/LekhakAnurag/status/1484250007096422404,[],0,0,1
1,1484240445811019776,2022-01-21 00:34:32,TN farmers’ groups protest K’taka Cong plan for Mekedatu dam #farmers #Ktaka  https://t.co/ZDkBadPBQO #Chennai #Cong #Congress #Delhi #Farmers Read Full  👇,"['farmers', 'ktaka', 'chennai', 'cong', 'congress', 'delhi', 'farmers']",947147264,telugustop,TeluguStop.com,https://twitter.com/telugustop/status/1484240445811019776,['http://dlvr.it/SHVV0g'],1,1,0
2,1484212779125178369,2022-01-20 22:44:36,Rajasthan CM directs to stop auctioning of farmers’ land amid protests  https://t.co/0zOJCBRhH8,[],1066972567943053312,HindustanTimes,Hindustan Times,https://twitter.com/HindustanTimes/status/1484212779125178369,['https://www.hindustantimes.com/india-news/rajasthan-cm-directs-to-stop-auctioning-of-farmers-land-amid-protests-101642698871718.html'],2,0,0
3,1484173856726155276,2022-01-20 20:09:56,PM Modi and BJP is trying to take revenge from Punjab and its people. They have learnt nothing from farmers protest that it will eventually result in their loss.  #PunjabChanniDeNaalHai  https://t.co/7WRDQsM5L4,['punjabchannidenaalhai'],2940723738,INCPunjab,Punjab Congress,https://twitter.com/INCPunjab/status/1484173856726155276,[],64,31,6
4,1484171588379758592,2022-01-20 20:00:55,"During farmers’ protests, the agencies were used against businessmen, singers &amp; artists supporting the farmers.  The farmers, farmer unions were also targeted by this insensitive Govt.  Does Modi hate Punjab, else why this conspiracy against Punjab?  #PunjabChanniDeNaalHai  https://t.co/TC6cWmvkWe",['punjabchannidenaalhai'],1085805900437352448,SevadalPY,Puducherry Pradesh Congress Sevadal,https://twitter.com/SevadalPY/status/1484171588379758592,[],12,12,1
5,1484168638231896064,2022-01-20 19:49:12,24th January protest of farmers against blunders of PTI government.  https://t.co/pjFTwr8pSe,[],1077509492,sharjeelinam,Sharjeel Inam Memon,https://twitter.com/sharjeelinam/status/1484168638231896064,[],404,178,45
8,1484151739335028742,2022-01-20 18:42:03,Farmers protest against unavailability of Urea at control rate #crisis #protest  https://t.co/avIg3qGeE9  https://t.co/IsQS0d6xQ9,"['crisis', 'protest']",2570701735,92newschannel,92 News HD Plus,https://twitter.com/92newschannel/status/1484151739335028742,['https://92newshd.tv/about/farmers-protest-against-unavailability-of-urea-at-control-rate?source=tweet'],15,2,0
9,1484131394473566209,2022-01-20 17:21:12,"The revenge of losing face in farmer protest and having to repeal the laws, then again being rejected by Punjab has hurt the feelings of BJP. The revenge tactics of BJP won't work here in Punjab.   #PunjabChanniDeNaalHai  https://t.co/L86jGJ4Vmh",['punjabchannidenaalhai'],2940723738,INCPunjab,Punjab Congress,https://twitter.com/INCPunjab/status/1484131394473566209,[],110,49,4
10,1484122711680978945,2022-01-20 16:46:42,They stood against Punjab during farmers protest. They tried to malign our name with a fake security lapse. Now they are using ED to their behest.   BJP is rejected. Punjab stands with Congress.   #PunjabChanniDeNaalHai  https://t.co/KGzMjT3bWX,['punjabchannidenaalhai'],2940723738,INCPunjab,Punjab Congress,https://twitter.com/INCPunjab/status/1484122711680978945,[],53,39,3
11,1484116790385180675,2022-01-20 16:23:11,"During farmers’ protests against the black laws, BJP government used central government agencies IT, ED &amp; CBI against businessmen, singers and artists who supported the farmers.  #PunjabChanniDeNaalHai  https://t.co/4LJejFgFE9",['punjabchannidenaalhai'],1054969680132227077,SevadalTN,Tamil Nadu Congress Sevadal,https://twitter.com/SevadalTN/status/1484116790385180675,[],29,30,3
12,1484116488592441344,2022-01-20 16:21:59,‘Congress has ruined our lives’: Rajasthan farmers protest against auction of land despite Rahul Gandhi’s tall promises  https://t.co/VswZX75HBL,[],74980737,OpIndia_com,OpIndia.com,https://twitter.com/OpIndia_com/status/1484116488592441344,['https://www.opindia.com/2022/01/congress-has-ruined-lives-rajasthan-farmers-protest-against-land-auction-gehlot-rahul-gandhi/'],424,160,19
14,1484105095306686467,2022-01-20 15:36:42,"The protestors said they condemned Congress and all the political parties who supported implementing the dam project. If farmers, citizens and parties do not stand against it, Tamil Nadu will be destroyed.   #TamiNadu #Mekedatudamproject #protest   https://t.co/HMYBA3jPai","['taminadu', 'mekedatudamproject', 'protest']",2264849412,LogicalIndians,The Logical Indian,https://twitter.com/LogicalIndians/status/1484105095306686467,['https://thelogicalindian.com/environment/mekedatu-reservoir-project-karnataka-congress-padyatra-33407'],1,1,0
16,1484077098474283011,2022-01-20 13:45:27,"#Rajasthan: After pressure was mounted, the administration has suspended the entire process of the entire land of farmers being auctioned.  Protest in Dausa against the #Congress party is underway.  https://t.co/mAD3BfUtbm","['rajasthan', 'congress']",240649814,TimesNow,TIMES NOW,https://twitter.com/TimesNow/status/1484077098474283011,[],54,10,3
17,1484070691725090816,2022-01-20 13:20:00,Why did the #farmers’ protests in India succeed and the anti-#CAA/NRC didn’t? This report by Soumya Shankar problematises this question against the framework of networked #protests.  https://t.co/dbHlRLIHqK  https://t.co/q7O77cbdKc,"['farmers', 'caa', 'protests']",180748385,orfonline,ORF,https://twitter.com/orfonline/status/1484070691725090816,['https://or-f.org/97299'],2,0,0
19,1484067166307885057,2022-01-20 13:05:59,#Rajasthan | Dausa farmers protest in Jaipur outside CM @ashokgehlot51's residence against Rajasthan government's direction to stop auctioning of agricultural land under 'Removal of Difficulties Act' by banks if farmers are unable to pay off their loans  via ANI  https://t.co/pIv6o6Rzmm,['rajasthan'],231692806,JagranEnglish,Jagran English,https://twitter.com/JagranEnglish/status/1484067166307885057,[],2,2,0
21,1484062900637810693,2022-01-20 12:49:02,#WATCH Rajasthan | Dausa farmers protest in Jaipur outside CM Ashok Gehlot's residence against Rajasthan government's direction to stop auctioning of agricultural land under 'Removal of Difficulties Act' by banks if farmers are unable to pay off their loans  https://t.co/6FwuGH6quu,['watch'],355989081,ANI,ANI,https://twitter.com/ANI/status/1484062900637810693,[],1475,448,74
22,1484048089321472004,2022-01-20 11:50:11,"The #YT channels in question had posted content on issues such as the protests against #CAA and the farmers' protests, and had tried to incite the minorities against the Government of #India, said #IBMinistry in a press release.   https://t.co/mVWvA1UpvO","['yt', 'caa', 'india', 'ibministry']",2982269822,TheQuint,The Quint,https://twitter.com/TheQuint/status/1484048089321472004,['https://www.thequint.com/tech-and-auto/tech-news/youtube-channels-websites-hatching-anti-india-conspiracy-will-be-blocked-information-and-broadcasting-minister-anurag-thakur'],4,2,3
23,1484041108732936194,2022-01-20 11:22:27,"To protest against this betrayal of the farmers, the SKM has decided that on 31st Jan,Day of Betrayal will be observed across the country and large protest demonstrations will be organized at the district and block levels.  @_YogendraYadav | #farmerprotest  https://t.co/a2I4xn3nY8",['farmerprotest'],3132907921,swaraj_abhiyan,Swaraj Abhiyan,https://twitter.com/swaraj_abhiyan/status/1484041108732936194,['https://gaurilankeshnews.com/skm-to-observe-nationwide-day-of-betrayal-on-31-january/'],4,4,0
0,1484155520428560384,2022-01-20 18:57:05,Original Congress #ToolKit : Divide &amp; Rule.,['toolkit'],149866342,rajgopal88,Rajgopal,https://twitter.com/rajgopal88/status/1484155520428560384,[],4,1,0
0,1484136748905287681,2022-01-20 17:42:29,"पंजाब में किसान उम्मीदवार बदल सकते हैं सियासी फ़िज़ा,  इन चार बड़ी वजहों से समझिए कैसे ? #punjabassemblyelection2022 #farmer #chandigarh #punjab #पंजाबविधानसभाचुनाव2022 #किसान #चंडीगढ़ #पंजाब  https://t.co/dp2QjadNqM","['punjabassemblyelection2022', 'farmer', 'chandigarh', 'punjab', 'पंजाबविधानसभाचुनाव2022', 'किसान', 'चंडीगढ़', 'पंजाब']",18186549,oneindiaHindi,Oneindia Hindi,https://twitter.com/oneindiaHindi/status/1484136748905287681,['https://hindi.oneindia.com/news/punjab/farmer-candidates-can-change-the-political-atmosphere-659390.html'],4,0,0
1,1484111597584859138,2022-01-20 16:02:32,@RahulGandhi जी ये उसी प्रदेश की तस्वीरें है जहां आप चुनाव में 10 तक गिनती के बाद किसानों के कर्जा माफ करने की बात कह रहे थे.... कितना मजबूर #किसान...  #कर्जमाफी व जमीन की #निलामी रोकने की  सीएम @ashokgehlot51 से दंडवत गुहार  @DrKirodilalBJP  की अगवाई में  सीएम हाउस के सामने.  https://t.co/cyeKHbpgxF,"['किसान', 'कर्जमाफी', 'निलामी']",498571300,jethanandani14,jitesh jethanandani,https://twitter.com/jethanandani14/status/1484111597584859138,[],316,101,7
3,1484036697536942083,2022-01-20 11:04:55,इफको का अनुपम उत्पाद नैनो यूरिया कम लागत में बेहतर उपज से किसानों को अधिक लाभ प्रदान करने में सक्षम है। यह पर्यावरण के अनुकूल होने से प्रकृति संरक्षण में भी अपनी भूमिका निभाता है।  #IFFCO #IFFCONanoUrea #NanoUrea #Farmers #kisaan #India #जैविक #खेती #किसान  https://t.co/U2ZphhTbjj,"['iffco', 'iffconanourea', 'nanourea', 'farmers', 'kisaan', 'india', 'जैविक', 'खेती', 'किसान']",242685646,IFFCO_PR,IFFCO,https://twitter.com/IFFCO_PR/status/1484036697536942083,[],89,10,1
4,1484031442518962176,2022-01-20 10:44:02,"राजस्थान: किसान की 15 बीघा जमीन नीलाम कर देने पर दौसा आए राकेश टिकैत, पीड़ितों से मिल रहे #rakeshtikait #dausa #rajasthan #rajasthannews #दौसा #राजस्थान #किसान #भारतीयकिसानयूनियन #किसानआंदोलन #राकेशटिकैत  https://t.co/BPRsilc1MC","['rakeshtikait', 'dausa', 'rajasthan', 'rajasthannews', 'दौसा', 'राजस्थान', 'किसान', 'भारतीयकिसानयूनियन', 'किसानआंदोलन', 'राकेशटिकैत']",18186549,oneindiaHindi,Oneindia Hindi,https://twitter.com/oneindiaHindi/status/1484031442518962176,['https://hindi.oneindia.com/news/rajasthan/farmer-s-leader-rakesh-tikait-came-to-dausa-rajasthan-after-auctioning-15-bighas-of-farmer-s-land-659269.html'],5,0,0
0,1484141847710941185,2022-01-20 18:02:45,"किसान अब इस अहंकारी सरकार को इसी की भाषा में जवाब देने के लिए तैयार है।   इस भाजपा सरकार को सिर्फ वोट की भाषा समझ आती है तो अब किसान अपने ""मिशन उत्तर प्रदेश"" से भाजपा की भाषा में ही उसको जवाब देगा।  @aviksahaindia | #farmerprotest  #MissionUttarPradesh  https://t.co/VHk6t8oRNg","['farmerprotest', 'missionuttarpradesh']",782439160388972544,_SwarajIndia,Swaraj India,https://twitter.com/_SwarajIndia/status/1484141847710941185,[],13,6,0
1,1484121409714794500,2022-01-20 16:41:32,"किसान अब इस अहंकारी सरकार को इसी की भाषा में जवाब देने के लिए तैयार है।   इस भाजपा सरकार को सिर्फ वोट की भाषा समझ आती है तो अब किसान अपने ""मिशन उत्तर प्रदेश"" से भाजपा की भाषा में ही उसको जवाब देगा।  #farmerprotest | #MissionUttarPradesh  https://t.co/ezIUTPDOxY","['farmerprotest', 'missionuttarpradesh']",886647512,aviksahaindia,Avik Saha,https://twitter.com/aviksahaindia/status/1484121409714794500,[],18,15,1
2,1484112373497868291,2022-01-20 16:05:37,"किसान अब इस अहंकारी सरकार को इसी की भाषा में जवाब देने के लिए तैयार है।   इस भाजपा सरकार को सिर्फ वोट की भाषा समझ आती है तो अब किसान अपने ""मिशन उत्तर प्रदेश"" से भाजपा की भाषा में ही उसको जवाब देगा।  @aviksahaindia | #farmerprotest  #MissionUttarPradesh  https://t.co/GRYdSFXnoB","['farmerprotest', 'missionuttarpradesh']",3132907921,swaraj_abhiyan,Swaraj Abhiyan,https://twitter.com/swaraj_abhiyan/status/1484112373497868291,[],4,3,0
0,1484243506474500102,2022-01-21 00:46:42,"I met residents in Melling to hear concerns about plans to build 149 homes on Wadacre Farm: Wildlife, flood risk, privacy, sewage system, school and GP places were all raised and I have asked Sefton Council to consider these concerns as they assess the planning application.  https://t.co/IjX8uDKviq",[],120720108,Bill_Esterson,Bill Esterson,https://twitter.com/Bill_Esterson/status/1484243506474500102,[],6,0,1
2,1484164857733648386,2022-01-20 19:34:11,.@repdavidscott says following the House’s work period the House Ag committee will take up work on the 2023 farm bill.,[],2727418962,Ximena_Bustillo,Ximena,https://twitter.com/Ximena_Bustillo/status/1484164857733648386,[],6,3,1
3,1484090757762129923,2022-01-20 14:39:44,"Key laws passed during this term: - Amendments to the central farm laws in its scope of application to Punjab - The PB Energy Security, Reform, Termination, and Re-determination of Tariff Bill, 2021 - The PB Learning of Punjabi and Other Languages (A) Bill, 2021 5/",[],37629039,PRSLegislative,PRS Legislative,https://twitter.com/PRSLegislative/status/1484090757762129923,[],1,0,1
