,id,conversation_id,created_at,date,timezone,place,tweet,language,hashtags,cashtags,user_id,user_id_str,username,name,day,hour,link,urls,photos,video,thumbnail,retweet,nlikes,nreplies,nretweets,quote_url,search,near,geo,source,user_rt_id,user_rt,retweet_id,reply_to,retweet_date,translate,trans_src,trans_dest
0,1381668439501074436,1381668439501074436,1618250400000.0,2021-04-12 23:30:00,+0530,,"Learn about how you can celebrate #Vaisakhi safely this year, updates on the Sikh Coalition's #FarmersProtest work, and more in our latest AVAAZ newsletter:  https://t.co/eZE164sV1W",en,"['vaisakhi', 'farmersprotest']",[],316671079,316671079,sikh_coalition,Sikh Coalition,1,23,https://twitter.com/sikh_coalition/status/1381668439501074436,['https://www.sikhcoalition.org/blog/2021/avaaz-sikh-celebrations-resource-vaisakhi-covid-19-guidance-more/'],[],0,,False,7,1,2,,farmers protest,,,,,,,[],,,,
1,1381657938310270979,1381657938310270979,1618247897000.0,2021-04-12 22:48:17,+0530,,Have not seen any news on #YogendraYadav for sometime. Anyone knows how he's doing and the next agitation he is planning? Seems to have given up on both #FarmersProtest (Tikait effect?) and #WestBengalElections,en,"['yogendrayadav', 'farmersprotest', 'westbengalelections']",[],47083884,47083884,SandipGhose,GhoseSpot,1,22,https://twitter.com/SandipGhose/status/1381657938310270979,[],[],0,,False,368,53,44,,farmers protest,,,,,,,[],,,,
2,1381657113089474572,1381657113089474572,1618247700000.0,2021-04-12 22:45:00,+0530,,"आड़े आया कोरोना: लॉकडाउन से किसान महापंचायतों में खलल, अब किसानों के घर जाकर होगी बात #Coronavirus #Covid19 #CoronaVaccine #TikaUtsav @PMOIndia @MoHFW_INDIA @ICMRDELHI @INCIndia @BJP4India #Panchayat #FarmersProtest #FarmLaws    https://t.co/6uHDSlweFe",hi,"['coronavirus', 'covid19', 'coronavaccine', 'tikautsav', 'panchayat', 'farmersprotest', 'farmlaws']",[],169018518,169018518,AmarUjalaNews,Amar Ujala,1,22,https://twitter.com/AmarUjalaNews/status/1381657113089474572,['https://www.amarujala.com/india-news/corona-came-in-the-way-lockdown-disrupts-farmers-maha-panchayat-now-they-will-go-to-farmers-house'],[],0,,False,28,2,4,,farmers protest,,,,,,,[],,,,
3,1381654330705506305,1381654330705506305,1618247036000.0,2021-04-12 22:33:56,+0530,,"A court in Delhi reserved its order on the bail plea filed by actor-activist Deep Sidhu, held in connection to the  #RepublicDayViolence. The order on Sidhu's bail plea will be pronounced on April 15. @iamdeepsidhu   #FarmLaws #Farmersprotest  https://t.co/p70WHVAsh8",en,"['republicdayviolence', 'farmlaws', 'farmersprotest']",[],22763833,22763833,Outlookindia,Outlook Magazine,1,22,https://twitter.com/Outlookindia/status/1381654330705506305,['https://www.outlookindia.com/website/story/india-news-republic-day-violence-court-reserves-order-on-deep-sidhus-bail-plea/380054'],[],0,,False,0,0,0,,farmers protest,,,,,,,[],,,,
4,1381622074720935937,1381622074720935937,1618239346000.0,2021-04-12 20:25:46,+0530,,ਪੰਜਾਬ ਦੀ ਕਿਸਾਨੀ ਨਾਲ ਦੁਸ਼ਮਣੀ ਭਰਿਆ ਵਤੀਰਾ ਕਰ ਰਹੀਆਂ ਸੂਬਾ ਅਤੇ ਕੇਂਦਰ ਸਰਕਾਰ ਸਮੇਤ ਹੋਰਨਾਂ ਅਹਿਮ ਮੁੱਦਿਆਂ 'ਤੇ ਕੌਮੀ ਮੀਡੀਆ ਅਦਾਰੇ ਨਿਊਜ਼18 ਨਾਲ ਹੋਈ ਗੱਲਬਾਤ ਆਪ ਸਭ ਨਾਲ ਸਾਂਝੀ ਕਰ ਰਿਹਾ ਹਾਂ। #AntiFarmerActs #FarmersProtest  https://t.co/532lfAGbsp,pa,"['antifarmeracts', 'farmersprotest']",[],3419496855,3419496855,officeofssbadal,Sukhbir Singh Badal,1,20,https://twitter.com/officeofssbadal/status/1381622074720935937,['https://twitter.com/i/broadcasts/1BRKjBeyvzpKw'],[],0,,False,83,12,51,,farmers protest,,,,,,,[],,,,
5,1381616915634810891,1381616915634810891,1618238116000.0,2021-04-12 20:05:16,+0530,,ਦੀਪ ਸਿੱਧੂ ਦੀ ਸੰਯੁਕਤ ਕਿਸਾਨ ਮੋਰਚੇ ਵਿੱਚ ਵਾਪਸੀ ਸੰਭਵ ਨਹੀਂ  #DeepSidhu #FarmersProtest #PunjabNews   ਇੱਥੇ ਪੜ੍ਹੋ ਪੂਰੀ ਖ਼ਬਰ: https://t.co/u2e6jr1Gqt,pa,"['deepsidhu', 'farmersprotest', 'punjabnews']",[],1037022253,1037022253,abpsanjha,ABP Sanjha,1,20,https://twitter.com/abpsanjha/status/1381616915634810891,['https://punjabi.abplive.com/news/punjab/deep-sidhu-return-to-the-sanyukta-kisan-morcha-is-not-possible-farmers-protest-farm-laws-619229'],[],0,,False,0,0,0,,farmers protest,,,,,,,[],,,,
6,1381615775283245064,1381615775283245064,1618237844000.0,2021-04-12 20:00:44,+0530,,ಗುಜರಾತ್​ಗೆ ಹೋಗಿ ಹಲವೆಡೆ ಕಡೆ ಸಭೆ ಮಾಡಿದ ಟಿಕಾಯತ್ ಅವರಿಗೆ ಕೆಲವು ನೂರರ ಸಂಖ್ಯೆಯಲ್ಲಿದ್ದ ಬೆಂಬಲಿಗರನ್ನು ನೋಡಿ ಆಘಾತವಾಗಿತ್ತು.   Link:  https://t.co/4mCdjnWlb4  #RakeshTikait #Gujarat #FarmersProtest,kn,"['rakeshtikait', 'gujarat', 'farmersprotest']",[],145540592,145540592,tv9kannada,TV9 Kannada,1,20,https://twitter.com/tv9kannada/status/1381615775283245064,['https://tv9kannada.com/national/after-karnataka-visit-bku-leader-rakesh-tikait-gujarat-visit-failed-to-evoke-good-response-212776.html'],[],0,,False,2,4,0,,farmers protest,,,,,,,[],,,,
7,1381599813104377859,1381599813104377859,1618234038000.0,2021-04-12 18:57:18,+0530,,📢📢#NEWS: Kisan Shaheed Smarak: A memorial dedicated to those who died during the farmers' protest. #FIIDailyEdit (1/n)   Read the full report here:  https://t.co/dqUaiidYzw  https://t.co/lSYfjUIx34,en,"['news', 'fiidailyedit']",[],2247560024,2247560024,FeminismInIndia,Feminism in India,1,18,https://twitter.com/FeminismInIndia/status/1381599813104377859,['https://bit.ly/3dX0N0x'],['https://pbs.twimg.com/media/EyxtYmsVIAMJezw.jpg'],1,https://pbs.twimg.com/media/EyxtYmsVIAMJezw.jpg,False,3,1,1,,farmers protest,,,,,,,[],,,,
8,1381596714692272136,1381596714692272136,1618233300000.0,2021-04-12 18:45:00,+0530,,The police told a Delhi court Monday that #DeepSidhu who has been lodged in jail in connection with the #RedFortViolence on January 26 intended to ‘create violence’ and ‘disregard the national flag’.   #FarmersProtest  https://t.co/6Rs2NrQyV9,en,"['deepsidhu', 'redfortviolence', 'farmersprotest']",[],896740409346371584,896740409346371584,editorji,Editorji,1,18,https://twitter.com/editorji/status/1381596714692272136,[],[],1,https://pbs.twimg.com/amplify_video_thumb/1381589670421667841/img/mU5wz4qJYmMKU8Np.jpg,False,1,1,2,,farmers protest,,,,,,,[],,,,
9,1381595925655613449,1381595925655613449,1618233112000.0,2021-04-12 18:41:52,+0530,,"खेती विरोधी काले क़ानूनों की पहली मार गरीब मज़दूर पर पड़ रही है। ये 2850 मज़दूर परिवार अब कहाँ जाएँ, क्या खाएँ, कहाँ रोज़गार ढूँढे?  क्या केंद्र सरकार, कृषि मंत्री और हरियाणा सरकार जवाब देंगे? @PMOIndia @mlkhattar @nstomar @RakeshTikaitBKU #FarmersProtest  #Farmers_vs_BikauModi  https://t.co/BKBhVR8OYL",hi,"['farmersprotest', 'farmers_vs_bikaumodi']",[],900215263034998785,900215263034998785,kkc_india,KKC INDIA,1,18,https://twitter.com/kkc_india/status/1381595925655613449,[],['https://pbs.twimg.com/media/EyxqKe8XIAMSSKs.jpg'],1,https://pbs.twimg.com/media/EyxqKe8XIAMSSKs.jpg,False,3,1,3,,farmers protest,,,,,,,[],,,,
10,1381576855753383938,1381573627615666182,1618228565000.0,2021-04-12 17:26:05,+0530,,"@SingharoyAnkur @ECISVEEP In long run we will all die. Accuracy of that prediction doesn’t help today. Danger due to: slow pace of #CovidVaccine shots, experts don’t yet know mutated #COVID19India behaviour, long/intensive Elec rallies &amp; ongoing #FarmersProtest etc. What if a 3rd spike comes in Autumn?",en,"['covidvaccine', 'covid19india', 'farmersprotest']",[],1401726968,1401726968,ambkcsingh,K. C. Singh,1,17,https://twitter.com/ambkcsingh/status/1381576855753383938,[],[],0,,False,12,2,4,,farmers protest,,,,,,,"[{'screen_name': 'SingharoyAnkur', 'name': 'Ankur Singha Roy', 'id': '439837631'}, {'screen_name': 'ECISVEEP', 'name': 'Election Commission of India #SVEEP', 'id': '1107605032801718274'}]",,,,
11,1381550099000553475,1381550099000553475,1618222186000.0,2021-04-12 15:39:46,+0530,,"किसान आंदोलन: राकेश टिकैत की दो टूक, ये शाहीन बाग का आंदोलन नहीं है   https://t.co/UqL8sc5w65  #farmersprotest #kisanandolan #rakeshtikait",hi,"['farmersprotest', 'kisanandolan', 'rakeshtikait']",[],18186549,18186549,oneindiaHindi,Oneindia Hindi,1,15,https://twitter.com/oneindiaHindi/status/1381550099000553475,['https://bit.ly/3a54kc3'],[],0,,False,3,0,0,,farmers protest,,,,,,,[],,,,
12,1381549728442159106,1381549728442159106,1618222097000.0,2021-04-12 15:38:17,+0530,,"किसान हमारे भाई, हम भी चाहते हैं कि बातचीत से अंदोलन का मसला जल्द खत्म हो : अनिल विज  https://t.co/AxefXurgZU  #Haryanahindinews #Ambalahindinews #FarmersProtest #Farmers #issue #Anilvijminister  https://t.co/eT9l4uhdx0",hi,"['haryanahindinews', 'ambalahindinews', 'farmersprotest', 'farmers', 'issue', 'anilvijminister']",[],80304808,80304808,punjabkesari,Punjab Kesari,1,15,https://twitter.com/punjabkesari/status/1381549728442159106,['https://m.haryana.punjabkesari.in/haryana/news/farmers-our-brothers-discuss-issue-agitation-soon-anil-vij-1364125?utm_source=twitterbot&utm_medium=social'],['https://pbs.twimg.com/media/EyxAKDNVcAEzON1.jpg'],1,https://pbs.twimg.com/media/EyxAKDNVcAEzON1.jpg,False,1,0,0,,farmers protest,,,,,,,[],,,,
13,1381543850083119106,1381543850083119106,1618220696000.0,2021-04-12 15:14:56,+0530,,"#DelhiCourt has reserved order in bail application filed by #DeepSidhu, accused of instigating violence &amp; alleged as the main instigator in the case by the prosecution. The hearing was in connection to the #RedFortViolence during the #farmersprotest tractor rally on January 26.  https://t.co/l3wIoubhYu",en,"['delhicourt', 'deepsidhu', 'redfortviolence', 'farmersprotest']",[],854614125003014144,854614125003014144,themojostory,Mojo Story,1,15,https://twitter.com/themojostory/status/1381543850083119106,[],['https://pbs.twimg.com/media/Eyw6sHaVEAAR53Y.jpg'],1,https://pbs.twimg.com/media/Eyw6sHaVEAAR53Y.jpg,False,5,0,0,,farmers protest,,,,,,,[],,,,
14,1381534891632852992,1381534891632852992,1618218560000.0,2021-04-12 14:39:20,+0530,,ਪੰਜਾਬ ਬੀਜੇਪੀ ਪ੍ਰਭਾਰੀ ਦਾ ਕਿਸਾਨਾਂ ਦੇ ਮੁੱਦੇ 'ਤੇ ਬਿਆਨ  #ZPHH #FarmersProtest  @BJP4Punjab @INCPunjab @AAPPunjab  https://t.co/tlXhm749oR,pa,"['zphh', 'farmersprotest']",[],2529715724,2529715724,ZeePunjabHH,Zee PHH,1,14,https://twitter.com/ZeePunjabHH/status/1381534891632852992,[],[],1,https://pbs.twimg.com/ext_tw_video_thumb/1381534726075260929/pu/img/pJ5daa462yMEBk3f.jpg,False,0,0,0,,farmers protest,,,,,,,[],,,,
15,1381534629987901441,1381534629987901441,1618218498000.0,2021-04-12 14:38:18,+0530,,ਪੰਜਾਬ ਬੀਜੇਪੀ ਪ੍ਰਭਾਰੀ ਦਾ ਕਿਸਾਨਾਂ ਦੇ ਮੁੱਦੇ 'ਤੇ ਬਿਆਨ ਕਿਸਾਨਾਂ ਦਾ ਰਵੱਈਆ ਬੇਹਦ ਅੜੀਅਲ- ਗੌਤਮ 'ਅੰਦੋਲਨ ਕਰ ਰਹੇ ਕਿਸਾਨ ਨਹੀਂ ਚਾਹੁੰਦੇ ਆਮਦਨ ਦੁੱਗਣੀ ਹੋਵੇ' ਮੁੱਦੇ ਦਾ ਹੱਲ ਗੱਲਬਾਤ ਰਾਹੀਂ ਹੀ ਹੋ ਸਕਦਾ ਹੈ- ਗੌਤਮ ਸਰਕਾਰ ਕਿਸਾਨਾਂ ਲਈ ਗੱਲਬਾਤ ਨੂੰ ਹਮੇਸ਼ਾਂ ਤਿਆਰ- ਗੌਤਮ #BreakingNews #FarmersProtest  https://t.co/6Ty1JTLril,pa,"['breakingnews', 'farmersprotest']",[],2529715724,2529715724,ZeePunjabHH,Zee PHH,1,14,https://twitter.com/ZeePunjabHH/status/1381534629987901441,[],['https://pbs.twimg.com/media/EywyUXvU4AQGTsM.jpg'],1,https://pbs.twimg.com/media/EywyUXvU4AQGTsM.jpg,False,0,0,0,,farmers protest,,,,,,,[],,,,
16,1381525510824415232,1381525510824415232,1618216323000.0,2021-04-12 14:02:03,+0530,,ਕੈਨੇਡਾ : ਜਗਮੀਤ ਸਿੰਘ ਦੀ ਅਗਵਾਈ ਵਾਲੀ NDP ਨੇ ਮਤਾ ਪਾਸ ਕਰ ਖੇਤੀ ਕਾਨੂੰਨਾਂ ਦੀ ਕੀਤੀ ਤਿੱਖੀ ਆਲੋਚਨਾ  https://t.co/YnikVIptGq #JagmeetSingh #NewAgricultureLaw #Criticism  #FarmersProtest  https://t.co/sNq1TQly1P,pa,"['jagmeetsingh', 'newagriculturelaw', 'criticism', 'farmersprotest']",[],222394250,222394250,JagbaniOnline,Jagbani,1,14,https://twitter.com/JagbaniOnline/status/1381525510824415232,['https://jagbani.punjabkesari.in/international/news/jagmeet-singh-new-agriculture-law-1279491'],['https://pbs.twimg.com/media/EywqH8dVEAAqbux.jpg'],1,https://pbs.twimg.com/media/EywqH8dVEAAqbux.jpg,False,7,0,0,,farmers protest,,,,,,,[],,,,
17,1381519320077901827,1381519320077901827,1618214847000.0,2021-04-12 13:37:27,+0530,,Two more farmers have lost their lives amid the ongoing farmers' movement. Shiromani Akali Dal pays humble tribute to the martyred farmers. May the Akal Purkh rest the souls in peace. #KisanAndolan #FarmersProtest #AntiFarmerActs  https://t.co/qFAX0EdQc9,en,"['kisanandolan', 'farmersprotest', 'antifarmeracts']",[],3186496375,3186496375,Akali_Dal_,Shiromani Akali Dal,1,13,https://twitter.com/Akali_Dal_/status/1381519320077901827,[],['https://pbs.twimg.com/media/EywkM-9U8AMBI6y.jpg'],1,https://pbs.twimg.com/media/EywkM-9U8AMBI6y.jpg,False,48,3,34,,farmers protest,,,,,,,[],,,,
18,1381517447950401545,1381517447950401545,1618214401000.0,2021-04-12 13:30:01,+0530,,"The Canadian New Democratic Party, led by Jagmeet Singh, has passed a resolution condemning India with regard to the ongoing protests against three farm laws enacted last year   (@anirudhb reports)   #FarmersProtest    https://t.co/nzZ5AZG86v",en,['farmersprotest'],[],36327407,36327407,htTweets,Hindustan Times,1,13,https://twitter.com/htTweets/status/1381517447950401545,['https://www.hindustantimes.com/world-news/canadian-party-condemns-india-s-three-farm-laws-101618124851039.html'],[],0,,False,23,33,5,,farmers protest,,,,,,,[],,,,
19,1381516693248172034,1381484435468513284,1618214221000.0,2021-04-12 13:27:01,+0530,,Court: Put up for orders on 15th April 2021.  #DeepSidhu #FarmersProtest #RepublicDayViolence,en,"['deepsidhu', 'farmersprotest', 'republicdayviolence']",[],1255161552,1255161552,LiveLawIndia,Live Law,1,13,https://twitter.com/LiveLawIndia/status/1381516693248172034,[],[],0,,False,11,0,4,,farmers protest,,,,,,,[],,,,
20,1381516464826408962,1381484435468513284,1618214167000.0,2021-04-12 13:26:07,+0530,,Court dictates order.  Court: Written submissions be filed by the parties within 2 days.  #DeepSidhu #FarmersProtest #RepublicDayViolence,en,"['deepsidhu', 'farmersprotest', 'republicdayviolence']",[],1255161552,1255161552,LiveLawIndia,Live Law,1,13,https://twitter.com/LiveLawIndia/status/1381516464826408962,[],[],0,,False,9,1,1,,farmers protest,,,,,,,[],,,,
21,1381515325829603330,1381484435468513284,1618213895000.0,2021-04-12 13:21:35,+0530,,Gupta: I am an honest citizen who took part in a peaceful protest.  #DeepSidhu #FarmersProtest #RepublicDayViolence,en,"['deepsidhu', 'farmersprotest', 'republicdayviolence']",[],1255161552,1255161552,LiveLawIndia,Live Law,1,13,https://twitter.com/LiveLawIndia/status/1381515325829603330,[],[],0,,False,8,1,1,,farmers protest,,,,,,,[],,,,
22,1381514374376873984,1381484435468513284,1618213668000.0,2021-04-12 13:17:48,+0530,,"Gupta: on 25th and 26th, I have given the entire transcripts. It's not possible to infer that he has instigated violence.   #DeepSidhu #FarmersProtest #RepublicDayViolence",en,"['deepsidhu', 'farmersprotest', 'republicdayviolence']",[],1255161552,1255161552,LiveLawIndia,Live Law,1,13,https://twitter.com/LiveLawIndia/status/1381514374376873984,[],[],0,,False,6,1,1,,farmers protest,,,,,,,[],,,,
23,1381513981571989508,1381513981571989508,1618213575000.0,2021-04-12 13:16:15,+0530,,"सरकार सध्या निवडणुकांमध्ये व्यस्त असले, तरी निमंत्रण दिल्यास चर्चेसाठी तयार आहोत, असे राकेश टिकैत यांनी म्हटले आहे.  #FarmersProtest #RakeshTikait   https://t.co/ELP7AEpkiu",mr,"['farmersprotest', 'rakeshtikait']",[],118395320,118395320,lokmat,Lokmat,1,13,https://twitter.com/lokmat/status/1381513981571989508,['https://www.lokmat.com/national/rakesh-tikait-says-not-shaheen-bagh-farmers-protest-continue-and-crowd-will-come-again-a719/'],[],0,,False,3,1,0,,farmers protest,,,,,,,[],,,,
24,1381513596690067462,1381484435468513284,1618213483000.0,2021-04-12 13:14:43,+0530,,Court: I have heard you. You have already said that it's a classic case of media trial. Do not repeat your submissions.  #DeepSidhu #FarmersProtest #RepublicDayViolence,en,"['deepsidhu', 'farmersprotest', 'republicdayviolence']",[],1255161552,1255161552,LiveLawIndia,Live Law,1,13,https://twitter.com/LiveLawIndia/status/1381513596690067462,[],[],0,,False,8,1,1,,farmers protest,,,,,,,[],,,,
25,1381513215771742214,1381484435468513284,1618213392000.0,2021-04-12 13:13:12,+0530,,Gupta: I am going there are a popular face like 1000 others. It is not a crime.  #DeepSidhu #FarmersProtest #RepublicDayViolence,en,"['deepsidhu', 'farmersprotest', 'republicdayviolence']",[],1255161552,1255161552,LiveLawIndia,Live Law,1,13,https://twitter.com/LiveLawIndia/status/1381513215771742214,[],[],0,,False,7,1,1,,farmers protest,,,,,,,[],,,,
26,1381513077674307587,1381484435468513284,1618213359000.0,2021-04-12 13:12:39,+0530,,Gupta: There are three serious offences (dacoity and attempt to murder). I don't understand what is the common object? I have been a lawyer and an actor. I know the difference between instigation and protest.  #DeepSidhu #FarmersProtest #RepublicDayViolence,en,"['deepsidhu', 'farmersprotest', 'republicdayviolence']",[],1255161552,1255161552,LiveLawIndia,Live Law,1,13,https://twitter.com/LiveLawIndia/status/1381513077674307587,[],[],0,,False,9,1,1,,farmers protest,,,,,,,[],,,,
27,1381512166696579074,1381484435468513284,1618213142000.0,2021-04-12 13:09:02,+0530,,Gupta continues reading other bail orders dealing with same allegations.  #DeepSidhu #FarmersProtest #RepublicDayViolence,en,"['deepsidhu', 'farmersprotest', 'republicdayviolence']",[],1255161552,1255161552,LiveLawIndia,Live Law,1,13,https://twitter.com/LiveLawIndia/status/1381512166696579074,[],[],0,,False,7,1,1,,farmers protest,,,,,,,[],,,,
28,1381508436907597828,1381484435468513284,1618212253000.0,2021-04-12 12:54:13,+0530,,"Gupta: Violence erupted as admitted by the IO, after I left.  #DeepSidhu #FarmersProtest #RepublicDayViolence",en,"['deepsidhu', 'farmersprotest', 'republicdayviolence']",[],1255161552,1255161552,LiveLawIndia,Live Law,1,12,https://twitter.com/LiveLawIndia/status/1381508436907597828,[],[],0,,False,11,1,1,,farmers protest,,,,,,,[],,,,
29,1381508329562763265,1381484435468513284,1618212227000.0,2021-04-12 12:53:47,+0530,,Gupta: There is positive evidence to the contrary which negates their case of mens rea. The presumption of innocence is in my favour.  #DeepSidhu #FarmersProtest #RepublicDayViolence,en,"['deepsidhu', 'farmersprotest', 'republicdayviolence']",[],1255161552,1255161552,LiveLawIndia,Live Law,1,12,https://twitter.com/LiveLawIndia/status/1381508329562763265,[],[],0,,False,11,1,1,,farmers protest,,,,,,,[],,,,
30,1381507975576100868,1381484435468513284,1618212143000.0,2021-04-12 12:52:23,+0530,,"Gupta now referring to the slogans as allegedly shouted by Sidhu.  ""These are as common slogans as Jai shree ram. How can this be termed as incitement?""  #DeepSidhu #FarmersProtest #RepublicDayViolence",en,"['deepsidhu', 'farmersprotest', 'republicdayviolence']",[],1255161552,1255161552,LiveLawIndia,Live Law,1,12,https://twitter.com/LiveLawIndia/status/1381507975576100868,[],[],0,,False,11,1,1,,farmers protest,,,,,,,[],,,,
31,1381506700482473990,1381484435468513284,1618211839000.0,2021-04-12 12:47:19,+0530,,"Gupta: He used the term ""parmaatma ki iccha"". It means god. Is using the name of god instigation? Its a very common punjabi term.  #DeepSidhu #FarmersProtest #RepublicDayViolence",en,"['deepsidhu', 'farmersprotest', 'republicdayviolence']",[],1255161552,1255161552,LiveLawIndia,Live Law,1,12,https://twitter.com/LiveLawIndia/status/1381506700482473990,[],[],0,,False,10,1,1,,farmers protest,,,,,,,[],,,,
32,1381506698716672002,1381484435468513284,1618211838000.0,2021-04-12 12:47:18,+0530,,Gupta: He knows what is the difference between protest and Instigation. He is a lawyer.   Gupta continues reading other transcripts. #DeepSidhu #FarmersProtest #RepublicDayViolence,en,"['deepsidhu', 'farmersprotest', 'republicdayviolence']",[],1255161552,1255161552,LiveLawIndia,Live Law,1,12,https://twitter.com/LiveLawIndia/status/1381506698716672002,[],[],0,,False,8,2,1,,farmers protest,,,,,,,[],,,,
33,1381506142170271752,1381484435468513284,1618211706000.0,2021-04-12 12:45:06,+0530,,Gupta: All these videos are with the Investigating agency. They have picked and choose.   #DeepSidhu #FarmersProtest #RepublicDayViolence,en,"['deepsidhu', 'farmersprotest', 'republicdayviolence']",[],1255161552,1255161552,LiveLawIndia,Live Law,1,12,https://twitter.com/LiveLawIndia/status/1381506142170271752,[],[],0,,False,12,1,1,,farmers protest,,,,,,,[],,,,
34,1381505844366307329,1381484435468513284,1618211635000.0,2021-04-12 12:43:55,+0530,,Gupta now refers to another transcript.  Gupta: He is criticising the government policies and that is why he is there. It's different.  #DeepSidhu #FarmersProtest #RepublicDayViolence,en,"['deepsidhu', 'farmersprotest', 'republicdayviolence']",[],1255161552,1255161552,LiveLawIndia,Live Law,1,12,https://twitter.com/LiveLawIndia/status/1381505844366307329,[],[],0,,False,10,1,1,,farmers protest,,,,,,,[],,,,
35,1381505668255948802,1381484435468513284,1618211593000.0,2021-04-12 12:43:13,+0530,,"Gutpa: By this logic all the 10,000 people who went there must be made accused in the matter. How can those 10,000 people be made accused? Is this possible?  #DeepSidhu #FarmersProtest #RepublicDayViolence",en,"['deepsidhu', 'farmersprotest', 'republicdayviolence']",[],1255161552,1255161552,LiveLawIndia,Live Law,1,12,https://twitter.com/LiveLawIndia/status/1381505668255948802,[],[],0,,False,13,1,1,,farmers protest,,,,,,,[],,,,
36,1381503695574028291,1381484435468513284,1618211122000.0,2021-04-12 12:35:22,+0530,,Gupta reads that legitimate dissent is an essential part of the democracy even if the dissenters are in minority.  #DeepSidhu #FarmersProtest #RepublicDayViolence,en,"['deepsidhu', 'farmersprotest', 'republicdayviolence']",[],1255161552,1255161552,LiveLawIndia,Live Law,1,12,https://twitter.com/LiveLawIndia/status/1381503695574028291,[],[],0,,False,16,1,1,,farmers protest,,,,,,,[],,,,
37,1381499825930203140,1381499825930203140,1618210200000.0,2021-04-12 12:20:00,+0530,,BKU leader #RakeshTikait on Sunday said the dialogue would resume where it had ended on January 22 and the demands remain unchanged  #FarmersProtest #IndianFarmers #FarmBills  https://t.co/PDzOJzUkQ8,en,"['rakeshtikait', 'farmersprotest', 'indianfarmers', 'farmbills']",[],43855487,43855487,bsindia,Business Standard,1,12,https://twitter.com/bsindia/status/1381499825930203140,['https://mybs.in/2ZdZtXZ'],[],0,,False,4,0,1,,farmers protest,,,,,,,[],,,,
38,1381499518168952833,1381484435468513284,1618210126000.0,2021-04-12 12:18:46,+0530,,PP: He is admitting his presence at Red Fort in the interview given after 26th January.  PP reading out the transcript.  #DeepSidhu #FarmersProtest #RepublicDayViolence,en,"['deepsidhu', 'farmersprotest', 'republicdayviolence']",[],1255161552,1255161552,LiveLawIndia,Live Law,1,12,https://twitter.com/LiveLawIndia/status/1381499518168952833,[],[],0,,False,3,1,0,,farmers protest,,,,,,,[],,,,
39,1381497516873580545,1381484435468513284,1618209649000.0,2021-04-12 12:10:49,+0530,,PP: He is an educated person. He is a liar.  #DeepSidhu #FarmersProtest #RepublicDayViolence,en,"['deepsidhu', 'farmersprotest', 'republicdayviolence']",[],1255161552,1255161552,LiveLawIndia,Live Law,1,12,https://twitter.com/LiveLawIndia/status/1381497516873580545,[],[],0,,False,7,1,2,,farmers protest,,,,,,,[],,,,
40,1381497341413224450,1381497341413224450,1618209607000.0,2021-04-12 12:10:07,+0530,,"ਕਿਸਾਨ ਅੰਦੋਲਨ 'ਚ ਕਰਤਾਰਪੁਰ ਲਾਂਘਾ ਖੋਲ੍ਹਣ ਦੀ ਗੂੰਜ, 500 ਕਿਲੋਮੀਟਰ ਦੀ ਪੈਦਲ ਦੌੜ #FarmersProtest #KartarpurCorridor #gurdaspur    https://t.co/h1GVyQYrN1",pa,"['farmersprotest', 'kartarpurcorridor', 'gurdaspur']",[],1037022253,1037022253,abpsanjha,ABP Sanjha,1,12,https://twitter.com/abpsanjha/status/1381497341413224450,['https://punjabi.abplive.com/news/farmers-protest-echoes-kartarpur-corridor-opening-500-km-walk-619170'],[],0,,False,0,0,0,,farmers protest,,,,,,,[],,,,
