,id,conversation_id,created_at,date,timezone,place,tweet,language,hashtags,cashtags,user_id,user_id_str,username,name,day,hour,link,urls,photos,video,thumbnail,retweet,nlikes,nreplies,nretweets,quote_url,search,near,geo,source,user_rt_id,user_rt,retweet_id,reply_to,retweet_date,translate,trans_src,trans_dest
0,1363077903286738946,1363077903286738946,1613818071000.0,2021-02-20 16:17:51,+0530,,Maxwell Lies About Trump &amp; Claims Bill Clinton On Epstein Tapes  https://t.co/Xu4B1E7gSE via @YouTube  My latest #epstein video on #youtube #princeandrew #clinton #maxwell Please support the survivors Virginia @VRSVirginia &amp; Maria @ArtisticBlower &amp; Annie Farmer @anniefarmer,en,"['epstein', 'youtube', 'princeandrew', 'clinton', 'maxwell']",[],276911103,276911103,shaunattwood,Shaun Attwood,6,16,https://twitter.com/shaunattwood/status/1363077903286738946,['https://youtu.be/VwETChK50mk'],[],0,,False,47,7,20,,farmer bill,,,,,,,[],,,,
1,1363016031917142019,1363016031917142019,1613803320000.0,2021-02-20 12:12:00,+0530,,Delhi Chief Minister @ArvindKejriwal will meet farmer union leaders tomorrow afternoon.   On the agenda are the farm union bills and other issues relating to agriculture,en,[],[],115875306,115875306,chowhanpriyanka,Priyanka Chowhan,6,12,https://twitter.com/chowhanpriyanka/status/1363016031917142019,[],[],0,,False,14,1,7,,farmer bill,,,,,,,[],,,,
2,1363015675665469441,1363015675665469441,1613803235000.0,2021-02-20 12:10:35,+0530,,#Breaking Delhi Chief Minsiter @ArvindKejriwal will meet farmer union leaders tomorrow afternoon. On the agenda are the farm union bills and other issues relating to agriculture,en,['breaking'],[],146751977,146751977,rupashreenanda,Rupashree Nanda,6,12,https://twitter.com/rupashreenanda/status/1363015675665469441,[],[],0,,False,229,0,104,,farmer bill,,,,,,,[],,,,
3,1362988453810499589,1362960952849702913,1613796745000.0,2021-02-20 10:22:25,+0530,,"@_Inderjeet__ Yes, I love going to our local Gurdwara. I’ve been preoccupied writing legislation for today’s bill deadline &amp; focusing on getting vaccines to the community. Here is an excerpt from me speaking at last month’s rally for farmers organized by CA gurdwaras  https://t.co/i9EEqIcUfD",en,[],[],17721573,17721573,Ash_Kalra,Ash Kalra 🌱,6,10,https://twitter.com/Ash_Kalra/status/1362988453810499589,[],[],1,https://pbs.twimg.com/ext_tw_video_thumb/1362988246372732929/pu/img/Cb8aqG_SR8CVffvv.jpg,False,1,0,1,,farmer bill,,,,,,,"[{'screen_name': '_Inderjeet__', 'name': 'inderjeet singh', 'id': '1334699027871322112'}]",,,,
4,1362981539760525312,1361553346889273344,1613795096000.0,2021-02-20 09:54:56,+0530,,"@wittypunjaban @Monica_Gill1 I love going to the Gurdwara, not to get votes but I go there with my family. And, for great events! Sorry, been focused on getting my bills written by today’s deadline &amp; on COVID relief. I tweeted early on in December &amp; spoke at farmer rally organized by Gurdwaras last month.  https://t.co/U2K4ZKbJnq",en,[],[],17721573,17721573,Ash_Kalra,Ash Kalra 🌱,6,09,https://twitter.com/Ash_Kalra/status/1362981539760525312,[],[],1,https://pbs.twimg.com/ext_tw_video_thumb/1362981448777539584/pu/img/Q6A91zr64juo7DQ-.jpg,False,27,3,5,,farmer bill,,,,,,,"[{'screen_name': 'wittypunjaban', 'name': 'Pali Kaur', 'id': '40316673'}, {'screen_name': 'Monica_Gill1', 'name': 'Monica Gill', 'id': '71129057'}]",,,,
5,1362978701638397958,1362958554412572674,1613794420000.0,2021-02-20 09:43:40,+0530,,"@Monica_Gill1 Hi Monica, I’ve been recently focused on getting legislation including single-payer bill written by deadline &amp; on vaccine distribution. Thank you for raising the issue with me. I spoke at a statewide rally organized by Gurdwaras in support of farmers last month. Here’s an excerpt  https://t.co/TpGv87FeCX",en,[],[],17721573,17721573,Ash_Kalra,Ash Kalra 🌱,6,09,https://twitter.com/Ash_Kalra/status/1362978701638397958,[],[],1,https://pbs.twimg.com/ext_tw_video_thumb/1362978446222139394/pu/img/m7Sq6kCvVaWGKARI.jpg,False,2,0,0,,farmer bill,,,,,,,"[{'screen_name': 'Monica_Gill1', 'name': 'Monica Gill', 'id': '71129057'}]",,,,
6,1362945083893559302,1362945083893559302,1613786404000.0,2021-02-20 07:30:04,+0530,,Thank you @SenBooker @SenatorWarnock for introducing bills to address systemic racism at USDA and support Black farmers who have faced overtly discriminatory policies &amp; been marginalized for years.   https://t.co/TFLX9r3NWz,en,[],[],19539716,19539716,foe_us,Friends of the Earth (Action),6,07,https://twitter.com/foe_us/status/1362945083893559302,['https://news.trust.org/item/20210209214616-d8d4n'],[],0,,False,31,0,18,,farmer bill,,,,,,,[],,,,
7,1362915546778460166,1362915546778460166,1613779362000.0,2021-02-20 05:32:42,+0530,,Farmers Voice Support for Bill Tackling Monopoly Power  https://t.co/CWZIzzXHpo  https://t.co/6BInN9GVcc,en,[],[],109483342,109483342,PNS_KY,PNS-Kentucky,6,05,https://twitter.com/PNS_KY/status/1362915546778460166,['https://pnsne.ws/2Nc9hI7'],['https://pbs.twimg.com/media/EuoMd7dWgAEsRlC.jpg'],1,https://pbs.twimg.com/media/EuoMd7dWgAEsRlC.jpg,False,0,0,0,,farmer bill,,,,,,,[],,,,
