,id,date,tweet,hashtags,user_id,username,name,link,urls,nlikes,nretweets,nreplies
69,1440152042601807876,2021-09-21 08:42:58,#Farmersprotest: Alternative routes from #Sonepat to #Delhi to be strengthened by #Haryana  https://t.co/QGpIXdKg5G @ggayatri27,"['farmersprotest', 'sonepat', 'delhi', 'haryana']",3046490198,thetribunechd,The Tribune,https://twitter.com/thetribunechd/status/1440152042601807876,['https://www.tribuneindia.com/news/haryana/farmers-protest-alternative-routes-from-sonepat-to-delhi-to-be-strengthened-by-haryana-314104#.YUlNpoXXaUM.twitter'],1,1,0
70,1440127116218023937,2021-09-21 07:03:55,आज उन 600 किसानों को नमन करता हूँ जिन्होंने तानाशाही के आगे झुकने की बजाय शहीद होना स्वीकार लिया था।  🙏😭🙏   #FarmersProtest  #किसान_अपना_हक_मांगता  #IStandWithFarmers,"['farmersprotest', 'किसान_अपना_हक_मांगता', 'istandwithfarmers']",1620776599,BharatSutharINC,Bharat Suthar,https://twitter.com/BharatSutharINC/status/1440127116218023937,[],186,72,8
0,1440328409373036544,2021-09-21 20:23:47,जनता की गलती है जो नेताओं के वादों में फंसते हैं : सोमेश अरोरा  @SomeshArora_ #KisaanAndolan #MahaPanchayat,"['kisaanandolan', 'mahapanchayat']",126309470,RavindraGautam_,Ravindra Gautam,https://twitter.com/RavindraGautam_/status/1440328409373036544,[],1,1,1
1,1440311599038754833,2021-09-21 19:16:59,आंदोलन में किसान हैं तो खेती कौन कर रहा है?  #KisaanAndolan #MahaPanchayat,"['kisaanandolan', 'mahapanchayat']",126309470,RavindraGautam_,Ravindra Gautam,https://twitter.com/RavindraGautam_/status/1440311599038754833,[],5,0,0
2,1440286803529908230,2021-09-21 17:38:27,मीडिया किसान आंदोलन को दबाने का प्रयास कर रहा है!  #KisaanAndolan #MahaPanchayat,"['kisaanandolan', 'mahapanchayat']",126309470,RavindraGautam_,Ravindra Gautam,https://twitter.com/RavindraGautam_/status/1440286803529908230,[],22,11,0
3,1440178979227402246,2021-09-21 10:30:00,मीडिया की कमान किसी और के पास : पंकज मुकाती  @mukatipankaj  #KisaanAndolan #MahaPanchayat,"['kisaanandolan', 'mahapanchayat']",126309470,RavindraGautam_,Ravindra Gautam,https://twitter.com/RavindraGautam_/status/1440178979227402246,[],6,1,0
4,1440148786588835840,2021-09-21 08:30:02,क्या किसानों की मांग जायज़ है?  @SomeshArora_ #KisaanAndolan #MahaPanchayat,"['kisaanandolan', 'mahapanchayat']",126309470,RavindraGautam_,Ravindra Gautam,https://twitter.com/RavindraGautam_/status/1440148786588835840,[],6,2,0
2,1440408501205929986,2021-09-22 01:42:02,Farmers In India Are Trying To Revive Their Protests Against Agriculture Deregulation  https://t.co/vo1SFnEVOW,[],1407789990,nprworld,NPR World,https://twitter.com/nprworld/status/1440408501205929986,['https://www.npr.org/2021/09/21/1039393825/farmers-in-india-are-trying-to-revive-their-protests-against-agriculture-deregul?utm_source=dlvr.it&utm_medium=twitter'],0,0,0
4,1440377787966058499,2021-09-21 23:40:00,"During the interview with Suresh Chavhanke, BKU leader Rakesh Tikait appeared to make it clear that his protests are not for farmers, but specifically against BJP governments, in centre and states  https://t.co/LoGSU8x9oA",[],74980737,OpIndia_com,OpIndia.com,https://twitter.com/OpIndia_com/status/1440377787966058499,['https://www.opindia.com/2021/09/rakesh-tikait-interview-suresh-chavanke-up-sugar-cane-price-farm-laws-protests/'],582,204,9
11,1440323587672477711,2021-09-21 20:04:37,"Farmers protest outside Greater Noida authority for jobs, land promised to them a decade ago  https://t.co/H0WbodhanZ",[],1066972567943053312,HindustanTimes,Hindustan Times,https://twitter.com/HindustanTimes/status/1440323587672477711,['https://www.hindustantimes.com/cities/noida-news/farmers-protest-outside-greater-noida-authority-101632234612742.html'],2,2,0
12,1440318202689437704,2021-09-21 19:43:13,Mr Rajewal is silent on the Congress party's role in the framing of ordinances &amp; amendments made in APMC Act in 2017. The protest on Sept 17 was to strengthen the movement. Mrs. Badal is the lone Union minister to have resigned in support of farmers. 3/3  https://t.co/7Zx53EaMnj,[],3186496375,Akali_Dal_,Shiromani Akali Dal,https://twitter.com/Akali_Dal_/status/1440318202689437704,[],29,15,3
0,1440335011060666382,2021-09-21 20:50:01,We're really happy to be featured in the collection of #MarketingTools curated by @DanielRowles' students...  Find out the rest of the amazing tools included in their #toolkit by listening to #DigitalMarketing Podcast Episode 279   https://t.co/fOT8fwjzs2,"['marketingtools', 'toolkit', 'digitalmarketing']",233631354,AudienseCo,Audiense,https://twitter.com/AudienseCo/status/1440335011060666382,['https://bit.ly/3nSlXUg'],0,0,0
0,1440362661955268629,2021-09-21 22:39:53,The Shiromani Akali Dal (SAD) asked senior farmer leader Balbir Singh Rajewal to “keep the Kisan Andolan above politics”   https://t.co/INuaVV9t1f,[],38647512,IndianExpress,The Indian Express,https://twitter.com/IndianExpress/status/1440362661955268629,['https://bit.ly/2XxDeHe'],41,4,0
2,1440318138025852930,2021-09-21 19:42:58,"Akali Dal urges SKM leader Balbir S Rajewal to keep #Kisan_Andolan above politics. Unfortunately, he has not taken any action against those who attacked protesters on Sept 17. We're ready to debate on political issues, but the Kisan forum shouldn't be used for the same. 1/3  https://t.co/vlLdVBA7OD",['kisan_andolan'],3186496375,Akali_Dal_,Shiromani Akali Dal,https://twitter.com/Akali_Dal_/status/1440318138025852930,[],51,27,8
9,1440196716628561920,2021-09-21 11:40:29,"Jai Kisan Andolan West Bengal's team are doing Sunderbans Kisan Adhikar Yatra from tomorrow.  In this journey, the team will inaugurate new village units in South 24 Parganas district of West Bengal.  @aviksahaindia | @_JaiKisan #FarmerProtest  https://t.co/jSQ8qSTLQn",['farmerprotest'],3132907921,swaraj_abhiyan,Swaraj Abhiyan,https://twitter.com/swaraj_abhiyan/status/1440196716628561920,[],3,3,0
10,1440166898109325318,2021-09-21 09:42:00,"Jai Kisan Andolan West Bengal's team are doing Sunderbans Kisan Adhikar Yatra from tomorrow.  In this journey, the team will inaugurate new village units in South 24 Parganas district of West Bengal.  @aviksahaindia | @_JaiKisan #FarmerProtest  https://t.co/SkPJscwb2b",['farmerprotest'],782439160388972544,_SwarajIndia,Swaraj India,https://twitter.com/_SwarajIndia/status/1440166898109325318,[],13,5,0
0,1440280100461682689,2021-09-21 17:11:49,தஞ்சாவூர் வருவாய் கோட்டாட்சியர் அலுவலகத்தில் குடியேறும் போராட்டம் நடத்திய விவசாயி...!  https://t.co/nhIvoP1NEl #Thanjavur #FarmerProtest,"['thanjavur', 'farmerprotest']",1379681009893961728,abpnadu,ABP Nadu,https://twitter.com/abpnadu/status/1440280100461682689,['https://bit.ly/2ZmHB9b'],2,1,0
2,1440249086033088537,2021-09-21 15:08:35,"ਅਕਾਲੀ ਦਲ ਖਿਲਾਫ ਡਟੀਆਂ ਕਿਸਾਨ ਜਥੇਬੰਦੀਆਂ, ਕਿਸਾਨਾਂ ਨੂੰ ਨਸ਼ੇੜੀ ਕਹਿਣ ਦਾ ਇਲਜ਼ਾਮ  #AkaliDal #FarmerProtest #FarmLaws  ਇੱਥੇ ਪੜ੍ਹੋ ਪੂਰੀ ਖ਼ਬਰ:  https://t.co/XrXJbCITnQ","['akalidal', 'farmerprotest', 'farmlaws']",1037022253,abpsanjha,ABP Sanjha,https://twitter.com/abpsanjha/status/1440249086033088537,['https://punjabi.abplive.com/news/punjab/farmers-organizations-against-akali-dal-accusing-farmers-of-being-drug-addicts-633054'],1,0,0
5,1440165859557740553,2021-09-21 09:37:52,जय किसान आंदोलन पश्चिम बंगाल के साथी कर रहे हैं कल से सुंदरबन किसान अधिकार यात्रा।  इस यात्रा में साथी करेंगे पश्चिम बंगाल के दक्षिण 24 परगना जिले में नए गांव यूनिटों का उद्धघाटन।   @aviksahaindia | @_JaiKisan  #FarmerProtest  https://t.co/9s8tJ6V1Zv,['farmerprotest'],3132907921,swaraj_abhiyan,Swaraj Abhiyan,https://twitter.com/swaraj_abhiyan/status/1440165859557740553,[],9,3,0
