,id,date,tweet,hashtags,user_id,username,name,link,urls,nlikes,nretweets,nreplies
22,1440256409229152259,2021-09-21 15:37:41,"Jai Kisan Andolan is opening New Village Units in South 24 Parganas District, West Bengal. Team of West Bengal Starting ""Sundarban Kisan Adhikar Yatra"" from tomorrow and will visit Districts of South 24 Parganas.  @_JaiKisan | @aviksahaindia  #FarmersProtest  https://t.co/uRG98mEZEA",['farmersprotest'],3132907921,swaraj_abhiyan,Swaraj Abhiyan,https://twitter.com/swaraj_abhiyan/status/1440256409229152259,[],5,3,0
23,1440251876365062146,2021-09-21 15:19:40,धीरे-धीरे देश समझ रहा है कि @RahulGandhi जी को बदनाम करने के लिए करोड़ों अरबों रुपए खर्च कर के षड्यंत्र रचे गए हैं। #FarmersProtest  https://t.co/iIGAw3KzQ4,['farmersprotest'],1022104826,VishalcINC,Vishal Chaudhary🇮🇳,https://twitter.com/VishalcINC/status/1440251876365062146,[],77,40,1
24,1440251560404025345,2021-09-21 15:18:25,धीरे-धीरे देश समझ रहा है कि @RahulGandhi जी को बदनाम करने के लिए करोड़ों अरबों रुपए खर्च कर के षड्यंत्र रचे गए हैं। #FarmersProtest  https://t.co/ZskDtTDiLc,['farmersprotest'],129686255,Ericjusa,EriC Stephen,https://twitter.com/Ericjusa/status/1440251560404025345,[],6,3,0
25,1440249391579762689,2021-09-21 15:09:48,भूमि अधिग्रहण बिल का पूरा श्रेय राहुल गांधी को जाता है। - @RakeshTikaitBKU  @RahulGandhi  #FarmersProtest  https://t.co/HlpEZ2gQNP,['farmersprotest'],1059503182727053313,SevadalMH,Maharashtra Pradesh Congress Sevadal,https://twitter.com/SevadalMH/status/1440249391579762689,[],222,149,5
26,1440242455853494274,2021-09-21 14:42:14,"‘ਕਿਸਾਨਾਂ ਨੂੰ ਆਪਣਾ ਅਗਲਾ ਭਵਿੱਖ ਅਨਿਸ਼ਤਿਤ ਲੱਗ ਰਿਹਾ ਹੈ’, ਕਾਂਗਰਸ ਆਗੂ ਹਰੀਸ਼ ਦਾ ਪੂਰਾ ਬਿਆਨ ਸੁਣੋ ਅਤੇ ਆਪਣੀ ਰਾਇ ਦਿਓ  #HarishRawat #FarmersProtest  https://t.co/sImdBAj07m","['harishrawat', 'farmersprotest']",826091183491387394,bbcnewspunjabi,BBC News Punjabi,https://twitter.com/bbcnewspunjabi/status/1440242455853494274,[],13,4,0
27,1440241721191780360,2021-09-21 14:39:19,"Farmers Protest: ਅਕਾਲੀ ਦਲ ਦੇ ਇਲਜ਼ਾਮਾਂ ਮਗਰੋਂ ਭੜਕੇ ਕਿਸਾਨ, ਰਾਜੇਵਾਲ ਨੇ ਪ੍ਰੈੱਸ ਕਾਨਫਰਸ ਕਰਕੇ ਕਹੀ ਵੱਡੀ  https://t.co/u1rYSwatuo #FarmersProtest #BalbirSinghRajewal","['farmersprotest', 'balbirsinghrajewal']",1037022253,abpsanjha,ABP Sanjha,https://twitter.com/abpsanjha/status/1440241721191780360,['https://punjabi.abplive.com/news/punjab/farmers-protest-farmers-angry-over-akali-dal-allegations-rajewal-says-in-press-conference-633047'],1,0,0
28,1440235012733825027,2021-09-21 14:12:39,"भारतीय किसान यूनियन के नेता श्री @RakeshTikaitBKU ने की किसानों के मुद्दे पर @RahulGandhi जी की तारीफ़!  ""भूमि अधिग्रहण कानून का श्रेय अकेले राहुल गांधी को जाता है""  #FarmersProtest #RahulGandhiWithFarmers  https://t.co/WKcixqeq8l","['farmersprotest', 'rahulgandhiwithfarmers']",423517610,SaurabhRaii_,𝐒𝐚𝐮𝐫𝐚𝐛𝐡 𝐑𝐚𝐢 ~ सौरभ राय 🇮🇳,https://twitter.com/SaurabhRaii_/status/1440235012733825027,[],100,50,4
29,1440233500943138823,2021-09-21 14:06:39,धीरे-धीरे देश समझ रहा है कि @RahulGandhi जी को बदनाम करने के लिए करोड़ों अरबों रुपए खर्च कर के षड्यंत्र रचे गए हैं। #FarmersProtest  https://t.co/NXwLFK0jr6,['farmersprotest'],16293020,IYC,Youth Congress,https://twitter.com/IYC/status/1440233500943138823,[],2574,772,58
30,1440232812351672327,2021-09-21 14:03:55,किसानो की आय दोगुनी करने का दावा करने वाली सरकार का सच सरकारी रिपोर्ट से ही सामने आ गया है।  किसान की आय दोगुनी होने के बजाए उलटा और घट गई है। क्या ऐसे कर रही है सरकार आय दोगुनी?  @_YogendraYadav | @_JaiKisan  #FarmersDemand_MSPLaw | #FarmersProtest  https://t.co/o2ZPlsNaVs,"['farmersdemand_msplaw', 'farmersprotest']",3132907921,swaraj_abhiyan,Swaraj Abhiyan,https://twitter.com/swaraj_abhiyan/status/1440232812351672327,[],18,8,0
31,1440230742508769285,2021-09-21 13:55:41,"Jai Kisan Andolan is opening New Village Units in South 24 Parganas District, West Bengal. Team of West Bengal Starting ""Sundarban Kisan Adhikar Yatra"" from tomorrow and will visit Districts of South 24 Parganas.  @_JaiKisan | @aviksahaindia  #FarmersProtest  https://t.co/BcuNYkqs52",['farmersprotest'],782439160388972544,_SwarajIndia,Swaraj India,https://twitter.com/_SwarajIndia/status/1440230742508769285,[],10,6,0
32,1440230567816040458,2021-09-21 13:55:00,"Bharat Bandh ALERT! 27 सितंबर को देशभर में किसानों का 'भारत बंद', जानें क्या रहेगा खुला-क्या रहेगा बंद  #KisanAndolan #FarmersProtest #BharatBandh    https://t.co/jv4omCpgJK","['kisanandolan', 'farmersprotest', 'bharatbandh']",64639742,JagranNews,Dainik Jagran,https://twitter.com/JagranNews/status/1440230567816040458,['https://www.jagran.com/news/national-bharat-bandh-alert-kisan-bharat-bandh-on-27-september-across-the-country-know-what-will-be-open-what-will-be-close-22040686.html'],14,2,2
33,1440229842385920012,2021-09-21 13:52:07,तिरंगा 🇮🇳 मेरा धर्म है कांग्रेस मेरा परिवार युवा मेरी शक्ति है  किसान मेरा भगवान  - #RahulGandhi   #MyLeaderRahulGandhi ❤️ #FarmersProtest  https://t.co/1ZKuf8WBfK,"['rahulgandhi', 'myleaderrahulgandhi', 'farmersprotest']",3182413640,SatveerINC,Satveer Choudhary,https://twitter.com/SatveerINC/status/1440229842385920012,[],126,27,2
34,1440227270291902469,2021-09-21 13:41:54,"मध्य प्रदेश: सरकार ने बढ़ाई रासायनिक उर्वरकों की कीमत, किसानों ने कहा- फिर #एमएसपी बढ़ाने से क्या फायदा हुआ  #FarmersProtest #MadhyaPradesh @ChouhanShivraj @KamalPatelBJP @OfficeOfKNath @INCMP @BJP4MP   https://t.co/eAvbIv2v3Z","['एमएसपी', 'farmersprotest', 'madhyapradesh']",323178871,makarandkale,Makarand Kale,https://twitter.com/makarandkale/status/1440227270291902469,['https://www.tv9hindi.com/agriculture/crop-special/madhya-pradesh-government-increased-the-price-of-chemical-fertilizers-farmers-said-then-what-was-the-benefit-of-increasing-msp-833754.html'],8,1,0
35,1440219902858567681,2021-09-21 13:12:37,"Jai Kisan Andolan West Bengal's team are doing Sunderbans Kisan Adhikar Yatra from tomorrow. . . In this journey, the Jai Kisan Andolan team will inaugurate new village units in South 24 Parganas district of West Bengal. . @JKA_WB || @_JaiKisan  . #FarmersProtest  https://t.co/DngdTwPHGa",['farmersprotest'],886647512,aviksahaindia,Avik Saha,https://twitter.com/aviksahaindia/status/1440219902858567681,[],59,16,1
36,1440215269717147649,2021-09-21 12:54:12,भाजपा सरकार देश के अन्नदाता पर कहर बनकर टूट रही हैं। 2019 में किसानों को बाजार में न्यूनतम समर्थन मूल्य से भी कम दाम मिला।  इससे यह साफ पता चल रहा है कि एमएसपी सिर्फ कागजों पर है।  #FarmersProtest | #FarmersDemand_MSPLaw   https://t.co/6EfKTusnmF,"['farmersprotest', 'farmersdemand_msplaw']",3132907921,swaraj_abhiyan,Swaraj Abhiyan,https://twitter.com/swaraj_abhiyan/status/1440215269717147649,['https://m.bshindi.com/article/commodities/section_commodities-181322_1.html'],3,2,0
37,1440214756300779522,2021-09-21 12:52:10,अगर हम illegal बैठें हैं तो हमें जेल में डलवा दों: @RakeshTikaitBKU  @manakgupta #News24Manthan  #UPElections2022 #FarmersProtest  https://t.co/VksbZ5wEm8,"['news24manthan', 'upelections2022', 'farmersprotest']",34206701,news24tvchannel,News24,https://twitter.com/news24tvchannel/status/1440214756300779522,[],226,60,9
38,1440214742920925192,2021-09-21 12:52:07,२०२२ पर्यंत शेतकऱ्यांचे उत्पन्न दुप्पट होणार होते..  NSO रिपोर्ट नुसार ६ वर्षांत शेतकऱ्यांचे उत्पन्न ४८% वरून ३८% वर..  तीन महिन्यांत कोणत्या जादूने उत्पन्न दुप्पट होणार?? 🤔  #FarmersProtest,['farmersprotest'],1001096800562958337,BhaiJagtap1,Bhai Jagtap - भाई जगताप,https://twitter.com/BhaiJagtap1/status/1440214742920925192,[],716,135,24
39,1440214039171264516,2021-09-21 12:49:19,"जिन लोगों ने BJP पार्टी बनाई थी, वो नेता आजकल कहां है? आडवाणी जी और मुरली मनोहर जोशी कैद में लगते हैं : @RakeshTikaitBKU  @manakgupta #News24Manthan  #UPElections2022 #FarmersProtest  https://t.co/YFPQitbI5B","['news24manthan', 'upelections2022', 'farmersprotest']",34206701,news24tvchannel,News24,https://twitter.com/news24tvchannel/status/1440214039171264516,[],674,132,28
40,1440213739664396293,2021-09-21 12:48:08,"Rahul Gandhi ठीक आदमी है, उसको बेवकूफ दिखाने के लिए BJP ने खूब ताकत लगाई : @RakeshTikaitBKU  @manakgupta #News24Manthan  #UPElections2022 #FarmersProtest  https://t.co/GFfDx36eRh","['news24manthan', 'upelections2022', 'farmersprotest']",34206701,news24tvchannel,News24,https://twitter.com/news24tvchannel/status/1440213739664396293,[],3205,919,87
41,1440213327691456517,2021-09-21 12:46:29,BJP ने उत्तर प्रदेश के जिला पंचायत चुनावों में डरा-धमकाकर वोट लिया : @RakeshTikaitBKU  @manakgupta #News24Manthan  #UPElections2022 #FarmersProtest  https://t.co/N1qM1aZxe2,"['news24manthan', 'upelections2022', 'farmersprotest']",34206701,news24tvchannel,News24,https://twitter.com/news24tvchannel/status/1440213327691456517,[],162,43,2
42,1440212763528163335,2021-09-21 12:44:15,Yogi सरकार ने गन्ने का 1₹ नहीं बढ़ाया  : @RakeshTikaitBKU  @manakgupta #News24Manthan  #UPElections2022 #FarmersProtest  https://t.co/MdVeoGqklR,"['news24manthan', 'upelections2022', 'farmersprotest']",34206701,news24tvchannel,News24,https://twitter.com/news24tvchannel/status/1440212763528163335,[],116,38,5
43,1440212255577034752,2021-09-21 12:42:14,"स्वराज इंडिया 27 सितंबर के भारत बंद को सफल बनाने के लिए देश भर में पूरी ताकत के साथ भाग लेगा।  भारत बंद में देश के कोने-कोने से किसान, मजदूर, व्यापारी, सरकारी कर्मचारी, छात्र, युवा, महिलाएं और सभी वर्ग के आम लोग शामिल होंगे।  #FarmersProtest | #BharatBand   https://t.co/y0hwiS7h0y","['farmersprotest', 'bharatband']",782439160388972544,_SwarajIndia,Swaraj India,https://twitter.com/_SwarajIndia/status/1440212255577034752,['https://bharatsarathi.com/%E0%A4%B8%E0%A5%8D%E0%A4%B5%E0%A4%B0%E0%A4%BE%E0%A4%9C-%E0%A4%87%E0%A4%82%E0%A4%A1%E0%A4%BF%E0%A4%AF%E0%A4%BE-27-%E0%A4%B8%E0%A4%BF%E0%A4%A4%E0%A4%82%E0%A4%AC%E0%A4%B0-%E0%A4%95%E0%A5%87-%E0%A4%AD/'],4,3,0
44,1440210981859196928,2021-09-21 12:37:10,"भाजपा वाले दूसरों के शब्द और रंग चुराते हैं, इनके पास अपना कुछ नहीं है : @RakeshTikaitBKU  @manakgupta #News24Manthan  #UPElections2022 #FarmersProtest  https://t.co/H2qHOFFNK5","['news24manthan', 'upelections2022', 'farmersprotest']",34206701,news24tvchannel,News24,https://twitter.com/news24tvchannel/status/1440210981859196928,[],239,58,10
45,1440210780968800258,2021-09-21 12:36:22,"Yogi जी का प्रमोशन होना चाहिए, उन्हें मोदी की जगह प्रधानमंत्री बना दो क्योंकि UP में तो उनकी सरकार नहीं बनने वाली :@RakeshTikaitBKU  @manakgupta #News24Manthan  #UPElections2022 #FarmersProtest  https://t.co/cO7vAehr25","['news24manthan', 'upelections2022', 'farmersprotest']",34206701,news24tvchannel,News24,https://twitter.com/news24tvchannel/status/1440210780968800258,[],280,69,16
46,1440210766615879687,2021-09-21 12:36:19,"किसान विरोधी कानून को निरस्त करने को लेकर गैर भाजपा दल रांची में 26 को निकालेंगे मशाल जुलूस, 27 को भारत बंद #FarmersProtest #Jharkhand #BJPJharkhand   https://t.co/nt7Avgoiki","['farmersprotest', 'jharkhand', 'bjpjharkhand']",2354323903,prabhatkhabar,Prabhat Khabar,https://twitter.com/prabhatkhabar/status/1440210766615879687,['https://www.prabhatkhabar.com/state/jharkhand/ranchi/non-bjp-parties-take-out-mashal-julus-against-farm-law-2020-in-ranchi-bharat-bandh-on-27-september-2021-srn'],3,1,0
47,1440208887970340864,2021-09-21 12:28:51,उत्तर प्रदेश में Owaisi सिर्फ विपक्ष का वोट काटेगा : @RakeshTikaitBKU  @manakgupta #News24Manthan  #UPElections2022 #FarmersProtest  https://t.co/jKJDrigapb,"['news24manthan', 'upelections2022', 'farmersprotest']",34206701,news24tvchannel,News24,https://twitter.com/news24tvchannel/status/1440208887970340864,[],114,33,7
48,1440207880649461762,2021-09-21 12:24:51,हरियाणा में किसानों का सिर फोड़ने वाले अधिकारी को नक्सल इलाकों में भेजना चाहिए : @RakeshTikaitBKU  @manakgupta #News24Manthan  #UPElections2022 #FarmersProtest  https://t.co/Dyd0Uxg15v,"['news24manthan', 'upelections2022', 'farmersprotest']",34206701,news24tvchannel,News24,https://twitter.com/news24tvchannel/status/1440207880649461762,[],498,103,10
49,1440207678530224135,2021-09-21 12:24:02,क्या अब हमें नारे भी BJP वाले बताएंगे कि हम कौनसा नारा लगाएं  : @RakeshTikaitBKU  @manakgupta #News24Manthan  #UPElections2022 #FarmersProtest  https://t.co/JqEgGYpJQk,"['news24manthan', 'upelections2022', 'farmersprotest']",34206701,news24tvchannel,News24,https://twitter.com/news24tvchannel/status/1440207678530224135,[],2959,642,67
50,1440207559806177286,2021-09-21 12:23:34,साल 2013 -  15 में से 8 फसलों पर MSP से अधिक दाम मिले  साल 2019 - 15 फसलों में से अधिकतर पर MSP से कम दाम  ये है मोदी सरकार के तीन खेती विरोधी क़ानूनों से खेत-खलिहान बेचने की साज़िश का सच।  अब भी सबूत चाहिए? - श्री रणदीप सिंह सुरजेवाला #FarmersProtest,['farmersprotest'],1066294547658010624,SevadalJK,J&K Pradesh Congress Sevadal,https://twitter.com/SevadalJK/status/1440207559806177286,[],48,26,1
51,1440206878089224193,2021-09-21 12:20:52,"मैं चुनाव नहीं लड़ूंगा, पिछले चुनाव में लोगों को बहकाकर वोट लिए गए : @RakeshTikaitBKU  @manakgupta #News24Manthan  #UPElections2022 #FarmersProtest  https://t.co/balvnhFIzf","['news24manthan', 'upelections2022', 'farmersprotest']",34206701,news24tvchannel,News24,https://twitter.com/news24tvchannel/status/1440206878089224193,[],2239,444,76
52,1440206208632193027,2021-09-21 12:18:12,BJP की 140 से ज़्यादा सीट नहीं आने वाली : @RakeshTikaitBKU  @manakgupta #News24Manthan  #UPElections2022 #FarmersProtest  https://t.co/Dn3CllAU6M,"['news24manthan', 'upelections2022', 'farmersprotest']",34206701,news24tvchannel,News24,https://twitter.com/news24tvchannel/status/1440206208632193027,[],449,93,26
53,1440206107641663496,2021-09-21 12:17:48,"उत्तर प्रदेश में सबसे महंगी बिजली है, गन्ने का ना भुगतान हुआ ना सरकार ने कोई रेट बढ़ाया इसलिए BJP को वोट नहीं मिलेगा : @RakeshTikaitBKU  @manakgupta #News24Manthan  #UPElections2022 #FarmersProtest  https://t.co/hOTctcxytS","['news24manthan', 'upelections2022', 'farmersprotest']",34206701,news24tvchannel,News24,https://twitter.com/news24tvchannel/status/1440206107641663496,[],809,212,42
54,1440205556476628997,2021-09-21 12:15:37,बंगाल के किसानों ने MSP मांगनी शुरू की इसलिए BJP वहां से भाग गई  : @RakeshTikaitBKU   @manakgupta #News24Manthan  #UPElections2022 #FarmersProtest  https://t.co/ifTo0uNYdA,"['news24manthan', 'upelections2022', 'farmersprotest']",34206701,news24tvchannel,News24,https://twitter.com/news24tvchannel/status/1440205556476628997,[],1074,217,20
55,1440204982758744068,2021-09-21 12:13:20,"हम कोई STAR नहीं, हम हल चलाने वाले किसान है : @RakeshTikaitBKU   @manakgupta #News24Manthan  #UPElections2022 #FarmersProtest  https://t.co/7QmflxDCA7","['news24manthan', 'upelections2022', 'farmersprotest']",34206701,news24tvchannel,News24,https://twitter.com/news24tvchannel/status/1440204982758744068,[],187,29,5
56,1440204799606022150,2021-09-21 12:12:36,हम स्टार नहीं हल चलाने वाले किसान हैं । #FarmersProtest @news24tvchannel,['farmersprotest'],831948775165923330,RakeshTikaitBKU,Rakesh Tikait,https://twitter.com/RakeshTikaitBKU/status/1440204799606022150,[],20037,3682,527
57,1440203356874575878,2021-09-21 12:06:52,कुछ लोग कहते है कि आंदोलन केवल पश्चिम में ही है #FarmersProtest  #हर_किसान_मोदी_से_परेशान  @DigamberBku @OfficialBKU @Kisanektamorcha @VoiceofFarmerss @news24tvchannel @UnionSaharanpur @vikasBkuTikri @HansrajMeena @VikramMeenaBKU @lvc_southasia  https://t.co/Yd94NE6Kj5,"['farmersprotest', 'हर_किसान_मोदी_से_परेशान']",987656094607589376,Dmalikbku,Dharmendra Malik,https://twitter.com/Dmalikbku/status/1440203356874575878,[],1081,250,40
58,1440203263593177102,2021-09-21 12:06:30,Master Misleaders misrepresent #FarmersProtest while continuously diverting attention from their mistake of anti-farmer #FarmLaws...,"['farmersprotest', 'farmlaws']",386014627,ashishdua_INC,Ashish Dua,https://twitter.com/ashishdua_INC/status/1440203263593177102,[],4,0,0
59,1440197703351164934,2021-09-21 11:44:24,#assemblypolls2022: Can a rejuvenated #FarmersProtest challenge the BJP in #UPElections2022  and #Uttarakhand polls?   https://t.co/lulDuYE3gS,"['assemblypolls2022', 'farmersprotest', 'upelections2022', 'uttarakhand']",50279781,FinancialXpress,Financial Express,https://twitter.com/FinancialXpress/status/1440197703351164934,['https://www.financialexpress.com/india-news/assembly-elections-2022-can-a-rejuvenated-farmers-agitation-challenge-the-bjp-in-poll-bound-uttar-pradesh-and-uttarakhand/2334394/'],2,0,0
60,1440195375613108225,2021-09-21 11:35:09,#WebQoof | A video showing a massive gathering and alcohol being distributed at an event is being linked to the ongoing #farmersprotest against the three new farm laws. Read our fact-check here.  https://t.co/ffi96MYgIL,"['webqoof', 'farmersprotest']",1039084269962813440,QuintFactCheck,WebQoof,https://twitter.com/QuintFactCheck/status/1440195375613108225,['https://www.thequint.com/news/webqoof/alcohol-distributed-in-ludhiana-linked-to-farmers-protest-fact-check'],3,0,0
61,1440185279311060999,2021-09-21 10:55:02,मज़बूत होता जय किसान आंदोलन  यूपी के मुहम्मदाबाद वलीदपुर (मऊ जिला) में @JKAUttarPradesh के साथियों ने प्रगतिशील किसान सभासद चन्द्रबली यादव के साथ मीटिंग की।  सभी ने तीनों कृषि बिल रद्द कराने व एमएसपी की गारंटी के लिए आखिरी सांस तक संघर्ष करने का संकल्प लिया।   #FarmersProtest  https://t.co/vKEPF0hXyZ,['farmersprotest'],782439160388972544,_SwarajIndia,Swaraj India,https://twitter.com/_SwarajIndia/status/1440185279311060999,[],24,9,0
62,1440183679918116871,2021-09-21 10:48:41,तीनों कृषि कानून वापस लो। MSP की गारंटी करो।  #FarmersProtest #हर_किसान_मोदी_से_परेशान  https://t.co/NTzoVB7ihE,"['farmersprotest', 'हर_किसान_मोदी_से_परेशान']",719567763824578561,PrasenjeetKuma6,Prasenjeet kumar,https://twitter.com/PrasenjeetKuma6/status/1440183679918116871,[],1,4,0
63,1440178346097135617,2021-09-21 10:27:29,ਹੁਣ ਹਰ ਬੁੱਧਵਾਰ ਨੂੰ ਹੋਇਆ ਕਰੇਗੀ ਪੰਜਾਬ ਕੈਬਨਟ ਦੀ ਮੀਟਿੰਗ।   @RahulGandhi @CHARANJITCHANNI @sherryontopp @Om_Parkash_Soni @INCPunjab #FarmersProtest #PunjabCM,"['farmersprotest', 'punjabcm']",1139588035278860288,Sukhjinder_INC,Sukhjinder Singh Randhawa,https://twitter.com/Sukhjinder_INC/status/1440178346097135617,[],395,47,50
64,1440163944887324684,2021-09-21 09:30:16,"Agri household income has gone up.. but a farmer's income from cultivation has dropped, says @_YogendraYadav we discuss the latest survey by NSO that gives us great insights into the plight of farmers and agriculture in India. #FarmersProtest #FarmLaws","['farmersprotest', 'farmlaws']",18472984,tanvishukla,Tanvi Shukla,https://twitter.com/tanvishukla/status/1440163944887324684,[],74,24,7
65,1440156329058856961,2021-09-21 09:00:00,বুম দেখে ভাইরাল ভিডিওগুলি পাঞ্জাবের লুধিয়ানায় কঁওকে কালান গ্রামে বাবা রাদু শাহ’র মেলায় তোলা। #FakeNews #BOOMFactCheck #FarmersProtest #Punjab  https://t.co/0djUDPGBj1,"['fakenews', 'boomfactcheck', 'farmersprotest', 'punjab']",1087229589376532481,BOOMLiveBangla,BOOMBangla,https://twitter.com/BOOMLiveBangla/status/1440156329058856961,['https://bangla.boomlive.in/fact-check/fake-news-farmers-protest-delhi-viral-videos-alcohol-langar-kanuke-kalan-village-baba-rodu-shah-fair-mela-ludhiana-punjab-factcheck-14784'],0,1,0
66,1440154619330449409,2021-09-21 08:53:12,"Rakesh Tikait a 'dacoit, farmers' protest getting foreign funds: BJP MP   https://t.co/8MU9uAuK69 #FarmersProtest",['farmersprotest'],18159588,Oneindia,Oneindia News,https://twitter.com/Oneindia/status/1440154619330449409,['http://www.oneindia.com/india/rakesh-tikait-a-dacoit-farmers-protest-getting-foreign-funds-bjp-mp-3313729.html'],0,1,0
67,1440153775365230595,2021-09-21 08:49:51,Can farm unions damage #BJP’s chances of winning #UPElections2022? A L I Chougule explains  #FarmersProtest   https://t.co/Rl0xJPFKwS  https://t.co/zwYpnWlqov,"['bjp', 'upelections2022', 'farmersprotest']",295693924,fpjindia,Free Press Journal,https://twitter.com/fpjindia/status/1440153775365230595,['https://www.freepressjournal.in/analysis/can-farm-unions-damage-bjps-chances-of-winning-up-polls-a-l-i-chougule-explains'],2,0,0
68,1440152540453097488,2021-09-21 08:44:57,ਆਓ ਅਸੀਂ ਸਾਰੇ ਵਾਅਦਾ ਕਰੀਏ ਕਿ ਇਵੇਂ ਹੀ ਏਕਤਾ ਰਖਦੇ ਹੋਏ ਆਪਣੇ ਦੇਸ਼ ਅਤੇ ਪੰਜਾਬ ਦੀ ਅਖੰਡਤਾ ਅਤੇ ਸ਼ਾਂਤੀ ਨੂੰ ਬਰਕਰਾਰ ਰੱਖੀਏ।  @RahulGandhi @CHARANJITCHANNI @sherryontopp @Om_Parkash_Soni #FarmersProtest #PEACEDAY2021  https://t.co/Ryc5IHqPQX,"['farmersprotest', 'peaceday2021']",1139588035278860288,Sukhjinder_INC,Sukhjinder Singh Randhawa,https://twitter.com/Sukhjinder_INC/status/1440152540453097488,[],227,22,33
