,id,conversation_id,created_at,date,timezone,place,tweet,language,hashtags,cashtags,user_id,user_id_str,username,name,day,hour,link,urls,photos,video,thumbnail,retweet,nlikes,nreplies,nretweets,quote_url,search,near,geo,source,user_rt_id,user_rt,retweet_id,reply_to,retweet_date,translate,trans_src,trans_dest
0,1437891404412248064,1437891404412248064,1631655000000.0,2021-09-15 03:00:00,+0530,,सीएम ने किसानों से पंजाब की जगह दिल्ली की सीमाओं या हरियाणा में प्रदर्शन करने को कहा   #AmrinderSingh #Punjab #FarmersProtest #Haryana #अमरिंदरसिंह #पंजाब #हरियाणा #किसानआंदोलन   https://t.co/fZsZxW4L2s,hi,"['amrindersingh', 'punjab', 'farmersprotest', 'haryana', 'अमरिंदरसिंह', 'पंजाब', 'हरियाणा', 'किसानआंदोलन']",[],817340591046414336,817340591046414336,thewirehindi,द वायर हिंदी,3,03,https://twitter.com/thewirehindi/status/1437891404412248064,['http://thewirehindi.com/186235/punjab-cm-asks-farmers-to-avoid-protests-in-the-state-but-unions-arent-convinced/'],[],0,,False,25,0,3,,#farmersprotest,,,,,,,[],,,,
1,1437840387318628359,1437840387318628359,1631642836000.0,2021-09-14 23:37:16,+0530,,हरियाणा के गृहमंत्री अनिल विज का आरोप- किसान आंदोलन के पीछे अमरिंदर सिंह का ही हाथ है  #Haryana #FarmersProtest    https://t.co/upTol9xDIC,hi,"['haryana', 'farmersprotest']",[],39240673,39240673,ABPNews,ABP News,2,23,https://twitter.com/ABPNews/status/1437840387318628359,['https://www.abplive.com/news/india/haryana-home-minister-anil-vij-said-amarinder-singh-is-behind-farmers-protest-1968056'],[],0,,False,285,13,18,,#farmersprotest,,,,,,,[],,,,
2,1437834686617698305,1437834686617698305,1631641477000.0,2021-09-14 23:14:37,+0530,,"कांग्रेस फंडिड आंदोलन की पोल खुल चुकी है, राहुल गांधी की इमेज सुधारने के चक्कर में देश को गुमराह किया गया।  किसानों को मोहरा बनाया गया ताकि जनता भावनाओं में आ जाये मगर एजेंडे छिपते नहीं हैं।  @capt_amarinder जी अब आपका और कांग्रेस का षड्यंत्र बेनकाब हो चुका है। #FarmersProtest  https://t.co/c0Kdt4eMbo",hi,['farmersprotest'],[],2354589132,2354589132,SunilYadavBJP,Sunil Yadav,2,23,https://twitter.com/SunilYadavBJP/status/1437834686617698305,[],['https://pbs.twimg.com/media/E_Q2zKXVgAgWgXN.jpg'],1,https://pbs.twimg.com/media/E_Q2zKXVgAgWgXN.jpg,False,264,3,207,,#farmersprotest,,,,,,,[],,,,
3,1437825111382392840,1437825111382392840,1631639194000.0,2021-09-14 22:36:34,+0530,,#UPElections2022 #FarmersProtest   Political observers say Narendra Modi's speech was aimed at placating Western Uttar Pradesh’s Jat farmers who have been up in arms against the BJP over the new farm laws    https://t.co/UsiReNOdDJ,en,"['upelections2022', 'farmersprotest']",[],414946220,414946220,scroll_in,scroll.in,2,22,https://twitter.com/scroll_in/status/1437825111382392840,['https://scroll.in/article/1005393/'],[],0,,False,5,1,1,,#farmersprotest,,,,,,,[],,,,
4,1437823306195824647,1437823306195824647,1631638764000.0,2021-09-14 22:29:24,+0530,,"#BaatToChubhegi : भाकियू, राष्ट्रीय प्रवक्ता राकेश टिकैत ने क्यों कहा बहुत सारे स्कूल कॉलेज बने हुए, पांच ईट रखा जा रहा है और इसके अलावा सब कुछ  बेचा जा रहा है.   देखिए @SavalRohit के साथ LIVE  यहां देखें LIVE :  https://t.co/lupHfP0aKD   #PMModi #FarmersProtest @RakeshTikaitBKU  https://t.co/7mIIKQjj4w",hi,"['baattochubhegi', 'pmmodi', 'farmersprotest']",[],1090885330163494914,1090885330163494914,AbpGanga,ABP Ganga,2,22,https://twitter.com/AbpGanga/status/1437823306195824647,['https://bit.ly/2VGNuwn'],[],1,https://pbs.twimg.com/amplify_video_thumb/1437800634669887488/img/tc3sH5D4LEpwpi1x.jpg,False,4,0,1,,#farmersprotest,,,,,,,[],,,,
5,1437822010713776130,1437822010713776130,1631638455000.0,2021-09-14 22:24:15,+0530,,हरियाणा के मंत्री अनिल विज ने कहा- ये किसान आंदोनल नहीं  इसे 'गदर' कह सकते हैं  https://t.co/rUMy0H4xcS #farmersprotest #farmer #anilvij #haryana #haryananews #haryanagovernment #किसानआंदोलन #अनिल #मंत्री,hi,"['farmersprotest', 'farmer', 'anilvij', 'haryana', 'haryananews', 'haryanagovernment', 'किसानआंदोलन', 'अनिल', 'मंत्री']",[],18186549,18186549,oneindiaHindi,Oneindia Hindi,2,22,https://twitter.com/oneindiaHindi/status/1437822010713776130,['https://hindi.oneindia.com/news/india/haryana-minister-anil-vij-said-these-farmers-can-not-call-it-a-movement-it-can-be-called-gadar-638929.html'],[],0,,False,0,0,0,,#farmersprotest,,,,,,,[],,,,
6,1437820924011687937,1437820924011687937,1631638196000.0,2021-09-14 22:19:56,+0530,,#Punjab │CM @capt_amarinder said it was unfortunate that the #farmers had given a political twist to his remarks instead of understanding the pain and misery caused to the people on account of their protests in the state. By Harish Manav #FarmersProtest  https://t.co/jGiFB7sPXJ,en,"['punjab', 'farmers', 'farmersprotest']",[],22763833,22763833,Outlookindia,Outlook Magazine,2,22,https://twitter.com/Outlookindia/status/1437820924011687937,['https://www.outlookindia.com/website/story/india-news-capt-amarinder-says-comments-to-move-farmer-protests-out-of-punjab-were-twisted-amid-outrage/394610'],[],0,,False,2,1,1,,#farmersprotest,,,,,,,[],,,,
7,1437815708491128836,1437815708491128836,1631636952000.0,2021-09-14 21:59:12,+0530,,"Farmers are welcome in Chhattisgarh, says CM Baghel assuring support  Read @ANI Story |  https://t.co/MYEy8WfY0h #FarmersProtest  https://t.co/aTKA8xM4t3",en,['farmersprotest'],[],817976607398731776,817976607398731776,ani_digital,ANI Digital,2,21,https://twitter.com/ani_digital/status/1437815708491128836,['https://www.aninews.in/news/national/general-news/farmers-are-welcome-in-chhattisgarh-says-cm-baghel-assuring-support20210914214355/'],['https://pbs.twimg.com/media/E_QlshMXIAwh68E.png'],1,https://pbs.twimg.com/media/E_QlshMXIAwh68E.png,False,23,1,1,,#farmersprotest,,,,,,,[],,,,
8,1437815593407639552,1437815593407639552,1631636925000.0,2021-09-14 21:58:45,+0530,,"CAPT. ABANDONS FARMERS?  When there was #RailRoko in #Punjab,all goods trains were halted &amp; export shipments were held. On #dharna days,roads are blocked by #farmers &amp; police,but general public suffers:Sameer Jain, General Secy,CAIT Punjab Chapter to @tanvishukla  #FarmersProtest  https://t.co/5FW9oFhS8M",en,"['railroko', 'punjab', 'dharna', 'farmers', 'farmersprotest']",[],3638215945,3638215945,MirrorNow,Mirror Now,2,21,https://twitter.com/MirrorNow/status/1437815593407639552,[],[],1,https://pbs.twimg.com/media/E_QlevYVIAEtVWT.jpg,False,0,0,0,,#farmersprotest,,,,,,,[],,,,
9,1437812460912660481,1437812460912660481,1631636178000.0,2021-09-14 21:46:18,+0530,,"#FarmersProtest   No #farmer caused any loss to anyone, no roads have been blocked and no trader has been harmed; Centre has closed everything, not us: Rashtriya Kisan Sangathan President Jasbir Singh Bhatti to @tanvishukla  https://t.co/3zcR6Nem0i",en,"['farmersprotest', 'farmer']",[],3638215945,3638215945,MirrorNow,Mirror Now,2,21,https://twitter.com/MirrorNow/status/1437812460912660481,[],[],1,https://pbs.twimg.com/media/E_QixkKVEAMDCRp.jpg,False,5,1,2,,#farmersprotest,,,,,,,[],,,,
10,1437812132242853890,1437812132242853890,1631636100000.0,2021-09-14 21:45:00,+0530,,#WATCH | Punjab CM Amarinder Singh asks farmers to protest outside Punjab  #FarmersProtest @capt_amarinder  https://t.co/AZ336X13aB,en,"['watch', 'farmersprotest']",[],231692806,231692806,JagranEnglish,Jagran English,2,21,https://twitter.com/JagranEnglish/status/1437812132242853890,[],[],1,https://pbs.twimg.com/media/E_QbRIMUYAIIZKG.jpg,False,0,0,0,,#farmersprotest,,,,,,,[],,,,
11,1437809799584903173,1437809799584903173,1631635544000.0,2021-09-14 21:35:44,+0530,,यूपी में बच्चे बुखार से तड़प तड़पकर मर रहे हैं और मुख्यमंत्री अब्बाजान-अब्बाजान चिल्ला रहे हैं विज्ञापन की खुली पोल तो मुद्दा भटका रहे हैं! सुनें- @SamarRaj_ की प्रस्तुति  पूरा वीडियो-  https://t.co/o2ExMSW3N6  #UP #ViralFever #ChildrenDeaths #YogoGovt #AbbaJaan #FarmersProtest  https://t.co/pxEqUBmZvC,hi,"['up', 'viralfever', 'childrendeaths', 'yogogovt', 'abbajaan', 'farmersprotest']",[],3097353133,3097353133,BoltaHindustan,Bolta Hindustan,2,21,https://twitter.com/BoltaHindustan/status/1437809799584903173,['https://youtu.be/m8uqz7x-jzw'],[],1,https://pbs.twimg.com/ext_tw_video_thumb/1437809045553901570/pu/img/5NDR5hZ0QZWJEHB7.jpg,False,625,12,224,,#farmersprotest,,,,,,,[],,,,
12,1437807318704562189,1437807318704562189,1631634952000.0,2021-09-14 21:25:52,+0530,,"महबूबा मुफ़्ती ने कहा, ''पिछले कई महीनों से किसान धरने पर बैठे हुए हैं, सरकार का मुख्य फ़ोकस किसानों के मुद्दे पर होना चाहिए' #MehboobaMufti #FarmersProtest    https://t.co/tOfSwOsQFq",hi,"['mehboobamufti', 'farmersprotest']",[],42606652,42606652,aajtak,AajTak,2,21,https://twitter.com/aajtak/status/1437807318704562189,['https://www.aajtak.in/india/news/story/mehbooba-mufti-says-government-focus-should-be-on-farmers-who-are-protesting-ntc-1326627-2021-09-14'],[],0,,False,757,109,76,,#farmersprotest,,,,,,,[],,,,
13,1437804252210941955,1437804252210941955,1631634221000.0,2021-09-14 21:13:41,+0530,,"#FarmersProtest   My comments asking farmers to move protests to Delhi or Haryana given a ‘political twist’, Punjab Chief Minister says   “If stir continues in Punjab we will lose out on jobs, revenue, investment,” Amarinder Singh had said  https://t.co/9aQYStYV6E",en,['farmersprotest'],[],414946220,414946220,scroll_in,scroll.in,2,21,https://twitter.com/scroll_in/status/1437804252210941955,['https://scroll.in/latest/1005395/'],[],0,,False,9,1,1,,#farmersprotest,,,,,,,[],,,,
14,1437804049726803977,1437804049726803977,1631634173000.0,2021-09-14 21:12:53,+0530,,"अनिल विज ने कहा कि ये आंदोलन तो रहा ही नहीं, आंदोलन में लोग तलवारें लेकर नहीं आते, लाठियां नहीं मारते, आने-जाने वालों का रास्ता नहीं रोकते।  https://t.co/3DiZqgcF9i  #AnilVij #FarmersProtest #BJP #Punjab #AmarinderSingh  https://t.co/Jvln2Xvkox",hi,"['anilvij', 'farmersprotest', 'bjp', 'punjab', 'amarindersingh']",[],150623438,150623438,prabhasakshi,Prabhasakshi,2,21,https://twitter.com/prabhasakshi/status/1437804049726803977,['https://www.prabhasakshi.com/national/farmers-movement-is-no-longer-a-movement-says-anil-vij'],['https://pbs.twimg.com/media/E_Qa0NNVcAkMVxw.jpg'],1,https://pbs.twimg.com/media/E_Qa0NNVcAkMVxw.jpg,False,0,0,0,,#farmersprotest,,,,,,,[],,,,
15,1437803827550306307,1437803827550306307,1631634120000.0,2021-09-14 21:12:00,+0530,,किसान महापंचायत को CM का समर्थन: भूपेश बघेल ने कहा- किसान आंदोलन को राहुल गांधी ने शुरू किया; अब किसान नेता छत्तीसगढ़ आ रहे हैं तो उनका स्वागत है  https://t.co/MLSW11RVwi  #KisanAndolan #FarmersProtest @bhupeshbaghel @RahulGandhi @BJP4Chandigarh,hi,"['kisanandolan', 'farmersprotest']",[],67378160,67378160,DainikBhaskar,Dainik Bhaskar,2,21,https://twitter.com/DainikBhaskar/status/1437803827550306307,['https://www.bhaskar.com/local/chhattisgarh/raipur/news/rahul-gandhi-kisan-andolan-rakesh-tikait-chhattisgarh-cm-bhupesh-baghel-support-to-kisan-mahapanchayat-128924128.html'],[],0,,False,138,3,16,,#farmersprotest,,,,,,,[],,,,
16,1437800324023009284,1437800324023009284,1631633284000.0,2021-09-14 20:58:04,+0530,,#BaatToChubhegi में राकेश टिकैत ने क्यों कहा भाजपा नेता बहरुपिया बनकर वोट मांगेंगे  देखिए @SavalRohit के साथ LIVE  यहां देखें LIVE :  https://t.co/lupHfP0aKD  #UttarPradesh #upelection2022 #CMYogi #PMModi #FarmersProtest  https://t.co/Il2ND0040e,hi,"['baattochubhegi', 'uttarpradesh', 'upelection2022', 'cmyogi', 'pmmodi', 'farmersprotest']",[],1090885330163494914,1090885330163494914,AbpGanga,ABP Ganga,2,20,https://twitter.com/AbpGanga/status/1437800324023009284,['https://bit.ly/2VGNuwn'],[],1,https://pbs.twimg.com/media/E_QXwDoUUAM4sfp.jpg,False,4,0,0,,#farmersprotest,,,,,,,[],,,,
17,1437799258803953664,1437799258803953664,1631633030000.0,2021-09-14 20:53:50,+0530,,"#FarmersProtest in #Punjab becomes a fight within the state with the CM asking #Farmers to take the protest somewhere else!  Tonight, on #TheUrbanDebate, @tanvishukla asks- What led to the CM's U-Turn on protests?  Is this an internal powerplay?  https://t.co/5U5jrZQplQ",en,"['farmersprotest', 'punjab', 'farmers', 'theurbandebate']",[],3638215945,3638215945,MirrorNow,Mirror Now,2,20,https://twitter.com/MirrorNow/status/1437799258803953664,[],[],1,https://pbs.twimg.com/amplify_video_thumb/1437799054356844546/img/J9RIAEOXuc9uYuGP.jpg,False,8,1,3,,#farmersprotest,,,,,,,[],,,,
18,1437798165017546752,1437798165017546752,1631632770000.0,2021-09-14 20:49:30,+0530,,"""BJP के राज में 10 फीसदी खेती से आय कम हुई है, जबकि वादा किया था कि फरवरी 2022 तक किसानों की आय दोगुनी होगी"": @GouravVallabh  #FarmersProtest #SabseBadaSawaal  https://t.co/z6svptfOL8",hi,"['farmersprotest', 'sabsebadasawaal']",[],34206701,34206701,news24tvchannel,News24,2,20,https://twitter.com/news24tvchannel/status/1437798165017546752,[],[],1,https://pbs.twimg.com/amplify_video_thumb/1437795753691389955/img/sZPc3W5df5VBZRfS.jpg,False,2652,39,829,,#farmersprotest,,,,,,,[],,,,
19,1437798094637178882,1437798094637178882,1631632753000.0,2021-09-14 20:49:13,+0530,,"जिस भी राजनैतिक व्यक्ति और राजनैतिक दल के पास थोड़ी सी भी शर्म हया होगी, वह किसानों के साथ रहेगा। #FarmersProtest  https://t.co/v1XM36HNfn",hi,['farmersprotest'],[],708963231419609088,708963231419609088,GunjanINC,Gunjan Patel,2,20,https://twitter.com/GunjanINC/status/1437798094637178882,[],[],1,https://pbs.twimg.com/ext_tw_video_thumb/1437797747986362371/pu/img/qDyqKGn_qRpDJlYH.jpg,False,217,5,91,,#farmersprotest,,,,,,,[],,,,
20,1437797908875730947,1437797908875730947,1631632709000.0,2021-09-14 20:48:29,+0530,,"Punjab CM's bizarre advice for farmers - Spare Punjab, target Haryana, Delhi | @gauravcsawant #Newstrack #AmarinderSingh #FarmersProtest #Punjab #Haryana #Delhi  https://t.co/rhzbNLqys6",en,"['newstrack', 'amarindersingh', 'farmersprotest', 'punjab', 'haryana', 'delhi']",[],19897138,19897138,IndiaToday,IndiaToday,2,20,https://twitter.com/IndiaToday/status/1437797908875730947,[],[],1,https://pbs.twimg.com/amplify_video_thumb/1437797671788421124/img/mfrPCn0VLaR6l7_l.jpg,False,13,0,5,,#farmersprotest,,,,,,,[],,,,
21,1437797461901262848,1437797461901262848,1631632602000.0,2021-09-14 20:46:42,+0530,,"""ये सरकार छोटे किसान को ही सबसे पहले बर्बाद करना चाहती है"": @KoharAbhimanyu  #FarmersProtest #SabseBadaSawaal  https://t.co/EowZCBVBzK",hi,"['farmersprotest', 'sabsebadasawaal']",[],34206701,34206701,news24tvchannel,News24,2,20,https://twitter.com/news24tvchannel/status/1437797461901262848,[],[],1,https://pbs.twimg.com/amplify_video_thumb/1437795765854736384/img/E97o_9JSVgyEFgWr.jpg,False,345,11,82,,#farmersprotest,,,,,,,[],,,,
22,1437797355651153922,1437797355651153922,1631632577000.0,2021-09-14 20:46:17,+0530,,हरियाणा के गृह मंत्री अनिल विज का इस आंदोलन पर गुस्सा फूट पड़ा है   #AnilVij #FarmersProtest    https://t.co/lwhsDk3kXj,hi,"['anilvij', 'farmersprotest']",[],461841349,461841349,ZeeNews,Zee News,2,20,https://twitter.com/ZeeNews/status/1437797355651153922,['https://zeenews.india.com/hindi/india/haryana-minister-anil-vij-condemn-farmers-protest-says-now-this-is-gadar-not-movement/986250'],[],0,,False,156,6,9,,#farmersprotest,,,,,,,[],,,,
23,1437795663555796992,1437795663555796992,1631632173000.0,2021-09-14 20:39:33,+0530,,ರೈತರ ಪ್ರತಿಭಟನೆಯನ್ನು ಹತ್ತಿಕ್ಕಲು ಬಿಜೆಪಿ ಜಾತಿ ರಾಜಕಾರಣ ಮಾಡುತ್ತಿದೆ: ಕಾಂಗ್ರೆಸ್ ಆರೋಪ #Congress #BJP #Politics #FarmersProtest   https://t.co/i0Bm7mPah9,kn,"['congress', 'bjp', 'politics', 'farmersprotest']",[],199202745,199202745,prajavani,Prajavani,2,20,https://twitter.com/prajavani/status/1437795663555796992,['https://www.prajavani.net/india-news/congress-accuses-bjp-of-casteist-politics-to-break-protesting-farmers-unity-866556.html'],[],0,,False,3,0,0,,#farmersprotest,,,,,,,[],,,,
24,1437794753282777106,1437794753282777106,1631631956000.0,2021-09-14 20:35:56,+0530,,"""किसान नेताओं को ये मसझना होगा कि हमारा भविष्य क्या है, किस तरह वो किसानों को संगठित करें"":  @vijaysardana  #FarmersProtest #SabseBadaSawaal  https://t.co/qpse6IYuKq",hi,"['farmersprotest', 'sabsebadasawaal']",[],34206701,34206701,news24tvchannel,News24,2,20,https://twitter.com/news24tvchannel/status/1437794753282777106,[],[],1,https://pbs.twimg.com/amplify_video_thumb/1437787480678404115/img/wfhig7i6JUSFcmsH.jpg,False,62,3,9,,#farmersprotest,,,,,,,[],,,,
25,1437792831402348550,1437792831402348550,1631631498000.0,2021-09-14 20:28:18,+0530,,"""देश गांधी के रास्ते से भटक गया है, जो गांधी ने कहा वही चौधरी चरण सिंह ने कहा"": @KCTyagiJDU  #FarmersProtest #SabseBadaSawaal  https://t.co/kEx4i0AmAw",hi,"['farmersprotest', 'sabsebadasawaal']",[],34206701,34206701,news24tvchannel,News24,2,20,https://twitter.com/news24tvchannel/status/1437792831402348550,[],[],1,https://pbs.twimg.com/amplify_video_thumb/1437787271885987858/img/pirR9MiXUPpQbVKa.jpg,False,123,9,21,,#farmersprotest,,,,,,,[],,,,
26,1437792538614800389,1437792538614800389,1631631428000.0,2021-09-14 20:27:08,+0530,,"ਕਿਸਾਨਾਂ ਵਾਲੇ ਬਿਆਨ 'ਤੇ ਦਿੱਤੀ ਮੁੱਖਮੰਤਰੀ ਨੇ ਸਫਾਈ, ਕਿਹਾ- ਮੇਰੇ ਬਿਆਨ ਨੂੰ ਦਿੱਤੀ ਗਈ ਸਿਆਸੀ ਰੰਗਤ  #Punjab #FarmersProtest @capt_amarinder @ZeePunjabHH    https://t.co/8eBBYL7JWT",pa,"['punjab', 'farmersprotest']",[],2529715724,2529715724,ZeePunjabHH,Zee PHH,2,20,https://twitter.com/ZeePunjabHH/status/1437792538614800389,['https://zeenews.india.com/hindi/zeephh/punjab/captain-amrinder-singh-says-the-political-tone-given-to-my-statement/986246'],[],0,,False,0,0,0,,#farmersprotest,,,,,,,[],,,,
27,1437792242186526722,1437792242186526722,1631631358000.0,2021-09-14 20:25:58,+0530,,"""किसानों की चिंता स्वतंत्र भारत के समय से ही है, पिछले सात साल में नहीं आई है"": @IGuruPrakash  #FarmersProtest #SabseBadaSawaal  https://t.co/VydM2YCTAa",hi,"['farmersprotest', 'sabsebadasawaal']",[],34206701,34206701,news24tvchannel,News24,2,20,https://twitter.com/news24tvchannel/status/1437792242186526722,[],[],1,https://pbs.twimg.com/amplify_video_thumb/1437787257457594374/img/eDCkvYP-O8nOggDC.jpg,False,68,4,13,,#farmersprotest,,,,,,,[],,,,
28,1437788263889186826,1437788263889186826,1631630409000.0,2021-09-14 20:10:09,+0530,,"2014 से लेकर 2021 तक बस हो, हो, हो, हो..मोदी जी पिछले 10 महीने से आंदोलित देश के किसान यही तो कह रहे हैं कि आपने जो कहा था वो हो..सात साल से आप ही सरकार हैं, मग़र 'हो' को 'हो गया' में नहीं बदल सके। उल्टे किसानों को ही बदनाम करने और ज़ुल्म ढाने की झड़ी लगा दी। #FarmersProtest  https://t.co/FB6IudxWRl",hi,['farmersprotest'],[],831394413272260610,831394413272260610,inc_sanjeev,Sanjeev Singh,2,20,https://twitter.com/inc_sanjeev/status/1437788263889186826,[],['https://pbs.twimg.com/media/E_QMy-PXIAUwx2U.jpg'],1,https://pbs.twimg.com/media/E_QMy-PXIAUwx2U.jpg,False,5,0,1,,#farmersprotest,,,,,,,[],,,,
29,1437787847382163464,1437787847382163464,1631630310000.0,2021-09-14 20:08:30,+0530,,"#BJP के ल‍िए #FarmersProtest से उपजी नाराजगी को दूर करने की चुनौती, क्‍या काम आएगा ये कदम  #politics    https://t.co/ZGF7rXMqYj",hi,"['bjp', 'farmersprotest', 'politics']",[],927426236137201664,927426236137201664,TNNavbharat,Times Now Navbharat,2,20,https://twitter.com/TNNavbharat/status/1437787847382163464,['https://www.timesnowhindi.com/india/article/in-the-election-year-bjp-remembered-raja-mahendra-pratap-singh-will-jat-voters-would-be-saved/363276'],[],0,,False,15,0,0,,#farmersprotest,,,,,,,[],,,,
30,1437783192208084995,1437783192208084995,1631629200000.0,2021-09-14 19:50:00,+0530,,"'Was his plan all along': As Akalis plan to observe 'Black Day', #HarsimratBadal took on #CaptainAmarinderSingh over his 'Go to Delhi' remark on protesting farmers.  Details here  👇  #FarmersProtest @HarsimratBadal_  #Punjab  https://t.co/60w3IEKQtZ",en,"['harsimratbadal', 'captainamarindersingh', 'farmersprotest', 'punjab']",[],896740409346371584,896740409346371584,editorji,Editorji,2,19,https://twitter.com/editorji/status/1437783192208084995,[],[],1,https://pbs.twimg.com/ext_tw_video_thumb/1437779908281970689/pu/img/3_K4CUEoXjzjkCV1.jpg,False,7,0,5,,#farmersprotest,,,,,,,[],,,,
31,1437782219490308107,1437782219490308107,1631628968000.0,2021-09-14 19:46:08,+0530,,"ये आंदोलन तो रहा ही नहीं, आंदोलन में लोग तलवारें लेकर नहीं आते, लाठियां नहीं मारते, आने-जाने वालों का रास्ता नहीं रोकते। आंदोलन में लोग धरना देते हैं, भूख हड़ताल करते हैं। इसको आंदोलन नहीं, गदर कहा जा सकता है: किसान आंदोलन पर हरियाणा के गृह मंत्री अनिल विज #FarmersProtest  https://t.co/Ydw1nn2LmA",hi,['farmersprotest'],[],123171317,123171317,NavbharatTimes,NBT Hindi News,2,19,https://twitter.com/NavbharatTimes/status/1437782219490308107,[],['https://pbs.twimg.com/media/E_QHQJHWEAQaps3.jpg'],1,https://pbs.twimg.com/media/E_QHQJHWEAQaps3.jpg,False,311,14,21,,#farmersprotest,,,,,,,[],,,,
32,1437781751443697672,1437781089200771077,1631628856000.0,2021-09-14 19:44:16,+0530,,"CAPT ABANDONS FARMERS?  #Punjab CM's controversial u-turn on protest, says shift #FarmersProtest outside state!  WHAT LED TO CAPT AMARINDER'S CHANGE IN STAND?  Watch @tanvishukla at 845PM LIVE on #TheUrbanDebate:  https://t.co/XdQfs2IZzG  https://t.co/WOZnrF35Eu",en,"['punjab', 'farmersprotest', 'theurbandebate']",[],3638215945,3638215945,MirrorNow,Mirror Now,2,19,https://twitter.com/MirrorNow/status/1437781751443697672,['http://bit.ly/2DI9YRg'],['https://pbs.twimg.com/media/E_QGWPrXsAgMKbY.jpg'],1,https://pbs.twimg.com/media/E_QGWPrXsAgMKbY.jpg,False,1,1,0,,#farmersprotest,,,,,,,[],,,,
