,id,conversation_id,created_at,date,timezone,place,tweet,language,hashtags,cashtags,user_id,user_id_str,username,name,day,hour,link,urls,photos,video,thumbnail,retweet,nlikes,nreplies,nretweets,quote_url,search,near,geo,source,user_rt_id,user_rt,retweet_id,reply_to,retweet_date,translate,trans_src,trans_dest
67,1437711995592081410,1437711995592081410,1631612225000.0,2021-09-14 15:07:05,+0530,,"Farmers' agitation sponsored by #Congress, alleges #SurjitJyani  #FarmersProtest  #CaptainAmarinder #punjab   https://t.co/YCyUkiDm4K",en,"['congress', 'surjitjyani', 'farmersprotest', 'captainamarinder', 'punjab']",[],852553470,852553470,ptcnews,ਪੀਟੀਸੀ ਨਿਊਜ਼ | PTC News,2,15,https://twitter.com/ptcnews/status/1437711995592081410,['https://www.ptcnews.tv/farmers-agitation-sponsored-by-congress-alleges-surjit-jyani/'],[],0,,False,2,0,0,,#farmersprotest,,,,,,,[],,,,
68,1437711332837507075,1437711332837507075,1631612067000.0,2021-09-14 15:04:27,+0530,,ਸ਼ਿਮਲਾ: ਸੇਬ ਕਾਸ਼ਤਕਾਰਾਂ ਦਾ ਸੂਬਾ ਤੇ ਕੇਂਦਰ ਸਰਕਾਰ ਖ਼ਿਲਾਫ਼ ਪ੍ਰਦਰਸ਼ਨ #Shimla #farmers #FarmersProtest #BJP  #HimachalGovernment    https://t.co/T04NqXq5JS,pa,"['shimla', 'farmers', 'farmersprotest', 'bjp', 'himachalgovernment']",[],852553470,852553470,ptcnews,ਪੀਟੀਸੀ ਨਿਊਜ਼ | PTC News,2,15,https://twitter.com/ptcnews/status/1437711332837507075,['https://youtu.be/Ovfe5bqARD4'],[],0,,False,0,0,0,,#farmersprotest,,,,,,,[],,,,
69,1437709927921774594,1437709927921774594,1631611732000.0,2021-09-14 14:58:52,+0530,,"मित्र उद्योगपतियों की आय लाखों करोड़ बढ़ी, अन्नदाता किसान की आय ₹27 प्रति दिन, अब मज़दूरी ही एकमात्र रास्ता बचा!  ये है मोदी जी और भाजपा को चुनने का ईनाम ! - श्री @rssurjewala #FarmersProtest  https://t.co/r3FQHTHXZe",hi,['farmersprotest'],[],16293020,16293020,IYC,Youth Congress,2,14,https://twitter.com/IYC/status/1437709927921774594,[],['https://pbs.twimg.com/media/E_PFiJmUUAQ47_m.jpg'],1,https://pbs.twimg.com/media/E_PFiJmUUAQ47_m.jpg,False,154,3,78,,#farmersprotest,,,,,,,[],,,,
70,1437709333517664263,1437709333517664263,1631611591000.0,2021-09-14 14:56:31,+0530,,"ਕਿਸਾਨ ਅੰਦੋਲਨ ਕਰਕੇ NHRC ਨੇ ਦਿੱਲੀ, ਹਰਿਆਣਾ ਅਤੇ ਯੂਪੀ ਦੀਆਂ ਸਰਕਾਰਾਂ ਨੂੰ ਭੇਜਿਆ ਨੋਟਿਸ   https://t.co/ZUTqrDx5wm  #farmersprotest  #NHRC  #Delhi #Rajasthan  #Haryana  #UP  #Industries  #transportation  #KisanAndolan",pa,"['farmersprotest', 'nhrc', 'delhi', 'rajasthan', 'haryana', 'up', 'industries', 'transportation', 'kisanandolan']",[],852553470,852553470,ptcnews,ਪੀਟੀਸੀ ਨਿਊਜ਼ | PTC News,2,14,https://twitter.com/ptcnews/status/1437709333517664263,['https://ptcnews.tv/kisan-andolan-nhrc-seeks-reports-of-farmers-protest-from-delhi-rajasthan-haryana-and-up/'],[],0,,False,0,0,0,,#farmersprotest,,,,,,,[],,,,
71,1437700512946667523,1437700512946667523,1631609488000.0,2021-09-14 14:21:28,+0530,,NHRC has asked the Institute of Economic Growth (IEG) to examine the adverse impact of the farmers agitation on industrial and commercial activities/production #FarmersProtest #Farmers #FarmersProstest #NHRC   https://t.co/wsx426wwn0,en,"['farmersprotest', 'farmers', 'farmersprostest', 'nhrc']",[],929076201187975168,929076201187975168,NENowNews,NorthEast Now,2,14,https://twitter.com/NENowNews/status/1437700512946667523,['https://nenow.in/north-east-news/nhrc-issues-notice-to-centre-states-wants-reports-on-farmers-agitation.html'],[],0,,False,0,0,2,,#farmersprotest,,,,,,,[],,,,
72,1437700136428318722,1437700136428318722,1631609398000.0,2021-09-14 14:19:58,+0530,,"The #NHRC said it has received several complaints regarding the ongoing #FarmersProtest, related to its ""adverse impact"" on the industrial units, ""seriously affecting"" more than 9,000 micro, medium, and large companies.  https://t.co/lVOU2hc3xL",en,"['nhrc', 'farmersprotest']",[],268201193,268201193,DeccanHerald,Deccan Herald,2,14,https://twitter.com/DeccanHerald/status/1437700136428318722,['https://www.deccanherald.com/national/nhrc-seeks-reports-from-govts-over-adverse-impact-of-farmers-protest-1030192.html'],[],0,,False,2,0,0,,#farmersprotest,,,,,,,[],,,,
73,1437698715230236674,1437698715230236674,1631609059000.0,2021-09-14 14:14:19,+0530,,"NHRC issues notices to Delhi, Rajasthan, Haryana, Uttar Pradesh and the Union of India and other Authorities asking for reports on #FarmersProtest . (1/n)    https://t.co/pr3WomkCnC",en,['farmersprotest'],[],3304122667,3304122667,abhishekdey04,Abhishek Dey,2,14,https://twitter.com/abhishekdey04/status/1437698715230236674,['https://nhrc.nic.in/media/press-release/nhrc-issues-notices-delhi-rajasthan-haryana-union-india-and-other-authorities'],[],0,,False,0,1,0,,#farmersprotest,,,,,,,[],,,,
74,1437698003406491650,1437696846785179654,1631608889000.0,2021-09-14 14:11:29,+0530,,NHRC says “There is an allegation that there is breach of the corona protocols by the agitating farmers at the protest site. There is further allegation that the inhabitants are not being allowed to move out of their houses due to the blockade of the passage.” #FarmersProtest,en,['farmersprotest'],[],48940193,48940193,maryashakil,Marya Shakil,2,14,https://twitter.com/maryashakil/status/1437698003406491650,[],[],0,,False,266,7,56,,#farmersprotest,,,,,,,[],,,,
75,1437697011885568004,1437696846785179654,1631608653000.0,2021-09-14 14:07:33,+0530,,"NHRC - “…seriously effecting more than 9000 micro, medium, and large companies.Allegedly, transportation is also adversely impacted, causing the commuters, patients, physically challenged people and senior citizens to suffer due to the heavy congestion on roads.” #FarmersProtest",en,['farmersprotest'],[],48940193,48940193,maryashakil,Marya Shakil,2,14,https://twitter.com/maryashakil/status/1437697011885568004,[],[],0,,False,287,5,56,,#farmersprotest,,,,,,,[],,,,
76,1437696846785179654,1437696846785179654,1631608614000.0,2021-09-14 14:06:54,+0530,,"NHRC issues notices to Delhi, Rajasthan, Haryana, U.P. Govts and GOI asking for reports of farmer protest.   NHRC says “it has received several complaints regarding the ongoing #FarmersProtest. There are allegations of adverse impact on the industrial units…”1/2",en,['farmersprotest'],[],48940193,48940193,maryashakil,Marya Shakil,2,14,https://twitter.com/maryashakil/status/1437696846785179654,[],[],0,,False,1216,68,248,,#farmersprotest,,,,,,,[],,,,
77,1437696077071671300,1437696077071671300,1631608430000.0,2021-09-14 14:03:50,+0530,,"ਕਿਸਾਨਾਂ ਨੂੰ ਘੇਰਨ ਲਈ ਕੇਂਦਰ ਨੇ ਲੱਭਿਆ ਨਵਾਂ ਰਾਹ, ਮਨੁੱਖੀ ਅਧਿਕਾਰ ਕਮਿਸ਼ਨ ਨੇ ਇਨ੍ਹਾਂ ਰਾਜਾਂ ਨੂੰ ਭੇਜੇ ਨੋਟਿਸ   https://t.co/2Y9nrkw4OO #NationalHumanRightsCommission #Notice #Delhi #Haryana #Rajasthan #UttarPradesh #FarmersProtest #FarmLaws #Farmers #DelhiBorders #FarmerSupports  https://t.co/mBUjB8UcWA",pa,"['nationalhumanrightscommission', 'notice', 'delhi', 'haryana', 'rajasthan', 'uttarpradesh', 'farmersprotest', 'farmlaws', 'farmers', 'delhiborders', 'farmersupports']",[],222394250,222394250,JagbaniOnline,Jagbani,2,14,https://twitter.com/JagbaniOnline/status/1437696077071671300,['https://jagbani.punjabkesari.in/national/news/national-human-rights-commission-issues-notice-states-for-farmers-protest-1313176'],['https://pbs.twimg.com/media/E_O49SlVIAcT3pH.jpg'],1,https://pbs.twimg.com/media/E_O49SlVIAcT3pH.jpg,False,17,1,3,,#farmersprotest,,,,,,,[],,,,
78,1437695111953993728,1437695111953993728,1631608200000.0,2021-09-14 14:00:00,+0530,,"कृषि कानून का विरोध करने पहुंचे किसानों से पूछा गया कानून के बारे में तो सुनने को मिली कई मांगे और आए कई तरह के जवाब, कहा: टिकैत कह रहे हैं तो नुकसानदायक है कानून #FarmersProtest #FarmLaw  https://t.co/2mJAxHr3Vi",hi,"['farmersprotest', 'farmlaw']",[],1004303857474605056,1004303857474605056,UPTakOfficial,UP Tak,2,14,https://twitter.com/UPTakOfficial/status/1437695111953993728,[],[],1,https://pbs.twimg.com/media/E_NWAQYVIAEYb79.jpg,False,6,0,0,,#farmersprotest,,,,,,,[],,,,
79,1437695111618465794,1437695111618465794,1631608200000.0,2021-09-14 14:00:00,+0530,,"किसानों के प्रदर्शन पर दिल्ली, यूपी और हरियाणा को #NHRC का नोटिस, यातायात बाधित होने पर मांगी रिपोर्ट  #FarmersProtest #KisanAndolan #Haryana #Delhi #UttarPradesh   https://t.co/1kDjHts9hP",hi,"['nhrc', 'farmersprotest', 'kisanandolan', 'haryana', 'delhi', 'uttarpradesh']",[],64639742,64639742,JagranNews,Dainik Jagran,2,14,https://twitter.com/JagranNews/status/1437695111618465794,['https://www.jagran.com/news/national-nhrc-issued-notices-to-delhi-rajasthan-haryana-up-for-reports-of-farmers-protest-22019081.html'],[],0,,False,22,0,2,,#farmersprotest,,,,,,,[],,,,
