,id,conversation_id,created_at,date,timezone,place,tweet,language,hashtags,cashtags,user_id,user_id_str,username,name,day,hour,link,urls,photos,video,thumbnail,retweet,nlikes,nreplies,nretweets,quote_url,search,near,geo,source,user_rt_id,user_rt,retweet_id,reply_to,retweet_date,translate,trans_src,trans_dest
0,1463636067802877966,1463636067802877966,1637793006000.0,2021-11-25 04:00:06,+0530,,"#InQuotes: It is only through a concerted and collective action of the organisations representing marginal, small, and medium far­mers that the multidimensional des­tructive turn in economic policy symbolised by these farm acts might be rever­sed.  https://t.co/Ra01PWulto",en,['inquotes'],[],53640157,53640157,epw_in,Economic & Political Weekly,4,04,https://twitter.com/epw_in/status/1463636067802877966,['https://www.epw.in/engage/gallery/who-benefits-bjps-new-agricultural-policies'],[],0,,False,1,0,0,,farm policy,,,,,,,[],,,,
1,1463545469066432516,1463545469066432516,1637771405000.0,2021-11-24 22:00:05,+0530,,"Whole-Farm Revenue Protection provides a risk management safety net to all commodities, including specialty crops, under one insurance policy and is the first Federal crop insurance program to be available in every state and county in the U.S.  https://t.co/oyfwn3h9tg  https://t.co/90I5AnteCY",en,[],[],983363934462849024,983363934462849024,usdaRMA,Risk Management Agency,3,22,https://twitter.com/usdaRMA/status/1463545469066432516,['https://bit.ly/3iT0gQC'],['https://pbs.twimg.com/media/FE-O2PwXIAQVlii.jpg'],1,https://pbs.twimg.com/media/FE-O2PwXIAQVlii.jpg,False,9,0,3,,farm policy,,,,,,,[],,,,
2,1463467546569588737,1463453532854628354,1637752827000.0,2021-11-24 16:50:27,+0530,,"We're now hearing from David Williams, @FCNCymru, and Professor Terry Marsden from @CUGeogPlan, in the first evidence session for our inquiry looking at the impact of trade and environmental policy on family farms.  Watch live:  https://t.co/7dAWybvn7B  https://t.co/IUCBzNScET",en,[],[],993359215,993359215,CommonsWelshAff,Welsh Affairs Committee,3,16,https://twitter.com/CommonsWelshAff/status/1463467546569588737,['https://parliamentlive.tv/Event/Index/7886ab57-9b99-4cf3-8edf-c65df300208a'],"['https://pbs.twimg.com/media/FE9G8ccXEAMRH8g.jpg', 'https://pbs.twimg.com/media/FE9G6E-XMAIMY9k.jpg']",1,https://pbs.twimg.com/media/FE9G8ccXEAMRH8g.jpg,False,1,0,1,,farm policy,,,,,,,[],,,,
3,1463453532854628354,1463453532854628354,1637749486000.0,2021-11-24 15:54:46,+0530,,We're holding the first evidence session for our inquiry looking at the impact of trade and environmental policy on family farms.  We're hearing from:   - Nick Fenwick @FUWpress - John Davies @NFUCymru - William Jones @WalesYFC  Watch live:  https://t.co/7dAWybvn7B  https://t.co/dT69YkCAIh,en,[],[],993359215,993359215,CommonsWelshAff,Welsh Affairs Committee,3,15,https://twitter.com/CommonsWelshAff/status/1463453532854628354,['https://parliamentlive.tv/Event/Index/7886ab57-9b99-4cf3-8edf-c65df300208a'],"['https://pbs.twimg.com/media/FE85CEIWQAEC8yr.jpg', 'https://pbs.twimg.com/media/FE85EKvX0AEX_2B.jpg', 'https://pbs.twimg.com/media/FE85FqPXsAcYKDx.jpg']",1,https://pbs.twimg.com/media/FE85CEIWQAEC8yr.jpg,False,8,1,4,,farm policy,,,,,,,[],,,,
4,1463442266618572802,1463442266618572802,1637746800000.0,2021-11-24 15:10:00,+0530,,❓ How's your wi-fi ❓   A survey has been launched to explore the current state of digital connectivity in rural Wales. This comes ahead of changes to farm policy that will require more paperwork to be completed online ⬇️    https://t.co/go7az2cilX  #farminguk,en,['farminguk'],[],16828440,16828440,FarmersWeekly,Farmers Weekly,3,15,https://twitter.com/FarmersWeekly/status/1463442266618572802,['https://www.fwi.co.uk/news/survey-launched-to-examine-broadband-access-in-rural-wales'],[],0,,False,1,0,0,,farm policy,,,,,,,[],,,,
5,1463418393571299329,1463418393571299329,1637741108000.0,2021-11-24 13:35:08,+0530,,"India's Prime Minister Modi has repealed farm reform laws after a year of angry and sometimes deadly street protests.  It's Modi's biggest policy U-turn since taking office and could have an impact on the upcoming elections, @archchaudhary explains  https://t.co/DZj61eJNnr  https://t.co/Fwtac9fkoJ",en,[],[],252751061,252751061,Quicktake,Bloomberg Quicktake,3,13,https://twitter.com/Quicktake/status/1463418393571299329,['https://trib.al/Dch8yq8'],[],1,https://pbs.twimg.com/amplify_video_thumb/1463015424967294977/img/iwhv26hGOpAcLgsC.jpg,False,10,0,5,,farm policy,,,,,,,[],,,,
6,1463329019575816194,1463329019575816194,1637719800000.0,2021-11-24 07:40:00,+0530,,FIR filed against #KanganaRanaut for social media post on farm law protestors  A Twitter spokesperson had then said that Ranaut repeatedly violated the company’s policy on “hateful conduct and abusive behaviour”.  https://t.co/FHQ1alx7Rw,en,['kanganaranaut'],[],414946220,414946220,scroll_in,scroll.in,3,07,https://twitter.com/scroll_in/status/1463329019575816194,['https://scroll.in/latest/1011263/'],[],0,,False,30,1,5,,farm policy,,,,,,,[],,,,
7,1463326505363296258,1463326505363296258,1637719200000.0,2021-11-24 07:30:00,+0530,,"🚨Out now!🚨  In S6E11 of #GrandTamasha, @MilanV, @dhume, &amp; @tanvi_madan give listeners a #NewsRoundup covering the farm bill repeal, India's trade policy, and India-China relations  🎧Listen here, or wherever you get your podcasts👇  https://t.co/njA6iqjbqX  https://t.co/sUcrhKdf7A",en,"['grandtamasha', 'newsroundup']",[],2427430309,2427430309,CarnegieSAsia,Carnegie South Asia,3,07,https://twitter.com/CarnegieSAsia/status/1463326505363296258,['https://bit.ly/30Q87IA'],['https://pbs.twimg.com/media/FE6F8-uXIAMCuKa.jpg'],1,https://pbs.twimg.com/media/FE6F8-uXIAMCuKa.jpg,False,2,0,1,,farm policy,,,,,,,[],,,,
8,1463316404938022914,1462991585914679298,1637716792000.0,2021-11-24 06:49:52,+0530,,"@NationalFarmers @Dale_AgForce @afsnsw @lesgordon2 @ricegrowers @tonymahar @graemeskruger @AdamKayCotton @WarwickRagg Had the pleasure of meeting and interviewing Les a few times and hearing his views on water policy, including on a Basin tour in 2015 when we took this picture - great job advocating for your community and members during some of the toughest farm policy debates in recent years",en,[],[],213875968,213875968,ColinJBettles,Colin James Bettles,3,06,https://twitter.com/ColinJBettles/status/1463316404938022914,[],[],0,,False,1,1,0,,farm policy,,,,,,,"[{'screen_name': 'NationalFarmers', 'name': ""National Farmers' Federation"", 'id': '321841033'}, {'screen_name': 'Dale_AgForce', 'name': 'Dale Miller', 'id': '1442293944'}, {'screen_name': 'afsnsw', 'name': 'Fiona Simson', 'id': '261433065'}, {'screen_name': 'lesgordon2', 'name': 'Les Gordon', 'id': '1417239720'}, {'screen_name': 'ricegrowers', 'name': 'RGA', 'id': '345753713'}, {'screen_name': 'tonymahar', 'name': 'Tony Mahar', 'id': '1279454083'}, {'screen_name': 'graemeskruger', 'name': 'Graeme Kruger', 'id': '300667859'}, {'screen_name': 'AdamKayCotton', 'name': 'Adam Kay', 'id': '1096194021267918849'}, {'screen_name': 'WarwickRagg', 'name': 'Warwick Ragg', 'id': '574250749'}]",,,,
