,id,conversation_id,created_at,date,timezone,place,tweet,language,hashtags,cashtags,user_id,user_id_str,username,name,day,hour,link,urls,photos,video,thumbnail,retweet,nlikes,nreplies,nretweets,quote_url,search,near,geo,source,user_rt_id,user_rt,retweet_id,reply_to,retweet_date,translate,trans_src,trans_dest
0,1443622186070286344,1443622186070286344,1633021325000.0,2021-09-30 22:32:05,+0530,,"LIVE now: The reconciliation bill has a bold climate agenda. The US could cut greenhouse gas emissions by investing in wind/solar energy, greener agriculture and climate-resilient infrastructure.  Join us w/@foodandwater's Mitch Jones + @350's @kalalight.  https://t.co/Ibo7eBt1tS",en,[],[],711946640362332160,711946640362332160,yourcallradio,Your Call Radio,4,22,https://twitter.com/yourcallradio/status/1443622186070286344,['https://www.kalw.org/show/your-call/2021-09-30/how-the-reconciliation-bill-would-address-the-climate-crisis-improve-long-term-home-care'],[],0,,False,3,0,1,,agriculture bills,,,,,,,[],,,,
1,1443618460874027009,1443618460874027009,1633020436000.0,2021-09-30 22:17:16,+0530,,I thank the @NEFarmBureau  for sharing why they support the bipartisan Hard Infrastructure Bill that will help Nebraska's agriculture while also opposing the $3.5T Bernie Sanders Reconciliation Bill.  I agree and so does the majority of #NE02.  https://t.co/cGGN5ynv25,en,['ne02'],[],818975124460335106,818975124460335106,RepDonBacon,Rep. Don Bacon 🇺🇸🇺🇦,4,22,https://twitter.com/RepDonBacon/status/1443618460874027009,['https://www.dropbox.com/s/zuk3oxvqwjs4ff2/Letter%20to%20House%20Members%20on%20Infrastructure%20Package%209-30-21%20Final%20%28Bacon%29.pdf?dl=0'],[],0,,False,10,8,6,,agriculture bills,,,,,,,[],,,,
2,1443611019067146244,1443611019067146244,1633018662000.0,2021-09-30 21:47:42,+0530,,"New fact check: As Democrats debate a $3.5 trillion reconciliation package, a false claim that the bill includes an ""animal agriculture tax"" has gained traction online  https://t.co/TZnMFN3vaL",en,[],[],364593753,364593753,dpfunke,Daniel Funke,4,21,https://twitter.com/dpfunke/status/1443611019067146244,['https://www.usatoday.com/story/news/factcheck/2021/09/30/fact-check-build-back-better-act-wouldnt-tax-cattle-farmers/5913599001/'],[],0,,False,39,1,27,,agriculture bills,,,,,,,[],,,,
3,1443590424829087746,1443590424829087746,1633013752000.0,2021-09-30 20:25:52,+0530,,"OSBA #agriculture law priority legislation receives sponsor testimony, as does a #debtadjustment bill. Plus, updates on the #vaccine bill and #redistricting in today's #WeeklyLegislativeReport:  https://t.co/BpyyfgTBlh  https://t.co/28CIkY3Y94",en,"['agriculture', 'debtadjustment', 'vaccine', 'redistricting', 'weeklylegislativereport']",[],19027088,19027088,OSBA,Ohio State Bar Association,4,20,https://twitter.com/OSBA/status/1443590424829087746,['https://bit.ly/39OAVm9'],['https://pbs.twimg.com/media/FAipvtqVUA0XvDR.jpg'],1,https://pbs.twimg.com/media/FAipvtqVUA0XvDR.jpg,False,6,0,1,,agriculture bills,,,,,,,[],,,,
4,1443542497117020161,1443542497117020161,1633002325000.0,2021-09-30 17:15:25,+0530,,"My Bill to amend the Veterinary Practice Act 2005 is progressing through the Oireachtas, after the first series of legislative scrutiny took place this week in front of the Oireachtas Agriculture Committee   https://t.co/AqJiIDIa6y",en,[],[],3091852973,3091852973,jackiecahillff,Jackie Cahill TD,4,17,https://twitter.com/jackiecahillff/status/1443542497117020161,['https://www.irishexaminer.com/farming/arid-40709561.html'],[],0,,False,15,0,6,,agriculture bills,,,,,,,[],,,,
5,1443539938121850880,1443525986927140867,1633001715000.0,2021-09-30 17:05:15,+0530,,@mattklewis @murphymike Agriculture is looking for a Party who can pass the Infrastructure bill. Anybody know one?? @RuralVoicesUSA,en,[],[],1131852757772713984,1131852757772713984,ChrisRGibbs,Chris Gibbs,4,17,https://twitter.com/ChrisRGibbs/status/1443539938121850880,[],[],0,,False,1,0,0,,agriculture bills,,,,,,,"[{'screen_name': 'mattklewis', 'name': 'Matt Lewis', 'id': '16887628'}, {'screen_name': 'murphymike', 'name': 'Mike Murphy', 'id': '20786801'}]",,,,
6,1443536880830648321,1443536880830648321,1633000986000.0,2021-09-30 16:53:06,+0530,,Agriculture is looking for a Party who can pass the Infrastructure bill. Anybody know one?? @RuralVoicesUSA @SpeakerPelosi @chuckschumer  @JoeBiden  @RonaldKlain,en,[],[],1131852757772713984,1131852757772713984,ChrisRGibbs,Chris Gibbs,4,16,https://twitter.com/ChrisRGibbs/status/1443536880830648321,[],[],0,,False,14,1,3,,agriculture bills,,,,,,,[],,,,
