,id,conversation_id,created_at,date,timezone,place,tweet,language,hashtags,cashtags,user_id,user_id_str,username,name,day,hour,link,urls,photos,video,thumbnail,retweet,nlikes,nreplies,nretweets,quote_url,search,near,geo,source,user_rt_id,user_rt,retweet_id,reply_to,retweet_date,translate,trans_src,trans_dest
0,1357478406967984134,1357478406967984134,1612483047000.0,2021-02-05 05:27:27,+0530,,"Twitter activism by celebs like Rihanna are ""based on a reductive caricature of complex issues"". @dhume nails it while calling out the hypocrisy and ignorance of celebrity activism against India's much needed farm reforms.  #FarmersProtest",en,['farmersprotest'],[],151432737,151432737,rupasubramanya,Rupa Subramanya,5,05,https://twitter.com/rupasubramanya/status/1357478406967984134,[],[],0,,False,124,45,43,https://twitter.com/dhume/status/1357407687777091584,#farmersprotest,,,,,,,[],,,,
1,1357475272304582664,1357475272304582664,1612482300000.0,2021-02-05 05:15:00,+0530,,Haryana extends internet shutdown in Jhajjar &amp; Sonipat districts by 24 hours due to the ongoing farmers' protest.  #FarmersProtest  https://t.co/jFwwf29cb8,en,['farmersprotest'],[],231692806,231692806,JagranEnglish,Jagran English,5,05,https://twitter.com/JagranEnglish/status/1357475272304582664,['https://english.jagran.com/india/farmers-protest-internet-shutdown-extended-in-2-haryana-districts-till-feb5-10023073'],[],0,,False,1,0,0,,#farmersprotest,,,,,,,[],,,,
2,1357474013883285509,1357474013883285509,1612482000000.0,2021-02-05 05:10:00,+0530,,#FarmersProtest | Protesters treated as anti-nationals: @HarsimratBadal_ after Ghazipur visit with opposition team   https://t.co/5RdWXirnm0  https://t.co/0nVqUMek7g,en,['farmersprotest'],[],36327407,36327407,htTweets,Hindustan Times,5,05,https://twitter.com/htTweets/status/1357474013883285509,['https://www.hindustantimes.com/india-news/protesters-treated-as-anti-nationals-harsimrat-badal-after-ghazipur-visit-with-opposition-team-101612424133580.html'],['https://pbs.twimg.com/media/EtXcti6VIAEBa5I.jpg'],1,https://pbs.twimg.com/media/EtXcti6VIAEBa5I.jpg,False,17,6,6,,#farmersprotest,,,,,,,[],,,,
3,1357473826628599808,1357473826628599808,1612481955000.0,2021-02-05 05:09:15,+0530,,விவசாயிகள் போராட்டம்: அமித் ஷா - தோவல் அவசர ஆலோசனை #FarmersProtest #AmitShah #AjitDoval   https://t.co/SbhDBLejKa,ta,"['farmersprotest', 'amitshah', 'ajitdoval']",[],14448642,14448642,dinamalarweb,Dinamalar,5,05,https://twitter.com/dinamalarweb/status/1357473826628599808,['https://www.dinamalar.com/news_detail.asp?id=2703099'],[],0,,False,11,0,1,,#farmersprotest,,,,,,,[],,,,
4,1357469420428419073,1357469420428419073,1612480905000.0,2021-02-05 04:51:45,+0530,,"I still #StandWithFarmers and support their peaceful protest. No amount of hate, threats or violations of human rights will ever change that. #FarmersProtest",en,"['standwithfarmers', 'farmersprotest']",[],810585618031984640,810585618031984640,Jamie_Margolin,Jamie Margolin,5,04,https://twitter.com/Jamie_Margolin/status/1357469420428419073,[],[],0,,False,2904,192,1025,https://twitter.com/GretaThunberg/status/1357282507616645122,#farmersprotest,,,,,,,[],,,,
5,1357463954469965825,1357463954469965825,1612479601000.0,2021-02-05 04:30:01,+0530,,"#FarmersProtest | On way to meet family of farmer who died, @priyankagandhi discusses stir   https://t.co/YfHYT7Mjpx  https://t.co/7PdLp8Xejm",en,['farmersprotest'],[],36327407,36327407,htTweets,Hindustan Times,5,04,https://twitter.com/htTweets/status/1357463954469965825,['https://www.hindustantimes.com/india-news/on-way-to-meet-family-of-farmer-who-died-priyanka-gandhi-discusses-stir-101612421566324.html'],['https://pbs.twimg.com/media/EtXVG1HVkAIo_bQ.jpg'],1,https://pbs.twimg.com/media/EtXVG1HVkAIo_bQ.jpg,False,20,3,4,,#farmersprotest,,,,,,,[],,,,
6,1357463952242987010,1357463952242987010,1612479601000.0,2021-02-05 04:30:01,+0530,,"""सरकार ने मन बना लिया है कि जब भी कोई उनसे असहमत होता है, तो उन्हें देश विरोधी कहते हैं"": मनिंदर सिंह सिरसा, अकाली दल प्रवक्ता #FarmersProtest #FarmLaws2020 #Farmers #RE  https://t.co/lJnjlUfOA0",hi,"['farmersprotest', 'farmlaws2020', 'farmers', 're']",[],42606652,42606652,aajtak,AajTak,5,04,https://twitter.com/aajtak/status/1357463952242987010,[],[],1,https://pbs.twimg.com/amplify_video_thumb/1357299911889362946/img/yIZctwTSYXLYmBmS.jpg,False,142,23,17,,#farmersprotest,,,,,,,[],,,,
7,1357463951748059137,1357463951748059137,1612479601000.0,2021-02-05 04:30:01,+0530,,"Communication specialist, Asmita Ghosh explains what exactly a social media 'toolkit' is all about  @preetichoudhry | #NewsToday #FarmersProtest #Re  https://t.co/KGeYF49ZBr",en,"['newstoday', 'farmersprotest', 're']",[],19897138,19897138,IndiaToday,IndiaToday,5,04,https://twitter.com/IndiaToday/status/1357463951748059137,[],[],1,https://pbs.twimg.com/amplify_video_thumb/1357352524974419970/img/-qOwKtvLonBtT8jB.jpg,False,20,1,9,,#farmersprotest,,,,,,,[],,,,
8,1357458914443485184,1357458914443485184,1612478400000.0,2021-02-05 04:10:00,+0530,,#FarmersProtest | Foreign celebs’ support for farmers’ protest sparks government censure: What we know   https://t.co/6MW3rLEUGx,en,['farmersprotest'],[],36327407,36327407,htTweets,Hindustan Times,5,04,https://twitter.com/htTweets/status/1357458914443485184,['https://www.hindustantimes.com/india-news/foreign-celebs-support-for-farmers-protest-sparks-govt-censure-what-we-know-101612421341935.html'],[],0,,False,22,2,5,,#farmersprotest,,,,,,,[],,,,
9,1357451364700356608,1357451364700356608,1612476600000.0,2021-02-05 03:40:00,+0530,,#FarmersProtest | Indo-Canadian groups ask Canada PM to condemn farmer protest violence on Jan 26  (Reports @anirudhb)   https://t.co/4o9Uvtjis4  https://t.co/3Dx3ZKc6m1,en,['farmersprotest'],[],36327407,36327407,htTweets,Hindustan Times,5,03,https://twitter.com/htTweets/status/1357451364700356608,['https://www.hindustantimes.com/world-news/indocanadian-groups-ask-canada-pm-to-condemn-farmer-protest-violence-on-jan-26-101612420020853.html'],['https://pbs.twimg.com/media/EtXLj7uUcAECmo4.jpg'],1,https://pbs.twimg.com/media/EtXLj7uUcAECmo4.jpg,False,75,7,16,,#farmersprotest,,,,,,,[],,,,
10,1357450063086292996,1357450063086292996,1612476289000.0,2021-02-05 03:34:49,+0530,,#FarmersProtest,und,['farmersprotest'],[],102409502,102409502,BritAsiaTV,BritAsia TV,5,03,https://twitter.com/BritAsiaTV/status/1357450063086292996,[],[],0,,False,11,1,3,https://twitter.com/thebigheadtweet/status/1357449325278711809,#farmersprotest,,,,,,,[],,,,
11,1357449036601638912,1357449036601638912,1612476045000.0,2021-02-05 03:30:45,+0530,,My heart breaks seeing the images from Delhi over the past couple of days. The right to peacefully protest and express opinions are fundamental rights in any democracy.   I hope for a peaceful resolution as farmers continue to exercise their democratic rights. #FarmersProtest  https://t.co/CbJG3RkQji,en,['farmersprotest'],[],777004766777880577,777004766777880577,PrabSarkaria,Prabmeet Sarkaria,5,03,https://twitter.com/PrabSarkaria/status/1357449036601638912,[],['https://pbs.twimg.com/media/EtagtFaWQAERvY6.jpg'],1,https://pbs.twimg.com/media/EtagtFaWQAERvY6.jpg,False,473,3,187,,#farmersprotest,,,,,,,[],,,,
12,1357448874424741891,1357448874424741891,1612476006000.0,2021-02-05 03:30:06,+0530,,"Whether @rihanna is spreading awareness about the #FarmersProtest in India or supporting #BlackLivesMatter, we can always count on her to show up.  https://t.co/F9PVjKwMVa",en,"['farmersprotest', 'blacklivesmatter']",[],753638148958216192,753638148958216192,GlblCtznCAN,Global Citizen Canada,5,03,https://twitter.com/GlblCtznCAN/status/1357448874424741891,['https://glblctzn.me/2O2g1Il'],[],0,,False,6,2,1,,#farmersprotest,,,,,,,[],,,,
13,1357448854363332609,1357448854363332609,1612476001000.0,2021-02-05 03:30:01,+0530,,सिंघु गाँव में क्यों लग रहा है जाम? किन- किन दिक्कतों का सामना कर रहे हैं वहां लोग? देखिये अनीशा माथुर की #ReporterDiary  #SinghuBorder #FarmersProtest #TrafficJam #RE  https://t.co/869VR0ivIj,hi,"['reporterdiary', 'singhuborder', 'farmersprotest', 'trafficjam', 're']",[],42606652,42606652,aajtak,AajTak,5,03,https://twitter.com/aajtak/status/1357448854363332609,[],[],1,https://pbs.twimg.com/amplify_video_thumb/1357241224571199489/img/FWdAeYbz3Ep8sSfA.jpg,False,60,16,18,,#farmersprotest,,,,,,,[],,,,
14,1357448431422173185,1357445104236179462,1612475900000.0,2021-02-05 03:28:20,+0530,,"While #Myanmar suspends #Facebook and other social media platforms for its use against the govt., #India resorts to internet shutdown again following violent clashes related to the #FarmersProtest...  Continue reading:  https://t.co/S9xEZbgpAd #APFCanada #AsiaWatch2021 #cdnpoli  https://t.co/BLPXt7lxyt",en,"['myanmar', 'facebook', 'india', 'farmersprotest', 'apfcanada', 'asiawatch2021', 'cdnpoli']",[],38480298,38480298,AsiaPacificFdn,APF Canada,5,03,https://twitter.com/AsiaPacificFdn/status/1357448431422173185,['http://ow.ly/vv2k50zslzN'],['https://pbs.twimg.com/media/Etad4fGVcAA5FyM.jpg'],1,https://pbs.twimg.com/media/Etad4fGVcAA5FyM.jpg,False,1,1,0,,#farmersprotest,,,,,,,[],,,,
15,1357446784537141248,1357446784537141248,1612475508000.0,2021-02-05 03:21:48,+0530,,.@derekobrienmp pauses his speech in #RajyaSabha midway to pay respect to farmers who died during #FarmersProtest; Opposition MPs join @AITCofficial MPs to observe a minute silence #Parliament   https://t.co/DuVC9ptWmX,en,"['rajyasabha', 'farmersprotest', 'parliament']",[],75507420,75507420,shemin_joy,Shemin,5,03,https://twitter.com/shemin_joy/status/1357446784537141248,['https://www.deccanherald.com/national/derek-obrien-pauses-for-a-minute-during-rs-speech-to-pay-respect-to-farmers-dead-during-protest-947458.html'],[],0,,False,0,0,0,,#farmersprotest,,,,,,,[],,,,
16,1357446335532736512,1357446335532736512,1612475401000.0,2021-02-05 03:20:01,+0530,,Has Bollywood actor @BeingSalmanKhan finally come out and shown his support towards to #FarmersProtest ?   Will others in the industry follow his lead and also show their support?   #IndianFarmersHumanRights #IStandWithFarmers #FarmersProtest #farmers #protest  https://t.co/5kJhG7Dx8c,en,"['farmersprotest', 'indianfarmershumanrights', 'istandwithfarmers', 'farmersprotest', 'farmers', 'protest']",[],102409502,102409502,BritAsiaTV,BritAsia TV,5,03,https://twitter.com/BritAsiaTV/status/1357446335532736512,[],[],1,https://pbs.twimg.com/ext_tw_video_thumb/1357446254763118595/pu/img/LkuVFnB6YRdcuInt.jpg,False,2367,162,522,,#farmersprotest,,,,,,,[],,,,
17,1357443489475293187,1357443489475293187,1612474722000.0,2021-02-05 03:08:42,+0530,,"Godi media is the gift that keeps on giving. Apparently RiRi was paid 100 crores for her tweet. And all you got was “band of propagandists”. Thank you, @meenaharris for standing your ground. Activists/ farmers/ journalists jailed but the #FarmersProtest remains a resilient force.",en,['farmersprotest'],[],1083854065,1083854065,TrishaBShetty,Trisha Shetty,5,03,https://twitter.com/TrishaBShetty/status/1357443489475293187,[],[],0,,False,113,3,22,https://twitter.com/meena/status/1357397863320358912,#farmersprotest,,,,,,,[],,,,
18,1357442729870057480,1357442729870057480,1612474541000.0,2021-02-05 03:05:41,+0530,,"In answer to multiple queries from reporters, the Department of State has shared a position about the #FarmersProtest. Here is our response:  https://t.co/JvAeI60NUu",en,['farmersprotest'],[],316671079,316671079,sikh_coalition,Sikh Coalition,5,03,https://twitter.com/sikh_coalition/status/1357442729870057480,[],['https://pbs.twimg.com/media/EtaZuN6XEAAdkJ-.jpg'],1,https://pbs.twimg.com/media/EtaZuN6XEAAdkJ-.jpg,False,155,14,52,,#farmersprotest,,,,,,,[],,,,
19,1357442011570335753,1357442011570335753,1612474370000.0,2021-02-05 03:02:50,+0530,,"How ridiculous. Burning effigies of an 18 yr old &amp; saying someone deserved domestic abuse because you disagree with them? If you can't make a point without violence, you've lost the debate  https://t.co/flrZXYsHlN @GretaThunberg @rihanna   #IndianFarmersHumanRights #FarmersProtest",en,"['indianfarmershumanrights', 'farmersprotest']",[],555229144,555229144,_JasvirSingh,Jasvir Singh ਜਸਵੀਰ جسویر जसवीर,5,03,https://twitter.com/_JasvirSingh/status/1357442011570335753,['https://www.theguardian.com/world/2021/feb/04/greta-thunberg-effigies-burned-in-delhi-after-tweets-on-farmers-protests'],[],0,,False,46,5,20,,#farmersprotest,,,,,,,[],,,,
