,id,conversation_id,created_at,date,timezone,place,tweet,language,hashtags,cashtags,user_id,user_id_str,username,name,day,hour,link,urls,photos,video,thumbnail,retweet,nlikes,nreplies,nretweets,quote_url,search,near,geo,source,user_rt_id,user_rt,retweet_id,reply_to,retweet_date,translate,trans_src,trans_dest
0,1401963574487097354,1401963574487097354,1623089138000.0,2021-06-07 23:35:38,+0530,,"The final line of this OpEd is ""As a lifelong Republican, I mourn for our party and our state."" =&gt;   Opinion: Ohio Farmers, Republican values under attack by ill-conceived anti-solar energy bill  https://t.co/C40a6jYPK9 via @DispatchAlerts",en,[],[],22032397,22032397,KentKSmith,Kent #BestRepSmiths Smith,1,23,https://twitter.com/KentKSmith/status/1401963574487097354,['https://www.dispatch.com/story/opinion/columns/guest/2021/06/07/mike-pullins-ohio-farmers-republican-values-under-attack-ill-conceived-anti-solar-energy-bill/7584013002/'],[],0,,False,5,1,4,,farmers' bill,,,,,,,[],,,,
1,1401920426612297728,1401920426612297728,1623078850000.0,2021-06-07 20:44:10,+0530,,"Opinion: Ohio Farmers, Republican values under attack by ill-conceived anti-solar energy bill  https://t.co/fmdIgerjQc",en,[],[],10685542,10685542,DispatchAlerts,Columbus Dispatch,1,20,https://twitter.com/DispatchAlerts/status/1401920426612297728,['https://www.dispatch.com/story/opinion/columns/guest/2021/06/07/mike-pullins-ohio-farmers-republican-values-under-attack-ill-conceived-anti-solar-energy-bill/7584013002/?utm_campaign=snd-autopilot'],[],0,,False,17,8,4,,farmers' bill,,,,,,,[],,,,
2,1401796556991254532,1401796556991254532,1623049317000.0,2021-06-07 12:31:57,+0530,,"Demonetisation and GST destroyed small and middle-size businesses in the country. They started an attack on the farmers by bringing three new Bills. They're trying to snatch the farmers’ rights. In the entire country, they'd spread unemployment.  #NoVaccineNoVacancy",en,['novaccinenovacancy'],[],4156671613,4156671613,IYCOdisha,Odisha Youth Congress,1,12,https://twitter.com/IYCOdisha/status/1401796556991254532,[],[],0,,False,1,0,0,,farmers' bill,,,,,,,[],,,,
3,1401779294657933322,1401779294657933322,1623045202000.0,2021-06-07 11:23:22,+0530,,"Demonetisation and GST destroyed small and middle-size businesses in the country. They started an attack on the farmers by bringing three new Bills. They're trying to snatch the farmers’ rights. In the entire country, they'd spread unemployment.  #NoVaccineNoVacancy",en,['novaccinenovacancy'],[],3286501752,3286501752,DelhiPYC,Delhi Youth Congress,1,11,https://twitter.com/DelhiPYC/status/1401779294657933322,[],[],0,,False,28,1,20,,farmers' bill,,,,,,,[],,,,
4,1401778676711133184,1401778676711133184,1623045054000.0,2021-06-07 11:20:54,+0530,,"Demonetisation and GST destroyed small and middle-size businesses in the country. They started an attack on the farmers by bringing three new Bills. They're trying to snatch the farmers’ rights. In the entire country, they'd spread unemployment.  #NoVaccineNoVacancy",en,['novaccinenovacancy'],[],4527641172,4527641172,IYC_Mumbai,Mumbai Youth Congress,1,11,https://twitter.com/IYC_Mumbai/status/1401778676711133184,[],[],0,,False,0,0,1,,farmers' bill,,,,,,,[],,,,
