,id,date,tweet,hashtags,user_id,username,name,link,urls,nlikes,nretweets,nreplies
6,1348170965272784896,2021-01-10 13:03:00,"किसान का और कितना दमन करेंगी बीजेपी व जेजेपी सरकार?? इतनी ठंड में क्यों जुल्म कर रही है हरियाणा सरकार? #किसान_के_लिए_बोले_भारत #किसान_आंदोलन  CM मनोहरलाल खट्टर की महापंचायत से पहले पुलिस और किसानों में भिड़ंत : पानी की बौछार, आंसू गैस के गोले दागे - NDTV  https://t.co/nO28pSXa8M","['किसान_के_लिए_बोले_भारत', 'किसान_आंदोलन']",2225467292,Aftabnuh,Ch Aftab Ahmed MLA,https://twitter.com/Aftabnuh/status/1348170965272784896,['https://khabar.ndtv.com/news/india/haryana-police-uses-water-cannon-and-tear-gases-on-agitating-farmers-in-karnal-ahead-cm-manohar-lal-khattar-rally-2350304/amp/1'],31,12,0
7,1348155007317594112,2021-01-10 11:59:35,मौजूदा #किसान_आंदोलन के दौरान कई #किसान अपनी जान गवां चुके हैं. अब इस तस्वीर के जरिए दावा किया जा रहा है कि दो दिन पहले आंदोलन में एक और #किसान का निधन हो गया है. @aajtak #AFWACheck @arjundeodia   https://t.co/0hmBeX52SV,"['किसान_आंदोलन', 'किसान', 'किसान', 'afwacheck']",1338488200638070784,AFWACheck,India Today Fact Check,https://twitter.com/AFWACheck/status/1348155007317594112,['https://bit.ly/3i0J4qB'],7,3,1
8,1348140444715245568,2021-01-10 11:01:43,#FarmersProtests गुजरात मे हो रहा है  गोदी मीडिया चुप है #Kevadia_FarmersProtests पर छतीसगढ़ के #किसान_आंदोलन पर चुप थे वैसे चुप है @RahulGandhi @priyankagandhi   #StatueOfDisplacement के खिलाफ गुजरात मेभी बडा आंदोलन होगा @abhisar_sharma @asadowaisi @LangaMahesh @diljitdosanjh  https://t.co/VSKdPjDMKd,"['farmersprotests', 'kevadia_farmersprotests', 'किसान_आंदोलन', 'statueofdisplacement']",933622354277646336,Chhotu_Vasava,Chhotubhai Vasava,https://twitter.com/Chhotu_Vasava/status/1348140444715245568,[],304,86,2
9,1348125340678320129,2021-01-10 10:01:42,तुम ही भविष्य हो मेरे भारत विशाल के  इस देश को रखना मेरे बच्चों सम्भाल के!!  जब यह बच्चा जवान होगा तो वह आजीवन यह सोचकर गर्व महसूस करेगा कि उसने नरेंद्र मोदी नाम के तानाशाह के खिलाफ लड़ाई लड़ी थी।  #FarmersProtests #TractorMarchDelhi #किसान_आंदोलन  https://t.co/bO3t60sfYb,"['farmersprotests', 'tractormarchdelhi', 'किसान_आंदोलन']",961724137,pandey_amrish,Amrish Ranjan Pandey,https://twitter.com/pandey_amrish/status/1348125340678320129,[],160,92,16
10,1348100995650187264,2021-01-10 08:24:58,आंदोलनकारी किसान सुप्रीम कोर्ट जाने के क्यों खिलाफ हैं ?   #किसान #किसान_हमारा_अभिमान #किसान_एकता_जिंदाबाद #किसान_आंदोलन #KisanProtest #KisanAndolan #FarmersProtests #FarmersProtestHijacked   -  https://t.co/sfAUo4kNrK via,"['किसान', 'किसान_हमारा_अभिमान', 'किसान_एकता_जिंदाबाद', 'किसान_आंदोलन', 'kisanprotest', 'kisanandolan', 'farmersprotests', 'farmersprotesthijacked']",78259714,ashutosh83B,ashutosh,https://twitter.com/ashutosh83B/status/1348100995650187264,['https://www.satyahindi.com/opinion/farm-unions-says-farmers-protest-will-continue-not-to-go-to-court-115947.html'],273,50,142
0,1348318109304643594,2021-01-10 22:47:42,किसान ही देश है। #किसान_एकता_जिंदाबाद  https://t.co/qX14Ply4Mf,['किसान_एकता_जिंदाबाद'],795868506667515904,DrSanjayINC,Dr. Sanjay Choudhary,https://twitter.com/DrSanjayINC/status/1348318109304643594,[],46,6,3
1,1348285221104336896,2021-01-10 20:37:01,करनाल के कैमला गांव में मुख्यमंत्री  मनोहर लाल खट्टर #किसान_एकता_जिंदाबाद  की सभा का कड़ा विरोध और सभा में  तोड़फोड़ होना यह दर्शाता है कि वह  हरियाणा की जनता का विश्वास खो  चुके हैं उनको नैतिकता के आधार पर इस्तीफा देना चाहिए,['किसान_एकता_जिंदाबाद'],2883222984,CaptAjayYadav,Capt. Ajay Singh Yadav Chairman AICC OBC Congress,https://twitter.com/CaptAjayYadav/status/1348285221104336896,[],100,16,4
2,1348268349424242689,2021-01-10 19:29:58,"अभी तो बस ये झांकी हैं,पूरी पिक्चर बाक़ी हैं! #किसान_एकता_जिंदाबाद",['किसान_एकता_जिंदाबाद'],3935324117,Chiranjeev_INC,Chiranjeev Rao,https://twitter.com/Chiranjeev_INC/status/1348268349424242689,[],262,39,3
3,1348265700935278593,2021-01-10 19:19:27,महाराष्ट्र के किसानो ने दिल्ली कूच की किसान विरोधी तिनो क़ानूनों का विरोध दर्ज किया #किसान_एकता_जिंदाबाद #किसानों_का_दर्द_समझों ⁦@INCIndia⁩ ⁦@bb_thorat⁩ ⁦@NitinRaut_INC⁩ ⁦@NANA_PATOLE⁩ ⁦@AshokChavanINC⁩ ⁦@SATAVRAJEEV⁩ ⁦@AmitV_Deshmukh⁩  https://t.co/QfR8D7sNUq,"['किसान_एकता_जिंदाबाद', 'किसानों_का_दर्द_समझों']",2160197948,RamkishanO,Ramkishan Ojha,https://twitter.com/RamkishanO/status/1348265700935278593,[],21,0,0
0,1348304056733745153,2021-01-10 21:51:52,संयुक्त किसान मोर्चा ने की अपील- लोहड़ी का पर्व कृषि कानूनों की प्रतियां जलाकर मनाया जाए #FarmersProstests #FarmLaws2020 #Lohri  लाइव अपडेट:  https://t.co/i5YAKvTCc2  https://t.co/so8xUYopEe,"['farmersprostests', 'farmlaws2020', 'lohri']",42606652,aajtak,AajTak,https://twitter.com/aajtak/status/1348304056733745153,['https://bit.ly/3bDtoc3'],224,23,26
1,1348296370751377411,2021-01-10 21:21:19,किसान तीन खेती कानूनों को वापस लेने की मांग पर अड़े हैं लेकिन सरकार का स्टैंड क्लियर है #Video #FarmersProstests   https://t.co/LRryutcY7e,"['video', 'farmersprostests']",42606652,aajtak,AajTak,https://twitter.com/aajtak/status/1348296370751377411,['https://www.aajtak.in/tez/video/farmers-protest-supreme-court-to-hear-all-pleas-against-new-farm-laws-on-monday-1190177-2021-01-10'],103,5,33
2,1348275541644697610,2021-01-10 19:58:33,रव‍िशंकर नाम का क‍िसान साईकल पर 150 किलोमीटर लंबा सफर तय करके गाजीपुर बॉर्डर पहुंचा  #FarmersProstests #Video   https://t.co/ClTm5fPxen,"['farmersprostests', 'video']",42606652,aajtak,AajTak,https://twitter.com/aajtak/status/1348275541644697610,['https://www.aajtak.in/india/news/video/farmer-claims-warned-about-the-movement-in-letter-to-the-president-in-2006-ghazipur-border-rdsv-1190080-2021-01-10'],111,7,11
3,1348261416797573122,2021-01-10 19:02:25,On @News24 at 7 pm on #FarmersProstests,['farmersprostests'],321380775,gopalkagarwal,Gopal Krishna Agarwal,https://twitter.com/gopalkagarwal/status/1348261416797573122,[],65,9,10
4,1348230896944619522,2021-01-10 17:01:09,Farmer protests in India: Listening to the people is the duty of a democratic government Urgent need to reach out to all sections to find a meeting ground on issues like farm laws #FarmersProstests #farmersrprotest #India .@Nidhi  https://t.co/1hiddBKhpS,"['farmersprostests', 'farmersrprotest', 'india']",20578408,gulf_news,Gulf News,https://twitter.com/gulf_news/status/1348230896944619522,['https://gn24.ae/b120ae63dbdf000'],8,4,3
5,1348224270686691328,2021-01-10 16:34:49,Haryana CM Manohar Lal Khattar Cancels Farmers' Meet After Protesters Vandalise Venue  #FarmersProstests   https://t.co/lJsp5Z1Wdv,['farmersprostests'],39240673,ABPNews,ABP News,https://twitter.com/ABPNews/status/1348224270686691328,['https://news.abplive.com/news/india/ahead-of-ml-khattars-visit-to-karnal-cops-use-tear-gas-on-farmers-1434423'],58,13,8
6,1348201447339347968,2021-01-10 15:04:08,"Can SupremeCourt settle #FarmersProstests when Gov couldn’t? Legal justice can be poor answer for political problem. Like baby in Solomon’s justice, ruling to saw baby into 2 mayn’t reveal mother when PM Modi can’t accept law’s flawed nor farmers let livelihoods be jeopardised.",['farmersprostests'],1401726968,ambkcsingh,K. C. Singh,https://twitter.com/ambkcsingh/status/1348201447339347968,[],88,12,11
7,1348175194888630272,2021-01-10 13:19:49,40-year-old farmer dies by suicide at Singhu border amid protests #FarmersProstests   https://t.co/Mq6wFWs9OJ,['farmersprostests'],3181372676,NewsBytesApp,NewsBytes,https://twitter.com/NewsBytesApp/status/1348175194888630272,['https://www.newsbytesapp.com/news/india/40-year-old-farmer-dies-by-suicide-at-singhu-border/story'],3,0,1
8,1348165168945979396,2021-01-10 12:39:58,"1998 साली काँग्रेसच्या काळात शेतकरी आंदोलनावर गोळीबार केल्यामुळे मृत्यू पावलेल्या शेतकऱ्यांचा हा फोटो आहे, असा दावा केला जात आहे.   ❌ परंतु, हे खोटं आहे ❌  ✅ हा फोटो 2007 साली आंध्र पदेशमध्ये झालेल्या घटनेचा आहे. #FarmersProstests  वाचा सत्य-   https://t.co/tSX6Gl5Et9",['farmersprostests'],1156553922011512833,fcmarathi,Fact Crescendo Marathi,https://twitter.com/fcmarathi/status/1348165168945979396,['https://marathi.factcrescendo.com/2007-photo-of-mudigoda-killing-shared-as-occurred-in-1998-under-congress-government/'],0,0,0
9,1348153635910332416,2021-01-10 11:54:08,Farmer protests in India: Listening to the people is the duty of a democratic government Urgent need to reach out to all sections to find a meeting ground on issues like farm laws .@Nidhi #FarmersProstests #farmersrprotest #India   https://t.co/1hiddBKhpS,"['farmersprostests', 'farmersrprotest', 'india']",20578408,gulf_news,Gulf News,https://twitter.com/gulf_news/status/1348153635910332416,['https://gn24.ae/b120ae63dbdf000'],25,5,1
10,1348089362227974144,2021-01-10 07:38:44,भारत की भावी पीढ़ी.... 🇮🇳 🙏.  #SinghuBorder #Delhi #FarmLaws2020 #FarmersProstests,"['singhuborder', 'delhi', 'farmlaws2020', 'farmersprostests']",109930762,LambaAlka,Alka Lamba,https://twitter.com/LambaAlka/status/1348089362227974144,[],715,181,8
