,id,conversation_id,created_at,date,timezone,place,tweet,language,hashtags,cashtags,user_id,user_id_str,username,name,day,hour,link,urls,photos,video,thumbnail,retweet,nlikes,nreplies,nretweets,quote_url,search,near,geo,source,user_rt_id,user_rt,retweet_id,reply_to,retweet_date,translate,trans_src,trans_dest
0,1454485699919441924,1454485699919441924,1635611388000.0,2021-10-30 21:59:48,+0530,,दीवाली से पहले पंजाब सरकार देगी गुलाबी सुंडी से नरमे की फसल खराब होने का मुआवजा  https://t.co/RxmgGk5OZD  #PunjabGoverment #Compensation #Farmers #Cottondamage #पंजाबसरकार #मुआवजा #किसान #फसल  https://t.co/8ugsHSuzNO,hi,"['punjabgoverment', 'compensation', 'farmers', 'cottondamage', 'पंजाबसरकार', 'मुआवजा', 'किसान', 'फसल']",[],80304808,80304808,punjabkesari,Punjab Kesari,6,21,https://twitter.com/punjabkesari/status/1454485699919441924,['https://m.punjabkesari.in/punjab/news/punjab-government-will-give-compensation-for-farmers-1482996?utm_source=twitterbot&utm_medium=social'],['https://pbs.twimg.com/media/FC9fCXaVcAEaPLD.jpg'],1,https://pbs.twimg.com/media/FC9fCXaVcAEaPLD.jpg,False,2,0,0,,#किसान,,,,,,,[],,,,
1,1454427972312518659,1454427972312518659,1635597625000.0,2021-10-30 18:10:25,+0530,,"#किसान नेता #तजिन्दर_सिंह_विर्क जी के साथ आज रुद्रपुर में मुलाकत की। उनके आवास पर जाकर उनका #हालचाल जाना और विभिन्न मुद्दों पर विचारों का आदान-प्रदान हुआ। किसान हमारे अपने हैं, हमारे अन्नदाता हैं और हम सदा उनके #संघर्ष में साथ हैं!  https://t.co/VQGUj3dI12",hi,"['किसान', 'तजिन्दर_सिंह_विर्क', 'हालचाल', 'संघर्ष']",[],1549940832,1549940832,sumitterbhullar,Sumittar Bhullar,6,18,https://twitter.com/sumitterbhullar/status/1454427972312518659,[],"['https://pbs.twimg.com/media/FC8qhqwUcAAubgD.jpg', 'https://pbs.twimg.com/media/FC8qhquVIAcfn_L.jpg', 'https://pbs.twimg.com/media/FC8qhqsVgAomRVt.jpg', 'https://pbs.twimg.com/media/FC8qhqrUUAMT8gL.jpg']",1,https://pbs.twimg.com/media/FC8qhqwUcAAubgD.jpg,False,21,0,12,,#किसान,,,,,,,[],,,,
2,1454415656418488324,1454415656418488324,1635594688000.0,2021-10-30 17:21:28,+0530,,"देखिए ""नए #भारत का नया #किसान"" आज रात 8 बजे!  प्रमुख वैज्ञानिक सलाहकार  @PrinSciAdvGoI के कार्यालय के सहयोग से देश के किसानो को टेक्नालजी से जोड़ती हुई इफको @IFFCO_PR और डीडी किसान @DDKisanChannel की नई पेशकश   @PMOIndia @AgriGoI @prasarbharati @icarindia @PIBHindi @sapnapoti  https://t.co/XdVv3AgIe1",hi,"['भारत', 'किसान']",[],1079611813782679552,1079611813782679552,PrinSciAdvOff,"Science, Technology and Innovation in India",6,17,https://twitter.com/PrinSciAdvOff/status/1454415656418488324,[],[],1,https://pbs.twimg.com/ext_tw_video_thumb/1454415438281154572/pu/img/aaxjKZk-eOaU69eo.jpg,False,21,4,7,,#किसान,,,,,,,[],,,,
3,1454302890227474438,1454302890227474438,1635567803000.0,2021-10-30 09:53:23,+0530,,"जो हक़ के लिए नही लड़ते - वो मुर्दा कहलाते है,  जो ज़मीर से समझौता नही करते - वो #किसान कहलाते है।  #FarmersProtest",hi,"['किसान', 'farmersprotest']",[],2536934545,2536934545,JitendraBaghel_,Jitendra Baghel जितेन्द्र बघेल,6,09,https://twitter.com/JitendraBaghel_/status/1454302890227474438,[],[],0,,False,75,4,14,,#किसान,,,,,,,[],,,,
4,1454280272841568256,1454280272841568256,1635562410000.0,2021-10-30 08:23:30,+0530,,आखिर सरकार को नफरत  और तानाशाही को दिवार गिरानी पड़ी।  उम्मीद है कि अब वह जल्द तीनो काले कानून वापिस लेगी ताकि #किसान खानाबदोशों जैसे जीवन को छोड़ कर अपने घर लौट सकें।  #किसान_एकता_जिंदाबाद  https://t.co/WGTWt1UiLS,hi,"['किसान', 'किसान_एकता_जिंदाबाद']",[],3307100833,3307100833,devendrayadvinc,Devender Yadav,6,08,https://twitter.com/devendrayadvinc/status/1454280272841568256,[],[],1,https://pbs.twimg.com/ext_tw_video_thumb/1454280230739218435/pu/img/zNjTVduOcbOdDy_y.jpg,False,230,5,69,,#किसान,,,,,,,[],,,,
