,id,date,tweet,hashtags,user_id,username,name,link,urls,nlikes,nretweets,nreplies
0,1432837517850599424,2021-09-01 04:17:39,"It was great to stop by the AFL-CIO booth and visit with President Bill McCarthy at the Fair. In Minnesota, we are the Democratic–Farmer–LABOR party!  https://t.co/4SdkPoozrx",[],33537967,amyklobuchar,Amy Klobuchar,https://twitter.com/amyklobuchar/status/1432837517850599424,[],782,72,51
1,1432775601212043276,2021-09-01 00:11:37,"Proud to support the bipartisan Next Generation Fuels Act. Biofuels, particularly ethanol, continue to be a vital market for our corn farmers. This bill will build off the success of the RFS to provide cleaner more efficient energy solutions &amp; support ag.  https://t.co/zSxBs0XPhA",[],3686482216,RepLaHood,Darin LaHood,https://twitter.com/RepLaHood/status/1432775601212043276,['https://lahood.house.gov/news?id=5F006040-0E06-4888-9E70-3D6E5BDBCB96&fbclid=IwAR2ziLvvFNG1pvN0gV1_oaD7EP--Jd3Sw1rfebS3redBH5Aj44-PWVlh6xI'],5,4,6
2,1432775287293595648,2021-09-01 00:10:22,#Herders-Farmers Clash: Governor Signs Anti-Grazing Bill Into Law In Southwest Nigeria  https://t.co/nAjMM4KAjv  https://t.co/XLr2z69MSE,['herders'],2931751387,HumAngle_,HumAngle_,https://twitter.com/HumAngle_/status/1432775287293595648,['https://humanglemedia.com/herders-farmers-clash-governor-signs-anti-grazing-bill-into-law-in-southwest-nigeria/'],5,3,0
3,1432752484448149509,2021-08-31 22:39:46,"True story: Bill Farmer once recorded my voicemail outgoing message as Goofy, and it was the greatest; but I had to change it once I was job hunting and a potential employer was highly confused.",[],121795745,TexasTribAbby,Abby Livingston,https://twitter.com/TexasTribAbby/status/1432752484448149509,[],14,0,2
4,1432751788541677573,2021-08-31 22:37:00,"Bill Farmer, the voice behind Goofy, says he has the best of both worlds. He gets anonymity when going to the grocery store and can also watch people's faces ""light up"" in recognition when he does his impression of the ""Mickey Mouse Funhouse"" character.  https://t.co/K2M2ST67d6",[],833612154,APEntertainment,AP Entertainment,https://twitter.com/APEntertainment/status/1432751788541677573,[],19,3,0
5,1432742476977098758,2021-08-31 22:00:00,A lathi charge by Haryana police on alleged farmers protesting violently against the Farm Bills in Karnal has triggered a war of words between the Punjab CM Amarinder Singh and Haryana CM ML Khattar  https://t.co/c4r65EhWCp,[],74980737,OpIndia_com,OpIndia.com,https://twitter.com/OpIndia_com/status/1432742476977098758,['https://www.opindia.com/2021/08/haryana-cm-ml-khattar-hits-back-at-amarinder-singh-farmer-protests/'],181,20,5
6,1432738702095052802,2021-08-31 21:45:00,"Today is the last day to tell us your thoughts on Bill No. 35. An Act to Amend the Lands Protection Act! The SC on Natural Resources and Environmental Sustainability wants to hear from farmers, landowners, and the public. Info on how to submit your views:  https://t.co/TuBABfegAz",[],213668848,peileg,PEI Legislature,https://twitter.com/peileg/status/1432738702095052802,['http://www.assembly.pe.ca/consultation-on-changes-to-the-lands-protection-act-bill-no-35'],1,0,0
0,1432818037082689546,2021-09-01 03:00:15,The absence of a coherent national policy on energy generation and climate change has been lambasted by the farm organisations.  https://t.co/s6WAdMxEa2,[],133241378,farmersjournal,Irish Farmers Journal,https://twitter.com/farmersjournal/status/1432818037082689546,['https://www.farmersjournal.ie/farm-organisations-slam-esb-moneypoint-move-644141'],0,0,0
1,1432811057316253699,2021-09-01 02:32:31,"A most informative discussion today with Lake District hill farmer Robin Taylforth &amp; @NECumbria team on grazing, conservation &amp; farm policy, common land, food production, livelihoods &amp; landscapes. Main take away - people need to speak with each other, &amp; listen to different views.  https://t.co/mldAJZ9CPT",[],78600745,TonyJuniper,Tony Juniper,https://twitter.com/TonyJuniper/status/1432811057316253699,[],56,11,6
2,1432719942634332163,2021-08-31 20:30:27,"#Myanmar has seen rapid agricultural mechanization since 2011. 🚜  Thanks to machine outsourcing services, small farms have not been left behind, explain @IFPRI's Xiaobo Zhang, @matfilipski, &amp; colleagues in their @_Food_Policy paper:  https://t.co/dIwDUcE3Sz  @PIM_CGIAR @USAID  https://t.co/g7JgaITyP0",['myanmar'],37926315,IFPRI,IFPRI,https://twitter.com/IFPRI/status/1432719942634332163,['https://doi.org/10.1016/j.foodpol.2021.102095'],12,5,0
3,1432709277270126605,2021-08-31 19:48:04,Join me at Farm Country Update  - American Ag Policy: A Conversation with the Secretary of Agriculture #TomVilsack! Find out more at  https://t.co/EGP8VraMWJ  @thepacker @FarmJournal @USDA #agriculture #farming,"['tomvilsack', 'agriculture', 'farming']",557073676,AmySowder,Amy Sowder,https://twitter.com/AmySowder/status/1432709277270126605,['https://farmjournal.swoogo.com/TownHallwithVilsack'],0,0,0
4,1432618720665509896,2021-08-31 13:48:14,Do you want to better understand the policy changes that will affect the future of your farm business? We are coordinating the #FarmForTheFuture programme across the UK. Find out more:  https://t.co/QPLVEM9il3  https://t.co/PvCWdxhQle,['farmforthefuture'],374498138,countrysidefund,The Prince's Countryside Fund,https://twitter.com/countrysidefund/status/1432618720665509896,['http://www.princescountrysidefund.org.uk/farmforthefuture'],7,5,0
0,1432851903449378818,2021-09-01 05:14:49,"Strengthened cooperation of #Pakistan &amp; #USA will benefit bilateral trade &amp; culture exchange, A bill was also moved to declare California the sister state of Punjab &amp; MOU was signed between agriculture univ of FSD &amp; univ of California Univ. #GovernorPunjab  https://t.co/GjvyL2LXWm","['pakistan', 'usa', 'governorpunjab']",2573296339,TeamSarwar,Team Sarwar,https://twitter.com/TeamSarwar/status/1432851903449378818,['https://tribune.com.pk/story/2317834/1'],14,10,0
0,1432757620398514187,2021-08-31 23:00:10,The idea that Canada's protectionist policies benefit mom-and-pop farms is mostly propaganda. #TheWalrusArchive #Agriculture  https://t.co/X3ZT8B2zqu,"['thewalrusarchive', 'agriculture']",15949042,thewalrus,The Walrus,https://twitter.com/thewalrus/status/1432757620398514187,['https://thewalrus.ca/youre-paying-too-much-for-milk/'],4,3,1
1,1432586581177552898,2021-08-31 11:40:31,"It’s no longer about just farm laws, as farmers vow to protest the Modi government’s broader economic policies!  https://t.co/FfNNUBQMeU",[],58200384,ziahaq,Zia Haq,https://twitter.com/ziahaq/status/1432586581177552898,[],4,2,1
0,1432825525098061824,2021-09-01 03:30:00,ML Khattar slams Congress. Listen in what the Haryana CM said. (@ashokasinghal2) #FarmersProtest #ITVideo #RE  https://t.co/pLSdnmuNHL,"['farmersprotest', 'itvideo', 're']",19897138,IndiaToday,IndiaToday,https://twitter.com/IndiaToday/status/1432825525098061824,[],8,1,0
1,1432803931520790530,2021-09-01 02:04:12,"एसडीएम आयुष सिन्हा पर मामला दर्ज करके सस्पेंड करने की मांग, डीसी को सौंपा ज्ञापन  https://t.co/D3AOvoon4v  #Haryanahindinews #JindHindinews #FarmersProtest #  https://t.co/Byca6XG1o1","['haryanahindinews', 'jindhindinews', 'farmersprotest']",80304808,punjabkesari,Punjab Kesari,https://twitter.com/punjabkesari/status/1432803931520790530,['https://m.haryana.punjabkesari.in/haryana/news/demand-to-suspend-sdm-ayush-sinha-by-registering-a-case-1448106?utm_source=twitterbot&utm_medium=social'],4,2,0
2,1432769631685513220,2021-08-31 23:47:54, https://t.co/G0wQYeBJiq ಇದು ಸೋಶಿಯಲ್ ಮೀಡಿಯಾ ಯುಗವಾಗಿರುವುದರಿಂದ ಜನರು ಸತ್ಯವೆಂದು ನಂಬಿ ಫೋಟೋಗಳನ್ನು ಶೇರ್ ಮಾಡುತ್ತಿರುತ್ತಾರೆ. ಈ ರೀತಿ ಮಾಡುವುದು ಖಂಡಿತವಾಗಿಯೂ ಅಪರಾಧವಾಗುತ್ತದೆ. #FarmersProtest #TrustNews18Kannada,"['farmersprotest', 'trustnews18kannada']",761154442628444160,News18Kannada,News18 Kannada,https://twitter.com/News18Kannada/status/1432769631685513220,['https://kannada.news18.com/news/national-international/fact-check-image-of-police-washing-blood-stained-street-is-not-linked-to-farmers-protest-in-karnal-stg-sktv-618311.html'],2,0,0
3,1432743019644526592,2021-08-31 22:02:09,जय किसान 🙏🏻  पीली मंदोरी (फतेहाबाद) में आज गाँव में चल रहे किसान धरने के 7 महीने पूरे होने पर आयोजित किसान सम्मेलन में हिस्सा लिया।   सम्मान के लिए सभी आदरणीय साथियों का दिल से आभार व धन्यवाद  #FarmersProtest  https://t.co/14msl57cEu,['farmersprotest'],1873814394,VineetPunia,Dr Vineet Punia / विनीत पुनिया,https://twitter.com/VineetPunia/status/1432743019644526592,[],71,14,1
4,1432741480544694272,2021-08-31 21:56:02,किसान आंदोलन पर बोले दुष्यंत चौटाला- कोई हमला करेगा तो आप माला पहनाकर उसका स्वागत नहीं करेंगे @Dchautala @dcmohry @DiprHaryana  https://t.co/J9YFUOljWD #haryana #haryanapolice #farmersprotest #हरियाणा,"['haryana', 'haryanapolice', 'farmersprotest', 'हरियाणा']",18186549,oneindiaHindi,Oneindia Hindi,https://twitter.com/oneindiaHindi/status/1432741480544694272,['https://hindi.oneindia.com/news/haryana/haryana-deputy-chief-minister-dushyant-chautala-talk-on-farmers-police-clash-636604.html'],4,0,0
5,1432737995161931789,2021-08-31 21:42:11,"#Haryana #CM #ManoharLalKhattar &amp; Captain #AmarinderSingh criticized each other over #farmersprotest. Punjab CM demanded Haryana CM's resignation and in reply, Haryana CM said, ""Who is he to demand my resignation instead, he should resign, he is behind farmer's agitation.""  https://t.co/EHuOiR6d7o","['haryana', 'cm', 'manoharlalkhattar', 'amarindersingh', 'farmersprotest']",854614125003014144,themojostory,Mojo Story,https://twitter.com/themojostory/status/1432737995161931789,[],2,0,1
6,1432736151996014599,2021-08-31 21:34:52,"From being an heir to 'Jannayak' Devi Lal, #DushyantChautala is now  'Khalnayak' for farmers. As JJP's fortunes fall, rivals like @DeependerSHooda &amp; Abhay Chautala are gaining in strength by supporting #FarmersProtest   https://t.co/BeKwBHm8a1","['dushyantchautala', 'farmersprotest']",610795031,AdityaMenon22,Aditya Menon,https://twitter.com/AdityaMenon22/status/1432736151996014599,['https://www.thequint.com/news/politics/dushyant-chautala-farmers-protest-jjp-inld-deepender-hooda-karnal-khattar-haryana'],103,28,4
7,1432724696148107268,2021-08-31 20:49:20,"@INCIndia delegation comprising #Haryana incharge @VivekBansal72, @INCHaryana President @kumari_selja, MP @DeependerSHooda, @officekiran @CaptAjayYadav AICC Secretaries @virenderrathor @ashishdua_INC met NHRC to demand cognisance of brutal, inhuman suppression of #FarmersProtest  https://t.co/2uwdGy3knQ","['haryana', 'farmersprotest']",386014627,ashishdua_INC,Ashish Dua,https://twitter.com/ashishdua_INC/status/1432724696148107268,[],7,2,1
8,1432724520427659266,2021-08-31 20:48:39,सभी किसान बागवान भाइयों से अनुरोध है कि इस धरना प्रदर्शन में अवश्य भाग लें तथा अपनी आवाज बुलंद करें। किसान एकता जिंदाबाद और कांग्रेस पार्टी जिंदाबाद ।। #Himachal #FarmersProtest #FarmerProtest  https://t.co/fWY3Qu0FCZ,"['himachal', 'farmersprotest', 'farmerprotest']",838355234581798912,Shimlacongress,Shimla Congress,https://twitter.com/Shimlacongress/status/1432724520427659266,[],29,14,1
9,1432722294724386817,2021-08-31 20:39:48,"If your govt has done so much for farmers as you claim @mlkhattar then why're your own farmers angry with you &amp; your @BJP4India? You failed to convince people that Punjab &amp; its farmers were responsible for #FarmersProtest, so are now resorting to lies &amp; false claims. 3/10",['farmersprotest'],263090427,capt_amarinder,Capt.Amarinder Singh,https://twitter.com/capt_amarinder/status/1432722294724386817,[],233,73,5
10,1432717245994647561,2021-08-31 20:19:44,"Original Reporting | Honouring The Farmers' Protest Shaheeds, from @amaanbali   ""Their families have only firmed up their resolve to continue the fight, rather than grieve, till the laws are withdrawn.""  #FarmersProtest   https://t.co/EqrcPHtZHK",['farmersprotest'],1347153799690006529,BaazNewsOrg,Baaz,https://twitter.com/BaazNewsOrg/status/1432717245994647561,['https://www.baaznews.org/p/honour-farmers-protest-shaheeds'],89,35,1
11,1432709309436153876,2021-08-31 19:48:12,करनाल लाठीचार्ज मामले को लेकर क्या बोले हरियाणा कांग्रेस प्रभारी विवेक बंसल  #Haryana #Karnal #FarmersProtest #Lathicharge  https://t.co/2KOhD3tLdd,"['haryana', 'karnal', 'farmersprotest', 'lathicharge']",2529715724,ZeePunjabHH,Zee PHH,https://twitter.com/ZeePunjabHH/status/1432709309436153876,[],1,1,1
12,1432707860425854977,2021-08-31 19:42:27,करनाल में किसानों पर हुए लाठीचार्ज को लेकर संयुक्त किसान मोर्चा ने मांगा सीएम मनोहर लाल खट्टर का इस्तीफा  https://t.co/EqaP33FuWL #किसानआंदोलन #farmersprotest #punjab #chandigarh #हरियाणा #haryana #चंडीगढ़ #haryanapolice #हरियाणापुलिस #manoharlalkhattar #मनोहरलालखट्टर,"['किसानआंदोलन', 'farmersprotest', 'punjab', 'chandigarh', 'हरियाणा', 'haryana', 'चंडीगढ़', 'haryanapolice', 'हरियाणापुलिस', 'manoharlalkhattar', 'मनोहरलालखट्टर']",18186549,oneindiaHindi,Oneindia Hindi,https://twitter.com/oneindiaHindi/status/1432707860425854977,['https://hindi.oneindia.com/news/chandigarh/samyukt-kisan-morcha-seeks-haryana-cm-s-resignation-over-lathi-charge-on-farmers-in-karnal-636582.html'],2,1,0
13,1432705817069957135,2021-08-31 19:34:19,@centerofright @_YogendraYadav @themojostory @BDUTT That's what I said in the programme too. Karnal kind of incidents are attempts to keep the issue alive in media. #FarmersProtest #KarnalLathiCharge,"['farmersprotest', 'karnallathicharge']",47083884,SandipGhose,GhoseSpot,https://twitter.com/SandipGhose/status/1432705817069957135,[],4,1,0
14,1432703506234986497,2021-08-31 19:25:08,"Never thought I’d agree on so many points with @_YogendraYadav. But, he did take exception to my saying the #FarmersProtest losing steam and asked me to watch out for September 5th rally in #Muzaffarnagar. On @themojostory with @BDUTT  https://t.co/GzNWm55wGm #KarnalLathiCharge","['farmersprotest', 'muzaffarnagar', 'karnallathicharge']",47083884,SandipGhose,GhoseSpot,https://twitter.com/SandipGhose/status/1432703506234986497,['https://youtu.be/WUX3u_pYCmI'],8,2,4
15,1432703471002734602,2021-08-31 19:25:00,ਫਾਜ਼ਿਲਕਾ : ਕਿਸਾਨਾਂ ਨੇ ਭਾਜਪਾ ਦੇ ਸਾਬਕਾ ਸਿਹਤ ਮੰਤਰੀ ਸੁਰਜੀਤ ਕੁਮਾਰ ਜਿਆਣੀ ਦਾ ਕੀਤਾ ਘਿਰਾਓ   https://t.co/eernENUAP4  #Fazilka  #Farmersprotest  #BJPleader  #SurjitKumarJayani  #MandiLadhuka,"['fazilka', 'farmersprotest', 'bjpleader', 'surjitkumarjayani', 'mandiladhuka']",852553470,ptcnews,ਪੀਟੀਸੀ ਨਿਊਜ਼ | PTC News,https://twitter.com/ptcnews/status/1432703471002734602,['https://wp.ptcnews.tv/fazilka-farmers-protest-against-bjp-leader-surjit-kumar-jayani-in-mandi-ladhuka/'],2,0,0
16,1432701363226615813,2021-08-31 19:16:37,বুম দেখে হরিয়ানার ওই গোরক্ষক গরুপাচারের সময় এক গাড়িকে বাধা দিতে গেলে আহত হয়। #FakeNews #BOOMFactCheck #FarmersProtest #Haryana   https://t.co/JLLTgZE7wB,"['fakenews', 'boomfactcheck', 'farmersprotest', 'haryana']",1087229589376532481,BOOMLiveBangla,BOOMBangla,https://twitter.com/BOOMLiveBangla/status/1432701363226615813,['https://bangla.boomlive.in/fact-check/photo-of-injured-injured-man-stitches-viral-farmers-protest-lathi-charge-haryana-imran-pratapgarhi-fake-news-14515'],2,2,0
17,1432694245719089154,2021-08-31 18:48:21,आज जनपद शामली गांव भारसी में आयोजित किसान पंचायत का छाया चित्र आप के साथ साझा कर रहा हूं । #FarmersProtest #5septemberkisanpanchayatmuzaffarnagar  https://t.co/25dZUmyhLT,"['farmersprotest', '5septemberkisanpanchayatmuzaffarnagar']",1357417203084062720,NareshTikait,Naresh Tikait,https://twitter.com/NareshTikait/status/1432694245719089154,[],4080,632,55
18,1432674772593233930,2021-08-31 17:30:58,ਕਰਨਾਲ ਲਾਠੀਚਾਰਜ 'ਤੇ ਹਰਿਆਣਾ ਦੇ ਡਿਪਟੀ CM ਦੁਸ਼ਿਯੰਤ ਚੌਟਾਲਾ ਦਾ ਬਿਆਨ  #FarmersProtest #Haryana #KarnalLathiCharge  #FarmLaws #DushyantChautala    https://t.co/K1lHgkBq8Z,"['farmersprotest', 'haryana', 'karnallathicharge', 'farmlaws', 'dushyantchautala']",852553470,ptcnews,ਪੀਟੀਸੀ ਨਿਊਜ਼ | PTC News,https://twitter.com/ptcnews/status/1432674772593233930,['https://youtu.be/hliuckNitfM'],1,1,0
19,1432674119670190082,2021-08-31 17:28:22,"The @INCIndia  leader said that while #manipur  is getting twice the supply it needs, the farmers of the state have been complaining of a shortage @Jairam_Ramesh #Farmers #FarmersProtest #BJPExposedAgain   https://t.co/H81Bi2IOGr","['manipur', 'farmers', 'farmersprotest', 'bjpexposedagain']",929076201187975168,NENowNews,NorthEast Now,https://twitter.com/NENowNews/status/1432674119670190082,['https://nenow.in/north-east-news/manipur/manipur-ex-union-minister-jairam-ramesh-accuses-bjp-govt-of-diverting-urea-supply-to-poppy-fields.html'],1,1,0
0,1432673671361937415,2021-08-31 17:26:35,ਪੰਜਾਬੀ ਅਦਾਕਾਰਾ ਸਿੰਮੀ ਚਾਹਲ ਨੇ ਆਪਣੀ ਚੁੰਨ੍ਹੀ 'ਤੇ ਦਿਖਾਈ 'ਕਿਸਾਨੀ ਅੰਦੋਲਨ' ਦੀ ਪਿਆਰੀ ਝਲਕ #SimiChahal #iStandWithFarmers🙏🏼 #FarmersProtest #KisanMajdoorEktaZindabad 💪🏼 #TakeBackFarmerLaws  https://t.co/neQEyJIcos,"['simichahal', 'istandwithfarmers', 'farmersprotest', 'kisanmajdoorektazindabad', 'takebackfarmerlaws']",222394250,JagbaniOnline,Jagbani,https://twitter.com/JagbaniOnline/status/1432673671361937415,[],95,8,3
0,1432654467258675201,2021-08-31 16:10:17,"वाह, क्या रंगबाज़ देशभक्त है और क्या मासूम @DelhiPolice है.  #किसान खालिस्तानी है, #CAA_NRC विरोधी पाकिस्तानी हैं.","['किसान', 'caa_nrc']",187862198,AmitMishra1207,Amit Mishra,https://twitter.com/AmitMishra1207/status/1432654467258675201,[],2,1,1
1,1432639268409659402,2021-08-31 15:09:53,"हरियाणा सरकार ने कहा- ‘मेरी फसल-मेरा ब्यौरा’ के लिए रजिस्ट्रेशन का आज आखिरी दिन, जल्दी करें किसान  https://t.co/yhEFIftpXj #haryanagovernment #farming #farmer #खेती #किसान #haryana #agriculture #agricultureminister","['haryanagovernment', 'farming', 'farmer', 'खेती', 'किसान', 'haryana', 'agriculture', 'agricultureminister']",18186549,oneindiaHindi,Oneindia Hindi,https://twitter.com/oneindiaHindi/status/1432639268409659402,['https://hindi.oneindia.com/news/haryana/haryana-government-said-today-is-the-last-day-of-registration-for-meri-fasal-mera-byora-636512.html'],5,0,0
