,id,conversation_id,created_at,date,timezone,place,tweet,language,hashtags,cashtags,user_id,user_id_str,username,name,day,hour,link,urls,photos,video,thumbnail,retweet,nlikes,nreplies,nretweets,quote_url,search,near,geo,source,user_rt_id,user_rt,retweet_id,reply_to,retweet_date,translate,trans_src,trans_dest
0,1375235297592573952,1375235297592573952,1616716620000.0,2021-03-26 05:27:00,+0530,,"आज भारत बंद : रेल-सड़क यातायात पर पड़ेगा असर, सब्जियों और दूध की आपूर्ति भी रोकी जाएगी  #BharathBandh #FarmersProtest #KisanAndolan #FarmBills  @nstomar @BJP4India @INCIndia   https://t.co/cFtHfAd14z",hi,"['bharathbandh', 'farmersprotest', 'kisanandolan', 'farmbills']",[],169018518,169018518,AmarUjalaNews,Amar Ujala,5,05,https://twitter.com/AmarUjalaNews/status/1375235297592573952,['https://www.amarujala.com/india-news/bharat-bandh-rail-road-transport-will-be-affected-markets-may-remain-closed'],[],0,,False,36,1,9,,farmers protest,,,,,,,[],,,,
1,1375228763399684100,1375228763399684100,1616715062000.0,2021-03-26 05:01:02,+0530,,இன்று முழு அடைப்பு; விவசாயிகள் அழைப்பு #FarmersProtest #BharatBandh #newfarmlaws   https://t.co/LcTstNHgag,ta,"['farmersprotest', 'bharatbandh', 'newfarmlaws']",[],14448642,14448642,dinamalarweb,Dinamalar,5,05,https://twitter.com/dinamalarweb/status/1375228763399684100,['https://www.dinamalar.com/news_detail.asp?id=2737273'],[],0,,False,5,3,1,,farmers protest,,,,,,,[],,,,
2,1375199024656027649,1375199024656027649,1616707972000.0,2021-03-26 03:02:52,+0530,,I'm proud my alderman @AldMattMartin voted to pass the #ChicagoIndiaResolution and grateful for @ChiAlderwoman’s steady and resolute leadership. #FarmersProtest   https://t.co/GgQOJdfNRQ,en,"['chicagoindiaresolution', 'farmersprotest']",[],278770101,278770101,Ameya_Pawar_IL,Ameya Pawar,5,03,https://twitter.com/Ameya_Pawar_IL/status/1375199024656027649,['https://www.google.com/amp/s/chicago.suntimes.com/platform/amp/columnists/2021/3/25/22350224/india-resolution-muslims-islam-islamophobia-trump-modi-chicago-city-council-steinberg'],[],0,,False,24,9,8,,farmers protest,,,,,,,[],,,,
3,1375193273527115778,1375193273527115778,1616706600000.0,2021-03-26 02:40:00,+0530,,بھارتی کسانوں نے کل ملک گیر ہڑتال کا اعلان کردیا  https://t.co/omzpnFWN7C #India #FarmersProtest,ur,"['india', 'farmersprotest']",[],373877736,373877736,Waqtnewstv,Waqt News,5,02,https://twitter.com/Waqtnewstv/status/1375193273527115778,['https://waqtnews.tv/26-Mar-2021/142245'],[],0,,False,19,0,0,,farmers protest,,,,,,,[],,,,
4,1375170053113409536,1375170053113409536,1616701064000.0,2021-03-26 01:07:44,+0530,,"शेतकऱ्यांचा आज भारत बंद; रस्ते, रेल्वे वाहतुकीला फटका बसण्याची शक्यता  https://t.co/bDAo5StO2w #FarmersProtest #BharatBandh",mr,"['farmersprotest', 'bharatbandh']",[],171880832,171880832,mataonline,Maharashtra Times,5,01,https://twitter.com/mataonline/status/1375170053113409536,['https://maharashtratimes.com/india-news/farmers-protest-bharat-bandh-today-traffic-likely-to-be-hit/articleshow/81695612.cms'],[],0,,False,50,0,4,,farmers protest,,,,,,,[],,,,
5,1375159631790497795,1375159628300910594,1616698580000.0,2021-03-26 00:26:20,+0530,,"And it isn't just female farmers who are affected—women who stayed behind to look after families and farms are contributing to the protests too, all in an effort to stand in solidarity and be heard. 3/",en,[],[],1344951,1344951,WIRED,WIRED,5,00,https://twitter.com/WIRED/status/1375159631790497795,[],[],0,,False,7,1,2,,farmers protest,,,,,,,[],,,,
6,1375159628300910594,1375159628300910594,1616698579000.0,2021-03-26 00:26:19,+0530,,"For three months, thousands of farmers have camped on the outskirts of New Delhi to protest new laws that would exploit the most vulnerable among them.   But the backbone of the protests have been thousands of women in bright yellow scarves.   #WomensHistoryMonth  1/  https://t.co/L2n7IAZR1x",en,['womenshistorymonth'],[],1344951,1344951,WIRED,WIRED,5,00,https://twitter.com/WIRED/status/1375159628300910594,[],['https://pbs.twimg.com/media/ExWL9MOUYAEy5-5.jpg'],1,https://pbs.twimg.com/media/ExWL9MOUYAEy5-5.jpg,False,63,10,32,,farmers protest,,,,,,,[],,,,
7,1375150237115805696,1375150237115805696,1616696340000.0,2021-03-25 23:49:00,+0530,,"सड़कों को जाम करेंगे किसान, ट्रेनें भी रोकेंगे, जानिए 'भारत बंद' में क्या-क्या रहेगा बंद, किन्हें मिलेगी छूट     https://t.co/GKcxDzjkCr via @NavbharatTimes  #FarmersProtest",hi,['farmersprotest'],[],123171317,123171317,NavbharatTimes,NBT Hindi News,4,23,https://twitter.com/NavbharatTimes/status/1375150237115805696,['http://nbt.in/ZC6ira53/omx'],[],0,,False,11,1,3,,farmers protest,,,,,,,[],,,,
8,1375149231028101120,1375149231028101120,1616696100000.0,2021-03-25 23:45:00,+0530,,"Ahead of the #BharatBandh called by protesting farmers on March 26, @DelhiPolice says adequate security arrangements have been made.   #FarmersProtest #FarmLaws   https://t.co/YVtNqn0400",en,"['bharatbandh', 'farmersprotest', 'farmlaws']",[],18071358,18071358,ZeeNewsEnglish,Zee News English,4,23,https://twitter.com/ZeeNewsEnglish/status/1375149231028101120,['https://zeenews.india.com/india/bharat-bandh-on-march-26-delhi-police-says-adequate-security-arrangements-in-place-2350507.html'],[],0,,False,27,2,4,,farmers protest,,,,,,,[],,,,
9,1375146603346993157,1375146603346993157,1616695473000.0,2021-03-25 23:34:33,+0530,,अजमेर सिंह बोले- बेटे को पता तक नहीं कि कौन सी फसल कब होती है.. #FarmersProtest    https://t.co/QIuU9SknVM,hi,['farmersprotest'],[],927426236137201664,927426236137201664,TNNavbharat,Times Now Navbharat,4,23,https://twitter.com/TNNavbharat/status/1375146603346993157,['https://www.timesnowhindi.com/india/article/retired-army-officer-in-himachal-pradesh-disinherits-son-for-his-participation-in-farmers-protests/340670'],[],0,,False,15,1,4,,farmers protest,,,,,,,[],,,,
10,1375144389912141826,1375144389912141826,1616694946000.0,2021-03-25 23:25:46,+0530,,"Bharat Bandh to be held from 6 am to 6 pm on March 26.   Farmers’ union leaders are hoping that all road &amp; rail transport, markets, and other public places will remain closed across the country.  #BharatBandh #FarmersProtest #SamyuktaKisanMorcha  https://t.co/YvSyN73kKR",en,"['bharatbandh', 'farmersprotest', 'samyuktakisanmorcha']",[],68927629,68927629,moneycontrolcom,Moneycontrol,4,23,https://twitter.com/moneycontrolcom/status/1375144389912141826,['https://www.moneycontrol.com/news/india/bharat-bandh-march-26-farmers-protest-farm-reform-laws-all-you-need-to-know-nationwide-strike-6692371.html'],[],0,,False,19,2,4,,farmers protest,,,,,,,[],,,,
11,1375137675112419333,1375137675112419333,1616693345000.0,2021-03-25 22:59:05,+0530,,The 'Bharat Bandh' will start at 6am and will remain in force till 6pm  on March 26 | #FarmersProtest #BharatBandh   https://t.co/gVo4fMVTMe,en,"['farmersprotest', 'bharatbandh']",[],19897138,19897138,IndiaToday,IndiaToday,4,22,https://twitter.com/IndiaToday/status/1375137675112419333,['https://www.indiatoday.in/india/story/bharat-bandh-farm-protest-agri-laws-rail-road-transport-markets-1783721-2021-03-25'],[],0,,False,70,3,18,,farmers protest,,,,,,,[],,,,
12,1375132178162483201,1375132178162483201,1616692034000.0,2021-03-25 22:37:14,+0530,,Farmer unions protesting against the three agri laws have called a complete 'Bharat Bandh' on March 26.  #FarmersProtest #FarmLaws #BharathBandh #Delhi  https://t.co/cSUvcbVPBN,en,"['farmersprotest', 'farmlaws', 'bharathbandh', 'delhi']",[],3991108098,3991108098,dt_next,DT Next,4,22,https://twitter.com/dt_next/status/1375132178162483201,['https://www.dtnext.in/News/National/2021/03/25221525/1283134/Bharat-Bandh-Rail-road-transport-likely-to-be-affected-.vpf'],[],0,,False,0,0,1,,farmers protest,,,,,,,[],,,,
13,1375131571557036032,1375131571557036032,1616691890000.0,2021-03-25 22:34:50,+0530,,"DNA: Top News of the Day | March 25, 2021  #CRPF #CRPFJawanMartyrd #FarmersProtest #BharatBandh #Petrol #diesel #PetrolDieselPrice #COVID19 #COVID #Holi #ShabeBarat #SBI #SecondWave    https://t.co/VZYrzAdYF3",en,"['crpf', 'crpfjawanmartyrd', 'farmersprotest', 'bharatbandh', 'petrol', 'diesel', 'petroldieselprice', 'covid19', 'covid', 'holi', 'shabebarat', 'sbi', 'secondwave']",[],17710740,17710740,dna,DNA,4,22,https://twitter.com/dna/status/1375131571557036032,['https://www.youtube.com/watch?v=Mghy-4u7cB4'],[],0,,False,5,0,0,,farmers protest,,,,,,,[],,,,
14,1375127685228163072,1375127685228163072,1616690963000.0,2021-03-25 22:19:23,+0530,,संयुक्त किसान मोर्चा ने भारत बंद की अपील के दौरान अपनी पांच मांगें रखी हैं #FarmersProtest    https://t.co/ObM8qWGBB6,hi,['farmersprotest'],[],3256464043,3256464043,QuintHindi,Quint Hindi,4,22,https://twitter.com/QuintHindi/status/1375127685228163072,['https://hindi.thequint.com/news/india/farmers-protest-5-demands-of-samyukta-kisan-morcha-before-bharat-bandh-details'],[],0,,False,35,1,12,,farmers protest,,,,,,,[],,,,
15,1375124784720314371,1375124784720314371,1616690271000.0,2021-03-25 22:07:51,+0530,,विवादित #FarmLaws के खिलाफ #FarmersProtest के चार महीने पूरे होने पर 26 मार्च को किसानों ने #BharatBandh का ऐलान किया है। इसे लेकर आज #SamyuktaKisanMorcha ने कहा कि शुक्रवार को 'पूर्ण भारत बंद' असरदार होगा और इससे आंदोलन को और ताकत मिलेगी।  https://t.co/G30VdLBsFo,hi,"['farmlaws', 'farmersprotest', 'bharatbandh', 'samyuktakisanmorcha']",[],884388810108182528,884388810108182528,navjivanindia,Navjivan,4,22,https://twitter.com/navjivanindia/status/1375124784720314371,['https://www.navjivanindia.com/news/tomorrows-bharat-bandh-will-be-effective-and-movement-will-get-new-force-says-samyukta-kisan-morcha'],[],0,,False,22,0,7,,farmers protest,,,,,,,[],,,,
16,1375121520389804033,1375121520389804033,1616689493000.0,2021-03-25 21:54:53,+0530,,"ਸੰਯੁਕਤ ਕਿਸਾਨ ਮੋਰਚੇ ਵੱਲੋਂ ਭਾਰਤ ਬੰਦ ਦਾ ਐਲਾਨ, ਜਾਣੋ ਕੀ ਕੀ ਰਹੇਗਾ ਬੰਦ  https://t.co/TVm30zAj3b #SamyuktaKisanMorcha #Indiashutdown #FarmersProtest  https://t.co/ooFA3UeR8C",pa,"['samyuktakisanmorcha', 'indiashutdown', 'farmersprotest']",[],222394250,222394250,JagbaniOnline,Jagbani,4,21,https://twitter.com/JagbaniOnline/status/1375121520389804033,['https://jagbani.punjabkesari.in/national/news/samyukta-kisan-morcha-calls-for-shutdown-of-india-1275750'],['https://pbs.twimg.com/media/ExVpud2VEAga0pg.jpg'],1,https://pbs.twimg.com/media/ExVpud2VEAga0pg.jpg,False,24,0,3,,farmers protest,,,,,,,[],,,,
17,1375121348817682438,1375121348817682438,1616689452000.0,2021-03-25 21:54:12,+0530,,कृषि कानूनों के विरोध में संयुक्त किसान मोर्चा द्वारा 26 मार्च को किए जा रहे भारत बंद में दिल्ली के व्यापारी किसानों के साथ नहीं दिखेंगे  #FarmersProtest @Pankajjainclick   https://t.co/R2WW3gmB3S,hi,['farmersprotest'],[],42606652,42606652,aajtak,AajTak,4,21,https://twitter.com/aajtak/status/1375121348817682438,['https://www.aajtak.in/india/delhi/story/merchants-will-not-support-sanyukt-kisan-morcha-bharat-bandh-markets-will-open-1228258-2021-03-25'],[],0,,False,218,17,18,,farmers protest,,,,,,,[],,,,
18,1375118915152437253,1375118915152437253,1616688872000.0,2021-03-25 21:44:32,+0530,,#Bandh #FarmersProtest  120 நாட்களை எட்டியது வேளாண் சட்டங்களுக்கு எதிரான விவசாயிகள் போராட்டம்; நாளை நாடு தழுவிய ‘பந்த்’.!!!  https://t.co/c8mvSpg1UC,ta,"['bandh', 'farmersprotest']",[],107337499,107337499,DinakaranNews,Dinakaran,4,21,https://twitter.com/DinakaranNews/status/1375118915152437253,['https://www.dinakaran.com/News_Detail.asp?Nid=666127'],[],0,,False,27,1,2,,farmers protest,,,,,,,[],,,,
19,1375115479900119048,1375115479900119048,1616688053000.0,2021-03-25 21:30:53,+0530,,"ਕਿਸਾਨਾਂ ਵੱਲੋਂ 26 ਮਾਰਚ ਯਾਨਿ ਕਿ ਕੱਲ੍ਹ ਨੂੰ ਭਾਰਤ ਬੰਦ ਦਾ ਸੱਦਾ ਦਿੱਤਾ ਗਿਆ ਹੈ, ਜਾਣੋ ਇਸ ਦੌਰਾਨ ਕੀ ਖੁੱਲ੍ਹਾ ਤੇ ਕੀ ਬੰਦ ਰਹੇਗਾ ਵੀਡੀਓ ਕ੍ਰੈਡਿਟ- ਸੰਯੁਕਤ ਕਿਸਾਨ ਮੋਰਚਾ  #Bharatbandh #Farmersprotest  https://t.co/KMDW7Iw5SM",pa,"['bharatbandh', 'farmersprotest']",[],826091183491387394,826091183491387394,bbcnewspunjabi,BBC News Punjabi,4,21,https://twitter.com/bbcnewspunjabi/status/1375115479900119048,[],[],1,https://pbs.twimg.com/amplify_video_thumb/1375115206939058177/img/6YRBDEIdLcpwNvAO.jpg,False,53,4,14,,farmers protest,,,,,,,[],,,,
20,1375113998354554883,1375113998354554883,1616687700000.0,2021-03-25 21:25:00,+0530,,"Bharat bandh on March 26: Rail, road transport to be affected #FarmersProtest #BharathBandh  https://t.co/wZzJS05ppz",en,"['farmersprotest', 'bharathbandh']",[],2227695199,2227695199,thenewsminute,TheNewsMinute,4,21,https://twitter.com/thenewsminute/status/1375113998354554883,['https://www.thenewsminute.com/article/bharat-bandh-march-26-rail-road-transport-be-affected-145955'],[],0,,False,2,0,2,,farmers protest,,,,,,,[],,,,
21,1375112066223144962,1375112066223144962,1616687239000.0,2021-03-25 21:17:19,+0530,,On the call of Sanyukta Kisan Morcha on 26 March BHARAT BANDH!  Repeal anti people three agriculture laws!  #RepealFarmLaws #FarmersProtest #FarmersMovement #Farmers #SFI  @Kisanektamorcha @KisanSabha @SFI_CEC  https://t.co/Bw4MjdBcgN,en,"['repealfarmlaws', 'farmersprotest', 'farmersmovement', 'farmers', 'sfi']",[],854354295461785600,854354295461785600,SfiDelhi,SFI Delhi,4,21,https://twitter.com/SfiDelhi/status/1375112066223144962,[],['https://pbs.twimg.com/media/ExVhIP6WEAQh53o.jpg'],1,https://pbs.twimg.com/media/ExVhIP6WEAQh53o.jpg,False,26,0,8,,farmers protest,,,,,,,[],,,,
22,1375108965311254529,1331218282427322370,1616686500000.0,2021-03-25 21:05:00,+0530,,"Questioning #KanganaRanaut as to who gave her the power to make allegations (comparing anti-#CAA &amp; #farmersprotest), Karnataka HC asked the trial court to take a fresh look &amp; pass orders regarding the complaint against the actor.  @XpressBengaluru   https://t.co/UapJBnafxJ",en,"['kanganaranaut', 'caa', 'farmersprotest']",[],94761188,94761188,NewIndianXpress,The New Indian Express,4,21,https://twitter.com/NewIndianXpress/status/1375108965311254529,['https://www.newindianexpress.com/states/karnataka/2021/mar/25/karnataka-hc-gives-relief-to-kangana-over-tweet-but-says-celebrities-must-show-restraint-2281522.html'],[],0,,False,11,1,5,,farmers protest,,,,,,,[],,,,
23,1375107748174704642,1375107748174704642,1616686210000.0,2021-03-25 21:00:10,+0530,,ਖੇਤੀ ਕਾਨੂੰਨਾਂ ਦਾ ਵਿਰੋਧ ਜਤਾ ਰਹੇ ਕਿਸਾਨਾਂ ਨੂੰ ਦਿੱਲੀ ਬਾਰਡਰਾਂ ਤੇ ਬੈਠੇ 4 ਮਹੀਨੇ ਹੋ ਗਏ ਹਨ ਤੇ ਹੁਣ ਉਨ੍ਹਾਂ ਨੇ 26 ਮਾਰਚ ਨੂੰ ਬੰਦ ਦਾ ਸੱਦਾ ਦਿੱਤਾ ਹੈ   https://t.co/0FiT7BsmUp #Bharatbandh #Farmersprotest,pa,"['bharatbandh', 'farmersprotest']",[],826091183491387394,826091183491387394,bbcnewspunjabi,BBC News Punjabi,4,21,https://twitter.com/bbcnewspunjabi/status/1375107748174704642,['https://bbc.in/3lRYXBC'],[],0,,False,43,1,6,,farmers protest,,,,,,,[],,,,
24,1375107018705436673,1375107018705436673,1616686036000.0,2021-03-25 20:57:16,+0530,,"The Samyukta Kisan Morcha (SKM)  said that all shops, malls, markets and commercial establishments will remain shut on Friday in view of its '#BharatBandh' call on completion of four months of farmers' protest at 3Delhi's borders against the Centre's three new #farmlaws.  https://t.co/qhH8P6UA3y",en,"['bharatbandh', 'farmlaws']",[],141584822,141584822,ians_india,IANS,4,20,https://twitter.com/ians_india/status/1375107018705436673,[],['https://pbs.twimg.com/media/ExVcfIWUUAIuYXV.jpg'],1,https://pbs.twimg.com/media/ExVcfIWUUAIuYXV.jpg,False,6,1,1,,farmers protest,,,,,,,[],,,,
25,1375106853458296837,1375106853458296837,1616685996000.0,2021-03-25 20:56:36,+0530,,"राकेश टिकैत बोले- सरकार कोरोना की आड़ में उन स्थानों पर प्रतिबंध लगा सकती है, जहां बड़ी संख्या में बैठे हैं किसान....  #FarmersProtest #FarmLaws #RakeshTikait  https://t.co/yIUuZ8qfwI",hi,"['farmersprotest', 'farmlaws', 'rakeshtikait']",[],108852592,108852592,Live_Hindustan,Hindustan,4,20,https://twitter.com/Live_Hindustan/status/1375106853458296837,['https://www.livehindustan.com/ncr/story-rakesh-tikait-said-govt-may-ban-places-where-farmers-are-sitting-in-large-number-of-under-the-cover-of-coronavirus-3936923.html'],[],0,,False,36,1,9,,farmers protest,,,,,,,[],,,,
26,1375106725473349639,1375106719987216391,1616685966000.0,2021-03-25 20:56:06,+0530,,That India was able to bully Twitter into clamping down on free speech *matters* because it brings into sharp focus how dangerous the Indian government's efforts to silence dissent have become. #FarmersProtest,en,['farmersprotest'],[],316671079,316671079,sikh_coalition,Sikh Coalition,4,20,https://twitter.com/sikh_coalition/status/1375106725473349639,[],[],0,,False,11,1,0,,farmers protest,,,,,,,[],,,,
27,1375106722512125954,1375106719987216391,1616685965000.0,2021-03-25 20:56:05,+0530,,"Since January, Twitter has also capitulated to the Indian government's demands to squash free speech by permanently suspending more than 500 accounts tweeting critically about the government's anti-democratic response to the #FarmersProtest.  https://t.co/PX1EFjhADA",en,['farmersprotest'],[],316671079,316671079,sikh_coalition,Sikh Coalition,4,20,https://twitter.com/sikh_coalition/status/1375106722512125954,['https://www.nytimes.com/2021/02/10/technology/india-twitter.html?referringSource=articleShare'],[],0,,False,6,1,1,,farmers protest,,,,,,,[],,,,
28,1375106471223037960,1375106471223037960,1616685905000.0,2021-03-25 20:55:05,+0530,,"The 6 AM to 6 PM shutdown is likely to affect transport services, both rail and road, and hamper the functioning of commercial establishments.  #BharatBandh #FarmersProtest   https://t.co/rDbgPzikXi",en,"['bharatbandh', 'farmersprotest']",[],268201193,268201193,DeccanHerald,Deccan Herald,4,20,https://twitter.com/DeccanHerald/status/1375106471223037960,['https://www.deccanherald.com/national/national-politics/farmers-plan-another-historic-bharat-bandh-farmers-govt-deadlock-persists-amid-polls-966454.html'],[],0,,False,1,1,1,,farmers protest,,,,,,,[],,,,
29,1375104745086484480,1375104745086484480,1616685494000.0,2021-03-25 20:48:14,+0530,,"राज्यसभा में हाथ जोड़कर बोले @DeependerSHooda- शहीद किसानों की अनदेखी बंद करें, परिजनों को आर्थिक पैकेज दें  #KisanAndolan #FarmersProtest #RajyaSabha #Congress #BharatBandh @INCHaryana   https://t.co/MNMqpu5cRN",hi,"['kisanandolan', 'farmersprotest', 'rajyasabha', 'congress', 'bharatbandh']",[],3097353133,3097353133,BoltaHindustan,Bolta Hindustan,4,20,https://twitter.com/BoltaHindustan/status/1375104745086484480,['https://boltahindustan.in/kisan-yuva/deependra-hooda-appeals-modi-govt-to-help-farmers-in-distress/'],[],0,,False,592,12,163,,farmers protest,,,,,,,[],,,,
30,1375099856658792466,1375099856658792466,1616684328000.0,2021-03-25 20:28:48,+0530,,#JusticeForMohanDelkar अब कलेक्टर ने FIRरद करने के लिए मुंबईहाइकोर्ट मे अर्जी कीहै पहले कलेक्टर की पारिवारिकसंपति की जांच होनी चाहिए क्योकि  विकास की आड़ मे अफसरनेता मिलके स्थानिय जनता का हक्क छीनकर कॉरपोरेट को देकर दलाली खाना चाहते थे जिसके खिलाफ स्व मोहनभाई थे #FarmersProtest  https://t.co/88RMaT8uWj,hi,"['justiceformohandelkar', 'farmersprotest']",[],933622354277646336,933622354277646336,Chhotu_Vasava,Chhotubhai Vasava,4,20,https://twitter.com/Chhotu_Vasava/status/1375099856658792466,[],['https://pbs.twimg.com/media/ExVWAhfXAAEl4Jq.jpg'],1,https://pbs.twimg.com/media/ExVWAhfXAAEl4Jq.jpg,False,84,3,43,,farmers protest,,,,,,,[],,,,
31,1375096802693681158,1375096802693681158,1616683600000.0,2021-03-25 20:16:40,+0530,,"ਗੁਰਦਾਸਪੁਰ ਦੀ ਮਨਜੀਤ ਕੌਰ ਇੰਝ ਦੇਵੇਗੀ ਕਿਸਾਨਾਂ ਦਾ ਸਾਥ, ਦੌੜ ਲਗਾ ਕੇ ਪਹੁੰਚ ਰਹੀ ਦਿੱਲੀ  #Gurdaspur #Manjit #FarmersProtest    https://t.co/cqHzJ680kv",pa,"['gurdaspur', 'manjit', 'farmersprotest']",[],1037022253,1037022253,abpsanjha,ABP Sanjha,4,20,https://twitter.com/abpsanjha/status/1375096802693681158,['https://punjabi.abplive.com/photo-gallery/news/this-is-how-manjit-kaur-from-gurdaspur-will-support-the-farmers-reaching-delhi-by-running-617597'],[],0,,False,0,0,0,,farmers protest,,,,,,,[],,,,
32,1375096382294351877,1375096382294351877,1616683500000.0,2021-03-25 20:15:00,+0530,,டெல்லி போராட்டக்களத்தில் நிரந்தர கட்டுமானங்களை உருவாக்க வேண்டாம்: விவசாய சங்க கூட்டமைப்பு    https://t.co/UgoU7hvSLt  #Delhi | #FarmersProtest,ta,"['delhi', 'farmersprotest']",[],622872390,622872390,PTTVOnlineNews,PuthiyathalaimuraiTV,4,20,https://twitter.com/PTTVOnlineNews/status/1375096382294351877,['https://bit.ly/3cwFiTH'],[],0,,False,20,1,2,,farmers protest,,,,,,,[],,,,
33,1375091675438186500,1375091675438186500,1616682378000.0,2021-03-25 19:56:18,+0530,,ಬೆಳಿಗ್ಗೆ 6ರಿಂದ ಸಂಜೆ 6ರವರೆಗೂ ಶಾಂತಿಯುತ ಬಂದ್ ಆಚರಿಸಲಾಗುತ್ತದೆ ಎಂದು ಸಂಯುಕ್ತ ಕಿಸಾನ್‌ ಮೋರ್ಚಾ ಹೇಳಿದೆ.  #Farmersprotest #BharatBandh #Farmlaws  https://t.co/hC2NdarilU,kn,"['farmersprotest', 'bharatbandh', 'farmlaws']",[],199202745,199202745,prajavani,Prajavani,4,19,https://twitter.com/prajavani/status/1375091675438186500,['https://www.prajavani.net/india-news/farmers-protest-bharat-bandh-rail-road-transport-likely-to-be-affected-in-parts-of-country-farm-laws-816447.html'],[],0,,False,20,0,0,,farmers protest,,,,,,,[],,,,
34,1375090643517628416,1375090643517628416,1616682132000.0,2021-03-25 19:52:12,+0530,,"#FarmersProtest Mahapanchayat in Haryana's Karnal today.  Images they don't want you to see, reality they want to hide  👇  https://t.co/LIDDQHC960",en,['farmersprotest'],[],79178279,79178279,saahilmenghani,Saahil Murli Menghani,4,19,https://twitter.com/saahilmenghani/status/1375090643517628416,[],['https://pbs.twimg.com/media/ExVNpY9XEAE0c-l.jpg'],1,https://pbs.twimg.com/media/ExVNpY9XEAE0c-l.jpg,False,1422,15,415,,farmers protest,,,,,,,[],,,,
35,1375087564395180033,1375087564395180033,1616681397000.0,2021-03-25 19:39:57,+0530,,"ਆੜ੍ਹਤੀਆ ਐਸੋਸੀਏਸ਼ਨ ਦੇ ਪ੍ਰਧਾਨ ਨੇ ਕੈਪਟਨ ਨਾਲ ਕੀਤੀ ਮੁਲਾਕਾਤ, ਮਿਲਿਆ ਕਿਸਾਨਾਂ ਨਾਲ ਖੜ੍ਹਨ ਦਾ ਭਰੋਸਾ  #FarmersProtest #CaptainAmrinderSingh   https://t.co/GgJpqP9C0c",pa,"['farmersprotest', 'captainamrindersingh']",[],1037022253,1037022253,abpsanjha,ABP Sanjha,4,19,https://twitter.com/abpsanjha/status/1375087564395180033,['https://punjabi.abplive.com/news/the-president-of-federation-of-arhatya-association-of-punjab-met-the-captain-and-assured-him-of-standing-with-the-farmers-617595'],[],0,,False,0,0,0,,farmers protest,,,,,,,[],,,,
36,1375085769627291651,1375085769627291651,1616680969000.0,2021-03-25 19:32:49,+0530,,"किसानों के एलान के मुताबिक, शुक्रवार यानि कल भारत बंद रहेगा. इस बंद का कई राजनीतिक दलों ने भी समर्थन किया है.  #FarmersProtest  #FarmLaws  #BharatBandh    https://t.co/2n87PhTx2l",hi,"['farmersprotest', 'farmlaws', 'bharatbandh']",[],39240673,39240673,ABPNews,ABP News,4,19,https://twitter.com/ABPNews/status/1375085769627291651,['https://www.abplive.com/news/india/bharat-bandh-on-26-march-rail-road-transport-likely-to-be-affected-due-to-farmers-protest-1833479'],[],0,,False,89,3,8,,farmers protest,,,,,,,[],,,,
