,id,date,tweet,hashtags,user_id,username,name,link,urls,nlikes,nretweets,nreplies
34,1360944953015169025,2021-02-14 19:02:16,"Police alleged that #DishaRavi asked #GretaThunberg to remove the main #toolkit document from her Twitter, after its incriminating details accidentally leaked into the public domain.  https://t.co/p26XJpNbrc","['disharavi', 'gretathunberg', 'toolkit']",22793955,indiacom,India.com,https://twitter.com/indiacom/status/1360944953015169025,['https://www.india.com/news/india/disha-ravi-climate-activist-arrested-toolkit-document-case-greta-thunberg-delhi-police-farmers-protest-4422138/'],0,1,0
35,1360942185978372097,2021-02-14 18:51:16,Police #Toolkit,['toolkit'],341894625,rohini_mohan,Rohini Mohan,https://twitter.com/rohini_mohan/status/1360942185978372097,[],40,16,8
36,1360939297025777668,2021-02-14 18:39:48,"I hope @GretaThunberg shares the Latest #ToolKit.  Punjab ""Farmers"" are the biggest contributors to Pollution in the region. They choke Delhi &amp; nearby states leading to deaths &amp; health issues for children.  Also that was first thing Farm bills addressed &amp; farmers got it removed!  https://t.co/TndvrV4XuG",['toolkit'],81582883,arunpudur,Arun Pudur,https://twitter.com/arunpudur/status/1360939297025777668,[],167,44,9
37,1360932752527265797,2021-02-14 18:13:47,"Greta Thunberg 'Toolkit' Case: Disha Ravi, Editor of Google Document, Shared It with Swedish Climate Activist, Says Delhi Police #GretaThunberg #DishaRavi #FarmersProtest #Toolkit #FarmLaws @DelhiPolice    https://t.co/NS7TV7324Z","['gretathunberg', 'disharavi', 'farmersprotest', 'toolkit', 'farmlaws']",828841083257778176,latestly,LatestLY,https://twitter.com/latestly/status/1360932752527265797,['https://www.latestly.com/india/news/greta-thunberg-toolkit-case-disha-ravi-editor-of-google-document-shared-it-with-swedish-climate-activist-says-delhi-police-2320973.html'],2,1,0
38,1360931221958615053,2021-02-14 18:07:42,21-year-old Bengaluru activist Disha Ravi named as one of the key conspirators in the Toolkit conspiracy  @nabilajamal_ @arvindojha  #GretaThunberg #DishaRavi #DelhiPolice #Toolkit  https://t.co/Dke4axKnya,"['gretathunberg', 'disharavi', 'delhipolice', 'toolkit']",19897138,IndiaToday,IndiaToday,https://twitter.com/IndiaToday/status/1360931221958615053,[],31,6,10
39,1360927694901284865,2021-02-14 17:53:41,"Later, she (Disha Ravi) asked @GretaThunberg to remove the main Doc after its incriminating details accidentally got into public domain. This is many times more than the 2 lines editing that she claims: Delhi Police  ANI   More:  https://t.co/l3bgnHe0fV   #DishaRavi #Toolkit","['disharavi', 'toolkit']",231692806,JagranEnglish,Jagran English,https://twitter.com/JagranEnglish/status/1360927694901284865,['http://english.jagran.com'],0,0,1
