,id,conversation_id,created_at,date,timezone,place,tweet,language,hashtags,cashtags,user_id,user_id_str,username,name,day,hour,link,urls,photos,video,thumbnail,retweet,nlikes,nreplies,nretweets,quote_url,search,near,geo,source,user_rt_id,user_rt,retweet_id,reply_to,retweet_date,translate,trans_src,trans_dest
0,1355213469243633670,1355213469243633670,1611943044000.0,2021-01-29 23:27:24,+0530,,"देश के आजकल के हालात के ऊपर #राहत_इंदौरी साहब का एक शेर पेशे खिदमत है।  जो आज साहिबे मसनद हैं कल नहीं होंगे, किराएदार हैं ज़ाती मकान थोड़ी है,, सभी का ख़ून है शामिल यहाँ की मिट्टी में, किसी के बाप का हिन्दोस्तान थोड़ी है,, #किसान_एकता_जिंदाबाद",hi,"['राहत_इंदौरी', 'किसान_एकता_जिंदाबाद']",[],1257200615781838849,1257200615781838849,KumarMehraulia,Rohit Kumar Mehraulia MLA,5,23,https://twitter.com/KumarMehraulia/status/1355213469243633670,[],[],0,,False,8,0,4,,#किसान_एकता_जिंदाबाद,,,,,,,[],,,,
1,1355177611908026372,1355177611908026372,1611934495000.0,2021-01-29 21:04:55,+0530,,खेतों से लेकर सड़कों तक किसान की आवाज़ बनो.. (आवाज़ दो हम एक है-जय जवान-जय किसान) #किसान_एकता_जिंदाबाद  #में_भी_राकेश_टिकैत_हूं  #spurdhachoudhary  https://t.co/GbI6F2AciG,hi,"['किसान_एकता_जिंदाबाद', 'में_भी_राकेश_टिकैत_हूं', 'spurdhachoudhary']",[],751456498350428160,751456498350428160,SpurdhaOfficial,Dr.Spurdha Choudhary,5,21,https://twitter.com/SpurdhaOfficial/status/1355177611908026372,[],['https://pbs.twimg.com/media/Es6O1LTXIAAKwCQ.jpg'],1,https://pbs.twimg.com/media/Es6O1LTXIAAKwCQ.jpg,False,334,6,26,,#किसान_एकता_जिंदाबाद,,,,,,,[],,,,
2,1355176047331840001,1355176047331840001,1611934122000.0,2021-01-29 20:58:42,+0530,,#राकेश_टिकैत जी : बेटियां पैर नहीं छुआ करती। मैं : फिर मेरे सलाम स्वीकारिए 🙏 बदले में जो पाया (आशीर्वाद) मेरे लिए उससे बढ़ कर कुछ नहीं। #किसान_एकता_जिंदाबाद #FarmersProstest @RahulGandhi  https://t.co/bjwJLxXGRl,hi,"['राकेश_टिकैत', 'किसान_एकता_जिंदाबाद', 'farmersprostest']",[],109930762,109930762,LambaAlka,Alka Lamba,5,20,https://twitter.com/LambaAlka/status/1355176047331840001,[],['https://pbs.twimg.com/media/Es6Nbr4VEAAUhcZ.jpg'],1,https://pbs.twimg.com/media/Es6Nbr4VEAAUhcZ.jpg,False,9863,198,1771,,#किसान_एकता_जिंदाबाद,,,,,,,[],,,,
3,1355165166128693256,1355165166128693256,1611931528000.0,2021-01-29 20:15:28,+0530,,"सरकार किसानो के जीवन,रोटी रोज़ी से जुड़े हुए किसान विरोधी बिल की वापसी में टाल मटोल करके टकराव की स्थिति पैदा कररही है।इससे पहले हालत बिगड़े सरकार को ये किसान विरोधी तीनो क़ानून वापस लेकर अमन चैन की स्थिति बनानी चाहिए। #किसान_के_लिए_बोले_भारत #किसान_एकता_जिंदाबाद @MurariLalBhart2",hi,"['किसान_के_लिए_बोले_भारत', 'किसान_एकता_जिंदाबाद']",[],2580563778,2580563778,SudhinBhadoria,Sudhindra Bhadoria,5,20,https://twitter.com/SudhinBhadoria/status/1355165166128693256,[],[],0,,False,173,2,56,https://twitter.com/ANI/status/1355089336891400196,#किसान_एकता_जिंदाबाद,,,,,,,[],,,,
4,1355155525801922562,1355155525801922562,1611929229000.0,2021-01-29 19:37:09,+0530,,पुलिस के सब सेटिंग करके तब आये हैं बीजेपी के गुंडे !!  #किसान_एकता_जिंदाबाद  #FarmersProstest,hi,"['किसान_एकता_जिंदाबाद', 'farmersprostest']",[],59084426,59084426,KuldeepKadyan,कुलदीप कादयान 🚜,5,19,https://twitter.com/KuldeepKadyan/status/1355155525801922562,[],[],0,,False,29,0,13,https://twitter.com/Singh_Manpreet0/status/1355134654060236807,#किसान_एकता_जिंदाबाद,,,,,,,[],,,,
5,1355128603307073541,1355128603307073541,1611922810000.0,2021-01-29 17:50:10,+0530,,दिल्ली पुलिस के सामने ही किसानों पर पथराव हो रहा है। और पुलिस क्या कर रही है - आप ख़ुद देखें। #FarmerTikaitVsModiDakait #SinghuBorder #मोदी_कायर_है #किसान_एकता_जिंदाबाद @HansrajMeena @LambaAlka  @DeependerSHooda @jayantrld  https://t.co/hPsHNssz1i,hi,"['farmertikaitvsmodidakait', 'singhuborder', 'मोदी_कायर_है', 'किसान_एकता_जिंदाबाद']",[],4507782194,4507782194,ChitraSarwara,Chitra Sarwara चित्रा सरवारा,5,17,https://twitter.com/ChitraSarwara/status/1355128603307073541,[],[],1,https://pbs.twimg.com/ext_tw_video_thumb/1355128376034529280/pu/img/nhDO1L-LALPOLACP.jpg,False,110,1,47,,#किसान_एकता_जिंदाबाद,,,,,,,[],,,,
6,1355116377200226304,1355116377200226304,1611919895000.0,2021-01-29 17:01:35,+0530,,"हरियाणा, कितलाना टोल किसान हुए मुखर- तिरंगा हमारी शान, आंदोलन पकड़ेगा और तेजी, प्रशासन के दवाब बनाने से भड़के लोग, कितलाना टोल पर उमड़ा जन सैलाब !!  #किसान_एकता_जिंदाबाद  #FarmersProtest  https://t.co/MrSW3TTLpb",hi,"['किसान_एकता_जिंदाबाद', 'farmersprotest']",[],59084426,59084426,KuldeepKadyan,कुलदीप कादयान 🚜,5,17,https://twitter.com/KuldeepKadyan/status/1355116377200226304,[],['https://pbs.twimg.com/media/Es5XKbUUUAUUWyC.jpg'],1,https://pbs.twimg.com/media/Es5XKbUUUAUUWyC.jpg,False,17,1,11,,#किसान_एकता_जिंदाबाद,,,,,,,[],,,,
7,1355110208704376835,1355110208704376835,1611918425000.0,2021-01-29 16:37:05,+0530,,मोदी को भी झुकना पड़ेगा शाह का अहंकार भी टूटेगा क्यों की अब ये लड़ाई देश के हर एक किसान जाती धर्म की है  #किसान_आंदोलन_जारी_रहेगा  #किसान_एकता_जिंदाबाद  @SachinPilot @RahulGandhi @pantlp  @ajaymaken,hi,"['किसान_आंदोलन_जारी_रहेगा', 'किसान_एकता_जिंदाबाद']",[],888423233522761729,888423233522761729,AbhimanyuP00NIA,Abhimanyu Poonia,5,16,https://twitter.com/AbhimanyuP00NIA/status/1355110208704376835,[],[],0,,False,447,7,63,,#किसान_एकता_जिंदाबाद,,,,,,,[],,,,
8,1355105964865646594,1355105964865646594,1611917413000.0,2021-01-29 16:20:13,+0530,,"जो सिख किसानो के हक की बात करे वो खालिस्तानी, जाट नेता किसानो साथ खड़ा हो वो दंगाई, मुसलमान किसानों के साथ खड़ा हो वो आतंकवादी और अगर देश का संभ्रांत वर्ग किसानो की आवाज उठाए तो वो अर्बन नक्सल। बस किसानो की मौत का तमाशा देखने वाले भक्त ही राष्ट्रवादी है। #किसान_एकता_जिंदाबाद  https://t.co/L3hePVw76l",hi,['किसान_एकता_जिंदाबाद'],[],4507782194,4507782194,ChitraSarwara,Chitra Sarwara चित्रा सरवारा,5,16,https://twitter.com/ChitraSarwara/status/1355105964865646594,[],"['https://pbs.twimg.com/media/Es5Np36UwAQ2W_9.jpg', 'https://pbs.twimg.com/media/Es5NqupVcAgjHYY.jpg', 'https://pbs.twimg.com/media/Es5NrgdVEAE7_ai.jpg', 'https://pbs.twimg.com/media/Es5NsQmUUAIRdhF.jpg']",1,https://pbs.twimg.com/media/Es5Np36UwAQ2W_9.jpg,False,62,1,16,,#किसान_एकता_जिंदाबाद,,,,,,,[],,,,
9,1355098926383153154,1355098926383153154,1611915735000.0,2021-01-29 15:52:15,+0530,,"मुज़फ्फरनगर किसान महासभा में उमड़ा जनसैलाब। लाखों की तादाद में किसानों के समर्थन में पहुंचे लोग।   ""एक आंसू भी हुकूमत के लिए ख़तरा है तुमने देखा नहीं है आंखों का समुंदर हो जाना"" #किसान_एकता_जिंदाबाद  https://t.co/EmgdCS5NFS",hi,['किसान_एकता_जिंदाबाद'],[],1927110241,1927110241,PJkanojia,Prashant Kanojia,5,15,https://twitter.com/PJkanojia/status/1355098926383153154,[],[],1,https://pbs.twimg.com/ext_tw_video_thumb/1355098847517655044/pu/img/yYt6Zx13efYU41pk.jpg,False,684,10,222,,#किसान_एकता_जिंदाबाद,,,,,,,[],,,,
10,1355093611293990913,1355093611293990913,1611914468000.0,2021-01-29 15:31:08,+0530,,किसान एकता ज़िंदाबाद   #किसान_आंदोलन #किसान_दिल्ली_फतह_करेगा #किसान_एकता_ज़िंदाबाद #JaiHind #JaiJawanJaiKisan #मोदी_कायर_हैं #FarmerTikaitVsModiDakait #TikriBorder #gazipurborder @INCIndia @INCJharkhand @BBCHindi @AJEnglish @CNN @ndtvindia  https://t.co/MEdH4Yo2Yv,hi,"['किसान_आंदोलन', 'किसान_दिल्ली_फतह_करेगा', 'किसान_एकता_ज़िंदाबाद', 'jaihind', 'jaijawanjaikisan', 'मोदी_कायर_हैं', 'farmertikaitvsmodidakait', 'tikriborder', 'gazipurborder']",[],2259119828,2259119828,F_Ansari_Godda,Furkan Ansari,5,15,https://twitter.com/F_Ansari_Godda/status/1355093611293990913,[],[],1,https://pbs.twimg.com/ext_tw_video_thumb/1355093092005605376/pu/img/9XmjCh69rz1xWyx8.jpg,False,8,0,1,,#किसान_एकता_जिंदाबाद,,,,,,,[],,,,
11,1355090229355548672,1355090229355548672,1611913661000.0,2021-01-29 15:17:41,+0530,,"यह जनसैलाब देख कर दिल्ली में बैठी निक्कमी सरकार और उदासीन भाजपा नेताओं के हौश उड़ गये होंगे ।  मोदी - शाह होश में आओ, किसानों की बात सुनो ।   #किसान_आंदोलन_जारी_रहेगा  #IndiaVsPMModi  #किसान_एकता_जिंदाबाद  #FarmersProtest  https://t.co/I9XxPICG2W",hi,"['किसान_आंदोलन_जारी_रहेगा', 'indiavspmmodi', 'किसान_एकता_जिंदाबाद', 'farmersprotest']",[],109332553,109332553,satyajeettambe,Satyajeet Tambe,5,15,https://twitter.com/satyajeettambe/status/1355090229355548672,[],[],1,https://pbs.twimg.com/ext_tw_video_thumb/1355090146572562432/pu/img/8_SeP3jCZnjTPCR6.jpg,False,324,11,53,,#किसान_एकता_जिंदाबाद,,,,,,,[],,,,
12,1355087511572234246,1355087511572234246,1611913013000.0,2021-01-29 15:06:53,+0530,,यही वक़्त है जब किसान आंदोलन के समर्थन में हर जिम्मेवार नागरिक को अपना पूरा जोर लगा देना चाहिए।   हम किसान के कर्जदार हैं। उनके ऊपर सरकारी बल और तानाशाही हथौड़ा कैसे चलने दे सकते हैं?  युवाओं के साथ आने से मोदी मीडिया और भोगी सरकार को बड़ा धक्का लगने वाला है। #किसान_एकता_जिंदाबाद  https://t.co/PZlVdzT0to,hi,['किसान_एकता_जिंदाबाद'],[],974591468340887552,974591468340887552,yuvahallabol,Yuva Halla Bol,5,15,https://twitter.com/yuvahallabol/status/1355087511572234246,[],['https://pbs.twimg.com/media/Es485pQU4AU6Izb.jpg'],1,https://pbs.twimg.com/media/Es485pQU4AU6Izb.jpg,False,109,2,73,,#किसान_एकता_जिंदाबाद,,,,,,,[],,,,
13,1355066150753767424,1355066150753767424,1611907920000.0,2021-01-29 13:42:00,+0530,,Repeal All Three Black Laws. #किसान_एकता_जिंदाबाद  https://t.co/0dlBMt5ksK,en,['किसान_एकता_जिंदाबाद'],[],219188946,219188946,hanumanbeniwal,HANUMAN BENIWAL,5,13,https://twitter.com/hanumanbeniwal/status/1355066150753767424,[],[],1,https://pbs.twimg.com/ext_tw_video_thumb/1355065926995992580/pu/img/_UBZqqrXXlGqoFJK.jpg,False,2768,93,674,,#किसान_एकता_जिंदाबाद,,,,,,,[],,,,
14,1355065662775783425,1355065662775783425,1611907804000.0,2021-01-29 13:40:04,+0530,,"मर जाएगा,  माफ़ी मांग कर भागेगा नहीं.!!  टिकैत है, सावरकर नहीं... #FarmerTikaitVsModiDakait #RakeshTikait #किसान_एकता_जिंदाबाद जय बाबा टिकैत की",hi,"['farmertikaitvsmodidakait', 'rakeshtikait', 'किसान_एकता_जिंदाबाद']",[],78527118,78527118,hemantogale,Hemant Ogale,5,13,https://twitter.com/hemantogale/status/1355065662775783425,[],[],0,,False,9,0,4,,#किसान_एकता_जिंदाबाद,,,,,,,[],,,,
15,1355064525972668418,1355064525972668418,1611907533000.0,2021-01-29 13:35:33,+0530,,"किसान नेता राकेश टिकैत जी के साथ हुई बदसलूकी को लेकर हजारों प्रदेशवासियों के साथ कल गाजीपुर बॉर्डर पहुंच रहा हूँ।  कल सुबह 9 बजे अम्बाला से चलकर कुरुक्षेत्र, करनाल, पानीपत, सोनीपत होते हुए 12 बजे गाजीपुर बॉर्डर धरने पर पहुंचेंगे।#FarmerFirst #farmersrprotest #किसान_एकता_जिंदाबाद  https://t.co/qTUgnoF3UU",hi,"['farmerfirst', 'farmersrprotest', 'किसान_एकता_जिंदाबाद']",[],779282123437903872,779282123437903872,AbhaySChautala,Abhay Singh Chautala,5,13,https://twitter.com/AbhaySChautala/status/1355064525972668418,[],[],1,https://pbs.twimg.com/ext_tw_video_thumb/1355064108840792069/pu/img/Ou0EEtWLx2aP3sH5.jpg,False,6121,153,1433,,#किसान_एकता_जिंदाबाद,,,,,,,[],,,,
16,1355063531066953728,1355063531066953728,1611907296000.0,2021-01-29 13:31:36,+0530,,"गोदी भेड़िया, सोरी, मीडिया सरकार के पालतू कुत्ते हो सकते हैं; पर शुक्र करो कि हमारे #भारत देश के #किसान यह गोदी भेड़ियों के गुलाम नहीँ है। #farmersrprotest #RakeshTikait #किसान_के_लिए_बोले_भारत #किसान_एकता_जिंदाबाद  Inspired by @ravishndtv .",hi,"['भारत', 'किसान', 'farmersrprotest', 'rakeshtikait', 'किसान_के_लिए_बोले_भारत', 'किसान_एकता_जिंदाबाद']",[],17801716,17801716,DeepalTrevedie,Deepal.‏‎‎Trivedi #Vo!,5,13,https://twitter.com/DeepalTrevedie/status/1355063531066953728,[],[],0,,False,11,2,5,,#किसान_एकता_जिंदाबाद,,,,,,,[],,,,
17,1355059314461863936,1355059314461863936,1611906291000.0,2021-01-29 13:14:51,+0530,,किसान तो आज अपनी लड़ाई लड़ रहे है लेकिन देश के मिडिल क्लास को यह समझना चाहिए कि तीनो क़ानून सिर्फ़ किसान के खिलाफ नही है। Essential Commodity Act की मार आप लोगो पर भी पड़ने वाली है.. #FarmerTikaitVsModiDakait #KisanAndolan #किसान_एकता_जिंदाबाद #मोदी_कायर_है @HansrajMeena @IamOnir  https://t.co/Bt7RNxR5dE,hi,"['farmertikaitvsmodidakait', 'kisanandolan', 'किसान_एकता_जिंदाबाद', 'मोदी_कायर_है']",[],4507782194,4507782194,ChitraSarwara,Chitra Sarwara चित्रा सरवारा,5,13,https://twitter.com/ChitraSarwara/status/1355059314461863936,[],"['https://pbs.twimg.com/media/Es4jQDLVEAMCyjI.jpg', 'https://pbs.twimg.com/media/Es4jQ2gUUAU9e-H.jpg']",1,https://pbs.twimg.com/media/Es4jQDLVEAMCyjI.jpg,False,177,2,62,,#किसान_एकता_जिंदाबाद,,,,,,,[],,,,
18,1355054848866045952,1355054848866045952,1611905226000.0,2021-01-29 12:57:06,+0530,,"एक आँसू भी हुकूमत के लिए ख़तरा है, तुम ने देखा नहीं आँखों का समुंदर होना।  केंद्र अपनी हठधर्मिता छोड़े और फौरन तीनों काले कृषि कानून वापस ले।   #किसान_एकता_जिंदाबाद  https://t.co/WXVuqjSvzt",hi,['किसान_एकता_जिंदाबाद'],[],4527223634,4527223634,IYCGujarat,Gujarat Youth Congress,5,12,https://twitter.com/IYCGujarat/status/1355054848866045952,[],['https://pbs.twimg.com/media/Es4fMR-XIAE3M8C.jpg'],1,https://pbs.twimg.com/media/Es4fMR-XIAE3M8C.jpg,False,24,0,10,,#किसान_एकता_जिंदाबाद,,,,,,,[],,,,
19,1355051295661453313,1355051295661453313,1611904379000.0,2021-01-29 12:42:59,+0530,,"जो किसानों की बात करेगा, वही देश पर राज करेगा।  #किसान_एकता_जिंदाबाद  #किसान_आंदोलन",hi,"['किसान_एकता_जिंदाबाद', 'किसान_आंदोलन']",[],1228993825,1228993825,imfulara,Vijay Fulara,5,12,https://twitter.com/imfulara/status/1355051295661453313,[],[],0,,False,395,18,112,,#किसान_एकता_जिंदाबाद,,,,,,,[],,,,
20,1355042081840926724,1355042081840926724,1611902182000.0,2021-01-29 12:06:22,+0530,,"किसानो की संख्या बॉर्डर पर थोड़ी कम क्या हुई, सरकार ने किसान भाइयों पर आत्याचर शुरू कर दिया।   #भाजपा सरकार यह कान खोल के सुन ले, जो किसानों के आँख में आँसू है, यहीं आसूँ सुनामी लेकर आयेगें।  #किसान_एकता_जिंदाबाद #किसान_के_लिए_बोले_भारत #FarmersProstest #FarmerTikaitVsModiDakait  https://t.co/9GQtZzIGpL",hi,"['भाजपा', 'किसान_एकता_जिंदाबाद', 'किसान_के_लिए_बोले_भारत', 'farmersprostest', 'farmertikaitvsmodidakait']",[],1449299132,1449299132,ripunbora,Ripun Bora,5,12,https://twitter.com/ripunbora/status/1355042081840926724,[],[],1,https://pbs.twimg.com/ext_tw_video_thumb/1355041998944702469/pu/img/_UuegVr8iEEs3FEM.jpg,False,65,3,20,,#किसान_एकता_जिंदाबाद,,,,,,,[],,,,
21,1355041811866083329,1355041811866083329,1611902118000.0,2021-01-29 12:05:18,+0530,,टकै दिए टकैत ने! #FarmerTikaitVsModiDakait #किसान_एकता_जिंदाबाद #मोदी_कायर_है #farmersrprotest  #RakeshTikait  #gazipurborder @HansrajMeena @IamOnir @RakeshTikaitBKU @OfficialBKU  https://t.co/cd3OiGfHtH,ne,"['farmertikaitvsmodidakait', 'किसान_एकता_जिंदाबाद', 'मोदी_कायर_है', 'farmersrprotest', 'rakeshtikait', 'gazipurborder']",[],4507782194,4507782194,ChitraSarwara,Chitra Sarwara चित्रा सरवारा,5,12,https://twitter.com/ChitraSarwara/status/1355041811866083329,[],"['https://pbs.twimg.com/media/Es4S_0_VkAMSfMJ.jpg', 'https://pbs.twimg.com/media/Es4TDaiU0AMoUcD.jpg', 'https://pbs.twimg.com/media/Es4TNiPUwAElzCT.jpg', 'https://pbs.twimg.com/media/Es4TV-NVgAISzTU.jpg']",1,https://pbs.twimg.com/media/Es4S_0_VkAMSfMJ.jpg,False,471,6,113,,#किसान_एकता_जिंदाबाद,,,,,,,[],,,,
22,1355029056211791878,1355029056211791878,1611899076000.0,2021-01-29 11:14:36,+0530,,तिरंगे की छांव तले अपने अधिकारों की आवाज बुलंद करते हमारे अन्नदाता देश की शान है। आज अहंकारी हुकूमत देश की शान के साथ खिलवाड़ कर रही है।  #किसान_एकता_जिंदाबाद #IndiaVsPMModi  https://t.co/F01ZVTIDWM,hi,"['किसान_एकता_जिंदाबाद', 'indiavspmmodi']",[],4527223634,4527223634,IYCGujarat,Gujarat Youth Congress,5,11,https://twitter.com/IYCGujarat/status/1355029056211791878,[],[],1,https://pbs.twimg.com/ext_tw_video_thumb/1355028255183659010/pu/img/eru66vohvpqRhUW3.jpg,False,31,0,24,,#किसान_एकता_जिंदाबाद,,,,,,,[],,,,
23,1355023676748402690,1355023676748402690,1611897794000.0,2021-01-29 10:53:14,+0530,,किसान आंदोलन जारी है और जारी रहेगा।   #किसान_एकता_जिंदाबाद,hi,['किसान_एकता_जिंदाबाद'],[],4247917752,4247917752,AAP4Jharkhand,AAP JHARKHAND,5,10,https://twitter.com/AAP4Jharkhand/status/1355023676748402690,[],[],0,,False,17,1,3,,#किसान_एकता_जिंदाबाद,,,,,,,[],,,,
24,1355021984913092610,1355021984913092610,1611897390000.0,2021-01-29 10:46:30,+0530,,"किसान अगर आंखों में आंसू लिए धरने पर है, तो सत्तासीन सरकारें जान लें कि गद्दी खतरे में है....!  #किसान_एकता_जिंदाबाद #FarmersProstest",hi,"['किसान_एकता_जिंदाबाद', 'farmersprostest']",[],855713804579217409,855713804579217409,MadanPrajapat_,Madan Prajapat,5,10,https://twitter.com/MadanPrajapat_/status/1355021984913092610,[],[],0,,False,70,5,6,,#किसान_एकता_जिंदाबाद,,,,,,,[],,,,
25,1355020081139380224,1355020081139380224,1611896937000.0,2021-01-29 10:38:57,+0530,,"हमारी और आज की पीढ़ी ने अंग्रेजों और उनके अत्याचारों को ना देखा और ना सहा, लेकिन वर्तमान हुकूमत को देखकर अंदाजा लगा सकते हैं कि उस समय हमारे लोगों ने क्या क्या जुल्म नहीं देखे होंगे और सहे होंगे।  #किसान_एकता_जिंदाबाद",hi,['किसान_एकता_जिंदाबाद'],[],227756311,227756311,virenderrathor,Virender Singh Rathore,5,10,https://twitter.com/virenderrathor/status/1355020081139380224,[],[],0,,False,27,0,6,,#किसान_एकता_जिंदाबाद,,,,,,,[],,,,
