,id,conversation_id,created_at,date,timezone,place,tweet,language,hashtags,cashtags,user_id,user_id_str,username,name,day,hour,link,urls,photos,video,thumbnail,retweet,nlikes,nreplies,nretweets,quote_url,search,near,geo,source,user_rt_id,user_rt,retweet_id,reply_to,retweet_date,translate,trans_src,trans_dest
26,1355015684929949699,1355015684929949699,1611895888000.0,2021-01-29 10:21:28,+0530,,"जवानी नही चिल्लाएगी तो पीढियां गिड़गिड़ाएंगी, आने वाली पुश्तें रोटी, मांग-मांग कर खाएंगी।  #किसान #किसान_एकता_जिंदाबाद",hi,"['किसान', 'किसान_एकता_जिंदाबाद']",[],1056801118758481921,1056801118758481921,Rakesh_Sachan_,राकेश सचान,5,10,https://twitter.com/Rakesh_Sachan_/status/1355015684929949699,[],[],0,,False,104,2,17,,#किसान_एकता_जिंदाबाद,,,,,,,[],,,,
27,1355014844634681346,1355014844634681346,1611895688000.0,2021-01-29 10:18:08,+0530,,"सत्यमेव जयते !  आंसुओं के सैलाब ने हवा का रुख  कुछ ऐसे बदला के सल्तनत भी हिल गयी,   गाजीपुर दमन का सपना देख रही सरकार और गोदी मीडिया की जमीं भी पैरों के नीचे से सरक गयी ।  देर रात बड़ी तादाद में अतिरिक्त सुरक्षा बल गाजीपुर बॉर्डर से उल्टे पांव वापिस लौटा ।  #किसान_एकता_जिंदाबाद  https://t.co/hbwHWYJ9l9",hi,['किसान_एकता_जिंदाबाद'],[],4527223634,4527223634,IYCGujarat,Gujarat Youth Congress,5,10,https://twitter.com/IYCGujarat/status/1355014844634681346,[],[],1,https://pbs.twimg.com/ext_tw_video_thumb/1355013666559696899/pu/img/wDD9EsC8TPogiaW9.jpg,False,21,0,13,,#किसान_एकता_जिंदाबाद,,,,,,,[],,,,
28,1355013398870642690,1355013398870642690,1611895343000.0,2021-01-29 10:12:23,+0530,,"""हमारे देश का किसान हमारी अर्थव्यवस्था का एक महत्वपूर्ण स्रोत है, जो बाज़ार से खुदरा में सब कुछ खरीदता है, थोक में सब कुछ बेचता है, और दोनों तरीकों से माल ढुलाई के लागत का भुगतान भी करता है।""  #किसान #किसान_एकता_जिंदाबाद  #किसान_के_लिए_बोले_भारत",hi,"['किसान', 'किसान_एकता_जिंदाबाद', 'किसान_के_लिए_बोले_भारत']",[],1449299132,1449299132,ripunbora,Ripun Bora,5,10,https://twitter.com/ripunbora/status/1355013398870642690,[],[],0,,False,94,2,36,,#किसान_एकता_जिंदाबाद,,,,,,,[],,,,
29,1355011517872181248,1355011517872181248,1611894895000.0,2021-01-29 10:04:55,+0530,,"अच्छे दिनों में ~~~किसान- मज़दूर सड़कों पर आ गए,""26 जनवरी को तिरंगे का अपमान हो गया,महंगाई से देश जुझ रहा युवा पीढ़ी बेरोजगार घूम रहे,6 सालों में सिर्फ विदेश घुमाव करते रहे मगर रिश्ते किसे से नहीं बना पाए! #किसान_एकता_जिंदाबाद",hi,['किसान_एकता_जिंदाबाद'],[],742597945485320192,742597945485320192,preeti_chobey,Preeti Chobey,5,10,https://twitter.com/preeti_chobey/status/1355011517872181248,[],[],0,,False,226,10,76,,#किसान_एकता_जिंदाबाद,,,,,,,[],,,,
30,1355011253194940416,1355011253194940416,1611894832000.0,2021-01-29 10:03:52,+0530,,PM हमारे किसान-मज़दूर पर वार करके भारत को कमज़ोर कर रहे हैं।  फ़ायदा सिर्फ़ देश-विरोधी ताक़तों का होगा। - श्री @RahulGandhi जी #किसान_एकता_जिंदाबाद,hi,['किसान_एकता_जिंदाबाद'],[],537523812,537523812,PRAVEENPATHAK13,Praveen Pathak,5,10,https://twitter.com/PRAVEENPATHAK13/status/1355011253194940416,[],[],0,,False,24,0,6,,#किसान_एकता_जिंदाबाद,,,,,,,[],,,,
31,1355006726030852099,1355006726030852099,1611893752000.0,2021-01-29 09:45:52,+0530,,किसानों पर हुए ज़ुल्म के विरोध में आज से शुरू हुए संसद के बजट सत्र के पहले दिन महामहिम राष्ट्रपति जी के अभिभाषण का बायकॉट किया। किसानों के समर्थन में आज संसद भवन परिसर भी नहीं गया। वापस सहारनपुर लौट रहा हूं।  #किसान_एकता_जिंदाबाद  #किसान_आंदोलन_जारी_रहेगा  #राकेश_टिकैत  #Farmer,hi,"['किसान_एकता_जिंदाबाद', 'किसान_आंदोलन_जारी_रहेगा', 'राकेश_टिकैत', 'farmer']",[],1182345900221333504,1182345900221333504,HajiFazlurMP,Haji Fazlur Rehman,5,09,https://twitter.com/HajiFazlurMP/status/1355006726030852099,[],[],0,,False,240,10,98,,#किसान_एकता_जिंदाबाद,,,,,,,[],,,,
32,1355004196492177411,1355004196492177411,1611893149000.0,2021-01-29 09:35:49,+0530,,Dy CM @msisodia will visit Ghazipur border to meet the farmers and will also inspect the arrangements of water and toilet.  #FarmerTikaitVsModiDakait #मोदी_कायर_हैं #किसान_एकता_जिंदाबाद,en,"['farmertikaitvsmodidakait', 'मोदी_कायर_हैं', 'किसान_एकता_जिंदाबाद']",[],101152134,101152134,Amitjanhit,Amit Mishra,5,09,https://twitter.com/Amitjanhit/status/1355004196492177411,[],[],0,,False,678,15,691,,#किसान_एकता_जिंदाबाद,,,,,,,[],,,,
33,1355003828802740226,1355003828802740226,1611893062000.0,2021-01-29 09:34:22,+0530,,"मर जाएगा,  माफ़ी मांग कर भागेगा नहीं.!!  टिकैत है, सावरकर नहीं...  #RakeshTikait #किसान_एकता_जिंदाबाद #कायर_मोदी जय बाबा टिकैत की",hi,"['rakeshtikait', 'किसान_एकता_जिंदाबाद', 'कायर_मोदी']",[],78527118,78527118,hemantogale,Hemant Ogale,5,09,https://twitter.com/hemantogale/status/1355003828802740226,[],[],0,,False,26,1,11,,#किसान_एकता_जिंदाबाद,,,,,,,[],,,,
34,1355001231622557699,1355001231622557699,1611892442000.0,2021-01-29 09:24:02,+0530,,"""अन्नदाताओं का अपमान नहीं सहेगा हिंदुस्तान""  पूरा देश हमारे किसान भाइयों के साथ खड़ा हैं।  #किसान_एकता_ज़िंदाबाद #किसान_आंदोलन #किसान_समर्थन  https://t.co/i6DpxqUiu8",hi,"['किसान_एकता_ज़िंदाबाद', 'किसान_आंदोलन', 'किसान_समर्थन']",[],2929450676,2929450676,AAPKartar,Kartar Singh Tanwar,5,09,https://twitter.com/AAPKartar/status/1355001231622557699,[],[],1,https://pbs.twimg.com/ext_tw_video_thumb/1355001064479744002/pu/img/_hTuZekpXYP6pDpd.jpg,False,4,3,1,,#किसान_एकता_जिंदाबाद,,,,,,,[],,,,
35,1355000915288199170,1355000915288199170,1611892367000.0,2021-01-29 09:22:47,+0530,,"उम्मीद है मोदी-खट्टर-योगी सरकार को भलीभाँति समझ में आने लगा होगा कि हर जगह एन्टी नेशनल, दंगा, ठायें-ठायें, UAPA, NSA, फ़र्ज़ी-झूठे प्रचार से काम नहीं चलता। किसान देश का चक्का चलाता है, उसे मजबूर किया गया तो, उसे जाम करने से कोई रोक नहीं सकता। #किसान_एकता_जिंदाबाद #मोदी_कायर_है",hi,"['किसान_एकता_जिंदाबाद', 'मोदी_कायर_है']",[],1056801118758481921,1056801118758481921,Rakesh_Sachan_,राकेश सचान,5,09,https://twitter.com/Rakesh_Sachan_/status/1355000915288199170,[],[],0,,False,237,2,51,,#किसान_एकता_जिंदाबाद,,,,,,,[],,,,
36,1354996518470578177,1354996518470578177,1611891319000.0,2021-01-29 09:05:19,+0530,,"सरकार शायद भूल गई कि घायल शेर की साँसे, उसकी दहाड़ से भी ज्यादा खतरनाक होती है! किसान विरोधी झुकेंगे भी ओर टूटेंगे भी।  देश के किसानों से निवेदन है कि वो किसान आंदोलन में हिस्सा लें ओर मजबूती से इन काले कानूनों के खिलाफ लड़े|| #किसान_एकता_जिंदाबाद #FarmerProtest #RakeshTikait",hi,"['किसान_एकता_जिंदाबाद', 'farmerprotest', 'rakeshtikait']",[],779282123437903872,779282123437903872,AbhaySChautala,Abhay Singh Chautala,5,09,https://twitter.com/AbhaySChautala/status/1354996518470578177,[],[],0,,False,3104,96,758,,#किसान_एकता_जिंदाबाद,,,,,,,[],,,,
37,1354994178535481344,1354994178535481344,1611890761000.0,2021-01-29 08:56:01,+0530,,#किसान_एकता_जिंदाबाद  #किसान_आंदोलन  #किसानो_के_साथ_न्याय_करो  https://t.co/LX8ALJr20e,und,"['किसान_एकता_जिंदाबाद', 'किसान_आंदोलन', 'किसानो_के_साथ_न्याय_करो']",[],3229635290,3229635290,aaprajeshrishi,Rajesh Rishi MLA Janakpuri,5,08,https://twitter.com/aaprajeshrishi/status/1354994178535481344,[],[],1,https://pbs.twimg.com/ext_tw_video_thumb/1354994046129864705/pu/img/FdIMxVRgrtUCs62R.jpg,False,17,1,12,,#किसान_एकता_जिंदाबाद,,,,,,,[],,,,
38,1354988492003045379,1354988492003045379,1611889405000.0,2021-01-29 08:33:25,+0530,,"जो लोग टिकैत के रोने पर हंस रहे हैं और ख़ुशी मना रहे हैं की पूरी सरकार प्रशासन मीडिया और पैसे के दम पर आपने किसानो को रुला ही दिया,   आपसे घटिया कोई नही हो सकता।   #किसान_एकता_जिंदाबाद",hi,['किसान_एकता_जिंदाबाद'],[],134412788,134412788,vbwalia,Vaibhav Walia,5,08,https://twitter.com/vbwalia/status/1354988492003045379,[],[],0,,False,672,9,208,,#किसान_एकता_जिंदाबाद,,,,,,,[],,,,
39,1354986047889760259,1354986047889760259,1611888822000.0,2021-01-29 08:23:42,+0530,,ले मशाले चल पड़े है लोग मेरे गांव के अब अंधेरा जीत लेंगे लोग मेरे गांव के। बिन लड़े कुछ भी नहीं मिलता यहां ये जान कर अब लड़ाई लड़ रहे है लोग मेरे गांव के। #किसान_एकता_जिंदाबाद  https://t.co/rmP9wAXNgZ,hi,['किसान_एकता_जिंदाबाद'],[],2364008863,2364008863,PreethySekhar,Preethy Sekhar,5,08,https://twitter.com/PreethySekhar/status/1354986047889760259,[],[],1,https://pbs.twimg.com/ext_tw_video_thumb/1354985988456550400/pu/img/RULpnp5iHWs17pNV.jpg,False,5,0,2,,#किसान_एकता_जिंदाबाद,,,,,,,[],,,,
