,id,conversation_id,created_at,date,timezone,place,tweet,language,hashtags,cashtags,user_id,user_id_str,username,name,day,hour,link,urls,photos,video,thumbnail,retweet,nlikes,nreplies,nretweets,quote_url,search,near,geo,source,user_rt_id,user_rt,retweet_id,reply_to,retweet_date,translate,trans_src,trans_dest
35,1474290977820925955,1474290977820925955,1640333334000.0,2021-12-24 13:38:54,+0530,,"Under Samyukta Kishan Morcha @cpimspeak protest in Agartala.   Alleges : @BJP4India &amp; @BJP4Tripura anti-farmers, failed to keep Vision Document promises.   @BjpBiplab 45 months rule reversed Tripura’s development 50 years.  @PradyotManikya anti-tribal, false ‘Greater Tipraland’  https://t.co/mxM7mN7vY6",en,[],[],1313620045,1313620045,PinakiDas1975,Pinaki Das,5,13,https://twitter.com/PinakiDas1975/status/1474290977820925955,[],"['https://pbs.twimg.com/media/FHW70YfVQAQreoy.jpg', 'https://pbs.twimg.com/media/FHW70YfVQAMUaTL.jpg', 'https://pbs.twimg.com/media/FHW70YiVUAAQVN4.jpg']",1,https://pbs.twimg.com/media/FHW70YfVQAQreoy.jpg,False,5,0,2,,farmers protest,,,,,,,[],,,,
36,1474281187019481120,1474281187019481120,1640331000000.0,2021-12-24 13:00:00,+0530,,"“Whether it was the farmers’ protests or the rising price of petrol and diesel, Raman’s journalism focussed on issues that affected the common people,” Channi said.   Parijat writes about Raman Kashyap, the journalist killed in the Lakhimpur Kheri carnage:  https://t.co/IDZimERHru",en,[],[],86478153,86478153,thecaravanindia,The Caravan,5,13,https://twitter.com/thecaravanindia/status/1474281187019481120,['http://bit.ly/3pB0vCj'],[],0,,False,7,0,4,,farmers protest,,,,,,,[],,,,
37,1474279427437596675,1474279427437596675,1640330580000.0,2021-12-24 12:53:00,+0530,,तीन के तीर कल न्यूज 18 उत्तर प्रदेश पर देखिए राकेश टिकैत जी महत्वपूर्ण इंटरव्यू #tikait  #FarmersProtest  @Kisanektamorcha @kisanItcell1 @OfficialBKU @PremaramSiyag6 @singhjagtarbaj  https://t.co/LmiPD63DQZ,hi,"['tikait', 'farmersprotest']",[],987656094607589376,987656094607589376,Dmalikbku,Dharmendra Malik,5,12,https://twitter.com/Dmalikbku/status/1474279427437596675,[],[],1,https://pbs.twimg.com/ext_tw_video_thumb/1474279187716345858/pu/img/QFTBH1CSMmgQ3Df-.jpg,False,638,19,122,,farmers protest,,,,,,,[],,,,
38,1474266562500517889,1474266562500517889,1640327513000.0,2021-12-24 12:01:53,+0530,,"""Participated in the Protest at the gate of Vidhan Bhawan over 'power stealer' remark against farmers""  @BJP4Maharashtra  @Dev_Fadnavis  @ChDadaPatil   #WinterSession #MaharashtraLegislativeCouncil  https://t.co/vDWjliJckB",en,"['wintersession', 'maharashtralegislativecouncil']",[],1200413787053903873,1200413787053903873,mipravindarekar,Pravin Darekar - प्रविण दरेकर,5,12,https://twitter.com/mipravindarekar/status/1474266562500517889,[],['https://pbs.twimg.com/media/FHWlnuNUUAISRVI.jpg'],1,https://pbs.twimg.com/media/FHWlnuNUUAISRVI.jpg,False,39,0,10,,farmers protest,,,,,,,[],,,,
39,1474237890909458435,1474237890909458435,1640320677000.0,2021-12-24 10:07:57,+0530,,"गोदी/SC-OBC-माइनॉरिटी/लिबरल मीडिया,पत्रकार इस न्यूज पर खामोश है   हसदेव अरण्य क्षेत्र में ग्रामसभाओं के विरोध के बाबजूद परसा कोल ब्लॉक में खनन शुरू करने के खिलाफ  #Tribal_Farmers ने  CM अशोक गहलोत और गौतम #Adani का पुतला जलाकर विरोध किया। #जय_आदिवासी #FarmersProtest #India  https://t.co/QA2DFRlhS4",hi,"['tribal_farmers', 'adani', 'जय_आदिवासी', 'farmersprotest', 'india']",[],933622354277646336,933622354277646336,Chhotu_Vasava,Chhotubhai Vasava,5,10,https://twitter.com/Chhotu_Vasava/status/1474237890909458435,[],['https://pbs.twimg.com/media/FHWLjGoVEAM-NfD.jpg'],1,https://pbs.twimg.com/media/FHWLjGoVEAM-NfD.jpg,False,113,0,39,,farmers protest,,,,,,,[],,,,
