,id,conversation_id,created_at,date,timezone,place,tweet,language,hashtags,cashtags,user_id,user_id_str,username,name,day,hour,link,urls,photos,video,thumbnail,retweet,nlikes,nreplies,nretweets,quote_url,search,near,geo,source,user_rt_id,user_rt,retweet_id,reply_to,retweet_date,translate,trans_src,trans_dest
0,1341165346099609602,1341165346099609602,1608593710000.0,2020-12-22 05:05:10,+0530,,"Looking through the Congressional budget / COVID bill. Some highlights for agriculture:  Funding for research, APHIS, FSA largely unchanged. Bill prohibits closure of county FSA offices.",en,[],[],15025049,15025049,NTVsSteveWhite,Steve White,2,05,https://twitter.com/NTVsSteveWhite/status/1341165346099609602,[],[],0,,False,3,1,0,,agriculture bills,,,,,,,[],,,,
1,1341140730056560640,1341140730056560640,1608587841000.0,2020-12-22 03:27:21,+0530,,"Very sad to hear that Rich Rominger, deputy secretary of @USDA under Bill Clinton and California Secretary of Food and Agriculture, just passed away. He was an extraordinary man, may his memory be a blessing.📷Judy Starkman  https://t.co/yihBgZxqG5",en,[],[],24224268,24224268,NaomiStarkman,Naomi Starkman,2,03,https://twitter.com/NaomiStarkman/status/1341140730056560640,[],['https://pbs.twimg.com/media/EpywNRrUUAAoNPZ.jpg'],1,https://pbs.twimg.com/media/EpywNRrUUAAoNPZ.jpg,False,43,5,5,,agriculture bills,,,,,,,[],,,,
2,1341099949602299906,1341093732528107523,1608578119000.0,2020-12-22 00:45:19,+0530,,wow $13 billion in Agriculture assistance ~$11 billion of that grants to secretary for producers (page 429 of bill),en,[],[],16061946,16061946,kelmej,Kellie Mejdrich,2,00,https://twitter.com/kelmej/status/1341099949602299906,[],[],0,,False,0,1,0,,agriculture bills,,,,,,,[],,,,
3,1341035446453870600,1341035446453870600,1608562740000.0,2020-12-21 20:29:00,+0530,,Agriculture is devolved but it is the national government deciding on licensing and charging levies in the Tea Bill yet we know its function is limited to policy.  Parliament even ignored the Council of Governors' concerns.  https://t.co/1PMPIRf6cH,en,[],[],25805906,25805906,OliverMathenge,Oliver Mathenge,1,20,https://twitter.com/OliverMathenge/status/1341035446453870600,[],"['https://pbs.twimg.com/media/EpxQn0jWMAIvLHH.jpg', 'https://pbs.twimg.com/media/EpxQoXtW4AkGOCI.jpg']",1,https://pbs.twimg.com/media/EpxQn0jWMAIvLHH.jpg,False,24,5,12,,agriculture bills,,,,,,,[],,,,
4,1341033123019157504,1341033123019157504,1608562186000.0,2020-12-21 20:19:46,+0530,,"Congratulations Senator @Aaroncheruiyot on the passing of your Tea Bill. It is no mean feat. To all those who had concerns with the Bill, Our Agriculture Committee will soon work on further amendments that will capture many of the concerns raised by stakeholders.",en,[],[],256136003,256136003,kipmurkomen,"KIPCHUMBA MURKOMEN, E.G.H",1,20,https://twitter.com/kipmurkomen/status/1341033123019157504,[],[],0,,False,2277,101,162,,agriculture bills,,,,,,,[],,,,
5,1341020171155083266,1341020171155083266,1608559098000.0,2020-12-21 19:28:18,+0530,,"Here is an answer to  Why these 3 agriculture bills?  Why now?  Who asked for? Where they discussed enough?  This is the list of committees, commissions, reports and groups who have discussed, deliberated and recommend this agri reforms in last 20 years. Read the full thread. 1/n",en,[],[],477500631,477500631,p_sahibsingh,Parvesh Sahib Singh,1,19,https://twitter.com/p_sahibsingh/status/1341020171155083266,[],[],0,,False,270,2,50,,agriculture bills,,,,,,,[],,,,
6,1340952650951532544,1340952650951532544,1608543000000.0,2020-12-21 15:00:00,+0530,,"Public meeting at Sonarpur, South 24 Pgn   -In solidarity with #FarmersProtest of Delhi   - Scrap Anti farmers Agriculture bills  -Bring alternative agriculture bills in WB Assembly    #BengalForFarmers  #No2FarmBills  https://t.co/nsr3X5k8ZA",en,"['farmersprotest', 'bengalforfarmers', 'no2farmbills']",[],2386808821,2386808821,CPIM_WESTBENGAL,CPI(M) WEST BENGAL,1,15,https://twitter.com/CPIM_WESTBENGAL/status/1340952650951532544,[],"['https://pbs.twimg.com/media/EpvG0d_U0AAkHha.jpg', 'https://pbs.twimg.com/media/EpvG0eEVoAAteWK.jpg', 'https://pbs.twimg.com/media/EpvG0eHVoAAtNIM.jpg', 'https://pbs.twimg.com/media/EpvG0eGUUAATenu.jpg']",1,https://pbs.twimg.com/media/EpvG0d_U0AAkHha.jpg,False,69,0,15,,agriculture bills,,,,,,,[],,,,
7,1340946030695608320,1340946030695608320,1608541421000.0,2020-12-21 14:33:41,+0530,,"For those who are still confused by all the so-called expert commentary on the three Farm Bills, this about a month-old piece is still the answer they were looking for: Is This the Market Reform Indian Agriculture Needs?   https://t.co/ozUrXkpZ8H",en,[],[],16427565,16427565,SundeepDougal,Sundeep Dougal,1,14,https://twitter.com/SundeepDougal/status/1340946030695608320,['https://www.theindiaforum.in/article/three-farm-bills'],[],0,,False,0,0,0,,agriculture bills,,,,,,,[],,,,
