,id,conversation_id,created_at,date,timezone,place,tweet,language,hashtags,cashtags,user_id,user_id_str,username,name,day,hour,link,urls,photos,video,thumbnail,retweet,nlikes,nreplies,nretweets,quote_url,search,near,geo,source,user_rt_id,user_rt,retweet_id,reply_to,retweet_date,translate,trans_src,trans_dest
0,1341445230717890560,1341445230717890560,1608660440000.0,2020-12-22 23:37:20,+0530,,भारतीय किसान यूनियन के हरिंदर सिंह लखोवाल ने कहा- 23 तारीख को हम एक टाइम का खाना नहीं खाएंगे. 27 तारीख को प्रधानमंत्री ने जो मन की बात का कार्यक्रम रखा है. उसका हम थालियां बजाकर विरोध करेंगे.  @nstomar @RakeshTikaitBKU @narendramodi @AmitShah   #FarmersProstests  https://t.co/h2pY32Da1n,hi,['farmersprostests'],[],3989159413,3989159413,Zee_Hindustan,ZEE HINDUSTAN,2,23,https://twitter.com/Zee_Hindustan/status/1341445230717890560,[],['https://pbs.twimg.com/media/Ep28KWRU8AAG3vy.png'],1,https://pbs.twimg.com/media/Ep28KWRU8AAG3vy.png,False,96,16,17,,#farmersprostests,,,,,,,[],,,,
1,1341434781167316997,1341434781167316997,1608657949000.0,2020-12-22 22:55:49,+0530,,"23 तारीख को हम एक टाइम का खाना नहीं खाएंगे। 26 और 27 तारीख़ को दूतावासों के बाहर हमारे लोग प्रदर्शन करेंगे। 27 तारीख को प्रधानमंत्री ने जो मन की बात का कार्यक्रम रखा है उसका हम थालियां बजाकर विरोध करेंगे: हरिंदर सिंह लखोवाल, भारतीय किसान यूनियन #FarmersProstests  https://t.co/dyVxdiEoQZ",hi,['farmersprostests'],[],1199243479714390021,1199243479714390021,AHindinews,ANI_HindiNews,2,22,https://twitter.com/AHindinews/status/1341434781167316997,[],['https://pbs.twimg.com/media/Ep23klMXIAMzGMb.jpg'],1,https://pbs.twimg.com/media/Ep23klMXIAMzGMb.jpg,False,93,42,12,,#farmersprostests,,,,,,,[],,,,
2,1341432915847049216,1341432915847049216,1608657504000.0,2020-12-22 22:48:24,+0530,,"कृषि कानूनों के खिलाफ जुटाए हस्ताक्षर राष्ट्रपति को सौंपने पर जानें क्‍यों दुविधा में रही कांग्रेस, अब कही यह बात #FarmerBill2020 #FarmersProstests #Congress   https://t.co/Pmy0AYasc8",hi,"['farmerbill2020', 'farmersprostests', 'congress']",[],64639742,64639742,JagranNews,Dainik Jagran,2,22,https://twitter.com/JagranNews/status/1341432915847049216,['https://www.jagran.com/politics/national-congress-in-dilemma-over-handing-over-collected-signatures-against-agricultural-laws-to-president-21193747.html'],[],0,,False,28,2,2,,#farmersprostests,,,,,,,[],,,,
3,1341431955536023552,1341431955536023552,1608657275000.0,2020-12-22 22:44:35,+0530,,"""नकल के लिए भी अकल"" की जरूरत होती है.....  #FarmersProstests  #किसान_आंदोलन",hi,"['farmersprostests', 'किसान_आंदोलन']",[],2536934545,2536934545,JitendraBaghel_,Jitendra Baghel जितेन्द्र बघेल,2,22,https://twitter.com/JitendraBaghel_/status/1341431955536023552,[],[],0,,False,21,0,4,https://twitter.com/BBCHindi/status/1341342740483870727,#farmersprostests,,,,,,,[],,,,
4,1341426629336166400,1341426629336166400,1608656005000.0,2020-12-22 22:23:25,+0530,,"If you say - only a limited few farmers, who do not represent all farmers of India - are protesting, why are you stopping all farmers approaching Delhi border from every direction? #FarmersProstests",en,['farmersprostests'],[],83983275,83983275,_RavinderSingh_,Ravinder Singh,2,22,https://twitter.com/_RavinderSingh_/status/1341426629336166400,[],[],0,,False,299,4,49,,#farmersprostests,,,,,,,[],,,,
5,1341415135852732417,1341415127967395840,1608653265000.0,2020-12-22 21:37:45,+0530,,"#FarmerReformLaws: How awareness of farm laws and people’s responses differ from state to state, shows @Network18Group survey.   #FarmersProstests #FarmerLaws |  https://t.co/LGAvTtjahh  https://t.co/Xn4KrBlEUK",en,"['farmerreformlaws', 'farmersprostests', 'farmerlaws']",[],68927629,68927629,moneycontrolcom,Moneycontrol,2,21,https://twitter.com/moneycontrolcom/status/1341415135852732417,['https://www.moneycontrol.com/news/india/huge-support-to-farm-reforms-from-most-agrarian-states-shows-news-18-network-survey-6254211.html'],['https://pbs.twimg.com/media/Ep2p70IUwAIQzqE.jpg'],1,https://pbs.twimg.com/media/Ep2p70IUwAIQzqE.jpg,False,6,0,0,,#farmersprostests,,,,,,,[],,,,
6,1341415127967395840,1341415127967395840,1608653263000.0,2020-12-22 21:37:43,+0530,,"#FarmerReformLaws: Huge support to farm reforms from most agrarian states, shows @Network18Group survey.   #FarmersProstests #FarmerLaws |  https://t.co/LGAvTtjahh  https://t.co/d4PfYf4Sf3",en,"['farmerreformlaws', 'farmersprostests', 'farmerlaws']",[],68927629,68927629,moneycontrolcom,Moneycontrol,2,21,https://twitter.com/moneycontrolcom/status/1341415127967395840,['https://www.moneycontrol.com/news/india/huge-support-to-farm-reforms-from-most-agrarian-states-shows-news-18-network-survey-6254211.html'],['https://pbs.twimg.com/media/Ep2pwS3XYAA1x1h.jpg'],1,https://pbs.twimg.com/media/Ep2pwS3XYAA1x1h.jpg,False,16,3,1,,#farmersprostests,,,,,,,[],,,,
7,1341255577284972545,1341255577284972545,1608615223000.0,2020-12-22 11:03:43,+0530,,"जमीन को अपनी माँ मानने वाले #आदिवासी अपनी आखरी सांस तक जल,जमीन,जंगल की लड़ाई को छोड़ने नही वाले  लेकिन इस बात को मुख्यधारा वाले वर्णव्यवस्था मे शामिल शरणार्थी लोग नही समजेंगे  क्योकि जमीन उनके लिए व्यपार है #आदिवासी_किसान #FarmersFirst #Farmers1st #FarmersProstests #coronavirus  https://t.co/6gEZfLQyMm",hi,"['आदिवासी', 'आदिवासी_किसान', 'farmersfirst', 'farmers1st', 'farmersprostests', 'coronavirus']",[],933622354277646336,933622354277646336,Chhotu_Vasava,Chhotubhai Vasava,2,11,https://twitter.com/Chhotu_Vasava/status/1341255577284972545,[],['https://pbs.twimg.com/media/Ep0Y1sUWMAAPoJT.jpg'],1,https://pbs.twimg.com/media/Ep0Y1sUWMAAPoJT.jpg,False,126,2,46,,#farmersprostests,,,,,,,[],,,,
