,id,date,tweet,hashtags,user_id,username,name,link,urls,nlikes,nretweets,nreplies
0,1479144316572475400,2022-01-06 23:04:20,"In November 2021, India's farmers won a historic victory.   They fought and overcame police repression, the COVID-19 pandemic, and strong international adversaries to bury the neoliberal agricultural bills, which were backed by the IMF and the US.    https://t.co/aqGzSJTJCX",[],1219283935865266178,ProgIntl,Progressive International,https://twitter.com/ProgIntl/status/1479144316572475400,['https://progressive.international/wire/2021-12-07-huge-victory-for-indian-farmers-after-modis-agricultural-reforms-are-repealed-by-parliament/en'],11,3,1
1,1479144309630853135,2022-01-06 23:04:19,"In 2020, India's parliament introduced three “Farm Bills” that attacked the livelihoods of farmers in service of foreign capital and big agribusiness. India's farmers launched a historic mobilization in response, as the Wire first covered in November 2020.  https://t.co/AIWhrwm6Uq",[],1219283935865266178,ProgIntl,Progressive International,https://twitter.com/ProgIntl/status/1479144309630853135,['https://progressive.international/wire/2020-11-24-the-farmers-of-punjab-vs-modis-farm-bills-in-photos/en/'],6,2,1
2,1479143226158170112,2022-01-06 23:00:00,UP CM Yogi Adityanath has announced a 50% rebate in power bills of private tubewells used by farmers in the state.  #UttarPradesh #Politics    https://t.co/49F5KJhiow,"['uttarpradesh', 'politics']",240649814,TimesNow,TIMES NOW,https://twitter.com/TimesNow/status/1479143226158170112,['https://www.timesnownews.com/india/article/ahead-of-polls-yogi-govt-announces-50-freeship-in-power-bills-of-private-tubewells-used-by-up-farmers/847048'],47,4,5
3,1479141387689807874,2022-01-06 22:52:42,"Ahead of #UttarPradesh polls, Yogi govt announces 50% rebate in power bills to farmers  Rashmi Sharma reports    https://t.co/NHWOWcMbSH",['uttarpradesh'],295693924,fpjindia,Free Press Journal,https://twitter.com/fpjindia/status/1479141387689807874,['https://www.freepressjournal.in/india/ahead-of-uttar-pradesh-polls-yogi-govt-announces-50-rebate-in-power-bills-to-farmers'],2,2,0
4,1479115037553926144,2022-01-06 21:08:00,"In a big relief to the farmers, Uttar Pradesh Chief Minister @myogiadityanath announces 50% freeship in power bills of private tubewells used by farmers in the state.  https://t.co/Cy9wRVpRTY",[],1056850669,airnewsalerts,All India Radio News,https://twitter.com/airnewsalerts/status/1479115037553926144,[],177,18,6
5,1479089975534653441,2022-01-06 19:28:24,Announcement just before the UP Polls. 50% freeship in farmers power bill of private tubewells.  #UPElection2022,['upelection2022'],173769066,Prashantps100,Prashant Srivastava,https://twitter.com/Prashantps100/status/1479089975534653441,[],3,2,0
0,1479136627427479554,2022-01-06 22:33:47,"‘मोदी को जूती दिखाओ, ₹74 लाख पाओ’ : पंजाब में PM के विरोध के लिए SFJ ने की थी इनाम की घोषणा, याद दिलाया ‘इंदिरा गाँधी’ का हाल  #khalistaniterrorists #Pannu #PMModi #PMModiSecurityLapse   https://t.co/dtzCRU5efv","['khalistaniterrorists', 'pannu', 'pmmodi', 'pmmodisecuritylapse']",1068155700168126464,OpIndia_in,ऑपइंडिया,https://twitter.com/OpIndia_in/status/1479136627427479554,['https://hindi.opindia.com/reports/national-security/khalistan-sfj-had-announced-rs-74-lakh-reward-to-disrupt-pm-modi-rally/'],130,67,3
1,1478964111832616962,2022-01-06 11:08:16,"#BulliBaiApp  Case: ""मैं हूं असली मास्टरमाइंड', फ्लाइट का खर्चा उठा लो तो सरेंडर के लिए तैयार हूं""  #BulliBaiApp  मामले में मुंबई पुलिस ने बेगुनाहों को गिरफ्तार किया    https://t.co/ajXcNy9DwA #KhalistaniTerrorists #YogiFor2022 #ModiFor2024","['bullibaiapp', 'bullibaiapp', 'khalistaniterrorists', 'yogifor2022', 'modifor2024']",370615515,RajeevGuptaCA,CA RAJEEV GUPTA,https://twitter.com/RajeevGuptaCA/status/1478964111832616962,['https://www.amarujala.com/india-news/bulli-bai-app-case-a-twitter-user-claimed-that-he-is-the-real-creator-and-mastermind-of-bulli-bai'],5,6,0
2,1478939353631969283,2022-01-06 09:29:53,PM माेदी की हत्या की साजिश हुई बेनकाब  इस बात के पुख्ता सबूत हैं कि कांग्रेस पार्टी और उसके नेता #Khalistaniterrorists  के बल पर  PM मोदी को अपने रास्ते से हमेशा के लिए हटाना चाहते थे    https://t.co/BvuSdGLG2g #ModiFor2024 #YogiFor2022 #NJAC,"['khalistaniterrorists', 'modifor2024', 'yogifor2022', 'njac']",370615515,RajeevGuptaCA,CA RAJEEV GUPTA,https://twitter.com/RajeevGuptaCA/status/1478939353631969283,['https://www.sudarshannews.in/Conspiracy-to-assassinate-PM-Modi-exposed-BJP-lashed-out-at-Congress-51328-newsdetails.aspx'],5,5,1
3,1478936682992787457,2022-01-06 09:19:17,क्या कांग्रेस ने रची PM मोदी की हत्या की साजिश ?   गृह मंत्रालय ने पंजाब सरकार से मांगी रिपोर्ट  #KhalistaniTerrorists का समर्थन करने वाली अन्य सभी विपक्षी पार्टियां इस हत्या की साज़िश पर अभी तक चुप्पी साधे हुए हैं क्योंकि उनका भी इस साज़िश में हाथ है    https://t.co/Otbs0C5ywN,['khalistaniterrorists'],370615515,RajeevGuptaCA,CA RAJEEV GUPTA,https://twitter.com/RajeevGuptaCA/status/1478936682992787457,['https://www.performindia.com/how-did-such-a-big-mistake-happen-in-the-security-of-pm-narendra-modi-home-ministry-sought-report-from-punjab-government/'],5,5,1
4,1478932707648237570,2022-01-06 09:03:29,"""Modi ji, how's the josh?""  Congress Party asks PM @narendramodi  after its failed attempt to assassinate him.  Congress Party in active connivance with the #KhalistaniTerrorists conspired to eliminate the PM Modi so that it can somehow come back to power  https://t.co/pUdWzLjW38",['khalistaniterrorists'],370615515,RajeevGuptaCA,CA RAJEEV GUPTA,https://twitter.com/RajeevGuptaCA/status/1478932707648237570,['https://www.indiatoday.in/india/story/-modi-ji-how-s-the-josh-pm-security-lapse-triggers-wild-reactions-from-political-leaders-1896427-2022-01-05'],9,6,1
5,1478922979895492609,2022-01-06 08:24:50,.@BJP4India workers who were on their way to attend PM @narendramodi jis rally in Punjab were beaten by #khalistaniterrorists.  This is the state of Sonia Gandhi’s Punjab.  Shame .   #BharatStandsWithModiJi  https://t.co/8ouHmFYHRg,"['khalistaniterrorists', 'bharatstandswithmodiji']",106081433,ashokepandit,Ashoke Pandit,https://twitter.com/ashokepandit/status/1478922979895492609,[],1966,849,70
0,1479178336291024897,2022-01-07 01:19:31,6 January SKM statement              SKM announced a symbolic protest for arrest of Ajay Mishra Teni and other outstanding demands but no program to stop P M's visit.  When some farmers were stopped by police they sat on road including Pyarayana flyover  where PMs convoy stopped,[],869868484297056256,SubhashiniAli,Subhashini Ali,https://twitter.com/SubhashiniAli/status/1479178336291024897,[],55,5,2
1,1479173422143840256,2022-01-07 01:00:00,Was the protest by farmers and a possible road blockade during PM Modi’s visit in #Punjab discussed during advance security liaison (ASL) meeting?  @LamaPrawesh speaks to officers across various agencies who explain the security protocol for PM.  https://t.co/4KLanHNFmg,['punjab'],36327407,htTweets,Hindustan Times,https://twitter.com/htTweets/status/1479173422143840256,['https://www.hindustantimes.com/india-news/pm-security-explained-101641409405429.html'],8,1,2
2,1479166385066500107,2022-01-07 00:32:02,"Punjab Cops Told About Farmers' Protest Ahead Of PM Visit, Reveals Letter  https://t.co/BmldYTwEsc  https://t.co/TJsQQp6kxF",[],96900937,ndtvfeed,NDTV News feed,https://twitter.com/ndtvfeed/status/1479166385066500107,['https://www.ndtv.com/india-news/punjab-police-was-intimated-about-farmers-protest-ahead-of-pm-visit-reveals-adgp-letter-2693468'],36,8,3
3,1479145163641409538,2022-01-06 23:07:42,"""Tell PM we were martyred for our land even wen PM said Na koi Ghusa hai, na kisi ne kabza kia hai"" ~20 brave hearts martyred in Galwan  ""Tell PM we could nt make it alive bcoz the PM didnt care to Listen to us or listen to our demands""~700 farmers martyred during farmer protests",[],42197010,VinayDokania,Vinay Kumar Dokania,https://twitter.com/VinayDokania/status/1479145163641409538,[],20,5,0
4,1479136521621938182,2022-01-06 22:33:22,"Khalistani's &amp; Congress is desperate for Dead Bodies, especially Sikh dead bodies. Allowing them to Parade them. They tried their level best during the ""Muftkhor"" alias Farmer protests. But the Police poured cold water over their plans.",[],18304860,Sootradhar,Jayess,https://twitter.com/Sootradhar/status/1479136521621938182,[],465,155,5
5,1479135467828170754,2022-01-06 22:29:11,#SamyuktKisanMorcha busts lies &amp; myths that Modi &amp; his Farmer-Haters Gang are trying to spin about farmers protests leading to security threat Modi faced the ultimate horror of a PM - a rally without people &amp; is now hiding behind this shenanigan  #JaiKisan #FarmersProtestPeaceful  https://t.co/nhfy4qB7ms,"['samyuktkisanmorcha', 'jaikisan', 'farmersprotestpeaceful']",886647512,aviksahaindia,Avik Saha,https://twitter.com/aviksahaindia/status/1479135467828170754,[],19,15,0
6,1479133459855597574,2022-01-06 22:21:12,Indian Prime Minister Narendra Modi was stranded in the open after farmers blocked a motorway as the country’s most guarded politician drove into the heart of a protest against farm laws. His aides blamed the breach on a political conspiracy.  https://t.co/psOHWiUife,[],17870319,RFI_En,RFI English,https://twitter.com/RFI_En/status/1479133459855597574,['https://tinyurl.com/y4hgbwk2'],1,1,0
7,1479129506052931585,2022-01-06 22:05:29,"2.  As per the pre-determined schedule, peaceful protests were held at every district and tehsil headquarters of Punjab on 5th January.  When some farmers were stopped by the police administration from going to the district headquarters of Ferozepur,",[],213020697,OzarkarVallabh,Vallabh Ozarkar,https://twitter.com/OzarkarVallabh/status/1479129506052931585,[],0,0,1
8,1479129502319927296,2022-01-06 22:05:28,"to Punjab on January 5, 10 farmer organizations affiliated to the Samyukta Kisan Morcha had announced a symbolic protest for the arrest of Ajay Mishra Teni and other outstanding demands.",[],213020697,OzarkarVallabh,Vallabh Ozarkar,https://twitter.com/OzarkarVallabh/status/1479129502319927296,[],0,0,1
9,1479125931104997385,2022-01-06 21:51:17,"PM SECURITY BREACH: POLITICS ESCALATES   On receiving the news of #PMModi proposed visit to Punjab on January 5, 10 farmer organizations affiliated with the Samyukta Kisan Morcha had announced a symbolic protest for the arrest of Ajay Mishra: Samyukt Kisan Morcha #securitybreach  https://t.co/UsjxJ5vnHI","['pmmodi', 'securitybreach']",3638215945,MirrorNow,Mirror Now,https://twitter.com/MirrorNow/status/1479125931104997385,[],4,0,0
10,1479124788664684544,2022-01-06 21:46:45,"सात सौ अधिक शहीद किसान- ""देश के पीएम से कह देना कि मैं जिंदा नहीं लौट पाया..."" #FarmersProtest #farmers  https://t.co/uwFGO81By7","['farmersprotest', 'farmers']",831394413272260610,inc_sanjeev,Sanjeev Singh,https://twitter.com/inc_sanjeev/status/1479124788664684544,[],10,3,0
11,1479123086897135616,2022-01-06 21:39:59,Can't think of a farmers' protest without YoYa. And that's one reason to think #Bhatinda road block was by imposters 😉 #justkidding,"['bhatinda', 'justkidding']",47083884,SandipGhose,GhoseSpot,https://twitter.com/SandipGhose/status/1479123086897135616,[],26,0,1
12,1479119177650618373,2022-01-06 21:24:27,#Punjab में #PMModi का काफिला रोकने वाले #SurjeetSinghPhool की पूरी कहानी..  सब्सक्राइब करें #TimesNowNavbharat 👉  https://t.co/ogFsKf9YX1  #TimesNowNavbharatOriginal #ModiSecurityBreach #NarendraModi #PunjabPolice #FarmersProtest #SecurityBreach  https://t.co/Zkz7ZfXxFV,"['punjab', 'pmmodi', 'surjeetsinghphool', 'timesnownavbharat', 'timesnownavbharatoriginal', 'modisecuritybreach', 'narendramodi', 'punjabpolice', 'farmersprotest', 'securitybreach']",927426236137201664,TNNavbharat,Times Now Navbharat,https://twitter.com/TNNavbharat/status/1479119177650618373,['https://bit.ly/TNNavbharatYouTube'],8,1,0
13,1479118709901852681,2022-01-06 21:22:35,"On receiving the news of PM Modi proposed visit to Punjab on January 5, 10 farmer organizations affiliated to the Samyukta Kisan Morcha had announced a symbolic protest for the arrest of Ajay Mishra Teni and other outstanding demands: Samyukt Kisan Morcha",[],355989081,ANI,ANI,https://twitter.com/ANI/status/1479118709901852681,[],982,88,38
14,1479118452518363140,2022-01-06 21:21:34,#FarmersProtest से बदले समीकरण को देखते हुए #BJP ने पश्चिमी उत्तर प्रदेश में जीत के लिए नए फॉर्मूले पर अमल शुरू कर दिया है.  #UPElections2022 #UttarPradesh    https://t.co/pxzCK7hTmo,"['farmersprotest', 'bjp', 'upelections2022', 'uttarpradesh']",927426236137201664,TNNavbharat,Times Now Navbharat,https://twitter.com/TNNavbharat/status/1479118452518363140,['https://www.timesnowhindi.com/elections/article/bjp-make-new-election-strategy-for-western-uttar-pradesh-will-it-benefit-the-party/381088'],8,1,0
15,1479106060820500500,2022-01-06 20:32:20,"After many attempts to scare farmers following #RepublicDay violence in 2021, the farmers stationed at Ghazipur border stand tall and affirm to continue their protest till farm laws are repealed, reported @Suchitrawrites   Read the full piece here:  https://t.co/TajPUt785w",['republicday'],99322430,TCNLive,TwoCircles.net,https://twitter.com/TCNLive/status/1479106060820500500,['http://twocircles.net/2021jan30/440764.html'],1,0,1
16,1479104684757372929,2022-01-06 20:26:51,Senior Political Analyst Prem Kumar : Weren't the intelligence agencies warned about the farmer protest from beforehand?  #IndiawithModi  @pradip103  @JMukadma  @IndiaNews_itv,['indiawithmodi'],4456498874,jankibaat1,Jan Ki Baat,https://twitter.com/jankibaat1/status/1479104684757372929,[],27,4,0
17,1479092828714143745,2022-01-06 19:39:45,"By his own admission @PMOIndia has said Punjab CM ensured his safety to bhatinda airport , but under his watch 700+ farmers didn't have the privilege of going back to their home alive !! #ModiRunsAway #FarmersProtest","['modirunsaway', 'farmersprotest']",35194696,vazhapadi,𝗥𝗮𝗺𝗮 𝗦𝘂𝗴𝗮𝗻𝘁𝗵𝗮𝗻 (வாழப்பாடி இராம சுகந்தன்),https://twitter.com/vazhapadi/status/1479092828714143745,[],13,11,0
18,1479092266178256902,2022-01-06 19:37:31,"लड़े हैं... जीते हैं लडेंगे... जीतेंगे  जय किसान आंदोलन 2015 से किसानों के हर सुख दुख में उनके  साथ खड़ा रहा है, संघर्ष करता रहा है।  जय किसान आंदोलन के संघर्ष की पूरी कहानी:  https://t.co/58RPlll5Vv  @_JaiKisan | #FarmersProtest  https://t.co/kZzBlEYxtn",['farmersprotest'],886647512,aviksahaindia,Avik Saha,https://twitter.com/aviksahaindia/status/1479092266178256902,['https://youtu.be/xRy4POXhVSI'],98,29,1
19,1479074874970628100,2022-01-06 18:28:24,Open calls to burn down Punjab!   Immediate action must be taken.   #FarmersProtest,['farmersprotest'],1323516625,rohinverma2410,Rohin Kumar,https://twitter.com/rohinverma2410/status/1479074874970628100,[],13,1,2
20,1479068360579051522,2022-01-06 18:02:31,"The government recently withdrew the 3 contentious farm laws after a year of protests. ""Despite several attempts to explain the benefits to the farmers, we have failed, thus repealing the laws,"" they said.  But, is this is the true reason? YKA member @harshbhusari7 asks. Read⬇️",[],16579578,YouthKiAwaaz,Youth Ki Awaaz,https://twitter.com/YouthKiAwaaz/status/1479068360579051522,[],2,0,0
21,1479066666948390915,2022-01-06 17:55:47,"PM Narendra Modi had to cancel his visit to Punjab's Ferozepur on Wednesday over a ""major lapse in security."" The main aspect of the lapse is how his cavalcade was stuck for 15-20 minutes on a flyover en route to his destination due to protest by farmers.  https://t.co/Mqb9RWMVkJ  https://t.co/WqLgLiXRNX",[],3181372676,NewsBytesApp,NewsBytes,https://twitter.com/NewsBytesApp/status/1479066666948390915,['https://www.newsbytesapp.com/news/india/modi-security-breach-punjab-police-erred-says-officials/story'],1,1,1
22,1479061043888357377,2022-01-06 17:33:27,"लड़े हैं... जीते हैं लडेंगे... जीतेंगे  जय किसान आंदोलन 2015 से किसानों के हर सुख दुख में उनके  साथ खड़ा रहा है, संघर्ष करता रहा है।  जय किसान आंदोलन के संघर्ष की पूरी कहानी:  https://t.co/3sn9WHTDZm  @_JaiKisan | #FarmersProtest  https://t.co/ZLTQbi8cIj",['farmersprotest'],3132907921,swaraj_abhiyan,Swaraj Abhiyan,https://twitter.com/swaraj_abhiyan/status/1479061043888357377,['https://youtu.be/xRy4POXhVSI'],9,6,0
23,1479040825304629254,2022-01-06 16:13:06,देश के पीएम से कह देना...   #IndiaStandsWithChanni #GoBackModi #FarmersProtest  https://t.co/NuXyUPF68d,"['indiastandswithchanni', 'gobackmodi', 'farmersprotest']",766154818436071424,VinodJakharIN,VINOD JAKHAR,https://twitter.com/VinodJakharIN/status/1479040825304629254,[],287,67,3
24,1479039554094977024,2022-01-06 16:08:03,#EXCLUSIVE | There was no plan for PM Modi to take the road route: Punjab CM @CHARANJITCHANNI to @ashokasinghal2 | #Punjab #PunjabPolls #FarmersProtest  https://t.co/ga2Bq4Ag6z,"['exclusive', 'punjab', 'punjabpolls', 'farmersprotest']",19897138,IndiaToday,IndiaToday,https://twitter.com/IndiaToday/status/1479039554094977024,[],203,61,11
25,1479035928869883906,2022-01-06 15:53:39,"PM Narendra Modi Security Lapse: Investigate If PM's Rally Cancelled Due to Security Breach or Farmers' Anger, Says Rakesh Tikait  #PMNarendraModi #RakeshTikait  #FarmersProtest #Farmers @narendramodi @RakeshTikaitBKU   https://t.co/QXfNKr41R7","['pmnarendramodi', 'rakeshtikait', 'farmersprotest', 'farmers']",828841083257778176,latestly,LatestLY,https://twitter.com/latestly/status/1479035928869883906,['https://www.latestly.com/india/news/pm-narendra-modi-security-lapse-investigate-if-pms-rally-cancelled-due-to-security-breach-or-farmers-anger-says-rakesh-tikait-3227864.html'],0,0,0
26,1479035765204164608,2022-01-06 15:53:00,President #RamNathKovind has expressed concern over the #PMModi security breach yesterday at #Punjab due to protests by farmers.   Read more here:  https://t.co/TUc8NzbWET  https://t.co/eZbmrm2NRs,"['ramnathkovind', 'pmmodi', 'punjab']",36327407,htTweets,Hindustan Times,https://twitter.com/htTweets/status/1479035765204164608,['https://bit.ly/3sYs2Bb'],21,4,0
27,1479034451615125505,2022-01-06 15:47:47,"BJP seeks clarification from Rahul Gandhi over security breach, says Congress used farmers to harm PM Modi. Listen to this press briefing by Punjab BJP president. #Punjab #PunjabPolls #FarmersProtest  https://t.co/rRmyfooSoh","['punjab', 'punjabpolls', 'farmersprotest']",19897138,IndiaToday,IndiaToday,https://twitter.com/IndiaToday/status/1479034451615125505,[],13,7,13
28,1479034127802253312,2022-01-06 15:46:29,"#WATCH Farmers sat on protest at Delhi borders for over a year,but yesterday when PM had to wait for around 15 mins he was troubled by it. Why these double standards? Modi Ji, you had said that you'll double farmers' income but you even took away what they had: #NavjotSinghSidhu  https://t.co/kzBGkLSO61","['watch', 'navjotsinghsidhu']",18159588,Oneindia,Oneindia News,https://twitter.com/Oneindia/status/1479034127802253312,[],0,0,1
29,1479031179114287105,2022-01-06 15:34:46,"#Farmers sat on protest at #Delhi borders for over a year, but the #PM had problems waiting for just 15 minutes: #Congress leader Navjot Singh Sidhu #PMSecurityLapse #PMSecurityBreach #FarmersProtest #Punjab   https://t.co/1yYscSUXjl","['farmers', 'delhi', 'pm', 'congress', 'pmsecuritylapse', 'pmsecuritybreach', 'farmersprotest', 'punjab']",929076201187975168,NENowNews,NorthEast Now,https://twitter.com/NENowNews/status/1479031179114287105,['https://nenow.in/top-news/sympathy-farmers-pm-security-breach.html'],4,1,0
30,1479030773768339456,2022-01-06 15:33:10,"Farmers sat on protest at Delhi borders for over a year,but yesterday when PM had to wait for around 15 mins he was troubled by it. Why these double standards? Modi Ji, you had said that you'll double farmers' income but you even took away what they had: #NavjotSidhu, Cong. (ANI)",['navjotsidhu'],4456498874,jankibaat1,Jan Ki Baat,https://twitter.com/jankibaat1/status/1479030773768339456,[],37,5,4
31,1479028227041492992,2022-01-06 15:23:02,Security breach: Kisan leader says SSP told them about PM Modi's route. Listen to what he said. #Punjab #PunjabPolls #FarmersProtest  https://t.co/kfGBdZjunW,"['punjab', 'punjabpolls', 'farmersprotest']",19897138,IndiaToday,IndiaToday,https://twitter.com/IndiaToday/status/1479028227041492992,[],33,9,11
32,1479027930269249536,2022-01-06 15:21:52,Modi and BJP forced the farmers to protest against the three black laws due to which 750 farmers lost their lives.   #KisanVirodhiModi  #70000Kursi700Bande  https://t.co/tHgiW8cMlR,"['kisanvirodhimodi', '70000kursi700bande']",2940723738,INCPunjab,Punjab Congress,https://twitter.com/INCPunjab/status/1479027930269249536,[],68,29,8
33,1479023693095342082,2022-01-06 15:05:02,"""Farmers sat on protest at Delhi borders for over a year, but yesterday when PM had to wait for around 15 mins he was troubled by it. Why these double standards?"" - PPCC chief @sherryontopp   #70000Kursi700Bande",['70000kursi700bande'],3168378830,IYCPunjab,Punjab Youth Congress,https://twitter.com/IYCPunjab/status/1479023693095342082,[],24,13,0
34,1479023505370857473,2022-01-06 15:04:17,"#VIDEO | Farmers sat on protest at Delhi borders for over a year,but y'day when PM had to wait for around 15 mins he was troubled by it. Why these double standards? Modi Ji, you had said that you'll double farmers' income but you even took away what they had: @sherryontopp   ANI  https://t.co/Uh81VfmZKO",['video'],231692806,JagranEnglish,Jagran English,https://twitter.com/JagranEnglish/status/1479023505370857473,[],2,0,1
35,1479022799523966976,2022-01-06 15:01:28,"Farmers sat on protest at Delhi borders for over a year, but yesterday when PM had to wait for around 15 mins he was troubled by it. Why these double standards? Modi Ji, you had said that you'll double farmers' income but you even took away what they had: Navjot Sidhu, Congress",[],1017101762,TOIChandigarh,TOIChandigarh,https://twitter.com/TOIChandigarh/status/1479022799523966976,[],11,1,1
36,1479022512226725893,2022-01-06 15:00:20,"#WATCH Farmers sat on protest at Delhi borders for over a year,but yesterday when PM had to wait for around 15 mins he was troubled by it. Why these double standards? Modi Ji, you had said that you'll double farmers' income but you even took away what they had: Navjot Sidhu, Cong  https://t.co/qtflt4WmOI",['watch'],355989081,ANI,ANI,https://twitter.com/ANI/status/1479022512226725893,[],2152,409,835
37,1479007831109996546,2022-01-06 14:02:00,Was the protest by farmers and a possible road blockade during PM Modi’s visit in #Punjab discussed during advance security liaison (ASL) meeting?  HT speaks to officers across various agencies who explain the security protocol for PM  | By @LamaPrawesh   https://t.co/4KLanHNFmg,['punjab'],36327407,htTweets,Hindustan Times,https://twitter.com/htTweets/status/1479007831109996546,['https://www.hindustantimes.com/india-news/pm-security-explained-101641409405429.html'],17,1,1
38,1479001772202938369,2022-01-06 13:37:55,"#PMSecurityBreach | The way BKU leaders jammed Moga-Ferozepur road near PM  @narendramodi's rally &amp; made @BJP4India leaders travel on patchy road, they deserve our appreciation. I thank all of them: BKU-Krantikari leader Surjeet Singh Phool  @RakeshTikaitBKU #FarmersProtest  https://t.co/rNTjtwpAXu","['pmsecuritybreach', 'farmersprotest']",896740409346371584,editorji,Editorji,https://twitter.com/editorji/status/1479001772202938369,[],3,0,0
39,1479000206326702081,2022-01-06 13:31:42,"Babu Lal Singh, a farmer from Mirzapur in UP, sold his 124 quintals of paddy on Dec 23, 2019. He claims he is yet to receive his payment of Rs 227,540. Several farmers under the banner of Bhartiya Kisan Union have assembled at Mirzapur collector office to protest.  🎥 @Mirzapuriy  https://t.co/f12EVqNNvQ",[],1205044900951027714,GaonConnectionE,Gaon Connection English,https://twitter.com/GaonConnectionE/status/1479000206326702081,[],18,10,3
