,id,conversation_id,created_at,date,timezone,place,tweet,language,hashtags,cashtags,user_id,user_id_str,username,name,day,hour,link,urls,photos,video,thumbnail,retweet,nlikes,nreplies,nretweets,quote_url,search,near,geo,source,user_rt_id,user_rt,retweet_id,reply_to,retweet_date,translate,trans_src,trans_dest
0,1387165410504622081,1387154159217094659,1619560980000.0,2021-04-28 03:33:00,+0530,,"For folks wondering how the House criminal justice committee voted on the defeated medical cannabis bill —  Yes: Beck, Dixie, Doggett, Farmer, Hardaway, Lamar, J. Sexton, Curcio  No: Campbell, Griffey, Hawk, Howell, Hulsey, Lamberth, Moody, Russell, Sherrell  #tnleg",en,['tnleg'],[],38026753,38026753,natalie_allison,Natalie Allison,3,03,https://twitter.com/natalie_allison/status/1387165410504622081,[],[],0,,False,25,7,12,,farmers' bill,,,,,,,[],,,,
1,1387139235778551808,1387139235778551808,1619554740000.0,2021-04-28 01:49:00,+0530,,Supporters of the bill said Indiana’s current wetlands law is too strict — causing home prices to go up and creating conflicts between farmers and state environmental regulators.  ➡️ @beckythiele  https://t.co/ai1o0VyQgD,en,[],[],21782431,21782431,WFIUNews,WFIU News,3,01,https://twitter.com/WFIUNews/status/1387139235778551808,['http://bit.ly/3vB7JrJ'],[],0,,False,0,0,0,,farmers' bill,,,,,,,[],,,,
2,1387095040980185088,1387095040980185088,1619544203000.0,2021-04-27 22:53:23,+0530,,#AB350 gets unanimous support once again as it moves through its 2nd policy committee. This bill provides the much needed technical support to help farmers and ranchers maintain their property's economical viability as they comply with #SGMA.  https://t.co/pmv95kZQNh @AgNetWest,en,"['ab350', 'sgma']",[],1335991011290443776,1335991011290443776,AsmVillapudua,Assemblymember Carlos Villapudua,2,22,https://twitter.com/AsmVillapudua/status/1387095040980185088,['https://agnetwest.com/sgma-assistance-bill-moving-through-legislative-process/'],[],0,,False,3,2,0,,farmers' bill,,,,,,,[],,,,
3,1387082351709143042,1387082351709143042,1619541178000.0,2021-04-27 22:02:58,+0530,,"“W/ the Ag Conservation Assistance Program, supporting our farmers &amp; ensuring clean waterways for generations to come would not be mutually exclusive goals.” (full article:  https://t.co/G7YCx6yyTm) More on the bill by @SenatorGeneYaw here:  https://t.co/gW7ZRNRAhg  https://t.co/RzP5YDYAiz",en,[],[],226257979,226257979,SenatorAument,Sen. Ryan P. Aument,2,22,https://twitter.com/SenatorAument/status/1387082351709143042,"['https://tinyurl.com/dnsuxdbn', 'https://www.legis.state.pa.us/cfdocs/billInfo/billInfo.cfm?sYear=2021&sInd=0&body=S&type=B&bn=0465']",['https://pbs.twimg.com/media/Ez_oC9DWEAM3Bf8.jpg'],1,https://pbs.twimg.com/media/Ez_oC9DWEAM3Bf8.jpg,False,1,1,0,,farmers' bill,,,,,,,[],,,,
4,1387036357609115653,1387036357609115653,1619530212000.0,2021-04-27 19:00:12,+0530,,"The start of the cropping season always represents an exciting time of year for longtime dairy farmer Bill Deutsch, @DCFBureau member from Sycamore. Read his #Plant21 outlook on @FarmWeekNow:  https://t.co/hSKwTVyub3  https://t.co/1PO2ddmBui",en,['plant21'],[],59143682,59143682,ILFarmBureau,Illinois Farm Bureau,2,19,https://twitter.com/ILFarmBureau/status/1387036357609115653,['https://bit.ly/3xlbN0H'],['https://pbs.twimg.com/media/Ez--NyFX0AMpfRj.jpg'],1,https://pbs.twimg.com/media/Ez--NyFX0AMpfRj.jpg,False,2,0,1,,farmers' bill,,,,,,,[],,,,
5,1386950825080152064,1386950825080152064,1619509819000.0,2021-04-27 13:20:19,+0530,,"As #Morocco's parliament prepares to debate a bill on legalising #cannabis for medical use, farmers are hoping to sell on the open market but fear their income will be slashed  https://t.co/cRnl5xBfcp",en,"['morocco', 'cannabis']",[],2316030049,2316030049,africanews,africanews 😷,2,13,https://twitter.com/africanews/status/1386950825080152064,['https://bit.ly/2R5flDu'],[],0,,False,4,0,0,,farmers' bill,,,,,,,[],,,,
6,1386885313650335747,1386885313650335747,1619494200000.0,2021-04-27 09:00:00,+0530,,Some state senate members are trying to pass a bill that would help farmers better conserve water and keep fertilizers out.   https://t.co/vGfws9kxqN,en,[],[],9651842,9651842,CBS21NEWS,CBS 21 News,2,09,https://twitter.com/CBS21NEWS/status/1386885313650335747,['https://local21news.com/news/local/state-senate-members-push-bill-to-help-farmers-conserve-water-keep-fertilizers-out'],[],0,,False,1,0,1,,farmers' bill,,,,,,,[],,,,
