,id,conversation_id,created_at,date,timezone,place,tweet,language,hashtags,cashtags,user_id,user_id_str,username,name,day,hour,link,urls,photos,video,thumbnail,retweet,nlikes,nreplies,nretweets,quote_url,search,near,geo,source,user_rt_id,user_rt,retweet_id,reply_to,retweet_date,translate,trans_src,trans_dest
0,1468933138239741953,1468933138239741953,1639055926000.0,2021-12-09 18:48:46,+0530,,सभी #किसान भाइयों और बहनों को इस ऐतिहासिक जीत की बधाई। #भाजपा_सरकार को पहले ही अपनी हठ छोड़ देनी चाहिए थी। कांग्रेस पार्टी सदा ही किसानों के साथ थी और रहेगी। #FarmersDefeatedArrogance @priyankagandhi @RahulGandhi  https://t.co/5w99ss1TMi,hi,"['किसान', 'भाजपा_सरकार', 'farmersdefeatedarrogance']",[],1329150212,1329150212,TheRajanRao,Rajan Rao,4,18,https://twitter.com/TheRajanRao/status/1468933138239741953,[],"['https://pbs.twimg.com/media/FGKy5jrVkAYJxdH.jpg', 'https://pbs.twimg.com/media/FGKy5j0VIAIkBxC.jpg']",1,https://pbs.twimg.com/media/FGKy5jrVkAYJxdH.jpg,False,12,1,3,,#किसान,,,,,,,[],,,,
1,1468905029729878018,1468905029729878018,1639049224000.0,2021-12-09 16:57:04,+0530,,#किसान नेताओं को मिला #सरकार का पत्र  #किसानआंदोलन  https://t.co/agNtdnqhT5,hi,"['किसान', 'सरकार', 'किसानआंदोलन']",[],584704422,584704422,shashimohan_s,Shashi Mohan Sharma,4,16,https://twitter.com/shashimohan_s/status/1468905029729878018,[],['https://pbs.twimg.com/media/FGKZVSvWYAQ6qmv.jpg'],1,https://pbs.twimg.com/media/FGKZVSvWYAQ6qmv.jpg,False,12,1,0,,#किसान,,,,,,,[],,,,
2,1468889331003629570,1468889331003629570,1639045481000.0,2021-12-09 15:54:41,+0530,,गाजीपुर बॉर्डर पर किसान एक दूसरे का मुंह मीठा कराते हुए। @RakeshTikaitBKU @rkmsofficial #kisanektazindabaad #किसान #किसानआंदोलन  https://t.co/xVuh7cit35,hi,"['kisanektazindabaad', 'किसान', 'किसानआंदोलन']",[],2896594519,2896594519,kunal635,Kunal Kashyap,4,15,https://twitter.com/kunal635/status/1468889331003629570,[],['https://pbs.twimg.com/media/FGKLDsRVUAMRHSg.jpg'],1,https://pbs.twimg.com/media/FGKLDsRVUAMRHSg.jpg,False,15,2,3,,#किसान,,,,,,,[],,,,
3,1468883561495158784,1468883561495158784,1639044106000.0,2021-12-09 15:31:46,+0530,,मतलब #किसानआंदोलन  को स्थगित समझा जाये.....  #किसान  #किसानआंदोलन  @RakeshTikaitBKU  @mlkhattar  @PMOIndia  @_YogendraYadav,hi,"['किसानआंदोलन', 'किसान', 'किसानआंदोलन']",[],140761905,140761905,DharamvirNews,Dharamvir Sharma,4,15,https://twitter.com/DharamvirNews/status/1468883561495158784,[],[],0,,False,2,0,0,https://twitter.com/News18India/status/1468876429471322112,#किसान,,,,,,,[],,,,
4,1468882361332862978,1468882361332862978,1639043820000.0,2021-12-09 15:27:00,+0530,,किसान मोर्च ने किसान आंदोलन स्थगित किया... #किसानआंदोलन  #किसानआंदोलनस्थगित #किसान,hi,"['किसानआंदोलन', 'किसानआंदोलनस्थगित', 'किसान']",[],462902673,462902673,News18Rajasthan,News18 Rajasthan,4,15,https://twitter.com/News18Rajasthan/status/1468882361332862978,[],[],0,,False,48,1,4,,#किसान,,,,,,,[],,,,
5,1468880658869075969,1468880658869075969,1639043414000.0,2021-12-09 15:20:14,+0530,,#किसान_आंदोलन हुआ खत्म....11 दिसंबर को सुबह 9 बजे #सिंधु_बॉर्डर से रवाना होंगे किसान   #पंजाब की #किसान_जत्थेबंदिया 13 दिसंबर को #दरबार_साहिब होंगे नतमस्तक...15 जनवरी को होगी #संयुक्त_किसान_मोर्चा की बैठक  #किसानआंदोलन  #किसान   @RakeshTikaitBKU  @PMOIndia  @mlkhattar  @nstomar  https://t.co/iM7zqcN83G,hi,"['किसान_आंदोलन', 'सिंधु_बॉर्डर', 'पंजाब', 'किसान_जत्थेबंदिया', 'दरबार_साहिब', 'संयुक्त_किसान_मोर्चा', 'किसानआंदोलन', 'किसान']",[],140761905,140761905,DharamvirNews,Dharamvir Sharma,4,15,https://twitter.com/DharamvirNews/status/1468880658869075969,[],[],1,https://pbs.twimg.com/ext_tw_video_thumb/1468880635376791553/pu/img/y_CjYnVosF2zmFTi.jpg,False,10,1,1,,#किसान,,,,,,,[],,,,
6,1468871740176564225,1468871740176564225,1639041287000.0,2021-12-09 14:44:47,+0530,,"किसानों ने घर वापसी का फैंसला लिया  11 को घर वापसी ,15 जनवरी  को अगली समीक्षा बैठक  CdS को दी गई श्रद्धांजलि ,कल उनकी अंतिम यात्रा के चलते परसो विजय जुलूस के साथ होगी वापसी। #किसान",hi,['किसान'],[],146470107,146470107,mohitbakshi88,Mohit Bakshi B+,4,14,https://twitter.com/mohitbakshi88/status/1468871740176564225,[],[],0,,False,8,0,0,https://twitter.com/mohitbakshi88/status/1468850307627057152,#किसान,,,,,,,[],,,,
7,1468871242014810112,1468871242014810112,1639041169000.0,2021-12-09 14:42:49,+0530,,किसान आंदोलन खत्म होने  के बाद की तस्वीरें किसान मोर्चा ने कहा बड़ी जीत लेकर जा रहे हैं.  11 दिसम्बर से बॉर्डर से किसान हटेंगे 13 दिसम्बर को स्वर्ण मंदिर जाएंगे 15 जनवरी को संयुक्त किसान मोर्चा की बैठक होगी  #FarmLawsRepealed #FarmersProtests #किसानआंदोलन #किसान #KisanAndolan  https://t.co/AP0qVHq2UJ,hi,"['farmlawsrepealed', 'farmersprotests', 'किसानआंदोलन', 'किसान', 'kisanandolan']",[],65519909,65519909,MadhawTiwari,Madhaw Tiwari,4,14,https://twitter.com/MadhawTiwari/status/1468871242014810112,[],[],1,https://pbs.twimg.com/ext_tw_video_thumb/1468870593411883008/pu/img/KfRhJ6u0blXnn06u.jpg,False,5,0,1,,#किसान,,,,,,,[],,,,
8,1468867848449638400,1468867848449638400,1639040359000.0,2021-12-09 14:29:19,+0530,,सिंघु बॉर्डर पर SKM की बैठक खत्म हो गई है। किसान संगठनों की बीच आंदोलन समाप्त करने की सहमति बन गई है।  आंदोलन समाप्त की औपचारिक घोषणा होनी बाकी है। 15 जनवरी को अगली बैठक होगी।  #किसानआंदोलन #किसान @RakeshTikaitBKU @OfficialBKU  https://t.co/4l6aCpgCpj,hi,"['किसानआंदोलन', 'किसान']",[],2697688184,2697688184,rajatkmishra1,Rajat Mishra,4,14,https://twitter.com/rajatkmishra1/status/1468867848449638400,[],['https://pbs.twimg.com/media/FGJ3hhGVIAAapfK.jpg'],1,https://pbs.twimg.com/media/FGJ3hhGVIAAapfK.jpg,False,14,0,7,,#किसान,,,,,,,[],,,,
9,1468792946648489987,1468792946648489987,1639022501000.0,2021-12-09 09:31:41,+0530,,"अंततः केंद्र की मोदी सरकार आंदोलन-जीवियों,  मवालियों,खालिस्तानियों,आतंकियों,उपद्रवियों, अंतरराष्ट्रीय षड्यंत्रकरियों को #किसान मानने को तैयार हो ही गई और जिन किसानों ने जान दे डाली उन्हें #शहीद मानते हुए उनके परिवारों को #मुआवजा देते हुए सारे मामले वापस लेगी. @RahulGandhi 😊👍  https://t.co/tcSQ5OH4bJ",hi,"['किसान', 'शहीद', 'मुआवजा']",[],109930762,109930762,LambaAlka,Alka Lamba,4,09,https://twitter.com/LambaAlka/status/1468792946648489987,[],[],1,https://pbs.twimg.com/ext_tw_video_thumb/1468792718616711171/pu/img/WGM3iB7fuWRrG1Oh.jpg,False,1936,48,474,,#किसान,,,,,,,[],,,,
10,1468776509003476995,1468776509003476995,1639018582000.0,2021-12-09 08:26:22,+0530,,सुबह की बड़ी #खबरें   &gt; आज #दिल्ली लाया जाएगा CDS #बिपिन_रावत और उनकी पत्नी का पार्थिव शरीर  &gt; आज आंदोलन खत्म करने का ऐलान कर सकते हैं #किसान  &gt; #रोहित_शर्मा को ODI कमान मिलने पर छिड़ा विवाद  पूरा एपिसोड यहाँ सुनिए:  https://t.co/4xCctTvVOK  #NewsUpdate @Live_Hindustan  https://t.co/SREkV4XBhF,hi,"['खबरें', 'दिल्ली', 'बिपिन_रावत', 'किसान', 'रोहित_शर्मा', 'newsupdate']",[],1203884614239932416,1203884614239932416,HTSmartcast,HT Smartcast,4,08,https://twitter.com/HTSmartcast/status/1468776509003476995,['https://www.htsmartcast.com/news-podcasts/hindustan-daily-news-wrap/'],['https://pbs.twimg.com/media/FGIkOfzVkAMO1Ld.jpg'],1,https://pbs.twimg.com/media/FGIkOfzVkAMO1Ld.jpg,False,11,0,3,,#किसान,,,,,,,[],,,,
