,id,conversation_id,created_at,date,timezone,place,tweet,language,hashtags,cashtags,user_id,user_id_str,username,name,day,hour,link,urls,photos,video,thumbnail,retweet,nlikes,nreplies,nretweets,quote_url,search,near,geo,source,user_rt_id,user_rt,retweet_id,reply_to,retweet_date,translate,trans_src,trans_dest
0,1401235579707084807,1401235579707084807,1622915570000.0,2021-06-05 23:22:50,+0530,,"राजनीतिक गिद्द @RahulGandhi ने #Toolkit में साफ शब्दों में लिखकर कांग्रेसी मुख्यमंत्रियों को भेजा था, कि वैक्सीन की जमकर बर्बादी करना ताकि जनता में वैक्सीन के लिए अफरा तफरी का सा माहौल बने।   @RahulGandhi की नीचता ने सारी हदें पार कर दी।  #VaccinationGhotala #VaccineWastage  https://t.co/5T8IyObBM8",hi,"['toolkit', 'vaccinationghotala', 'vaccinewastage']",[],2354589132,2354589132,SunilYadavBJP,Sunil Yadav,6,23,https://twitter.com/SunilYadavBJP/status/1401235579707084807,[],['https://pbs.twimg.com/media/E3IwTtHVcAMYyfA.jpg'],1,https://pbs.twimg.com/media/E3IwTtHVcAMYyfA.jpg,False,179,1,49,,#toolkit,,,,,,,[],,,,
1,1401179432455266311,1401179432455266311,1622902184000.0,2021-06-05 19:39:44,+0530,,"ರಾಜ್ಯವನ್ನು ಎಲ್ಲಾ ಬಗೆಯಲ್ಲೂ ಹಳ್ಳ ಹಿಡಿಸಿದ ಬಿಜೆಪಿಗೆ ಈಗ ವರ್ಚಸ್ಸು ವೃದ್ಧಿಯ ಚಿಂತೆ!  ಅಲ್ಲಿ ಮೋದಿ ವರ್ಚಸ್ಸು ವೃದ್ಧಿಗೆ #Toolkit ತಂತ್ರಗಾರಿಕೆ, ಇಲ್ಲಿ ವರ್ಚಸ್ಸು ವೃದ್ಧಿಗೆ ಸಮಿತಿ!  @BJP4Karnataka ನಿಮ್ಮ ಯೋಗ್ಯತೆ ಬಯಲಾಗಿದೆ, ಎಷ್ಟೇ ತಿಪ್ಪರಲಾಗ ಹಾಕಿದರೂ ಮಂಕುಬೂದಿ ಎರಚಲಾಗದು, ಜನ ನಿಮ್ಮನ್ನು ಮನೆಗೆ ಕಳಿಸುವುದು ನಿಶ್ಚಿತ.  https://t.co/epgT9qQtJU",kn,['toolkit'],[],758572309368098816,758572309368098816,INCKarnataka,Karnataka Congress,6,19,https://twitter.com/INCKarnataka/status/1401179432455266311,[],['https://pbs.twimg.com/media/E3H9QmgVIAAvyGK.jpg'],1,https://pbs.twimg.com/media/E3H9QmgVIAAvyGK.jpg,False,77,2,37,,#toolkit,,,,,,,[],,,,
2,1401178533469122564,1401178533469122564,1622901969000.0,2021-06-05 19:36:09,+0530,,"🔥Congress Toolkit changed 1000 families life 🔥 Today my brother @PatelRameshRed1  Telangana Pcc Secretry distributed 25 kgs rice, vegetables &amp; fruits through me in suryapet town. @RahulGandhi @priyankagandhi @manickamtagore @JitendraSAlwar #Toolkit #CongressToolkit #Covid_19  https://t.co/RLYlcH7ld0",en,"['toolkit', 'congresstoolkit', 'covid_19']",[],1187739234863591425,1187739234863591425,seethakkaMLA,Danasari Anasuya (Seethakka),6,19,https://twitter.com/seethakkaMLA/status/1401178533469122564,[],[],1,https://pbs.twimg.com/ext_tw_video_thumb/1401178238668312583/pu/img/szehO2e_IqPrjxx3.jpg,False,1036,27,242,,#toolkit,,,,,,,[],,,,
3,1401092443093692420,1401092443093692420,1622881444000.0,2021-06-05 13:54:04,+0530,,"सोनिया जी, @bhupeshbaghel ने हमारे बच्चों की वैक्सीन क्या आपके कहने पर बर्बाद की?  इस बात की भी जांच होनी चाहिये कि यह बर्बादी जान बूझ कर रणनीति के तहत तो नहीं की गयी?  #toolkit  https://t.co/76nk0Lj7kP",hi,['toolkit'],[],1698414426,1698414426,BJP4CGState,BJP Chhattisgarh,6,13,https://twitter.com/BJP4CGState/status/1401092443093692420,[],['https://pbs.twimg.com/media/E3Gt9n9VEAMvSKi.jpg'],1,https://pbs.twimg.com/media/E3Gt9n9VEAMvSKi.jpg,False,114,4,50,,#toolkit,,,,,,,[],,,,
4,1401080009939320832,1401080009939320832,1622878479000.0,2021-06-05 13:04:39,+0530,,"ट्विटर की पॉलिसी में #ToolKit का असर साफ दिख रहा है, एक व्यक्ति जो इस दुनिया में नहीं हैं और 8 महीने से ट्विटर एकाउंट भी एक्टिव नहीं है फिर भी #blueTick नहीं हटा है।  दूसरी तरफ @RSSorg सरसंघचालक आदरणीय श्री @DrMohanBhagwat जी के एकाउंट से #blueTick हटा दिया है।  Shame On Twitter  https://t.co/YjSw6GGFS8",hi,"['toolkit', 'bluetick', 'bluetick']",[],892370345511997440,892370345511997440,INeetuDabas,Neetu Singh 🇮🇳,6,13,https://twitter.com/INeetuDabas/status/1401080009939320832,[],['https://pbs.twimg.com/media/E3Gi1CLVkAIZHht.jpg'],1,https://pbs.twimg.com/media/E3Gi1CLVkAIZHht.jpg,False,487,25,260,,#toolkit,,,,,,,[],,,,
5,1400999453343981569,1400999453343981569,1622859273000.0,2021-06-05 07:44:33,+0530,,ಮಕ್ಕಳು ಈ ದೇಶದ ಭವಿಷ್ಯ. ಅವರನ್ನು ಯಾವುದೇ ಕಾರಣಕ್ಕೂ ರಾಜಕೀಯಕ್ಕೆ ಬಳಸಿಕೊಳ್ಳಬಾರದು. ಅವರಿಗೆ ಪಕ್ಷಾತೀತವಾಗಿ ಶಿಕ್ಷಣ ನೀಡಬೇಕು. ಆಗಲೇ ಉತ್ತಮ ಸಮಾಜ ನಿರ್ಮಾಣವಾಗುತ್ತದೆ. ಶಾಲಾ #Whatsapp ನಲ್ಲಿ ಹರಿದಾಡುತಿರುವ #Toolkit ಈ ದೇಶದ ಮತ್ತು ಮಕ್ಕಳ ಭವಿಷ್ಯದ ದೃಷ್ಟಿಯಿಂದ ಅಪಾಯಕಾರಿಯಾಗಿದೆ.  https://t.co/8U66Jq579d,kn,"['whatsapp', 'toolkit']",[],1010735390481735681,1010735390481735681,GCC_MP,GC ChandraShekhar,6,07,https://twitter.com/GCC_MP/status/1400999453343981569,[],[],1,https://pbs.twimg.com/ext_tw_video_thumb/1400999351061680131/pu/img/QtB7By99PB9B5aDx.jpg,False,65,3,20,,#toolkit,,,,,,,[],,,,
