,id,conversation_id,created_at,date,timezone,place,tweet,language,hashtags,cashtags,user_id,user_id_str,username,name,day,hour,link,urls,photos,video,thumbnail,retweet,nlikes,nreplies,nretweets,quote_url,search,near,geo,source,user_rt_id,user_rt,retweet_id,reply_to,retweet_date,translate,trans_src,trans_dest
0,1442632646010474499,1442632646010474499,1632785400000.0,2021-09-28 05:00:00,+0530,,"किसान आंदोलन: भारत बंद को मिला-जुला असर, टिकैत ने कहा- आंदोलन सफ़ल रहा   #किसानआंदोलन #भारतबंद #राकेशटिकैत #कृषिकानून #FarmersProtest #BharatBandh #RakeshTikait #FarmLaws   https://t.co/R3qQ7wjuOE",hi,"['किसानआंदोलन', 'भारतबंद', 'राकेशटिकैत', 'कृषिकानून', 'farmersprotest', 'bharatbandh', 'rakeshtikait', 'farmlaws']",[],817340591046414336,817340591046414336,thewirehindi,द वायर हिंदी,2,05,https://twitter.com/thewirehindi/status/1442632646010474499,['http://thewirehindi.com/187940/farmers-protest-mix-response-of-bharat-bandh-in-country-bhartiya-kisan-union/'],[],0,,False,76,1,12,,farmers protest,,,,,,,[],,,,
1,1442621323054919683,1442621323054919683,1632782700000.0,2021-09-28 04:15:00,+0530,,"#Indian farmers opposed to reforms they say threaten their livelihoods renewed their push against the changes with nationwide protests, a year after laws on the liberalization of the sector were introduced.   https://t.co/f35m2CE3uV",en,['indian'],[],22240612,22240612,AlArabiya_Eng,Al Arabiya English,2,04,https://twitter.com/AlArabiya_Eng/status/1442621323054919683,['https://english.alarabiya.net/News/world/2021/09/27/Indian-farmers-opposing-reforms-stage-nationwide-protests'],[],0,,False,6,1,0,,farmers protest,,,,,,,[],,,,
2,1442620472756097025,1442620472756097025,1632782497000.0,2021-09-28 04:11:37,+0530,,PU students join farmers’ protest  https://t.co/AUsiKBfE42,en,[],[],1017101762,1017101762,TOIChandigarh,TOIChandigarh,2,04,https://twitter.com/TOIChandigarh/status/1442620472756097025,['http://toi.in/EDSp9b45'],[],0,,False,0,0,0,,farmers protest,,,,,,,[],,,,
3,1442591100565348354,1442591100565348354,1632775495000.0,2021-09-28 02:14:55,+0530,,"Ha! @IndiaToday  is carrying a segment on the #FarmersProtest saying it has ""lost steam"" on the day of #BharatBandh   Ek saal se jo log apne haq ke liye lad rahe hain, unki himmat nahin dikhi @sardesairajdeep ko. Laanat hai is aadmi pe.",hi,"['farmersprotest', 'bharatbandh']",[],408467423,408467423,VidyaKrishnan,Vidya,2,02,https://twitter.com/VidyaKrishnan/status/1442591100565348354,[],[],0,,False,35,6,10,https://twitter.com/IndiaToday/status/1442458209294315521,farmers protest,,,,,,,[],,,,
4,1442580071332528131,1442580071332528131,1632772865000.0,2021-09-28 01:31:05,+0530,,In pictures: Farmers block roads and railway tracks in different parts of India as part of protests against controversial farm laws during nationwide protests  https://t.co/eLO47hH756,en,[],[],804605049859145728,804605049859145728,TRTWorldNow,TRT World Now,2,01,https://twitter.com/TRTWorldNow/status/1442580071332528131,[],"['https://pbs.twimg.com/media/FAUSykEVEAg6MY9.jpg', 'https://pbs.twimg.com/media/FAUSy_dXEAAiPVa.jpg', 'https://pbs.twimg.com/media/FAUSzl3UYAUr78F.jpg', 'https://pbs.twimg.com/media/FAUS3oXX0AEDnhV.jpg']",1,https://pbs.twimg.com/media/FAUSykEVEAg6MY9.jpg,False,54,1,12,,farmers protest,,,,,,,[],,,,
5,1442573506261266432,1442573506261266432,1632771300000.0,2021-09-28 01:05:00,+0530,,#BharatBandh | Delhi Congress leaders including president Chaudhary Anil Kumar were reportedly turned away from the #FarmersProtest site at #Ghazipur. #FarmLaws  https://t.co/mGQABqAEKd,en,"['bharatbandh', 'farmersprotest', 'ghazipur', 'farmlaws']",[],94761188,94761188,NewIndianXpress,The New Indian Express,2,01,https://twitter.com/NewIndianXpress/status/1442573506261266432,[],[],1,https://pbs.twimg.com/media/FATuE3RUYAU1EMQ.jpg,False,4,1,0,,farmers protest,,,,,,,[],,,,
6,1442568504780079108,1442568504780079108,1632770107000.0,2021-09-28 00:45:07,+0530,,"भारत बंद में फंसे युगांडा के नागरिक, किसानों ने सौहार्दपूर्ण ढंग से दिया रास्ता  https://t.co/3trAQK02rD  #Haryanahindinews #Panipathindinews #FarmersProtest #UgandaCitizen #  https://t.co/3lzxbI8g0z",hi,"['haryanahindinews', 'panipathindinews', 'farmersprotest', 'ugandacitizen']",[],80304808,80304808,punjabkesari,Punjab Kesari,2,00,https://twitter.com/punjabkesari/status/1442568504780079108,['https://m.haryana.punjabkesari.in/haryana/news/ugandan-citizens-trapped-in-bharat-bandh-farmers-gave-way-amicably-1464147?utm_source=twitterbot&utm_medium=social'],['https://pbs.twimg.com/media/FAUIaSxUYAE6zyv.jpg'],1,https://pbs.twimg.com/media/FAUIaSxUYAE6zyv.jpg,False,4,0,0,,farmers protest,,,,,,,[],,,,
7,1442565904257073155,1442565904257073155,1632769487000.0,2021-09-28 00:34:47,+0530,,"Thousands of Indian farmers are blocking major roads and railway tracks outside the capital of New Delhi, marking one year of protests against agricultural laws that they say will shatter their livelihoods.  https://t.co/GDZ0wxUBSY",en,[],[],28785486,28785486,ABC,ABC News,2,00,https://twitter.com/ABC/status/1442565904257073155,['https://abcn.ws/3i8Vzlk'],[],0,,False,56,7,27,,farmers protest,,,,,,,[],,,,
8,1442563320872005634,1442563320872005634,1632768871000.0,2021-09-28 00:24:31,+0530,,"#FarmersProtest #Farmers வேளாண் சட்டங்களை திரும்ப பெறக் கோரி நாடு முழுவதும் விவசாயிகள் போராட்டம்: தமிழகத்தில் 500 இடங்களில் ஆர்ப்பாட்டம்; பஸ், ரயில் மறியலில் ஈடுபட்ட எம்பி, எம்எல்ஏக்கள் கைது    https://t.co/z6pAbIwN4e",ta,"['farmersprotest', 'farmers']",[],107337499,107337499,DinakaranNews,Dinakaran,2,00,https://twitter.com/DinakaranNews/status/1442563320872005634,['https://www.dinakaran.com/News_Detail.asp?Nid=708316'],[],0,,False,10,0,2,,farmers protest,,,,,,,[],,,,
9,1442562823268167686,1442562823268167686,1632768753000.0,2021-09-28 00:22:33,+0530,,"27 सितंबर का भारत बंद ऐतिहासिक रहा। संयुक्त किसान मोर्चा के इस अभूतपूर्व भारत बंद से क्या हासिल हुआ, बता रहे हैं @_YogendraYadav अपनी इस वीडियो में।  देखिए यह वीडियो:  #FarmersProtest | #KisanAndolan  https://t.co/MqQebTeM0a",hi,"['farmersprotest', 'kisanandolan']",[],782439160388972544,782439160388972544,_SwarajIndia,Swaraj India,2,00,https://twitter.com/_SwarajIndia/status/1442562823268167686,[],[],1,https://pbs.twimg.com/ext_tw_video_thumb/1442562539179560963/pu/img/iuuACy6aMK-DcE8h.jpg,False,30,2,15,,farmers protest,,,,,,,[],,,,
10,1442561452770955273,1442561452770955273,1632768426000.0,2021-09-28 00:17:06,+0530,,"कृषि कानूनों पर सबसे पहले अपनी मोहर लगाने वाले #AAP,  किसानों को गिरफ्तार कर जेल भेजने के लिए DTC की 500 बसे उपलब्ध करवाने वाले #AAP, पिछली बार बंद को विफल करने का प्रयास करने वाले #AAP के ठग,आज किसानों को #भारत_बंद की कामयाबी पर बधाई दे रहे हैं 🤣. #FarmersProtest #BharathBandh",hi,"['aap', 'aap', 'aap', 'भारत_बंद', 'farmersprotest', 'bharathbandh']",[],109930762,109930762,LambaAlka,Alka Lamba,2,00,https://twitter.com/LambaAlka/status/1442561452770955273,[],[],0,,False,615,19,176,https://twitter.com/TOIIndiaNews/status/1442559678383230983,farmers protest,,,,,,,[],,,,
11,1442559804778508291,1442559804778508291,1632768033000.0,2021-09-28 00:10:33,+0530,,"#FarmersProtest: Making sincere efforts to remove road blockades by farmers, #Haryana tells SC  https://t.co/cJrPY32hzM @satyastp_satya",en,"['farmersprotest', 'haryana']",[],3046490198,3046490198,thetribunechd,The Tribune,2,00,https://twitter.com/thetribunechd/status/1442559804778508291,['https://www.tribuneindia.com/news/haryana/making-sincere-efforts-to-remove-road-blockades-by-farmers-haryana-tells-sc-316965'],[],0,,False,4,0,2,,farmers protest,,,,,,,[],,,,
12,1442557816552574976,1442557816552574976,1632767559000.0,2021-09-28 00:02:39,+0530,,"Karnataka Ahead: Massive Support For Farmers, Farmers Unions Hold March In Bengaluru During Bharat Bandh #BharatBandh #FarmersProtest @Suraj_Suresh16  Watch-  https://t.co/TWi1XJZExc",en,"['bharatbandh', 'farmersprotest']",[],979273137136300032,979273137136300032,IndiaAheadNews,India Ahead News,2,00,https://twitter.com/IndiaAheadNews/status/1442557816552574976,['https://youtu.be/Jpzh_-seeKI'],[],0,,False,4,1,0,,farmers protest,,,,,,,[],,,,
13,1442553503432335360,1442553503432335360,1632766531000.0,2021-09-27 23:45:31,+0530,,"Harrowing Time On Highways, Say Commuters Stuck During #BharatBandh  #FarmersProtest #FarmLaws  https://t.co/zukGosLXxP",en,"['bharatbandh', 'farmersprotest', 'farmlaws']",[],249643872,249643872,ndtvvideos,NDTV Videos,1,23,https://twitter.com/ndtvvideos/status/1442553503432335360,[],[],1,https://pbs.twimg.com/media/FAT6kfDVcAkigxT.jpg,False,6,0,0,,farmers protest,,,,,,,[],,,,
14,1442549658564313092,1442549658564313092,1632765614000.0,2021-09-27 23:30:14,+0530,,Indian farmers stage nationwide protests against reforms  https://t.co/a1n8uC7HGa  https://t.co/UHu2XLkVTo,en,[],[],15954704,15954704,ReutersAsia,Reuters Asia,1,23,https://twitter.com/ReutersAsia/status/1442549658564313092,['https://www.reuters.com/world/india/indian-farmers-aim-nationwide-protests-against-reforms-monday-2021-09-27/?taid=615206adc9cd470001335188&utm_campaign=trueAnthem%3A+Trending+Content&utm_medium=trueAnthem&utm_source=twitter'],['https://pbs.twimg.com/media/FAT3RLhUcAAfbW6.jpg'],1,https://pbs.twimg.com/media/FAT3RLhUcAAfbW6.jpg,False,20,0,4,,farmers protest,,,,,,,[],,,,
15,1442549601005887488,1442549601005887488,1632765600000.0,2021-09-27 23:30:00,+0530,,"Indian farmers stage nationwide protests, one year after the government introduced reforms which the farmers say will threaten their livelihood  https://t.co/OTB9tMPLVV  https://t.co/2otTXxl4B4",en,[],[],1652541,1652541,Reuters,Reuters,1,23,https://twitter.com/Reuters/status/1442549601005887488,['https://reut.rs/3uexkqN'],[],1,https://pbs.twimg.com/amplify_video_thumb/1442470616074895364/img/Epelasqa0AYyoOtn.jpg,False,71,6,29,,farmers protest,,,,,,,[],,,,
16,1442549572174180352,1442549572174180352,1632765593000.0,2021-09-27 23:29:53,+0530,,"Political parties, farmers stage protest across Maharashtra, demand scrapping of farm laws  https://t.co/51TKMU6K4U",en,[],[],1066972567943053312,1066972567943053312,HindustanTimes,Hindustan Times,1,23,https://twitter.com/HindustanTimes/status/1442549572174180352,['https://www.hindustantimes.com/cities/mumbai-news/political-parties-farmers-stage-protest-across-maharashtra-demand-scrapping-of-farm-laws-101632765591240.html'],[],0,,False,0,0,0,,farmers protest,,,,,,,[],,,,
17,1442549465500454916,1442549465500454916,1632765568000.0,2021-09-27 23:29:28,+0530,,"#BharatBandh evokes mixed response: Has the #farmstir lost steam and direction? #NewsToday with @sardesairajdeep | Full show:  https://t.co/96KUcpmULN  #ITVideo #farmersprotest | @pawankhera, @rpsinghkhalsa, @_yogendrayadav  https://t.co/27wyBYtokN",en,"['bharatbandh', 'farmstir', 'newstoday', 'itvideo', 'farmersprotest']",[],19897138,19897138,IndiaToday,IndiaToday,1,23,https://twitter.com/IndiaToday/status/1442549465500454916,['https://intdy.in/oo5s6n'],[],1,https://pbs.twimg.com/amplify_video_thumb/1442532976705765384/img/W5fRpTTXv9wDCV3X.jpg,False,13,7,1,,farmers protest,,,,,,,[],,,,
18,1442549344213733385,1442549344213733385,1632765539000.0,2021-09-27 23:28:59,+0530,,"Delhi Ahead: Protesting Farmers Hold Bharat Bandh, Rakesh Tikait Slams Centre, Says Agitation Will Continue Until Farm Laws Are Repealed #BharatBandh #FarmersProtest @ShivangPatrakar   Watch-  https://t.co/w0FBCzfrqT",en,"['bharatbandh', 'farmersprotest']",[],979273137136300032,979273137136300032,IndiaAheadNews,India Ahead News,1,23,https://twitter.com/IndiaAheadNews/status/1442549344213733385,['https://youtu.be/dUZpQq-EeGc'],[],0,,False,2,0,2,,farmers protest,,,,,,,[],,,,
19,1442549077095301121,1442549077095301121,1632765475000.0,2021-09-27 23:27:55,+0530,,Bharat Bandh: Thin crowd at farmer protest sites in Delhi  https://t.co/RkSp1bAl1O,en,[],[],1066972567943053312,1066972567943053312,HindustanTimes,Hindustan Times,1,23,https://twitter.com/HindustanTimes/status/1442549077095301121,['https://www.hindustantimes.com/cities/delhi-news/bharat-bandh-thin-crowd-at-farmer-protest-sites-in-delhi-many-have-gone-home-for-harvest-say-protesters-101632765228311.html'],[],0,,False,1,0,0,,farmers protest,,,,,,,[],,,,
