,id,date,tweet,hashtags,user_id,username,name,link,urls,nlikes,nretweets,nreplies
34,1324286583441416194,2020-11-05 15:15:00,"#Farmers in Punjab, Haryana block roads as part of nationwide protest against #FarmLaws    https://t.co/YZtbJxeWcv  https://t.co/uTtf6kq6jd","['farmers', 'farmlaws']",1612504999,BiIndia,Business Insider India🇮🇳,https://twitter.com/BiIndia/status/1324286583441416194,['https://www.businessinsider.in/india/news/farmers-in-punjab-haryana-block-roads-as-part-of-nationwide-protest-against-farm-laws/articleshow/79057791.cms'],1,0,0
35,1324281352431181826,2020-11-05 14:54:13,"ਜਲੰਧਰ 'ਚ ਕਿਸਾਨਾਂ ਦਾ ਚੱਕਾ ਜਾਮ, ਵੇਖੋ ਮੌਕੇ ਦੀਆਂ ਤਸਵੀਰਾਂ  https://t.co/KLR6CKeG1i #Jalandhar #Farmers #Protest #PAPChowk  https://t.co/piS9ZnjPZe","['jalandhar', 'farmers', 'protest', 'papchowk']",222394250,JagbaniOnline,Jagbani,https://twitter.com/JagbaniOnline/status/1324281352431181826,['https://jagbani.punjabkesari.in/punjab/news/farmers-protest-against-central-government-jalandhar-1246753'],3,0,0
36,1324278162079936512,2020-11-05 14:41:32,Punjab: Farmers block Delhi-Amritsar highway to protest against farm laws   https://t.co/Q1QoxjeHpC,[],495780767,HTPunjab,HT Punjab,https://twitter.com/HTPunjab/status/1324278162079936512,['https://www.hindustantimes.com/chandigarh/punjab-farmers-block-delhi-amritsar-highway-to-protest-against-farm-laws/story-2vjMnjWrAVa8vatH1hJOkN.html'],4,0,0
37,1324275841434447872,2020-11-05 14:32:19,Punjab: Farmers block Delhi-Amritsar highway to protest against farm laws  https://t.co/wfNOn6m1V7,[],1066972567943053312,HindustanTimes,Hindustan Times,https://twitter.com/HindustanTimes/status/1324275841434447872,['http://www.hindustantimes.com/chandigarh/punjab-farmers-block-delhi-amritsar-highway-to-protest-against-farm-laws/story-2vjMnjWrAVa8vatH1hJOkN.html'],0,0,0
38,1324272010642575365,2020-11-05 14:17:05,நெல் கொள்முதல் நிலையங்களில் முறைகேடுகளில் ஈடுபடும் ஊழியர்கள் மீது அரசு கடும் நடவடிக்கை எடுக்க வேண்டும்: நவ.26-ல் ஆர்ப்பாட்டம்; விவசாயிகள் சங்கம் அறிவிப்பு #Farmers #Protest  https://t.co/I7Yhi1VSnz,"['farmers', 'protest']",1704625526,TamilTheHindu,Tamil The Hindu,https://twitter.com/TamilTheHindu/status/1324272010642575365,['https://www.hindutamil.in/news/tamilnadu/598567-farmers-association-announces-protest.html'],9,1,2
0,1324403897364930560,2020-11-05 23:01:10,"Due to Gurjar Andolan &amp; Kisan Agitation, few more trains have been diverted &amp; certain trains have been short terminated and accordingly short originated. #WRUpdate  https://t.co/Bo48lZW3Yv",['wrupdate'],3188629370,WesternRly,Western Railway,https://twitter.com/WesternRly/status/1324403897364930560,[],77,11,4
1,1324400224941436933,2020-11-05 22:46:34,"Repercussions on WR's Train services due to Kisan Andolan in Punjab  02903 Mumbai Central-Amritsar Exp &amp; 02925 Bandra T.-Amritsar Exp of 05th &amp; 06th Nov,20 will be short terminated at Ambala City  @RailMinIndia",[],3188629370,WesternRly,Western Railway,https://twitter.com/WesternRly/status/1324400224941436933,[],32,5,2
2,1324386022742880256,2020-11-05 21:50:08,खेती कानूनों के खिलाफ धरना दे रहे किसान की मौत  https://t.co/VreUT0reEt  #PunjabHindinews #agriculture #farmer #kisanandolan  https://t.co/YFjO8izuaV,"['punjabhindinews', 'agriculture', 'farmer', 'kisanandolan']",80304808,punjabkesari,Punjab Kesari,https://twitter.com/punjabkesari/status/1324386022742880256,['https://m.punjab.punjabkesari.in/punjab/news/farmer-s-death-protesting-against-farming-laws-1274976?utm_source=twitterbot&utm_medium=social'],1,0,0
3,1324385264542781440,2020-11-05 21:47:07,खेती कानूनों के खिलाफ धरना दे रहे किसान की मौत  https://t.co/VreUT0reEt  #PunjabHindinews #agriculture #farmer #kisanandolan  https://t.co/0ReFe6FRnk,"['punjabhindinews', 'agriculture', 'farmer', 'kisanandolan']",80304808,punjabkesari,Punjab Kesari,https://twitter.com/punjabkesari/status/1324385264542781440,['https://m.punjab.punjabkesari.in/punjab/news/farmer-s-death-protesting-against-farming-laws-1274976?utm_source=twitterbot&utm_medium=social'],1,0,1
0,1324294524617682945,2020-11-05 15:46:33,उखु किसानलाई भुक्तानी दिन बाँकी रकम एक महिनाभित्र दिलाउने गरी समन्वय गर्न उद्योग वाणिज्य तथा आपूर्ति मन्त्रालयलाई संसदीय समितिकाे निर्देशन  #उखु #किसान #भुक्तानी #चिनीमिल #nayapatrika  https://t.co/ZHj6RBD6To,"['उखु', 'किसान', 'भुक्तानी', 'चिनीमिल', 'nayapatrika']",4919613771,NAYA_PATRIKA,Naya Patrika,https://twitter.com/NAYA_PATRIKA/status/1324294524617682945,['https://www.nayapatrikadaily.com/news-details/54298/2020-11-05'],4,0,0
1,1324241861599399937,2020-11-05 12:17:17,#BJP की योगी सरकार पराली जलाने पर किसान को जेल भेजेगी! पर #MSP से नीचे धान ख़रीदने वालों को नहीं! ये #किसान विरोधी रविय्या नहीं चलेगा हम हर स्तर पर विरोध करेंगे-सुरेंद्र राजपूत   https://t.co/7TA7p6Y3xe,"['bjp', 'msp', 'किसान']",2969163974,ssrajputINC,Surendra Rajput ‏,https://twitter.com/ssrajputINC/status/1324241861599399937,[],80,12,2
