,id,conversation_id,created_at,date,timezone,place,tweet,language,hashtags,cashtags,user_id,user_id_str,username,name,day,hour,link,urls,photos,video,thumbnail,retweet,nlikes,nreplies,nretweets,quote_url,search,near,geo,source,user_rt_id,user_rt,retweet_id,reply_to,retweet_date,translate,trans_src,trans_dest
0,1344030861642100741,1344030861642100741,1609276902000.0,2020-12-30 02:51:42,+0530,,Thank you to @ptcnews for inviting me to speak about #Indian #FarmersProtest I stand in solidarity with all those fighting for justice. #IStandWithFarmers  https://t.co/SsiQqF8YuD,en,"['indian', 'farmersprotest', 'istandwithfarmers']",[],620007630,620007630,PreetKGillMP,Preet Kaur Gill MP,3,02,https://twitter.com/PreetKGillMP/status/1344030861642100741,[],[],1,https://pbs.twimg.com/ext_tw_video_thumb/1344030801499979777/pu/img/qGGd47OtLOTNz060.jpg,False,642,27,134,,#istandwithfarmers,,,,,,,[],,,,
1,1343916103379025922,1343916103379025922,1609249542000.0,2020-12-29 19:15:42,+0530,,और कितने इम्तिहान? कब तक देश-परस्ती साबित करेगा हमारा क़िसान! सरकार को मीडिया और इंडस्ट्री का ग़ुरूर है बेचारा किसान सड़कों पर सोने को मजबूर है! .  #ManjinderSinghSirsa #kisanektazindabaad #farmer #IStandWithFarmers #farmersprotest #SinghuBorder #tractor2twitter #isupportfarmers  https://t.co/C258soyqGi,hi,"['manjindersinghsirsa', 'kisanektazindabaad', 'farmer', 'istandwithfarmers', 'farmersprotest', 'singhuborder', 'tractor2twitter', 'isupportfarmers']",[],73353129,73353129,mssirsa,Manjinder Singh Sirsa,2,19,https://twitter.com/mssirsa/status/1343916103379025922,[],['https://pbs.twimg.com/media/EqaMj7YUUAAlYKa.jpg'],1,https://pbs.twimg.com/media/EqaMj7YUUAAlYKa.jpg,False,280,53,51,,#istandwithfarmers,,,,,,,[],,,,
2,1343817134837657600,1343817134837657600,1609225946000.0,2020-12-29 12:42:26,+0530,,40 ਕਿਸਾਨ ਜਥੇਬੰਦੀਆਂ ਦੇ ਸੰਯੁਕਤ ਕਿਸਾਨ ਮੋਰਚੇ ਨੇ ਉੱਤਰਾਖੰਡ ਸਰਕਾਰ ਨੂੰ ਕਿਸਾਨਾਂ ਨਾਲ ਧੱਕੇਸ਼ਾਹੀ ਕਰਨ ਵਿਰੁੱਧ ਚਿਤਾਵਨੀ ਦਿੱਤੀ ਹੈ! We won’t tolerate any unconstitutional actions taken against farmers or to suppress farmers voice by state govts!! .  #kisanektazindabaad #IStandWithFarmers  https://t.co/dSYH99H9pg,und,"['kisanektazindabaad', 'istandwithfarmers']",[],73353129,73353129,mssirsa,Manjinder Singh Sirsa,2,12,https://twitter.com/mssirsa/status/1343817134837657600,[],[],1,https://pbs.twimg.com/ext_tw_video_thumb/1343816265220034561/pu/img/K0m0LYjAJpDqtsqq.jpg,False,73,4,14,,#istandwithfarmers,,,,,,,[],,,,
3,1343791435091304450,1343791435091304450,1609219819000.0,2020-12-29 11:00:19,+0530,,ਹੋ ਰਹੇ ਸੰਘਰਸ਼ ਨੂੰ ਐਵੇਂ ਨਾ ਜਾਣੀ ਤੂੰ ਹਾਕਮਾਂ  This protest by Farmers is growing strong day by day; Govts &amp; Police should not underestimate our passion &amp; courage Watch the Video  #kisanektazindabaad  #IStandWithFarmers #farmersprotest #SinghuBorder #tractor2twitter #isupportfarmers  https://t.co/wICmFVnfNq,en,"['kisanektazindabaad', 'istandwithfarmers', 'farmersprotest', 'singhuborder', 'tractor2twitter', 'isupportfarmers']",[],73353129,73353129,mssirsa,Manjinder Singh Sirsa,2,11,https://twitter.com/mssirsa/status/1343791435091304450,[],[],1,https://pbs.twimg.com/ext_tw_video_thumb/1343791287112110081/pu/img/SvBtWiQ4c7cKn63g.jpg,False,254,44,46,,#istandwithfarmers,,,,,,,[],,,,
4,1343746637047349248,1343746637047349248,1609209138000.0,2020-12-29 08:02:18,+0530,,"ਸਤਿਗੁਰ 'ਤੇ ਆਸਾਂ ਦਾ ਦੀਵਾ ਸਦਾ ਹੀ ਜਗਦਾ ਰਹਿੰਦਾ ਹੈ, ਇਹ ਝੱਖੜਾਂ 'ਚ ਵੀ ਬੁਝਦਾ ਨਹੀਂ। ਕਿਰਤੀ ਹੱਥਾਂ ਰਾਹੀਂ ਕਿਸਾਨ ਸੰਘਰਸ਼, ਸਤਿਗੁਰ ਦੀ ਓਟ ਨਾਲ ਸ਼ੁਰੂ ਹੋਇਆ ਤੇ ਫਤਿਹ ਵੀ ਉਸਦੀ ਹੈ   #ManjinderSinghSirsa #kisanektazindabaad #IStandWithFarmers #farmersprotest #SinghuBorder #tractor2twitter #isupportfarmers  https://t.co/chwl4YqHt8",pa,"['manjindersinghsirsa', 'kisanektazindabaad', 'istandwithfarmers', 'farmersprotest', 'singhuborder', 'tractor2twitter', 'isupportfarmers']",[],73353129,73353129,mssirsa,Manjinder Singh Sirsa,2,08,https://twitter.com/mssirsa/status/1343746637047349248,[],['https://pbs.twimg.com/media/EqXyb9LU8AA8KLy.jpg'],1,https://pbs.twimg.com/media/EqXyb9LU8AA8KLy.jpg,False,108,14,21,,#istandwithfarmers,,,,,,,[],,,,
