,id,conversation_id,created_at,date,timezone,place,tweet,language,hashtags,cashtags,user_id,user_id_str,username,name,day,hour,link,urls,photos,video,thumbnail,retweet,nlikes,nreplies,nretweets,quote_url,search,near,geo,source,user_rt_id,user_rt,retweet_id,reply_to,retweet_date,translate,trans_src,trans_dest
35,1421072427841310722,1421072427841310722,1627645043000.0,2021-07-30 17:07:23,+0530,,"लोकतांत्रिक देश में सरकार किसानों की बात नहीं मान रही है, लेकिन जब तक सरकार मांगे पूरी नहीं करेगी तब तक आन्दोलन जारी रहेगा .। #FarmersProtest  https://t.co/oCmvUXwe76",hi,['farmersprotest'],[],2799118662,2799118662,comredamraram,Amra Ram,5,17,https://twitter.com/comredamraram/status/1421072427841310722,[],"['https://pbs.twimg.com/media/E7ip0lUUYAUYp4F.jpg', 'https://pbs.twimg.com/media/E7ip1OaVcAIMdJU.jpg']",1,https://pbs.twimg.com/media/E7ip0lUUYAUYp4F.jpg,False,250,1,35,,#farmersprotest,,,,,,,[],,,,
36,1421064878807162885,1421064878807162885,1627643243000.0,2021-07-30 16:37:23,+0530,,"हम 5 सितंबर को पंचायत करेंगे। पंचायत में हम आंदोलन को आगे बढ़ाने पर चर्चा करेंगे: राकेश टिकैत, भारतीय किसान यूनियन के राष्ट्रीय प्रवक्ता #FarmersProtest   https://t.co/Zn4lWf5MEY",hi,['farmersprotest'],[],123171317,123171317,NavbharatTimes,NBT Hindi News,5,16,https://twitter.com/NavbharatTimes/status/1421064878807162885,['http://nbt.in/BreakingNews'],[],0,,False,15,2,1,,#farmersprotest,,,,,,,[],,,,
37,1421061140184928261,1421061140184928261,1627642352000.0,2021-07-30 16:22:32,+0530,,Superfast Punjab: ਸੁਪਰ ਅੰਦਾਜ਼ 'ਚ ਮੁੱਖ ਖ਼ਬਰਾਂ 'ਤੇ ਇੱਕ ਨਜ਼ਰ  #Tokyo2020 #TokyoOlympics2020 #PVSindhu #badmintonTokyo2020 #IndiaTodayAtOlympics #Punjab #PunjabPoliceRecruitment2021 #HarsimratKaurBadal #kisanektazindabaad #FarmersProtest    https://t.co/pTykLyNUZj,pa,"['tokyo2020', 'tokyoolympics2020', 'pvsindhu', 'badmintontokyo2020', 'indiatodayatolympics', 'punjab', 'punjabpolicerecruitment2021', 'harsimratkaurbadal', 'kisanektazindabaad', 'farmersprotest']",[],852553470,852553470,ptcnews,ਪੀਟੀਸੀ ਨਿਊਜ਼ | PTC News,5,16,https://twitter.com/ptcnews/status/1421061140184928261,['https://youtu.be/4Y8AeM4JXRg'],[],0,,False,0,0,0,,#farmersprotest,,,,,,,[],,,,
38,1421060404118048770,1421060404118048770,1627642177000.0,2021-07-30 16:19:37,+0530,,"JPC Probe: ਅਕਾਲੀ ਦਲ, ਬਸਪਾ ਤੇ ਸ਼ਿਵ ਸੈਨਾ ਸਣੇ 8 ਪਾਰਟੀਆਂ ਨੇ ਅੰਦੋਲਨਕਾਰੀ ਕਿਸਾਨਾਂ ਦੀਆਂ ਮੌਤਾਂ ਲਈ ਮੰਗੀ JPC ਜਾਂਚ  https://t.co/VSIWn52GAe #jpcprobe #FarmersProtest #farmerdeaths",pa,"['jpcprobe', 'farmersprotest', 'farmerdeaths']",[],1037022253,1037022253,abpsanjha,ABP Sanjha,5,16,https://twitter.com/abpsanjha/status/1421060404118048770,['https://punjabi.abplive.com/news/india/farmers-protest-opposition-demands-jpc-probe-to-ascertain-details-of-farmer-deaths-during-agitation-628721'],[],0,,False,0,0,0,,#farmersprotest,,,,,,,[],,,,
39,1421059616671109124,1421059616671109124,1627641989000.0,2021-07-30 16:16:29,+0530,,जो अन्नदाता से टकराएगा चूर-चूर हो जाएगा...  राजस्थान भाजपा अनुसूचित जाति मोर्चा के प्रदेश अध्यक्ष कैलाश मेघवाल के किसानों ने कपड़े फाड़े   #Rajasthan #FarmersProtest  https://t.co/HHTMkL9IPM,hi,"['rajasthan', 'farmersprotest']",[],2150842150,2150842150,keshavyadaviyc,Keshav Chand Yadav,5,16,https://twitter.com/keshavyadaviyc/status/1421059616671109124,[],[],1,https://pbs.twimg.com/ext_tw_video_thumb/1421059514086805509/pu/img/mPu_kF3Hz2MvDaOp.jpg,False,72,0,22,,#farmersprotest,,,,,,,[],,,,
40,1421059609574268935,1421059609574268935,1627641987000.0,2021-07-30 16:16:27,+0530,,"""ममता मिलने आ रही हैं, मुझे नहीं पता"": @RakeshTikaitBKU   किसान नेता राकेश टिकैत ने कहा कि 5 सितंबर को रैली के बाद किसान आंदोलन को और पूरे देश में फैलाएंगे, लखनऊ और दूसरे राज्यों में भी फैलेगा आंदोलन .   देखिए राम किंकर सिंह (@ramkinkarsingh) की #ReporterDiary #FarmersProtest  https://t.co/ykNIah84ms",hi,"['reporterdiary', 'farmersprotest']",[],42606652,42606652,aajtak,AajTak,5,16,https://twitter.com/aajtak/status/1421059609574268935,[],[],1,https://pbs.twimg.com/amplify_video_thumb/1421057288060641283/img/u1FPX5YDdpdmzW24.jpg,False,93,23,9,,#farmersprotest,,,,,,,[],,,,
41,1421055445624451077,1421055445624451077,1627640994000.0,2021-07-30 15:59:54,+0530,,श्रीगंगानगर : राजस्थान भाजपा अनुसूचित जाति मोर्चा के प्रदेश अध्यक्ष कैलाश मेघवाल के किसानों ने कपड़े फाड़े   #Rajasthan #FarmersProtest  https://t.co/UYjSXL4W11,hi,"['rajasthan', 'farmersprotest']",[],34206701,34206701,news24tvchannel,News24,5,15,https://twitter.com/news24tvchannel/status/1421055445624451077,[],[],1,https://pbs.twimg.com/ext_tw_video_thumb/1421055391232757760/pu/img/u5glAIXrWRHR4GBh.jpg,False,2649,191,702,,#farmersprotest,,,,,,,[],,,,
42,1421052572283019266,1421052572283019266,1627640309000.0,2021-07-30 15:48:29,+0530,,"To the people who do not support the #FarmersProtest   This is how our farmers still prepare the land, and it's 2021 This is cuz they never got a fair share for their crops  And NO corporates won't come in &amp; make it easy 4 them, they work fr their OWN profit #TractorToTwitter  https://t.co/xIkkMLEJTv",en,"['farmersprotest', 'tractortotwitter']",[],933622354277646336,933622354277646336,Chhotu_Vasava,Chhotubhai Vasava,5,15,https://twitter.com/Chhotu_Vasava/status/1421052572283019266,[],['https://pbs.twimg.com/media/E7iXxRfWQAUu5ML.jpg'],1,https://pbs.twimg.com/media/E7iXxRfWQAUu5ML.jpg,False,64,0,18,,#farmersprotest,,,,,,,[],,,,
43,1421052527852679169,1421052527852679169,1627640299000.0,2021-07-30 15:48:19,+0530,,The question is not what the farmers can secure for themselves. The real question is what the farmers can secure for the entire country — Whether they can lead the larger battle for saving the very idea of India.  Read this Full article by @_YogendraYadav   #FarmersProtest  https://t.co/WxWxPUXSsh,en,['farmersprotest'],[],782439160388972544,782439160388972544,_SwarajIndia,Swaraj India,5,15,https://twitter.com/_SwarajIndia/status/1421052527852679169,[],['https://pbs.twimg.com/media/E7iXviWUcAA1zMY.jpg'],1,https://pbs.twimg.com/media/E7iXviWUcAA1zMY.jpg,False,15,1,7,,#farmersprotest,,,,,,,[],,,,
44,1421040557481070595,1421040557481070595,1627637445000.0,2021-07-30 15:00:45,+0530,,"कभी बिहार सरकार में कृषि मंत्री रहे नरेंद्र सिंह ने की राकेश टिकैत से मुलाकात, दावा किया आने वाले विधानसभा चुनावों में खेती कानूनों को लाने वाली सरकारों को मुंह की खानी पड़ेगी देखिये राम किंकर सिंह (@Ramkinkarsingh) की #ReporterDiary  #FarmersProtest #FarmLaws  https://t.co/LTqNSWjatv",hi,"['reporterdiary', 'farmersprotest', 'farmlaws']",[],42606652,42606652,aajtak,AajTak,5,15,https://twitter.com/aajtak/status/1421040557481070595,[],[],1,https://pbs.twimg.com/amplify_video_thumb/1421039560985767941/img/N9RpGvRQFXuPD6My.jpg,False,55,8,3,,#farmersprotest,,,,,,,[],,,,
45,1421038607523999744,1421038607523999744,1627636980000.0,2021-07-30 14:53:00,+0530,,மேகதாது: போராட்டம் அறிவித்து கெத்து காட்டிய அண்ணாமலை.. ஓங்கி அடித்து உட்கார வைத்த விவசாயிகள் சங்கம். #politics #திமுக_சொன்னீங்களே_செஞ்சீங்களா #FarmersProtest    https://t.co/keszK0xn87,ta,"['politics', 'திமுக_சொன்னீங்களே_செஞ்சீங்களா', 'farmersprotest']",[],738683931520798720,738683931520798720,AsianetNewsTM,Asianetnews Tamil,5,14,https://twitter.com/AsianetNewsTM/status/1421038607523999744,['https://tamil.asianetnews.com/politics/annamalai-announces-hunger-strike-for-mekedatu-dam-farmers-association-criticized-annamalai--qx1tbz'],[],0,,False,1,0,0,,#farmersprotest,,,,,,,[],,,,
46,1421035777060868096,1421035777060868096,1627636305000.0,2021-07-30 14:41:45,+0530,,किसानों से मुलाकात करेंगी ममता?   #MamataBanerjee #Delhi #FarmersProtest  https://t.co/euLT81GOrq,hi,"['mamatabanerjee', 'delhi', 'farmersprotest']",[],461841349,461841349,ZeeNews,Zee News,5,14,https://twitter.com/ZeeNews/status/1421035777060868096,[],[],1,https://pbs.twimg.com/media/E7iIbyCVEAQrzQv.jpg,False,55,8,2,,#farmersprotest,,,,,,,[],,,,
47,1421034702203359232,1421034702203359232,1627636049000.0,2021-07-30 14:37:29,+0530,,Farmers Protest: ਬਿਜਲੀ ਸੋਧ ਬਿੱਲ ਸੰਸਦ 'ਚ ਪੇਸ਼ ਕਰਨ ਦੀ ਤਿਆਰੀ ਤੋਂ ਭੜਕੇ ਕਿਸਾਨ  https://t.co/r3Q3Q08I11 #FarmersProtest #kisansansad #JantarMantar,pa,"['farmersprotest', 'kisansansad', 'jantarmantar']",[],1037022253,1037022253,abpsanjha,ABP Sanjha,5,14,https://twitter.com/abpsanjha/status/1421034702203359232,['https://punjabi.abplive.com/news/punjab/power-amendment-bill-is-to-be-debated-in-the-kisan-parliament-at-jantar-mantar-628709'],[],0,,False,0,0,0,,#farmersprotest,,,,,,,[],,,,
48,1421033118912421891,1421033118912421891,1627635671000.0,2021-07-30 14:31:11,+0530,,"रोज के ₹300, शराब के साथ शबाब भी: देह व्यापार का अड्डा बना टिकरी बॉर्डर, टेंट में नंगे पड़े रहते हैं ‘किसान’  #TikriBorder #FarmersProtest    https://t.co/rGuOsciSnJ",hi,"['tikriborder', 'farmersprotest']",[],1068155700168126464,1068155700168126464,OpIndia_in,ऑपइंडिया,5,14,https://twitter.com/OpIndia_in/status/1421033118912421891,['https://hindi.opindia.com/national/debauchery-in-the-name-of-farmers-protest-300-rupees-per-person-for-joining-the-dharna-tikri-border/'],[],0,,False,314,10,210,,#farmersprotest,,,,,,,[],,,,
49,1421023812641042436,1421023812641042436,1627633452000.0,2021-07-30 13:54:12,+0530,,Please continue to support the #FarmersProtest 🙏🏻🙏🏻,en,['farmersprotest'],[],2347762888,2347762888,RaviSinghKA,ravinder singh,5,13,https://twitter.com/RaviSinghKA/status/1421023812641042436,[],[],0,,False,5101,42,1587,,#farmersprotest,,,,,,,[],,,,
50,1421023143259299848,1421023143259299848,1627633293000.0,2021-07-30 13:51:33,+0530,,"Akali Dal, 6 other parties demand JPC into farmers’ deaths  https://t.co/PzvdHbPTwB @anshumalini3 @Akali_Dal_ #farmersprotest",en,['farmersprotest'],[],3046490198,3046490198,thetribunechd,The Tribune,5,13,https://twitter.com/thetribunechd/status/1421023143259299848,['https://www.tribuneindia.com/news/nation/akali-dal-6-other-parties-demand-jpc-into-farmers-deaths-290505#.YQO2ddY-mso.twitter'],[],0,,False,6,0,0,,#farmersprotest,,,,,,,[],,,,
51,1421022746633392128,1421022746633392128,1627633198000.0,2021-07-30 13:49:58,+0530,,क्या गाज़ीपुर बॉर्डर पर किसानों से मिलेंगी ममता? दिल्ली-यूपी के गाजीपुर बॉर्डर पर सुरक्षा बढ़ा दी गई है लेकिन बंगाल मुख्यमंत्री ममता बनर्जी के वहाँ आकर किसानों से मिलने की पुष्टि नहीं हो रही!  देखिये संजय शर्मा (@mewatisanjoo) की #ReporterDiary  #FarmersProtest #MamataBanerjee  https://t.co/hBJGNM8akI,hi,"['reporterdiary', 'farmersprotest', 'mamatabanerjee']",[],42606652,42606652,aajtak,AajTak,5,13,https://twitter.com/aajtak/status/1421022746633392128,[],[],1,https://pbs.twimg.com/amplify_video_thumb/1421022382945234950/img/3JsTqTSeEkJsAb6_.jpg,False,52,4,5,,#farmersprotest,,,,,,,[],,,,
52,1421019894980628482,1421019894980628482,1627632518000.0,2021-07-30 13:38:38,+0530,,Members of Parliament from the Congress Party are raising their voice against the anti farmer black laws in the Parliament and demanding that the farmers' issues should be discussed on priority.   #FarmersProtest   @ManishTewari  @GurjeetSAujla  https://t.co/FsQLU6NwcT,en,['farmersprotest'],[],2281874448,2281874448,SevadalPB,Punjab Pradesh Congress Sevadal,5,13,https://twitter.com/SevadalPB/status/1421019894980628482,[],"['https://pbs.twimg.com/media/E7h6Dv1VIAIaeB0.jpg', 'https://pbs.twimg.com/media/E7h6EDwVcAMqgfM.jpg']",1,https://pbs.twimg.com/media/E7h6Dv1VIAIaeB0.jpg,False,22,4,8,,#farmersprotest,,,,,,,[],,,,
53,1421017509851848709,1421017509851848709,1627631950000.0,2021-07-30 13:29:10,+0530,,It is our moral duty to acknowledge our Annadatas. Revoke these black laws.  #KisaanMajdoorEktaZondabad #FarmersProtest,en,"['kisaanmajdoorektazondabad', 'farmersprotest']",[],705356851156635648,705356851156635648,YAD_Ferozepur,YAD Ferozepur,5,13,https://twitter.com/YAD_Ferozepur/status/1421017509851848709,[],[],0,,False,0,0,0,,#farmersprotest,,,,,,,[],,,,
54,1421016992111235072,1421016992111235072,1627631826000.0,2021-07-30 13:27:06,+0530,,Rollback three black laws. We stand in complete solidarity with our farmers.  #AdjounrmentMotion #FarmersProtest,en,"['adjounrmentmotion', 'farmersprotest']",[],705286985896689664,705286985896689664,Yad_Faridkot,YAD Faridkot,5,13,https://twitter.com/Yad_Faridkot/status/1421016992111235072,[],[],0,,False,0,0,0,,#farmersprotest,,,,,,,[],,,,
55,1421016881104777218,1421016881104777218,1627631800000.0,2021-07-30 13:26:40,+0530,,We won’t back down until GOI listens to the voice of farmers &amp; repeal the black laws. #AdjounrmentMotion #FarmersProtest,en,"['adjounrmentmotion', 'farmersprotest']",[],705285121365049344,705285121365049344,YAD_Bathinda,YAD Bathinda,5,13,https://twitter.com/YAD_Bathinda/status/1421016881104777218,[],[],0,,False,0,0,0,,#farmersprotest,,,,,,,[],,,,
56,1421016745016320001,1421016745016320001,1627631767000.0,2021-07-30 13:26:07,+0530,,Revoke these three farm laws. Don't bite the hand that feeds you. #KisaanMajdoorEktaZondabad #FarmersProtest,en,"['kisaanmajdoorektazondabad', 'farmersprotest']",[],705275077672079360,705275077672079360,YAD_Barnala,YAD Barnala,5,13,https://twitter.com/YAD_Barnala/status/1421016745016320001,[],[],0,,False,0,0,0,,#farmersprotest,,,,,,,[],,,,
57,1421016630230851584,1421016630230851584,1627631740000.0,2021-07-30 13:25:40,+0530,,Repeal these black laws. Lets stand with our farmers.  #KisaanMajdoorEktaZondabad #FarmersProtest,en,"['kisaanmajdoorektazondabad', 'farmersprotest']",[],705271256795381760,705271256795381760,YAD_Amritsar,YAD Amritsar,5,13,https://twitter.com/YAD_Amritsar/status/1421016630230851584,[],[],0,,False,0,0,0,,#farmersprotest,,,,,,,[],,,,
58,1421016467332468737,1421016467332468737,1627631701000.0,2021-07-30 13:25:01,+0530,,Battle against Farm Laws will continue as strong as ever.  #KisaanMajdoorEktaZindabad #FarmersProtest,en,"['kisaanmajdoorektazindabad', 'farmersprotest']",[],705347235706327040,705347235706327040,Nawanshahr_YAD,YAD Nawanshahr,5,13,https://twitter.com/Nawanshahr_YAD/status/1421016467332468737,[],[],0,,False,0,0,0,,#farmersprotest,,,,,,,[],,,,
59,1421016370234347520,1421016370234347520,1627631678000.0,2021-07-30 13:24:38,+0530,,10th day of Adjournment Motion and the centre is neglecting our farmers.  #AdjounrmentMotion #FarmersProtest,en,"['adjounrmentmotion', 'farmersprotest']",[],705335868387536896,705335868387536896,Moga_YAD,YAD Moga,5,13,https://twitter.com/Moga_YAD/status/1421016370234347520,[],[],0,,False,0,0,0,,#farmersprotest,,,,,,,[],,,,
