,id,conversation_id,created_at,date,timezone,place,tweet,language,hashtags,cashtags,user_id,user_id_str,username,name,day,hour,link,urls,photos,video,thumbnail,retweet,nlikes,nreplies,nretweets,quote_url,search,near,geo,source,user_rt_id,user_rt,retweet_id,reply_to,retweet_date,translate,trans_src,trans_dest
0,1361384078277185537,1361384078277185537,1613414232000.0,2021-02-16 00:07:12,+0530,,21 साल की देश की बिटिया गिरफ़्तार है क्योंकि देश को किसी #Toolkit से ख़तरा है जिसे उसने लिखा है ?!  कहानियां गढ़कर #किसान_आंदोलन से जुड़े लोगों को परेशान करने के मामले बढ़ रहे हैं। क्लाइमेट एक्टिविस्ट #DishaRavi की गिरफ़्तारी युवाओं को डराने और आगे न आने देने के मक़सद से तो नहीं?,hi,"['toolkit', 'किसान_आंदोलन', 'disharavi']",[],2393674370,2393674370,RajBabbar23,Raj Babbar,2,00,https://twitter.com/RajBabbar23/status/1361384078277185537,[],[],0,,False,1071,25,213,,#किसान_आंदोलन,,,,,,,[],,,,
1,1361377490627743748,1361377490627743748,1613412661000.0,2021-02-15 23:41:01,+0530,,हद है!! मृतप्राय #कांग्रेस को #किसान_आंदोलन से संजीवनी चाहिए और इसके लिए शराब बांटने को भी तैयार है।बड़ी बात नहीं- ऐसी कवायदें झारखंड में भी चल रही हों। @BJP4Jharkhand @yourBabulal @dprakashbjp @SethSanjayMP @SunilSingh_BJP @sunilsoren_mp @vishnumppalamu @SbhagatBJP @jayantsinha,hi,"['कांग्रेस', 'किसान_आंदोलन']",[],733687317580251136,733687317580251136,maheshpoddarmp,Mahesh Poddar,1,23,https://twitter.com/maheshpoddarmp/status/1361377490627743748,[],[],0,,False,9,1,1,https://twitter.com/PiyushGoyal/status/1361308392220807174,#किसान_आंदोलन,,,,,,,[],,,,
2,1361347188882739206,1361347188882739206,1613405437000.0,2021-02-15 21:40:37,+0530,,उप्र के बिजनौर में किसान महापंचायत के दौरान श्रीमती प्रियंका गांधी को सुनने उमड़ा जनसैलाब! #किसान_आंदोलन  https://t.co/6i02BDsz8B,hi,['किसान_आंदोलन'],[],265974620,265974620,subhashsojatia,Subhash Kumar Sojatia,1,21,https://twitter.com/subhashsojatia/status/1361347188882739206,[],"['https://pbs.twimg.com/media/EuR6C2XUUAcLLp5.jpg', 'https://pbs.twimg.com/media/EuR6DG6UcAArvB0.jpg', 'https://pbs.twimg.com/media/EuR6DXnVoAMmPBR.jpg']",1,https://pbs.twimg.com/media/EuR6C2XUUAcLLp5.jpg,False,8,0,2,,#किसान_आंदोलन,,,,,,,[],,,,
3,1361320995110350848,1361320995110350848,1613399192000.0,2021-02-15 19:56:32,+0530,,"दुष्यंत चौटाला इस्तीफा देने विधानसभा पहुंचे, बाद में पता चला इस्तीफा तो बाबू की जेब मे ही रह गया।  #किसान_आंदोलन",hi,['किसान_आंदोलन'],[],125325790,125325790,ArchanaDalmia,Archana Dalmia,1,19,https://twitter.com/ArchanaDalmia/status/1361320995110350848,[],[],0,,False,620,15,116,,#किसान_आंदोलन,,,,,,,[],,,,
4,1361300729541976064,1361300729541976064,1613394360000.0,2021-02-15 18:36:00,+0530,,"Government insulted farmers, ministers called them traitors: @priyankagandhi   #किसान_आंदोलन  https://t.co/zmfCEpJmE8",en,['किसान_आंदोलन'],[],789070593391931393,789070593391931393,SevadalCHD,Chandigarh Congress Sevadal,1,18,https://twitter.com/SevadalCHD/status/1361300729541976064,['https://m.tribuneindia.com/news/nation/government-insulted-farmers-ministers-called-them-traitors-priyanka-gandhi-212785?__twitter_impression=true'],[],0,,False,3,0,1,,#किसान_आंदोलन,,,,,,,[],,,,
5,1361216896217976834,1361216896217976834,1613374372000.0,2021-02-15 13:02:52,+0530,,कौन है ये शख़्स जिसकी तस्वीर सोशल मीडिया पर #किसान_आंदोलन से जोड़कर शेयर की जा रही है? #FarmersProtest #KisanAndolan #FakeNews   https://t.co/3TxmAlCCSN,hi,"['किसान_आंदोलन', 'farmersprotest', 'kisanandolan', 'fakenews']",[],1051809513509023744,1051809513509023744,BoomFactsHindi,BOOM Hindi,1,13,https://twitter.com/BoomFactsHindi/status/1361216896217976834,['https://hindi.boomlive.in/fact-check/tamilnadu-pastor-kisan-andolan-disguise-congress-fake-news-11931'],[],0,,False,1,0,0,,#किसान_आंदोलन,,,,,,,[],,,,
