,id,conversation_id,created_at,date,timezone,place,tweet,language,hashtags,cashtags,user_id,user_id_str,username,name,day,hour,link,urls,photos,video,thumbnail,retweet,nlikes,nreplies,nretweets,quote_url,search,near,geo,source,user_rt_id,user_rt,retweet_id,reply_to,retweet_date,translate,trans_src,trans_dest
0,1322428066400890880,1322428066400890880,1604126395000.0,2020-10-31 12:09:55,+0530,,#Agriculture #Bills #Demonstration மத்திய அரசின் 3 வேளாண் சட்டங்களுக்கு எதிராக காங்கிரஸ் கட்சியினர் தமிழகம் முழுவதும் ஆர்ப்பாட்டம் !  https://t.co/WpLJ8fmYKh,ta,"['agriculture', 'bills', 'demonstration']",[],107337499,107337499,DinakaranNews,Dinakaran,6,12,https://twitter.com/DinakaranNews/status/1322428066400890880,['https://www.dinakaran.com/News_Detail.asp?Nid=628103'],[],0,,False,6,0,0,,agriculture bills,,,,,,,[],,,,
1,1322410471480193024,1322410471480193024,1604122200000.0,2020-10-31 11:00:00,+0530,,"The 3 #Punjab bills aren't laws yet &amp; require assent of Governor, which he's unlikely to give: SC Kashyap says, there's no time frame by which Governor must take any action [on the bills] #FarmBills2020 #FarmLaws #agriculture @htTweets  https://t.co/kAiIbObgie",en,"['punjab', 'farmbills2020', 'farmlaws', 'agriculture']",[],1712296868,1712296868,CPR_India,CPR India,6,11,https://twitter.com/CPR_India/status/1322410471480193024,['https://www.hindustantimes.com/india-news/punjab-bills-offer-little-on-ground/story-v9q9diTe0BZES4HL0wpTrI.html'],[],0,,False,1,1,0,,agriculture bills,,,,,,,[],,,,
2,1322406207135518720,1322406207135518720,1604121183000.0,2020-10-31 10:43:03,+0530,,The 5th Session of the Rajasthan Vidhan Sabha is set to begin again today. 4 bills are listed for introduction including three related to agriculture.  https://t.co/7wO7pFs0tV,en,[],[],37629039,37629039,PRSLegislative,PRS Legislative,6,10,https://twitter.com/PRSLegislative/status/1322406207135518720,[],['https://pbs.twimg.com/media/Elogj7-VkAEqJLY.jpg'],1,https://pbs.twimg.com/media/Elogj7-VkAEqJLY.jpg,False,18,1,0,,agriculture bills,,,,,,,[],,,,
3,1322401231260717057,1322401231260717057,1604119997000.0,2020-10-31 10:23:17,+0530,,"Rajasthan govt is simply following the religion of opposing centre's 3 Farm Laws by their senior leaders. Congress itself had implemented contract farming in its ruled states: Gulab Chand Kataria, Leader of Opposition in Rajasthan Assembly on Rajasthan govt's new Agriculture Bill  https://t.co/LrGI732RH9",en,[],[],355989081,355989081,ANI,ANI,6,10,https://twitter.com/ANI/status/1322401231260717057,[],['https://pbs.twimg.com/media/Elobav_UYAIr1Lp.jpg'],1,https://pbs.twimg.com/media/Elobav_UYAIr1Lp.jpg,False,191,2,14,,agriculture bills,,,,,,,[],,,,
4,1322384360289415168,1322384360289415168,1604115974000.0,2020-10-31 09:16:14,+0530,,Watch @nstomar on Agriculture bills interview by @realSukhiChahal  https://t.co/y10yskumkx,en,[],[],45795876,45795876,rpsinghkhalsa,RP Singh National Spokesperson BJP,6,09,https://twitter.com/rpsinghkhalsa/status/1322384360289415168,['https://youtu.be/5k3UMqjQnlY'],[],0,,False,11,2,6,,agriculture bills,,,,,,,[],,,,
