,id,conversation_id,created_at,date,timezone,place,tweet,language,hashtags,cashtags,user_id,user_id_str,username,name,day,hour,link,urls,photos,video,thumbnail,retweet,nlikes,nreplies,nretweets,quote_url,search,near,geo,source,user_rt_id,user_rt,retweet_id,reply_to,retweet_date,translate,trans_src,trans_dest
0,1396885364783128577,1396885360756633602,1621878398000.0,2021-05-24 23:16:38,+0530,,"Also technically, VT’s hemp program is still operating under the 2014 farm bill, not the 2018 hemp legalization law (under which consumables are banned until the FDA eventually issues rules). That might not last, but for now, it’s easy to see why MA hemp farmers are livid.",en,[],[],27338838,27338838,Dan_Adams86,Dan Adams,1,23,https://twitter.com/Dan_Adams86/status/1396885364783128577,[],[],0,,False,2,1,0,,farmers' bill,,,,,,,[],,,,
1,1396872298892771330,1396872298892771330,1621875283000.0,2021-05-24 22:24:43,+0530,,Assemblyman Houghtaling &amp; @AsmJohnArmato Bill to Strengthen Legal Protections for Farmers Under ‘Right to Farm Act’ Passes Assembly:  (@EricAndJoann)  https://t.co/Jg8aqV4Ab3  https://t.co/2fbogLbHMi,en,[],[],57673909,57673909,njassemblydems,NJ Assembly Democrats,1,22,https://twitter.com/njassemblydems/status/1396872298892771330,['https://www.assemblydems.com/houghtaling-armato-bill-to-strengthen-legal-protections-for-farmers-under-right-to-farm-act-passes-assembly/'],"['https://pbs.twimg.com/media/E2Kv1sCXsAAdNDK.jpg', 'https://pbs.twimg.com/media/E2Kv319WQAU_41q.jpg']",1,https://pbs.twimg.com/media/E2Kv1sCXsAAdNDK.jpg,False,0,0,1,,farmers' bill,,,,,,,[],,,,
2,1396848930244206595,1396848930244206595,1621869711000.0,2021-05-24 20:51:51,+0530,,".@jack, first they came for those protesting the bigoted CAA bill; then they came for the farmers; then for the citizens volunteering for #COVID19..  Stop funding hate &amp; bigotry.   Delhi Cops At @Twitter Offices Amid Row Over ""Congress Toolkit"" Tweet  https://t.co/mfEFhfg9ae @ndtv",en,['covid19'],[],559652727,559652727,PKashwan,Dr. Prakash Kashwan,1,20,https://twitter.com/PKashwan/status/1396848930244206595,['https://ndtv.com/india-news/delhi-police-at-twitter-office-in-gurgaon-amid-row-over-congress-toolkit-tweet-2448555'],[],0,,False,1,0,0,,farmers' bill,,,,,,,[],,,,
3,1396810274569555972,1396810274569555972,1621860495000.0,2021-05-24 18:18:15,+0530,,"I would like to ask govt. via media that when on 5 June 2021 you brought 3 bills without discussing with us. we did not ask for it. Today we are just saying that take them back: @RajaramTripath7,(National Convener, All India Farmers Alliance)  Watch #Viewpoint with @Zakka_Jacob  https://t.co/lDZMGRgRP2",en,['viewpoint'],[],6509832,6509832,CNNnews18,News18,1,18,https://twitter.com/CNNnews18/status/1396810274569555972,[],[],1,https://pbs.twimg.com/media/E2J2fRLWUAkgGC4.jpg,False,11,5,0,,farmers' bill,,,,,,,[],,,,
4,1396796041983365122,1396796041983365122,1621857102000.0,2021-05-24 17:21:42,+0530,,"We have brought these bills only in favor of the farmers: RP Singh (@rpsinghkhalsa), Spokesperson BJP.  Watch #NationAt5 with @AnchorAnandN  https://t.co/UOyVNGrSEn",en,['nationat5'],[],6509832,6509832,CNNnews18,News18,1,17,https://twitter.com/CNNnews18/status/1396796041983365122,[],[],1,https://pbs.twimg.com/media/E2JqdzeWEAA4F-D.jpg,False,13,5,0,,farmers' bill,,,,,,,[],,,,
5,1396704262013390854,1396704262013390854,1621835220000.0,2021-05-24 11:17:00,+0530,,Today's front page 🗞️  Douglas Ross urged to keep past promises and end silence on the trade bill which threatens Scots farmers  https://t.co/ffvSFtJD8L,en,[],[],2887077099,2887077099,ScotNational,The National,1,11,https://twitter.com/ScotNational/status/1396704262013390854,[],['https://pbs.twimg.com/media/E2GWe6JXsAAgUi4.jpg'],1,https://pbs.twimg.com/media/E2GWe6JXsAAgUi4.jpg,False,56,2,29,,farmers' bill,,,,,,,[],,,,
6,1396701745246478343,1396701745246478343,1621834620000.0,2021-05-24 11:07:00,+0530,,The Farmers Bill is what has encouraged the mass protests. The govt should withdraw the bills and the protests will stop. The govt is killing people. It’s really that simple.,en,[],[],557555403,557555403,arpitachatter,Arpita Chatterjee,1,11,https://twitter.com/arpitachatter/status/1396701745246478343,[],[],0,,False,55,38,17,https://twitter.com/BDUTT/status/1396666071717871618,farmers' bill,,,,,,,[],,,,
7,1396668938080059395,1396668938080059395,1621826798000.0,2021-05-24 08:56:38,+0530,,"Our farmers have been peacefully protesting the unconstitutional #FarmBills for months, undeterred by #COVID19. @BJP4India Govt’s silence on this issue reeks of negligence towards their lives.   PM @narendramodi should immediately resume talks with the farmers &amp; repeal the bills.",en,"['farmbills', 'covid19']",[],2545112041,2545112041,LoPIndia,"Leader of Opposition, Rajya Sabha",1,08,https://twitter.com/LoPIndia/status/1396668938080059395,[],[],0,,False,304,3,116,,farmers' bill,,,,,,,[],,,,
8,1396635811303591942,1396635811303591942,1621818900000.0,2021-05-24 06:45:00,+0530,,"Local farmers selling directly to consumers, rather than through wholesale grocery stores, means larger profits for producers and a cheaper grocery bill for customers.  https://t.co/DEFewzfqR1",en,[],[],7166582,7166582,KOMUnews,KOMU 8 News,1,06,https://twitter.com/KOMUnews/status/1396635811303591942,['https://www.komu.com/news/midmissourinews/buying-local-a-cost-cutter-for-increasing-grocery-bills/article_78ed1584-bc1f-11eb-b43f-4725f23cc047.html?utm_source=SocialNewsDesk&utm_medium=twitter&utm_campaign=SND_twitter'],[],0,,False,11,1,1,,farmers' bill,,,,,,,[],,,,
