,id,conversation_id,created_at,date,timezone,place,tweet,language,hashtags,cashtags,user_id,user_id_str,username,name,day,hour,link,urls,photos,video,thumbnail,retweet,nlikes,nreplies,nretweets,quote_url,search,near,geo,source,user_rt_id,user_rt,retweet_id,reply_to,retweet_date,translate,trans_src,trans_dest
0,1412123424760205316,1412123424760205316,1625511435000.0,2021-07-06 00:27:15,+0530,,556 farmers have died at the #FarmersProtest !! Yet Mr Modi’s government remains silent ! THATS 556 FARMERS!!!!,en,['farmersprotest'],[],2347762888,2347762888,RaviSinghKA,ravinder singh,2,00,https://twitter.com/RaviSinghKA/status/1412123424760205316,[],[],0,,False,3733,47,1470,,farmers protest,,,,,,,[],,,,
1,1412110664244465665,1412110664244465665,1625508392000.0,2021-07-05 23:36:32,+0530,,#किसान एक बार जो ठान ले वो करकें रहता है अब किसान ठान चुका हैं की हम अपना हक़ लेकर रहेंगे...।  #किसान_संसद_कूच_करेगा #FarmersProtest  https://t.co/QlyoAtyiCo,hi,"['किसान', 'किसान_संसद_कूच_करेगा', 'farmersprotest']",[],2799118662,2799118662,comredamraram,Amra Ram,1,23,https://twitter.com/comredamraram/status/1412110664244465665,[],['https://pbs.twimg.com/media/E5jTJ_tVIAQojUv.jpg'],1,https://pbs.twimg.com/media/E5jTJ_tVIAQojUv.jpg,False,321,2,48,,farmers protest,,,,,,,[],,,,
2,1412095224155762688,1412095224155762688,1625504711000.0,2021-07-05 22:35:11,+0530,,#Farmers plan #nationwidestrike against #fuelprice hike on July 8; protests before #Parliament from July 22  https://t.co/fbgDZrs3kn,en,"['farmers', 'nationwidestrike', 'fuelprice', 'parliament']",[],161318053,161318053,business_today,Business Today,1,22,https://twitter.com/business_today/status/1412095224155762688,['https://www.businesstoday.in/latest/economy/story/farmers-plan-nationwide-strike-against-fuel-price-hike-on-july-8-protests-before-parliament-from-july-22-300518-2021-07-05'],[],0,,False,21,3,2,,farmers protest,,,,,,,[],,,,
3,1412091884990697473,1412091884990697473,1625503915000.0,2021-07-05 22:21:55,+0530,,राज्य सरकारें 2003 से ही कृषि सुधार पर काम कर रही हैं और मोदी सरकार 2014 से ही पूंजीपति उद्धार पर ! #FarmersProtest #किसानों_की_क्रांति_तख़्त_हिलाएगी  https://t.co/rhQSiT9kiC,hi,"['farmersprotest', 'किसानों_की_क्रांति_तख़्त_हिलाएगी']",[],331670085,331670085,AbhayDubeyINC,Abhay Dubey,1,22,https://twitter.com/AbhayDubeyINC/status/1412091884990697473,[],[],1,https://pbs.twimg.com/ext_tw_video_thumb/1412091487869759490/pu/img/YZ2SmnZ5rDxjG8mo.jpg,False,353,9,65,,farmers protest,,,,,,,[],,,,
4,1412072363219243019,1412072224828248066,1625499261000.0,2021-07-05 21:04:21,+0530,,"Sanyukt Kisan Morcha (SKM) said that a group of five members from each organisation and at least 200 farmers would protest every day outside the #Parliament, reported The Indian Express.",en,['parliament'],[],2264849412,2264849412,LogicalIndians,The Logical Indian,1,21,https://twitter.com/LogicalIndians/status/1412072363219243019,[],[],0,,False,1,0,0,,farmers protest,,,,,,,[],,,,
5,1412072224828248066,1412072224828248066,1625499228000.0,2021-07-05 21:03:48,+0530,,"#Farmer organisations are planning to 'gherao' Parliament during the upcoming Monsoon Session.  The protest is to show their agitation against the three controversial farm laws, reported the Hindustan Times.  https://t.co/D0wpelUVJf",en,['farmer'],[],2264849412,2264849412,LogicalIndians,The Logical Indian,1,21,https://twitter.com/LogicalIndians/status/1412072224828248066,[],['https://pbs.twimg.com/media/E5iwJr5VEAUkOwn.jpg'],1,https://pbs.twimg.com/media/E5iwJr5VEAUkOwn.jpg,False,1,3,0,,farmers protest,,,,,,,[],,,,
6,1412072176870576128,1412072176870576128,1625499216000.0,2021-07-05 21:03:36,+0530,,#Dwarka: Farmers prostrate to mark protest against JKTL company over unheard demands.  #Gujarat #TV9News  https://t.co/ezFviQUsVl,en,"['dwarka', 'gujarat', 'tv9news']",[],346406417,346406417,tv9gujarati,Tv9 Gujarati,1,21,https://twitter.com/tv9gujarati/status/1412072176870576128,[],[],1,https://pbs.twimg.com/media/E5iwH0AVUAEonKe.jpg,False,5,0,0,,farmers protest,,,,,,,[],,,,
7,1412071017716064261,1412071017716064261,1625498940000.0,2021-07-05 20:59:00,+0530,,#AAP (@AamAadmiParty) leader #RaghavChadha (@raghav_chadha) on Monday alleged that the Bharatiya Janata Party (@BJP4India) wants to replace the Delhi government's public prosecutors with its own lawyers in cases pertaining to the farmers' protests.  https://t.co/ROju5Zb1bs,en,"['aap', 'raghavchadha']",[],141584822,141584822,ians_india,IANS,1,20,https://twitter.com/ians_india/status/1412071017716064261,[],['https://pbs.twimg.com/media/E5ieLWGVgAIJXyX.jpg'],1,https://pbs.twimg.com/media/E5ieLWGVgAIJXyX.jpg,False,47,0,4,,farmers protest,,,,,,,[],,,,
8,1412068999022530560,1412068999022530560,1625498458000.0,2021-07-05 20:50:58,+0530,,ਕਿਸਾਨੀ ਮੁੱਦੇ 'ਤੇ ਚੱਲਦੀ ਡਿਬੇਟ 'ਚ ਅਡੀਟਰ ਨਾਲ ਹੀ ਔਖਾ ਹੋਗਿਆ ਬੀਜੇਪੀ ਬੁਲਾਰਾ   #FarmersProtest #FarmLaws2020 #PTCNews #DelhiProtest #BJPLeaders #HarpreetSingh #CentreGovernment #PTCStandsWithFarmers   https://t.co/zz1upWFQNH,pa,"['farmersprotest', 'farmlaws2020', 'ptcnews', 'delhiprotest', 'bjpleaders', 'harpreetsingh', 'centregovernment', 'ptcstandswithfarmers']",[],852553470,852553470,ptcnews,ਪੀਟੀਸੀ ਨਿਊਜ਼ | PTC News,1,20,https://twitter.com/ptcnews/status/1412068999022530560,['https://youtu.be/bTB-ydT7AIo'],[],0,,False,0,0,0,,farmers protest,,,,,,,[],,,,
9,1412063665193422853,1412063665193422853,1625497187000.0,2021-07-05 20:29:47,+0530,,Panjab : Farmer Suicides :   There are so many heartbreaking stories of farmer Suicides across Panjab.   Khalsa Aid is assisting some of these families 🙏🏻  #FarmerSuicide #FarmersProtest  https://t.co/TRvoFYAnwR,en,"['farmersuicide', 'farmersprotest']",[],102391534,102391534,Khalsa_Aid,Khalsa Aid,1,20,https://twitter.com/Khalsa_Aid/status/1412063665193422853,[],[],1,https://pbs.twimg.com/ext_tw_video_thumb/1412063492539142148/pu/img/4N-Gw3mLYXYoIMTr.jpg,False,428,3,105,,farmers protest,,,,,,,[],,,,
10,1412062710360018950,1412062710360018950,1625496959000.0,2021-07-05 20:25:59,+0530,,"Om Prakash Chautala's return from jail, Bhupinder Hooda's assertion within Congress and farmers' protests have created a churn in Haryana's Jat politics. What happens next?  @AdityaMenon22 writes.   https://t.co/ADaJuN3eMK",en,[],[],2982269822,2982269822,TheQuint,The Quint,1,20,https://twitter.com/TheQuint/status/1412062710360018950,['https://www.thequint.com/news/politics/bhupinder-hooda-om-prakash-chautala-haryana-jat-politics-farmers-protest'],[],0,,False,12,0,4,,farmers protest,,,,,,,[],,,,
11,1412059571703599106,1412059571703599106,1625496211000.0,2021-07-05 20:13:31,+0530,,"Record procurement of wheat at 433.24 LMT in RMS 2021-22, says Centre #agriculture #Punjab #FarmersProtest  https://t.co/IiUAEe1Ghw..",en,"['agriculture', 'punjab', 'farmersprotest']",[],884845294772396032,884845294772396032,Vibha_Tribune,Vibha Sharma,1,20,https://twitter.com/Vibha_Tribune/status/1412059571703599106,['https://m.tribuneindia.com/news/nation/record-procurement-of-wheat-at-433-24-lmt-in-rms-2021-22-says-centre-278627?_gl=1*74i8w*_ga*TVRfWEhjdm5vOXNXckl1SVRoTjhoWURSUGpvdW10S1d4ZHlhSTFsTzhzdVJkVzJiWF9fY0V3ejU1UThJUEFaUw'],[],0,,False,1,0,1,,farmers protest,,,,,,,[],,,,
12,1412056962569621511,1412056962569621511,1625495589000.0,2021-07-05 20:03:09,+0530,,मानसून सत्र के दौरान हर दिन संसद के बाहर प्रदर्शन करेंगे: संयुक्त किसान मोर्चा #SKM #FarmersProtest #Parliament #MonsoonSession #FarmLaws #एसकेएम #किसानआंदोलन #मानसूनसत्र #कृषिकानून   https://t.co/vriXwRBiJl,hi,"['skm', 'farmersprotest', 'parliament', 'monsoonsession', 'farmlaws', 'एसकेएम', 'किसानआंदोलन', 'मानसूनसत्र', 'कृषिकानून']",[],817340591046414336,817340591046414336,thewirehindi,द वायर हिंदी,1,20,https://twitter.com/thewirehindi/status/1412056962569621511,['http://thewirehindi.com/176506/will-protest-every-day-outside-parliament-during-monsoon-session-skm/'],[],0,,False,52,1,8,,farmers protest,,,,,,,[],,,,
13,1412056801885913088,1412056801885913088,1625495550000.0,2021-07-05 20:02:30,+0530,,"🔹ਆਮ ਆਦਮੀ ਨੂੰ ਮਹਿੰਗਾਈ ਦੀ ਚੌਤਰਫ਼ਾ ਮਾਰ  🔹ਖਾਣ ਵਾਲੇ ਮਹਿੰਗੇ ਤੇਲ ਨੇ ਵੀ ਜ਼ਾਇਕਾ ਵਿਗਾੜਿਆ  🔹ਬੀਜੇਪੀ ਦੇ ਬੁਲਾਰੇ ਪੀਟੀਸੀ ਤੋਂ ਵੀ ਕਿਉਂ ਔਖੇ ? 🔹ਵੇਖੋ, ਵਿਚਾਰ ਤਕਰਾਰ: ਲੋਕਾਂ ਦਾ ਨਿਕਲਿਆ ਤੇਲ  #VicharTaqrar #HikeinPrice #Inflation #BJP #FarmersProtest #PTCNews #MustardOil   https://t.co/iL686v88SQ",pa,"['vichartaqrar', 'hikeinprice', 'inflation', 'bjp', 'farmersprotest', 'ptcnews', 'mustardoil']",[],852553470,852553470,ptcnews,ਪੀਟੀਸੀ ਨਿਊਜ਼ | PTC News,1,20,https://twitter.com/ptcnews/status/1412056801885913088,['https://youtu.be/9MqOcDhN9Rc'],[],0,,False,0,0,0,,farmers protest,,,,,,,[],,,,
14,1412053747774103552,1412053747774103552,1625494822000.0,2021-07-05 19:50:22,+0530,,AAP leader Raghav Chadha on Monday alleged that the Bharatiya Janata Party wants to replace the Delhi government's public prosecutors with its own lawyers in cases pertaining to the farmers' protests. #AAP #FarmersProtest #BJP @raghav_chadha @AAPDelhi   https://t.co/rUNYI6SGnJ,en,"['aap', 'farmersprotest', 'bjp']",[],470299753,470299753,TheDailyPioneer,The Pioneer,1,19,https://twitter.com/TheDailyPioneer/status/1412053747774103552,['https://www.dailypioneer.com/2021/top-stories/bjp-wants-to-replace-delhi-govt-prosecutors-in-farm-protest-cases--aap.html'],[],0,,False,17,1,2,,farmers protest,,,,,,,[],,,,
15,1412053451547189251,1412053451547189251,1625494752000.0,2021-07-05 19:49:12,+0530,,#KisanVirodhiBJP BJP Govt's Policy of Revenge against Farmers Exposed!! - BJP passes anti-farmer laws which is being protested by farmers. - Now the BJP Govt wants to appoint its own lawyers in cases pertaining to farmers' protest to take revenge on farmers.  https://t.co/Wu3xDpd7u1,en,['kisanvirodhibjp'],[],1344588571,1344588571,AAPOdisha,AAP Odisha 🇮🇳,1,19,https://twitter.com/AAPOdisha/status/1412053451547189251,[],['https://pbs.twimg.com/media/E5ifGEeVIAA_IqU.jpg'],1,https://pbs.twimg.com/media/E5ifGEeVIAA_IqU.jpg,False,37,1,41,,farmers protest,,,,,,,[],,,,
16,1412052638879813636,1412052638879813636,1625494558000.0,2021-07-05 19:45:58,+0530,,BJP passes anti-farmer laws  Now BJP appointed LG wants that BJP-controlled Delhi Police should choose public prosecutor in cases filed against farmer’s during their protest!  Obviously BJP doesn’t want a fair trial that @ArvindKejriwal’s prosecutors wud ensure  #KisanVirodhiBJP,en,['kisanvirodhibjp'],[],2245097203,2245097203,AAPGoa,Aam Aadmi Party Goa,1,19,https://twitter.com/AAPGoa/status/1412052638879813636,[],[],0,,False,55,3,49,,farmers protest,,,,,,,[],,,,
17,1412050446387089426,1412050446387089426,1625494035000.0,2021-07-05 19:37:15,+0530,,BJP passes anti-farmer laws  Now BJP appointed LG wants that BJP-controlled Delhi Police should choose public prosecutor in cases filed against farmer’s during their protest!  Obviously BJP doesn’t want a fair trial that @ArvindKejriwal’s prosecutors wud ensure  #KisanVirodhiBJP  https://t.co/R5GpivBCqO,en,['kisanvirodhibjp'],[],1415078539,1415078539,AAPHaryana,AAP Haryana,1,19,https://twitter.com/AAPHaryana/status/1412050446387089426,[],['https://pbs.twimg.com/media/E5icW7GVgAUtsN8.jpg'],1,https://pbs.twimg.com/media/E5icW7GVgAUtsN8.jpg,False,57,3,45,,farmers protest,,,,,,,[],,,,
18,1412048995212349441,1412048995212349441,1625493689000.0,2021-07-05 19:31:29,+0530,,बाल्मीकि किसान पंचायत गाजीपुर बॉर्डर मैं शामिल हुए बाल्मीकि समाज के कई नेता कहा कि समाज को किसान से लड़ने की   साजिश को कामयाब नही होने देंगे। #FarmersProtest  @AHindinews @PTI_News @Kisanektamorcha @bstvlive @AmarUjalaNews @punjabkesari @PMOIndia @down2earthindia  https://t.co/ifhTvdWky5,hi,['farmersprotest'],[],831948775165923330,831948775165923330,RakeshTikaitBKU,Rakesh Tikait,1,19,https://twitter.com/RakeshTikaitBKU/status/1412048995212349441,[],"['https://pbs.twimg.com/media/E5ibC8BVUAkKitr.jpg', 'https://pbs.twimg.com/media/E5ibD51VkAQVZuy.jpg']",1,https://pbs.twimg.com/media/E5ibC8BVUAkKitr.jpg,False,6365,211,1285,,farmers protest,,,,,,,[],,,,
19,1412043670719655941,1412043670719655941,1625492420000.0,2021-07-05 19:10:20,+0530,,BJP wants to remove capable Public prosecutors appointed by Kejriwal govt &amp; appoint its own Lawyers in cases pertaining to #Farmers  protest..  Of Course to Manipulate.. #KisanVirodhiBJP  https://t.co/7VwJUyEh6K,en,"['farmers', 'kisanvirodhibjp']",[],1016786527,1016786527,aartic02,Aarti,1,19,https://twitter.com/aartic02/status/1412043670719655941,[],[],1,https://pbs.twimg.com/amplify_video_thumb/1411953110168133638/img/7HzldgwKcNS_pZv8.jpg,False,111,5,68,,farmers protest,,,,,,,[],,,,
20,1412040765941768193,1412040765941768193,1625491727000.0,2021-07-05 18:58:47,+0530,,"🔹ਆਮ ਆਦਮੀ ਨੂੰ ਮਹਿੰਗਾਈ ਦੀ ਚੌਤਰਫ਼ਾ ਮਾਰ  🔹ਖਾਣ ਵਾਲੇ ਮਹਿੰਗੇ ਤੇਲ ਨੇ ਵੀ ਜ਼ਾਇਕਾ ਵਿਗਾੜਿਆ  🔹ਬੀਜੇਪੀ ਦੇ ਬੁਲਾਰੇ ਪੀਟੀਸੀ ਤੋਂ ਵੀ ਕਿਉਂ ਔਖੇ ? 🔹ਵੇਖੋ, ਵਿਚਾਰ ਤਕਰਾਰ: ਲੋਕਾਂ ਦਾ ਨਿਕਲਿਆ ਤੇਲ, ਅੱਜ ਰਾਤ 8:00 ਵਜੇ ਸਿਰਫ਼ ਪੀਟੀਸੀ ਨਿਊਜ਼ 'ਤੇ   #VicharTaqrar #HikeinPrice #Inflation #BJP #FarmersProtest #PTCNews  https://t.co/9XLAFgbz9Y",pa,"['vichartaqrar', 'hikeinprice', 'inflation', 'bjp', 'farmersprotest', 'ptcnews']",[],852553470,852553470,ptcnews,ਪੀਟੀਸੀ ਨਿਊਜ਼ | PTC News,1,18,https://twitter.com/ptcnews/status/1412040765941768193,[],['https://pbs.twimg.com/media/E5iTgdIVEAgo1dx.jpg'],1,https://pbs.twimg.com/media/E5iTgdIVEAgo1dx.jpg,False,1,0,0,,farmers protest,,,,,,,[],,,,
21,1412040063484141577,1412040063484141577,1625491560000.0,2021-07-05 18:56:00,+0530,,संसद के घेराव से निकलेगा किसानों का समाधान ?   देखिये @sandeep_news24 के साथ #सबसेबड़ासवाल LIVE   @IGuruPrakash @AbhayDubeyINC  #FarmersProtest #किसान_आंदोलन   https://t.co/qzKj3GH8HR,hi,"['सबसेबड़ासवाल', 'farmersprotest', 'किसान_आंदोलन']",[],34206701,34206701,news24tvchannel,News24,1,18,https://twitter.com/news24tvchannel/status/1412040063484141577,['https://twitter.com/i/broadcasts/1mnxeaaaVpNxX'],[],0,,False,134,17,18,,farmers protest,,,,,,,[],,,,
22,1412036198873378819,1412036198873378819,1625490638000.0,2021-07-05 18:40:38,+0530,,"Agriculture ‘transformed’ by nitrogen measures, farmers plan protests  https://t.co/kyHoiJRJ2z",en,[],[],22020347,22020347,DutchNewsNL,DutchNews.NL,1,18,https://twitter.com/DutchNewsNL/status/1412036198873378819,['https://www.dutchnews.nl/news/2021/07/agriculture-transformed-by-nitrogen-measures-farmers-plan-protests/'],[],0,,False,2,0,0,,farmers protest,,,,,,,[],,,,
23,1412030788137222147,1412030788137222147,1625489348000.0,2021-07-05 18:19:08,+0530,,#Farmers to protest outside #Parliament during its #MonsoonSession2021  #FarmersProtest #FarmLaws #FarmerProtests    https://t.co/lhqNUNWzjS,en,"['farmers', 'parliament', 'monsoonsession2021', 'farmersprotest', 'farmlaws', 'farmerprotests']",[],852553470,852553470,ptcnews,ਪੀਟੀਸੀ ਨਿਊਜ਼ | PTC News,1,18,https://twitter.com/ptcnews/status/1412030788137222147,['https://www.ptcnews.tv/farmers-to-protest-outside-parliament-during-its-monsoon-session-2021/'],[],0,,False,2,0,0,,farmers protest,,,,,,,[],,,,
24,1412027515057491971,1412027515057491971,1625488568000.0,2021-07-05 18:06:08,+0530,,"Our farmers are fighting for us, make sure their voice is louder enough....  #FarmersProtest #किसान_संसद_कूच_करेगा  https://t.co/WCV9B0t9Ug",en,"['farmersprotest', 'किसान_संसद_कूच_करेगा']",[],2154396798,2154396798,pradeepmathurUP,Pradeep Mathur,1,18,https://twitter.com/pradeepmathurUP/status/1412027515057491971,[],['https://pbs.twimg.com/media/E5iHiQyVEAIJeFM.jpg'],1,https://pbs.twimg.com/media/E5iHiQyVEAIJeFM.jpg,False,13,0,2,,farmers protest,,,,,,,[],,,,
25,1412022571579719682,1412022571579719682,1625487389000.0,2021-07-05 17:46:29,+0530,,#NewsAlert | Farmers to protest #fuelpricehike. A nationwide protest called for July 8th.   Details by Mohit Sharma.  https://t.co/BIAaBO3XCu,en,"['newsalert', 'fuelpricehike']",[],240649814,240649814,TimesNow,TIMES NOW,1,17,https://twitter.com/TimesNow/status/1412022571579719682,[],[],1,https://pbs.twimg.com/media/E5iC_y4XMAE0elE.jpg,False,12,1,2,,farmers protest,,,,,,,[],,,,
26,1412019024318193669,1412019024318193669,1625486544000.0,2021-07-05 17:32:24,+0530,,"ਜੱਸ ਬਾਜਵਾ ਦੇ ਸਰਕਾਰ ਨੂੰ ਤਿੱਖੇ ਬੋਲ, ‘ਪਰਚੇ ਜਿੰਨੇ ਮਰਜ਼ੀ ਪਾਓ, ਅਸੀਂ ਉਨੀ ਤਾਕਤ ਨਾਲ ਹੋਰ ਅੱਗੇ ਆਵਾਂਗੇ’   https://t.co/DBzLnYhZhq  #JassBajwa #Interview #PunjabiSinger #FarmersProtest #FarmLaws  https://t.co/NXB07Ef3VH",pa,"['jassbajwa', 'interview', 'punjabisinger', 'farmersprotest', 'farmlaws']",[],222394250,222394250,JagbaniOnline,Jagbani,1,17,https://twitter.com/JagbaniOnline/status/1412019024318193669,['https://jagbani.punjabkesari.in/entertainment/news/jass-bajwa-interview-1299001'],['https://pbs.twimg.com/media/E5h_z_6VoAYY9XF.jpg'],1,https://pbs.twimg.com/media/E5h_z_6VoAYY9XF.jpg,False,5,0,0,,farmers protest,,,,,,,[],,,,
27,1412018140502892547,1412018140502892547,1625486333000.0,2021-07-05 17:28:53,+0530,,BJP passes anti-farmer laws  Now BJP appointed LG wants that BJP-controlled Delhi Police should choose public prosecutor in cases filed against farmer’s during their protest!  Obviously BJP doesn’t want a fair trial that @ArvindKejriwal’s prosecutors wud ensure  #KisanVirodhiBJP  https://t.co/IOUy5TbOjw,en,['kisanvirodhibjp'],[],361301678,361301678,AtishiAAP,Atishi,1,17,https://twitter.com/AtishiAAP/status/1412018140502892547,[],['https://pbs.twimg.com/media/E5h_At1UYAYd580.jpg'],1,https://pbs.twimg.com/media/E5h_At1UYAYd580.jpg,False,267,10,154,,farmers protest,,,,,,,[],,,,
28,1412010431867068419,1412010428238950401,1625484495000.0,2021-07-05 16:58:15,+0530,,Delhi Home Minister Satyender Jain requests the LG not to appoint special public prosecutors.  Delhi police had urged for appointment of special public prosecutors.   #FarmersProtest,en,['farmersprotest'],[],493059410,493059410,scribe_prashant,Prashant Kumar,1,16,https://twitter.com/scribe_prashant/status/1412010431867068419,[],[],0,,False,33,2,9,,farmers protest,,,,,,,[],,,,
29,1412010428238950401,1412010428238950401,1625484494000.0,2021-07-05 16:58:14,+0530,,BIG BREAKING: Huge row over appointment of special public prosecutors for cases against farmers during farm protests.   Del govt against appointing SPPs on Delhi police req.   SPPs should not be appointed at behest of any inv agencies in the interest of justice &amp; fair trial: Jain,en,[],[],493059410,493059410,scribe_prashant,Prashant Kumar,1,16,https://twitter.com/scribe_prashant/status/1412010428238950401,[],[],0,,False,96,2,21,,farmers protest,,,,,,,[],,,,
30,1412009921697226755,1412009921697226755,1625484373000.0,2021-07-05 16:56:13,+0530,,"‘आधी रात को बजेगा हॉर्न, ट्रैक्टर और सिलिंडर लेकर हाइवे पर जुटें’: किसानों ने संसद भवन के सामने प्रदर्शन का किया ऐलान  #FarmersProtest   https://t.co/tjQyypdS6V",hi,['farmersprotest'],[],1068155700168126464,1068155700168126464,OpIndia_in,ऑपइंडिया,1,16,https://twitter.com/OpIndia_in/status/1412009921697226755,['https://hindi.opindia.com/politics/united-kisan-morcha-announced-group-of-200-farmers-will-protest-in-front-of-parliament-from-july-22-till-the-end-of-monsoon-session/'],[],0,,False,53,1,17,,farmers protest,,,,,,,[],,,,
31,1412008120809705478,1412008118221869060,1625483944000.0,2021-07-05 16:49:04,+0530,,@_YogendraYadav @GulPanag @Kisanektamorcha @khalsaaid_india @Khalsa_Aid @diljitdosanjh   #farmersprotest #farmers #greenrevolution #indianagriculture #protest #indianews #kisanektazindabaad #kisan #tikriborder #kisanandolan #nofarmersnofood #punjab #haryana #uttarpradesh,und,"['farmersprotest', 'farmers', 'greenrevolution', 'indianagriculture', 'protest', 'indianews', 'kisanektazindabaad', 'kisan', 'tikriborder', 'kisanandolan', 'nofarmersnofood', 'punjab', 'haryana', 'uttarpradesh']",[],3010084370,3010084370,unscriptednews_,Unscripted.News,1,16,https://twitter.com/unscriptednews_/status/1412008120809705478,[],[],0,,False,3,1,0,,farmers protest,,,,,,,[],,,,
32,1412005986848567301,1412005986848567301,1625483435000.0,2021-07-05 16:40:35,+0530,,"'The Indian government which has already been silencing protests, criminalising dissent &amp; harassing #HumanRights defenders, cut mobile internet in #Kashmir on Republic Day in Jan 2021 &amp; blocked internet access in the context of Farmers Protests in Feb 2021' - @APC_News #KeepitOn",en,"['humanrights', 'kashmir', 'keepiton']",[],4895804187,4895804187,WITNESS_Asia,WITNESS Asia-Pacific,1,16,https://twitter.com/WITNESS_Asia/status/1412005986848567301,[],[],0,,False,1,0,0,https://twitter.com/APC_News/status/1412003793156423681,farmers protest,,,,,,,[],,,,
33,1411998092631502853,1411998092631502853,1625481553000.0,2021-07-05 16:09:13,+0530,,किसानों ने कहा है कि वे लोग मॉनसून सत्र खत्म होने तक संसद के बाहर प्रदर्शन करेंगे | #FarmersProtest #Parliament #MonsoonSession    https://t.co/KSwTS17kEb,hi,"['farmersprotest', 'parliament', 'monsoonsession']",[],42606652,42606652,aajtak,AajTak,1,16,https://twitter.com/aajtak/status/1411998092631502853,['https://www.aajtak.in/india/news/story/farmers-protest-action-plan-ready-for-parliament-gherao-protest-8-july-petrol-lpg-price-hike-ntc-1285156-2021-07-05'],[],0,,False,101,8,4,,farmers protest,,,,,,,[],,,,
34,1411993394667155457,1411993394667155457,1625480433000.0,2021-07-05 15:50:33,+0530,,"July 5 - Isfahan, central #Iran Farmers and their families protest authorities' measures of rerouting a local river for the Revolutionary Guards' projects while leaving their lands devastated without water. #IranProtests  https://t.co/7zFx4uHzFm",en,"['iran', 'iranprotests']",[],62088756,62088756,Mojahedineng,People's Mojahedin Organization of Iran (PMOI/MEK),1,15,https://twitter.com/Mojahedineng/status/1411993394667155457,[],[],1,https://pbs.twimg.com/ext_tw_video_thumb/1411941958432534528/pu/img/SOEHObzmmRBHrEyN.jpg,False,43,0,45,,farmers protest,,,,,,,[],,,,
35,1411991411210145797,1411991411210145797,1625479960000.0,2021-07-05 15:42:40,+0530,,HH Madamsahiba Mirchinder K keeping a tab on footage from @nakulssawhney 's upcoming film on farmers' protests in India.   HH likes to personally supervise the framing of sequences.,en,[],[],389914405,389914405,nehadixit123,Neha Dixit,1,15,https://twitter.com/nehadixit123/status/1411991411210145797,[],[],0,,False,20,2,0,https://twitter.com/nakulssawhney/status/1411988606751678465,farmers protest,,,,,,,[],,,,
36,1411989887436292098,1411989887436292098,1625479597000.0,2021-07-05 15:36:37,+0530,,ਨਵਦੀਪ ਤੇ ਉਸ ਦੇ ਪਿਤਾ ਨੂੰ ਯੂਨੀਅਨ ਤੋਂ ਬਾਹਰ ਕੱਢੇ ਜਾਣ 'ਤੇ ਬੋਲੇ ਗੁਰਨਾਮ ਚੜੂਨੀ #FarmersProtest #FarmLaws #GurnamCharuni ਇੱਥੇ ਪੜ੍ਹੋ ਪੂਰੀ ਖ਼ਬਰ: https://t.co/S1qdB1rVYP,pa,"['farmersprotest', 'farmlaws', 'gurnamcharuni']",[],1037022253,1037022253,abpsanjha,ABP Sanjha,1,15,https://twitter.com/abpsanjha/status/1411989887436292098,['https://punjabi.abplive.com/news/india/gurnam-charuni-spoke-after-navdeep-and-his-father-were-expelled-from-the-union-626297'],[],0,,False,0,0,0,,farmers protest,,,,,,,[],,,,
37,1411986091343630336,1411986091343630336,1625478692000.0,2021-07-05 15:21:32,+0530,,(BKU) and #Valmiki community members jointly hold a #mahapanchayat at #ghazipurborder #BKU national spokesperson #RakeshTikait also share the protest stage with leaders of #Bhartiya Valmiki Organisation to discuss issues concerning #Dalit #farmers and #Valmikis.  https://t.co/xXjvidNNM1,en,"['valmiki', 'mahapanchayat', 'ghazipurborder', 'bku', 'rakeshtikait', 'bhartiya', 'dalit', 'farmers', 'valmikis']",[],570570777,570570777,ARUNSHARMAJI,Arun Sharma,1,15,https://twitter.com/ARUNSHARMAJI/status/1411986091343630336,[],[],1,https://pbs.twimg.com/ext_tw_video_thumb/1411985761251979271/pu/img/cwmdN1Q_bkRmIfpM.jpg,False,2,0,0,,farmers protest,,,,,,,[],,,,
