,id,conversation_id,created_at,date,timezone,place,tweet,language,hashtags,cashtags,user_id,user_id_str,username,name,day,hour,link,urls,photos,video,thumbnail,retweet,nlikes,nreplies,nretweets,quote_url,search,near,geo,source,user_rt_id,user_rt,retweet_id,reply_to,retweet_date,translate,trans_src,trans_dest
0,1466437123121242112,1466437123121242112,1638460829000.0,2021-12-02 21:30:29,+0530,,"चार दिसंबर को खत्म हो सकता है किसान आंदोलन, संयुक्त किसान मोर्चा के नेता ने दिए संकेत  #FarmLaws #KisanAndolan  #FarmersProtest    https://t.co/VJp1q7e5St",hi,"['farmlaws', 'kisanandolan', 'farmersprotest']",[],64639742,64639742,JagranNews,Dainik Jagran,4,21,https://twitter.com/JagranNews/status/1466437123121242112,['https://www.jagran.com/delhi/new-delhi-city-sanyukt-kisan-morcha-call-meeting-on-dec-4-may-be-end-kisan-andolan-22259871.html'],[],0,,False,55,0,8,,kisan andolan,,,,,,,[],,,,
1,1466420116455833611,1466420116455833611,1638456775000.0,2021-12-02 20:22:55,+0530,,This day last year I wrote on why protests are democracy’s oxygen and why those who protest are greater democrats than rulers who dub them “andolanjeevis.” #KisanAndolan #FarmLaws #FarmLawsRepealed  https://t.co/9JSgmh1dtE,en,"['kisanandolan', 'farmlaws', 'farmlawsrepealed']",[],56312411,56312411,sagarikaghose,Sagarika Ghose,4,20,https://twitter.com/sagarikaghose/status/1466420116455833611,[],['https://pbs.twimg.com/media/FFnFUUbXMAQW0j0.jpg'],1,https://pbs.twimg.com/media/FFnFUUbXMAQW0j0.jpg,False,101,9,13,,kisan andolan,,,,,,,[],,,,
2,1466405490062020617,1466405490062020617,1638453287000.0,2021-12-02 19:24:47,+0530,,"Agriculture Minister @nstomar told parliament in a written that the government has ""no record"" of the deaths of farmers who were protesting the three contentious farm laws over the last year. #farmlaws #kisanandolan  https://t.co/ZXoYQxM9gZ",en,"['farmlaws', 'kisanandolan']",[],16579578,16579578,YouthKiAwaaz,Youth Ki Awaaz,4,19,https://twitter.com/YouthKiAwaaz/status/1466405490062020617,[],['https://pbs.twimg.com/media/FFmrTIFUUAgPK_4.jpg'],1,https://pbs.twimg.com/media/FFmrTIFUUAgPK_4.jpg,False,2,0,1,,kisan andolan,,,,,,,[],,,,
3,1466388788389638148,1466388788389638148,1638449305000.0,2021-12-02 18:18:25,+0530,,"सरकार भी दबाव में है तो दूसरी ओर किसान संगठन भी दबाव में हैं। #संयुक्त_किसान_मोर्चो की बैठक में इस तरह का फैसला लिया जाएगा, जिससे किसान आंदोलन और ज्यादा मजबूत होगा, भले ही उसका स्वरूप बदल सकता है। #KisanAndolan #Farmers",hi,"['संयुक्त_किसान_मोर्चो', 'kisanandolan', 'farmers']",[],1427376980,1427376980,journo_jitendra,Jitender Bhardwaj,4,18,https://twitter.com/journo_jitendra/status/1466388788389638148,[],[],0,,False,8,0,1,https://twitter.com/journo_jitendra/status/1466388289296863237,kisan andolan,,,,,,,[],,,,
4,1466387607827271681,1466387607827271681,1638449024000.0,2021-12-02 18:13:44,+0530,,"सब एक साथ लड़ने आए थे और लड़ रहे हैं। केंद्र को सच की रोशनी में किसानों की बात माननी होगी। इतना तय है कि चार दिसंबर को एसकेएम की बैठक में जो फैसला होगा, वह सामूहिक होगा। उसमें यह नहीं देखा जाएगा कि पंजाब के किसान संगठन क्या चाहते हैं।#KisanAndolan #Farmers",hi,"['kisanandolan', 'farmers']",[],1427376980,1427376980,journo_jitendra,Jitender Bhardwaj,4,18,https://twitter.com/journo_jitendra/status/1466387607827271681,[],[],0,,False,3,0,0,https://twitter.com/journo_jitendra/status/1466387269820973065,kisan andolan,,,,,,,[],,,,
5,1466382714626457609,1466382714626457609,1638447857000.0,2021-12-02 17:54:17,+0530,,"किसान आंदोलन: दोबारा टिकैत के आंसू गिरें अभी वैसी नौबत नहीं, 'दबाव' और 'संघर्ष' के बीच होगा निर्णायक फैसला  https://t.co/yeeMfZ5Tc2 #KisanAndolan #किसान_आंदोलन #FarmersProtests  I Report….",hi,"['kisanandolan', 'किसान_आंदोलन', 'farmersprotests']",[],1427376980,1427376980,journo_jitendra,Jitender Bhardwaj,4,17,https://twitter.com/journo_jitendra/status/1466382714626457609,['https://www.amarujala.com/india-news/after-repeal-farm-laws-questions-raised-about-the-future-of-farmers-protest-it-will-go-ahead-or-end-here'],[],0,,False,3,0,0,,kisan andolan,,,,,,,[],,,,
6,1466380433076064263,1466380433076064263,1638447313000.0,2021-12-02 17:45:13,+0530,,"#OMG: तीनों कृषि कानून वापस होने के बाद भी किसान आंदोलन जारी, क्या है अगली तैयारी?  For more #OmgVideos visit:  https://t.co/EYU009dslv          #OMGIndiaTV #KisanAndolan #FarmBill #FarmLawsRepealed  https://t.co/FGKor0c9Ux",hi,"['omg', 'omgvideos', 'omgindiatv', 'kisanandolan', 'farmbill', 'farmlawsrepealed']",[],34245009,34245009,indiatvnews,India TV,4,17,https://twitter.com/indiatvnews/status/1466380433076064263,['http://indiatvnews.com/video/oh-my-god'],[],1,https://pbs.twimg.com/media/FFmglkDVIAEe2kH.jpg,False,47,5,12,,kisan andolan,,,,,,,[],,,,
7,1466371512156315650,1466371512156315650,1638445187000.0,2021-12-02 17:09:47,+0530,,"किसान आंदोलन: दोबारा टिकैत के आंसू गिरें अभी वैसी नौबत नहीं, 'दबाव' और 'संघर्ष' के बीच होगा निर्णायक फैसला #KisanAndolan #FarmLawsRepealed  https://t.co/88cwFJnMB2",hi,"['kisanandolan', 'farmlawsrepealed']",[],169018518,169018518,AmarUjalaNews,Amar Ujala,4,17,https://twitter.com/AmarUjalaNews/status/1466371512156315650,['https://www.amarujala.com/india-news/after-repeal-farm-laws-questions-raised-about-the-future-of-farmers-protest-it-will-go-ahead-or-end-here'],[],0,,False,31,0,3,,kisan andolan,,,,,,,[],,,,
8,1466364017945939968,1466364017945939968,1638443400000.0,2021-12-02 16:40:00,+0530,,सिंघु बार्डर से मुकरबा चौक पहुंचे निहंगों को पुलिस ले जा रही है बंगला साहिब गुरुद्वारा  #KisanAndolan  #Delhi   https://t.co/siiLftaCJd,hi,"['kisanandolan', 'delhi']",[],64639742,64639742,JagranNews,Dainik Jagran,4,16,https://twitter.com/JagranNews/status/1466364017945939968,['https://www.jagran.com/delhi/new-delhi-city-ncr-delhi-police-taking-nihangs-to-bangla-sahib-gurdwara-know-the-whole-matter-22258575.html'],[],0,,False,15,0,1,,kisan andolan,,,,,,,[],,,,
9,1466354057367281671,1466354057367281671,1638441025000.0,2021-12-02 16:00:25,+0530,,"ਵਰੁਣ ਗਾਂਧੀ ਨੇ ਫਿਰ ਆਪਣੀ ਹੀ ਸਰਕਾਰ 'ਤੇ ਚੁੱਕੇ ਸਵਾਲ, ਕਿਹਾ- ਕਦੋਂ ਤੱਕ ਦੇਸ਼ ਦੇ ਨੌਜਵਾਨ ਸਬਰ ਰੱਖਣ?  https://t.co/PhA32ds1sd  #KisanAndolan #uttarpradesh #BharatiyaJanataParty #varungandhi #BJP @varungandhi80",pa,"['kisanandolan', 'uttarpradesh', 'bharatiyajanataparty', 'varungandhi', 'bjp']",[],852553470,852553470,ptcnews,ਪੀਟੀਸੀ ਨਿਊਜ਼ | PTC News,4,16,https://twitter.com/ptcnews/status/1466354057367281671,['https://www.ptcnews.tv/varun-gandhi-raised-questions-to-government-how-long-should-the-youth-of-the-country-be-patien'],[],0,,False,1,0,0,,kisan andolan,,,,,,,[],,,,
10,1466336014645940227,1466336014645940227,1638436723000.0,2021-12-02 14:48:43,+0530,,सरकार ने कहा उनको नहीं मालूम कि कितने किसान आदोलन में शहीद हुए..मतलब जब मालूम ही नहीं तो मुआवजा कैसा.दोस्तों अगर दुश्मन से मजबूरी में संधि करनी पड़ जाए तो इसका मतबल ये नहीं है कि दुश्मनी दोस्ती में बदल गई..सरकार ने डिसीजन बदला है किसानों के लिए अपना परसेप्शन नहीं #KisanAndolan,hi,['kisanandolan'],[],855721072443797506,855721072443797506,PragyaLive,Pragya Mishra,4,14,https://twitter.com/PragyaLive/status/1466336014645940227,[],[],0,,False,7432,130,1473,,kisan andolan,,,,,,,[],,,,
11,1466322346797506560,1466322346797506560,1638433465000.0,2021-12-02 13:54:25,+0530,,"ਬੀਜੇਪੀ ਸੰਸਦ ਮੈਂਬਰ ਵਰੁਣ ਗਾਂਧੀ ਨੇ ਵਿਖਾਇਆ ਆਪਣੀ ਹੀ ਸਰਕਾਰ ਨੂੰ ਸ਼ੀਸ਼ਾ, ਪੁੱਛਿਆ ਕਦੋਂ ਤੱਕ ਦੇਸ਼ ਦੇ ਨੌਜਵਾਨ ਸਬਰ ਰੱਖਣ?  https://t.co/0nWaNxICEq #KisanAndolan #uttarpradesh #BharatiyaJanataParty #varungandhi",pa,"['kisanandolan', 'uttarpradesh', 'bharatiyajanataparty', 'varungandhi']",[],1037022253,1037022253,abpsanjha,ABP Sanjha,4,13,https://twitter.com/abpsanjha/status/1466322346797506560,['https://punjabi.abplive.com/news/india/bjp-mp-varun-gandhi-showed-his-own-government-a-mirror-asked-how-long-the-youth-of-the-country-should-be-patient-637339'],[],0,,False,0,1,0,,kisan andolan,,,,,,,[],,,,
12,1466316208240611332,1466316208240611332,1638432001000.0,2021-12-02 13:30:01,+0530,,"आंदोलन में किसानों की मौत का रिकॉर्ड नहीं, मुआवजे का सवाल नहीं: केंद्र    और अधिक खबरें व मुफ्त ई-पेपर पढ़ने के लिए दैनिक भास्कर ऐप इंस्टॉल करें -  https://t.co/hO3HVqumVH  @PMOIndia #kisanandolan @IndianFarmers_ @RakeshTikaitBKU  https://t.co/ODglbrTVKE",hi,['kisanandolan'],[],67378160,67378160,DainikBhaskar,Dainik Bhaskar,4,13,https://twitter.com/DainikBhaskar/status/1466316208240611332,['https://dainik-b.in/M4RPWQKPcjb'],['https://pbs.twimg.com/media/FFlJDD6VcAQZb1e.jpg'],1,https://pbs.twimg.com/media/FFlJDD6VcAQZb1e.jpg,False,95,2,24,,kisan andolan,,,,,,,[],,,,
13,1466315055868219394,1466315055868219394,1638431726000.0,2021-12-02 13:25:26,+0530,,"There is a tirade against MSP and it is full of ignorance, prejudice, and fabrications.   Share this #Instagram post and help us bust the myths and support our farmers.   #kisanandolan #farmersprotest #MSP   https://t.co/eyeTlxmgDC",en,"['instagram', 'kisanandolan', 'farmersprotest', 'msp']",[],1317076194,1317076194,_YogendraYadav,Yogendra Yadav,4,13,https://twitter.com/_YogendraYadav/status/1466315055868219394,['https://www.instagram.com/p/CW-POzHvNrT/?utm_medium=copy_link'],[],0,,False,148,11,41,,kisan andolan,,,,,,,[],,,,
14,1466309524080365574,1466309524080365574,1638430407000.0,2021-12-02 13:03:27,+0530,,"ਖੇਤੀ ਕਾਨੂੰਨਾਂ ਦੀ ਵਾਪਸੀ ਮਗਰੋਂ ਮੁੱਖ ਮੰਤਰੀ ਖੱਟਰ ਦੇ ਤੇਵਰ ਨਰਮ, ਕਿਸਾਨਾਂ ਨੂੰ ਗੱਲਬਾਤ ਲਈ ਬੁਲਾਇਆ ਜਾਵੇਗਾ  https://t.co/Gm4hWVGYyJ #farmerprotest #KisanAndolan #Agriculturelaws #ChiefMinisterKhattar",pa,"['farmerprotest', 'kisanandolan', 'agriculturelaws', 'chiefministerkhattar']",[],1037022253,1037022253,abpsanjha,ABP Sanjha,4,13,https://twitter.com/abpsanjha/status/1466309524080365574,['https://punjabi.abplive.com/news/india/after-the-return-of-agriculture-laws-chief-minister-khattar-s-soft-spoken-farmers-will-be-invited-for-talks-637328'],[],0,,False,1,0,0,,kisan andolan,,,,,,,[],,,,
15,1466305356083056642,1466305356083056642,1638429414000.0,2021-12-02 12:46:54,+0530,,"किसानों को भेजेंगे निमंत्रण, उनके साथ बातचीत काफी नजदीक तक पहुंच गई है-Manohar Lal  #HaryanaNews #KisanAndolan #FIR #Latest #ZeePHH @cmohry @mlkhattar @BJP4Haryana  https://t.co/LIRtg7FTes",hi,"['haryananews', 'kisanandolan', 'fir', 'latest', 'zeephh']",[],2529715724,2529715724,ZeePunjabHH,Zee PHH,4,12,https://twitter.com/ZeePunjabHH/status/1466305356083056642,[],[],1,https://pbs.twimg.com/media/FFlc8EsVEAEsrbE.jpg,False,2,0,2,,kisan andolan,,,,,,,[],,,,
16,1466301296583983105,1466301296583983105,1638428446000.0,2021-12-02 12:30:46,+0530,,किसान आंदोलन की आड़ में नकली किसान कर रहे ड्रग्स की तस्करी. दिल्ली में साढ़े 9 किलो ड्रग्स के साथ 2 कथित किसान नेता गिरफ्तार.  #KisanAndolan #RakeshTikait #DRUGS   Zee Hindustan LIVE:  https://t.co/7dU2YCxZsD  https://t.co/HvaL0eeOce,hi,"['kisanandolan', 'rakeshtikait', 'drugs']",[],3989159413,3989159413,Zee_Hindustan,ZEE HINDUSTAN,4,12,https://twitter.com/Zee_Hindustan/status/1466301296583983105,['http://shorturl.at/azBD2'],[],1,https://pbs.twimg.com/media/FFlZWW7VEAEHblS.jpg,False,28,2,15,,kisan andolan,,,,,,,[],,,,
17,1466300469353930764,1466300469353930764,1638428249000.0,2021-12-02 12:27:29,+0530,,"ਕਿਸਾਨ ਅੰਦੋਲਨ ਨੂੰ ਲੈ ਕੇ ਮੁੜ ਸਿਆਸਤ, ਰਾਘਵ ਚੱਢਾ ਦਾ ਕੇਂਦਰ ਸਰਕਾਰ 'ਤੇ ਨਿਸ਼ਾਨਾ  #RaghavChadha #LatestNews #KisanAndolan #ZeePHH @ArvindKejriwal @AamAadmiParty @raghav_chadha @AAPPunjab @BhagwantMann @HarpalCheemaMLA  https://t.co/fZnN9fcaVs",pa,"['raghavchadha', 'latestnews', 'kisanandolan', 'zeephh']",[],2529715724,2529715724,ZeePunjabHH,Zee PHH,4,12,https://twitter.com/ZeePunjabHH/status/1466300469353930764,[],[],1,https://pbs.twimg.com/media/FFlYfkbVQAI2EcN.jpg,False,36,0,8,,kisan andolan,,,,,,,[],,,,
18,1466299466701414400,1466299466701414400,1638428010000.0,2021-12-02 12:23:30,+0530,,#10KaDangal | सियासत से 'समर्थन मूल्य' वसूले बिना नहीं लौटेंगे टिकैत?   #RakeshTikait #KisanAndolan #FarmersLaw   Zee Hindustan LIVE:  https://t.co/7dU2YCxZsD  https://t.co/7TuMooibHl,hi,"['10kadangal', 'rakeshtikait', 'kisanandolan', 'farmerslaw']",[],3989159413,3989159413,Zee_Hindustan,ZEE HINDUSTAN,4,12,https://twitter.com/Zee_Hindustan/status/1466299466701414400,['http://shorturl.at/azBD2'],[],1,https://pbs.twimg.com/media/FFlXD56VkAAcwia.jpg,False,6,0,2,,kisan andolan,,,,,,,[],,,,
19,1466297018570063873,1466297018570063873,1638427426000.0,2021-12-02 12:13:46,+0530,,#10KaDangal | सियासत से 'समर्थन मूल्य' वसूले बिना नहीं लौटेंगे टिकैत?  #RakeshTikait #KisanAndolan #FarmersLaw   Zee Hindustan LIVE:  https://t.co/7dU2YCxZsD  https://t.co/obIegy6yc9,hi,"['10kadangal', 'rakeshtikait', 'kisanandolan', 'farmerslaw']",[],3989159413,3989159413,Zee_Hindustan,ZEE HINDUSTAN,4,12,https://twitter.com/Zee_Hindustan/status/1466297018570063873,['http://shorturl.at/azBD2'],[],1,https://pbs.twimg.com/media/FFlVIMsUYAUMHZD.jpg,False,5,0,1,,kisan andolan,,,,,,,[],,,,
