,id,conversation_id,created_at,date,timezone,place,tweet,language,hashtags,cashtags,user_id,user_id_str,username,name,day,hour,link,urls,photos,video,thumbnail,retweet,nlikes,nreplies,nretweets,quote_url,search,near,geo,source,user_rt_id,user_rt,retweet_id,reply_to,retweet_date,translate,trans_src,trans_dest
0,1370411099342786560,1370411099342786560,1615566441000.0,2021-03-12 21:57:21,+0530,,"हरियाणा के बाद अब यूपी में भी BJP नेताओं का बहिष्कार! मंत्री के ख़िलाफ़ जुटे लोग, लगे मुर्दाबाद के नारे  #UttarPradesh #Shamli #KisanAndolan #Farmers #YogiAdityanath   https://t.co/JD8mTfi5Pk",hi,"['uttarpradesh', 'shamli', 'kisanandolan', 'farmers', 'yogiadityanath']",[],3097353133,3097353133,BoltaHindustan,Bolta Hindustan,5,21,https://twitter.com/BoltaHindustan/status/1370411099342786560,['https://boltahindustan.in/uttar-pradesh/amid-farmers-protest-bjp-leader-and-minister-suresh-rana-face-boycott-in-shamli/'],[],0,,False,281,1,65,,kisan andolan,,,,,,,[],,,,
1,1370288893782679554,1370288893782679554,1615537305000.0,2021-03-12 13:51:45,+0530,,किसान आंदोलन : अमृतसर में 169 दिन बाद किसान यूनियन का धरना खत्म  https://t.co/mgsvZSzven #farmersprotets #kisanandolan #punjab #haryana #amritsar,hi,"['farmersprotets', 'kisanandolan', 'punjab', 'haryana', 'amritsar']",[],18186549,18186549,oneindiaHindi,Oneindia Hindi,5,13,https://twitter.com/oneindiaHindi/status/1370288893782679554,['https://bit.ly/3l8Vsqg'],[],0,,False,0,0,0,,kisan andolan,,,,,,,[],,,,
2,1370287077179289603,1370287077179289603,1615536872000.0,2021-03-12 13:44:32,+0530,,#BJP का विरोध करने #Bengal  जाएंगे @RakeshTikaitBKU; नंदीग्राम-कोलकाता में कृषि कानूनों के खिलाफ पंचायत करेंगे  #agriculturelaw #Nandigram #WestBengalElections2021  @BJP4India @PMOIndia #kisanandolan   https://t.co/7nUScS33wR,hi,"['bjp', 'bengal', 'agriculturelaw', 'nandigram', 'westbengalelections2021', 'kisanandolan']",[],1149193552431210496,1149193552431210496,AsianetNewsHN,Asianetnews Hindi,5,13,https://twitter.com/AsianetNewsHN/status/1370287077179289603,['https://hindi.asianetnews.com/national-news/farmers-protest-rakesh-tikait-to-begin-mission-west-bengal-kpp-qpui1i'],[],0,,False,0,0,0,,kisan andolan,,,,,,,[],,,,
3,1370277860733186049,1370277860733186049,1615534675000.0,2021-03-12 13:07:55,+0530,,कृषि कानूनों को लेकर पिछले चार महीने से किसानों का आंदोलन जारी है। अब किसान नेताओं ने सरकार पर दबाव बढ़ाने के लिए चुनावी राज्यों में पंचायतें करने का फैसला किया है। #RakeshTikait #WestBengalElections2021 #KisanAndolan #IndiaTogether #IndiaAgainstPropaganda #NEWSUPDATE  https://t.co/QhqaDTWl2Y,hi,"['rakeshtikait', 'westbengalelections2021', 'kisanandolan', 'indiatogether', 'indiaagainstpropaganda', 'newsupdate']",[],1149193552431210496,1149193552431210496,AsianetNewsHN,Asianetnews Hindi,5,13,https://twitter.com/AsianetNewsHN/status/1370277860733186049,[],['https://pbs.twimg.com/media/EwQ0PHiVcAIxOCB.jpg'],1,https://pbs.twimg.com/media/EwQ0PHiVcAIxOCB.jpg,False,0,0,0,,kisan andolan,,,,,,,[],,,,
4,1370268585617072129,1370268585617072129,1615532463000.0,2021-03-12 12:31:03,+0530,,सन1855 के स्वतंत्रता संग्राम के आदिवासी क्रांतिवीर योद्धा #बाबुराव_पुल्लेसूर_शेडमार्के जी की  188वीं जन्मजयंती पर उन्हे नमन  आदिवासीयो का इतिहास दबाया गया है इंडिया में ताकि जमीन से जुड़े कबीलाई लोग एक न हो #BaburaoShedmake  #FarmersProtests #KisanAndolan #JusticeForMohanDelkar  https://t.co/MdJVGXMtPB,hi,"['बाबुराव_पुल्लेसूर_शेडमार्के', 'baburaoshedmake', 'farmersprotests', 'kisanandolan', 'justiceformohandelkar']",[],933622354277646336,933622354277646336,Chhotu_Vasava,Chhotubhai Vasava,5,12,https://twitter.com/Chhotu_Vasava/status/1370268585617072129,[],['https://pbs.twimg.com/media/EwQsAuiWUAILR4A.jpg'],1,https://pbs.twimg.com/media/EwQsAuiWUAILR4A.jpg,False,176,3,43,,kisan andolan,,,,,,,[],,,,
5,1370253971063853062,1370253971063853062,1615528979000.0,2021-03-12 11:32:59,+0530,,दिल्ली की सीमाओं पर चले रहे किसान आंदोलन में बड़ी संख्या में महिलाएं शामिल हैं। इनमें कई अपने परिवार के साथ आईं हैं तो कुछ का परिवार गांव में ही है।  @shivangi441 की रिपोर्ट #FarmersProstests #KisanAndolan   https://t.co/YC3uc08s9K,hi,"['farmersprostests', 'kisanandolan']",[],421701259,421701259,GaonConnection,GaonConnection,5,11,https://twitter.com/GaonConnection/status/1370253971063853062,['https://www.gaonconnection.com/desh/one-of-the-major-successes-of-the-farmers-protest-is-that-women-are-ahead-in-it-48856'],[],0,,False,48,1,12,,kisan andolan,,,,,,,[],,,,
6,1370224252440350724,1370224252440350724,1615521893000.0,2021-03-12 09:34:53,+0530,,"Traffic Alert  Due to protest  of Kisan Andolan, Nainital  highway  No.  9  and  NH-24  is  closed  at the  point of  U P.Gate.  Traffic is heavy in both carriageways.   Diversion has continue g From  Delhi towards Ghaziabad via Paper market . But now till strength check report ,",en,[],[],143766231,143766231,dtptraffic,Delhi Traffic Police,5,09,https://twitter.com/dtptraffic/status/1370224252440350724,[],[],0,,False,40,6,11,,kisan andolan,,,,,,,[],,,,
7,1370223316921839621,1370223316921839621,1615521670000.0,2021-03-12 09:31:10,+0530,,"Traffic Alert  Due to protest  of Kisan Andolan,   Nainital  highway  No.  9  and  NH-24  is  closed  at the  point of  U P.Gate.  Traffic is heavy in both carriageways.  Diversion has been  given From  Delhi   towards  Ghaziabad.",en,[],[],143766231,143766231,dtptraffic,Delhi Traffic Police,5,09,https://twitter.com/dtptraffic/status/1370223316921839621,[],[],0,,False,63,9,10,,kisan andolan,,,,,,,[],,,,
