,id,conversation_id,created_at,date,timezone,place,tweet,language,hashtags,cashtags,user_id,user_id_str,username,name,day,hour,link,urls,photos,video,thumbnail,retweet,nlikes,nreplies,nretweets,quote_url,search,near,geo,source,user_rt_id,user_rt,retweet_id,reply_to,retweet_date,translate,trans_src,trans_dest
0,1474001241399123972,1474001241399123972,1640264256000.0,2021-12-23 18:27:36,+0530,,"'वीरू' क्‍यों बन गए राजस्‍थान के चार किसान, कड़ाके की ठंड में टंकी पर चढ़कर कर रहे प्रदर्शन  #hanumangarh #rajasthan #rajasthannews #राजस्थान #किसान  https://t.co/S0twJocttI",hi,"['hanumangarh', 'rajasthan', 'rajasthannews', 'राजस्थान', 'किसान']",[],18186549,18186549,oneindiaHindi,Oneindia Hindi,4,18,https://twitter.com/oneindiaHindi/status/1474001241399123972,['https://hindi.oneindia.com/news/rajasthan/four-farmers-of-nohar-climbed-the-tank-water-in-hanumangarh-district-of-rajasthan-654545.html'],[],0,,False,3,0,0,,#किसान,,,,,,,[],,,,
1,1473925512573583360,1473925512573583360,1640246201000.0,2021-12-23 13:26:41,+0530,,"#किसान #आंदोलन कर रहे थे या #पैदावार ?  भारत का चावल निर्यात वर्तमान वित्त वर्ष के पहले सात महीनों में, पिछले वित्त वर्ष की इसी अवधि के मुकाबले 33% से अधिक वृद्धि के साथ 11.79 मिलियन टन हो गया है...  #farmerswithmodiji #KisanDiwas @RakeshTikaitBKU",hi,"['किसान', 'आंदोलन', 'पैदावार', 'farmerswithmodiji', 'kisandiwas']",[],297229210,297229210,KrpandeyKumar,Manish Kumar Pandey,4,13,https://twitter.com/KrpandeyKumar/status/1473925512573583360,[],[],0,,False,1,0,0,https://twitter.com/nstomar/status/1473910150142382080,#किसान,,,,,,,[],,,,
2,1473911212853186560,1473911212853186560,1640242791000.0,2021-12-23 12:29:51,+0530,,"'किसानों से मुकदमे वापस होंगे', आंकड़े बताते हुए CM बोले- हरियाणा में सिर्फ 46 पोस्टमॉर्टम हुए, देंगे मुआवजा #haryana #farmersprotest #manoharlalkhattar #हरियाणा #किसानआंदोलन #किसान #मनोहरलालखट्टर #haryananews #haryanagovernment  https://t.co/V063id9DJy",hi,"['haryana', 'farmersprotest', 'manoharlalkhattar', 'हरियाणा', 'किसानआंदोलन', 'किसान', 'मनोहरलालखट्टर', 'haryananews', 'haryanagovernment']",[],18186549,18186549,oneindiaHindi,Oneindia Hindi,4,12,https://twitter.com/oneindiaHindi/status/1473911212853186560,['https://hindi.oneindia.com/news/haryana/govt-withdraw-cases-from-farmers-who-protested-in-haryana-during-the-farmers-agitation-says-cm-654535.html'],[],0,,False,1,1,0,,#किसान,,,,,,,[],,,,
3,1473892810491187204,1473892810491187204,1640238404000.0,2021-12-23 11:16:44,+0530,,Tribute to the 'Champion of India's peasants' Chaudhary Charan Singh on his Birth Anniversary.  #NationalFarmersDay #FarmersDay #Farmers #KisanDiwas #ChaudharyCharanSingh  #IndianFarmers #किसान #किसान_दिवस  https://t.co/iqoIxXCic4,en,"['nationalfarmersday', 'farmersday', 'farmers', 'kisandiwas', 'chaudharycharansingh', 'indianfarmers', 'किसान', 'किसान_दिवस']",[],1415078539,1415078539,AAPHaryana,AAP Haryana,4,11,https://twitter.com/AAPHaryana/status/1473892810491187204,[],['https://pbs.twimg.com/media/FHRRsrcUUAI0MII.jpg'],1,https://pbs.twimg.com/media/FHRRsrcUUAI0MII.jpg,False,25,3,13,,#किसान,,,,,,,[],,,,
4,1473889090672103426,1473889090672103426,1640237517000.0,2021-12-23 11:01:57,+0530,,"कृषिप्रधान देश भारत में #किसान अन्नदाता ही नहीं, देश की अर्थ-व्यवस्था की रीढ़ भी हैं। मान. प्रधानमंत्री श्री @narendramodi जी और मुख्यमंत्री @ChouhanShivraj जी ने किसानों को समृद्धि और सम्मान देने के लिए बहुत प्रयास किए हैं।  किसान भाइयों को #किसान_दिवस की हार्दिक शुभकामनाएं!",hi,"['किसान', 'किसान_दिवस']",[],367036910,367036910,yashodhararaje,Yashodhara Raje Scindia,4,11,https://twitter.com/yashodhararaje/status/1473889090672103426,[],[],0,,False,63,2,10,,#किसान,,,,,,,[],,,,
5,1473882439361564674,1473882439361564674,1640235931000.0,2021-12-23 10:35:31,+0530,,"जय जवान, जय किसान  किसान की उन्नति, देश की प्रगति है!  किसान है अन्नदाता, यही है देश के भाग्यविधाता...!! राष्ट्रीय किसान दिवस के शुभ अवसर पर देश के प्रिये किसान भाइयों को हार्दिक शुभकामनाएं। #किसान #किसानदिवस #Farmerday #farmersday #NarendraBJPRaj #harshiniatul #NewsUpdate  https://t.co/CHmKPtej9x",hi,"['किसान', 'किसानदिवस', 'farmerday', 'farmersday', 'narendrabjpraj', 'harshiniatul', 'newsupdate']",[],1097760203280404480,1097760203280404480,NarendraBJPRaj,Narendra Kumar,4,10,https://twitter.com/NarendraBJPRaj/status/1473882439361564674,[],['https://pbs.twimg.com/media/FHRIQ42VIAEhSXt.jpg'],1,https://pbs.twimg.com/media/FHRIQ42VIAEhSXt.jpg,False,27,1,2,,#किसान,,,,,,,[],,,,
6,1473881941724205056,1473881941724205056,1640235812000.0,2021-12-23 10:33:32,+0530,,#किसान_दिवस  #किसान  #चौधरी_चरण_सिंह  https://t.co/hjoZTaUZOk,und,"['किसान_दिवस', 'किसान', 'चौधरी_चरण_सिंह']",[],2280044274,2280044274,AnkitParihar9,Er. Ankit Parihar,4,10,https://twitter.com/AnkitParihar9/status/1473881941724205056,[],['https://pbs.twimg.com/media/FHRHzBYVkAMPHCy.jpg'],1,https://pbs.twimg.com/media/FHRHzBYVkAMPHCy.jpg,False,18,0,2,,#किसान,,,,,,,[],,,,
7,1473874528484749313,1473874528484749313,1640234045000.0,2021-12-23 10:04:05,+0530,,"जय जवान, जय किसान  किसान की उन्नति, देश की प्रगति है!  किसान है अन्नदाता, यही है देश के भाग्यविधाता...!!  राष्ट्रीय किसान दिवस के शुभ अवसर पर देश के प्रिये किसान भाइयों को हार्दिक शुभकामनाएं। #किसान #किसानदिवस #Farmerday #RamkhelawanPatel  https://t.co/SRZLTPrm6N",hi,"['किसान', 'किसानदिवस', 'farmerday', 'ramkhelawanpatel']",[],1107182664425955328,1107182664425955328,Ramkhelawanbjp,Ramkhelawan Patel,4,10,https://twitter.com/Ramkhelawanbjp/status/1473874528484749313,[],['https://pbs.twimg.com/media/FHRBENsVEAk5xyh.jpg'],1,https://pbs.twimg.com/media/FHRBENsVEAk5xyh.jpg,False,16,2,2,,#किसान,,,,,,,[],,,,
8,1473871948568416256,1473871948568416256,1640233430000.0,2021-12-23 09:53:50,+0530,,"देश का अन्नदाता, भाग्यविधाता किसान है। देश की प्रगति किसान की प्रगति के बिना अधूरी है। इस लिए किसानों के हित में काम करने का, उन का जीवन बेहतर बनाने का हम सभी संकल्प करते है। सभी किसान भाईयों को राष्ट्रीय किसान दिवस की शुभकामनाएं! #किसानदिवस #किसान #NationalFarmersDay #FarmersDay  https://t.co/QLQs6rjFdh",hi,"['किसानदिवस', 'किसान', 'nationalfarmersday', 'farmersday']",[],2189716682,2189716682,praful_patel,Praful Patel,4,09,https://twitter.com/praful_patel/status/1473871948568416256,[],['https://pbs.twimg.com/media/FHQ-udtVEAUAl0-.jpg'],1,https://pbs.twimg.com/media/FHQ-udtVEAUAl0-.jpg,False,61,2,9,,#किसान,,,,,,,[],,,,
9,1473862741207052288,1473862741207052288,1640231235000.0,2021-12-23 09:17:15,+0530,,विशेष: जब चौधरी चरण सिंह ने एक झटके में 27 हज़ार पटवारियों का इस्तीफा स्वीकार कर लिया था #किसान #किसान_दिवस #farmersday #charansingh  https://t.co/XDShhqCQrh,hi,"['किसान', 'किसान_दिवस', 'farmersday', 'charansingh']",[],421701259,421701259,GaonConnection,GaonConnection,4,09,https://twitter.com/GaonConnection/status/1473862741207052288,['https://www.gaonconnection.com/desh/when-chaudhary-charan-singh-accepted-the-resignation-of-27-thousand-patvari-in-one-stroke'],[],0,,False,13,0,4,,#किसान,,,,,,,[],,,,
10,1473847545650507778,1473847545650507778,1640227612000.0,2021-12-23 08:16:52,+0530,,"किसान की उन्नति, देश की प्रगति है!  किसान है अन्नदाता, यही है देश के भाग्यविधाता!! राष्ट्रीय किसान दिवस के शुभ अवसर पर देश के प्रिये किसान भाइयों को हार्दिक शुभकामनाएं। #किसान #किसानदिवस #DeptofFisheries #kisandiwas2021  https://t.co/bPWWdtQJ5a",hi,"['किसान', 'किसानदिवस', 'deptoffisheries', 'kisandiwas2021']",[],1122456704447172608,1122456704447172608,FisheriesGoI,"Department of Fisheries, Min of FAH&D",4,08,https://twitter.com/FisheriesGoI/status/1473847545650507778,[],['https://pbs.twimg.com/media/FHQohgYVQAEmzBG.jpg'],1,https://pbs.twimg.com/media/FHQohgYVQAEmzBG.jpg,False,36,0,13,,#किसान,,,,,,,[],,,,
11,1473834569140879361,1473834569140879361,1640224518000.0,2021-12-23 07:25:18,+0530,,"जय जवान, जय किसान, जय हिन्दुस्तान...  किसान की उन्नति, देश की प्रगति है!  किसान है अन्नदाता, यही है देश के भाग्यविधाता...!!  राष्ट्रीय किसान दिवस के शुभ अवसर पर देश के प्रिये किसान भाइयों को हार्दिक शुभकामनाएं। #किसान #किसानदिवस #Farmerday #Farmersday",hi,"['किसान', 'किसानदिवस', 'farmerday', 'farmersday']",[],1198188880073068544,1198188880073068544,JitendraRaiMLA,Jitendra Kumar Rai,4,07,https://twitter.com/JitendraRaiMLA/status/1473834569140879361,[],[],0,,False,163,2,13,,#किसान,,,,,,,[],,,,
