,id,conversation_id,created_at,date,timezone,place,tweet,language,hashtags,cashtags,user_id,user_id_str,username,name,day,hour,link,urls,photos,video,thumbnail,retweet,nlikes,nreplies,nretweets,quote_url,search,near,geo,source,user_rt_id,user_rt,retweet_id,reply_to,retweet_date,translate,trans_src,trans_dest
34,1425051630383206401,1425051630383206401,1628593759000.0,2021-08-10 16:39:19,+0530,,#Blacklaws have threatened livelihood of #farmers : @HarsimratBadal_ in #LokSabha  #FarmersProtest #KisanMajdoorEktaZindabaad #KisanAndolan #SpeakUpForFarmers #SADforFarmers    https://t.co/8HAEaLQan8,en,"['blacklaws', 'farmers', 'loksabha', 'farmersprotest', 'kisanmajdoorektazindabaad', 'kisanandolan', 'speakupforfarmers', 'sadforfarmers']",[],852553470,852553470,ptcnews,ਪੀਟੀਸੀ ਨਿਊਜ਼ | PTC News,2,16,https://twitter.com/ptcnews/status/1425051630383206401,['https://www.ptcnews.tv/black-laws-have-threatened-livelihood-of-farmers-harsimrat-badal-in-lok-sabha/'],[],0,,False,0,0,0,,farmers protest,,,,,,,[],,,,
35,1425050610538192903,1425050610538192903,1628593516000.0,2021-08-10 16:35:16,+0530,,"आपस में बँट जाओगे,  तो खेत कैसे बचाओगे?  500 में बिक जाओगे, तो खेत कैसे बचाओगे?  #काला_क़ानून_वापस_लो #FarmersProtest @SanjayAzadSln  https://t.co/1pgCLOz0Yg",hi,"['काला_क़ानून_वापस_लो', 'farmersprotest']",[],971734602,971734602,AAPChhattisgarh,आप छत्तीसगढ़,2,16,https://twitter.com/AAPChhattisgarh/status/1425050610538192903,[],[],1,https://pbs.twimg.com/ext_tw_video_thumb/1425050569710850051/pu/img/b8pav7ULFO6ZOv_w.jpg,False,15,0,9,,farmers protest,,,,,,,[],,,,
36,1425050433374998528,1425050433374998528,1628593474000.0,2021-08-10 16:34:34,+0530,,MASSIVE PROTEST AGAINST FARM LAWS‼️  Aam Aadmi Party MP @SanjayAzadSln raised Farmers' voice in Rajya Sabha!  #AAPwithFARMERS🚜  https://t.co/whQvAi2Y7p,en,['aapwithfarmers'],[],711694309,711694309,AamAadmiParty,AAP,2,16,https://twitter.com/AamAadmiParty/status/1425050433374998528,[],[],1,https://pbs.twimg.com/ext_tw_video_thumb/1425050288600219649/pu/img/vdAVCSTzVPbtDeGS.jpg,False,621,113,222,,farmers protest,,,,,,,[],,,,
37,1425047733014917124,1425047733014917124,1628592830000.0,2021-08-10 16:23:50,+0530,,"The thirteen day long farmers’ protest at Jantar Mantar in New Delhi, concluded on Monday, August 9, with a Mahila Sansad (women’s parliament). Over 200 women farmers were present, discussing the farm laws.  @DanishPandit_ was at Jantar Mantar for the Mahila Sansad. In Photos:  https://t.co/vwQlIwQlDp",en,[],[],2262642157,2262642157,TheCitizen_in,The Citizen,2,16,https://twitter.com/TheCitizen_in/status/1425047733014917124,[],"['https://pbs.twimg.com/media/E8bJWyEVUAE7xRQ.jpg', 'https://pbs.twimg.com/media/E8bJWyCUYAg9-SS.jpg', 'https://pbs.twimg.com/media/E8bJWyAVUAAyrKr.jpg', 'https://pbs.twimg.com/media/E8bJWyCVEAMeEzi.jpg']",1,https://pbs.twimg.com/media/E8bJWyEVUAE7xRQ.jpg,False,4,0,2,,farmers protest,,,,,,,[],,,,
38,1425042422476677126,1425042422476677126,1628591564000.0,2021-08-10 16:02:44,+0530,,Government have no intention to repeal draconian #FarmLaws  They have ignored #FarmersProtest,en,"['farmlaws', 'farmersprotest']",[],1165648182694404107,1165648182694404107,OfficialArupRoy,Arup Roy,2,16,https://twitter.com/OfficialArupRoy/status/1425042422476677126,[],[],0,,False,32,1,12,,farmers protest,,,,,,,[],,,,
39,1425038464966270977,1425038464966270977,1628590620000.0,2021-08-10 15:47:00,+0530,,Viral Video: ਐਸਐਚਓ ਨੇ ਕਿਸਾਨਾਂ 'ਤੇ ਝਾੜੀ ਥਾਣਦਾਰੀ! ਵੀਡੀਓ ਵਾਇਰਲ ਹੋਣ ਮਗਰੋਂ ਕਸੂਤੇ ਘਿਰੇ  https://t.co/NgeLvKbe9L #PunjabNews #videoviral #PunjabPolice #FarmersProtest,pa,"['punjabnews', 'videoviral', 'punjabpolice', 'farmersprotest']",[],1037022253,1037022253,abpsanjha,ABP Sanjha,2,15,https://twitter.com/abpsanjha/status/1425038464966270977,['https://punjabi.abplive.com/news/punjab/sho-balwinder-singh-of-banur-police-station-lashes-out-at-farmers-video-went-viral-629517'],[],0,,False,0,0,0,,farmers protest,,,,,,,[],,,,
40,1425030880628596737,1425030880628596737,1628588812000.0,2021-08-10 15:16:52,+0530,,"ਸੰਸਦ ਬਾਹਰ Akali Dal ਤੇ Congress ਇਕਜੁੱਟ, 'ਤਿੰਨ ਕਾਨੂੰਨ' ਵਾਪਸ ਲੈਣ ਦੀ ਮੰਗ ਨੂੰ ਲੈ ਕੇ ਪ੍ਰਦਰਸ਼ਨ  https://t.co/0dmuuMuWwt #FarmersProtest #FarmLaws #ShiromaniAkaliDal #HarsimratKaurBadal #Parliament #PunjabCongress",pa,"['farmersprotest', 'farmlaws', 'shiromaniakalidal', 'harsimratkaurbadal', 'parliament', 'punjabcongress']",[],1037022253,1037022253,abpsanjha,ABP Sanjha,2,15,https://twitter.com/abpsanjha/status/1425030880628596737,['https://punjabi.abplive.com/news/punjab/sad-congress-opposition-unite-to-protest-outside-parliament-demand-central-government-to-roll-back-three-farm-laws-629513'],[],0,,False,0,0,0,,farmers protest,,,,,,,[],,,,
41,1425028960333668355,1425028960333668355,1628588354000.0,2021-08-10 15:09:14,+0530,,ਕਿਸਾਨਾਂ ਦੇ ਹੱਕਾਂ ਲਈ ਡਟੇ ਸ਼੍ਰੋਮਣੀ ਅਕਾਲੀ ਦਲ-ਬਸਪਾ ਸਾਂਸਦਾਂ ਵੱਲੋਂ ਪਾਰਲੀਮੈਂਟ ਬਾਹਰ 'ਕਾਲੇ ਕਾਨੂੰਨਾਂ' ਖਿਲਾਫ਼ ਪ੍ਰਦਰਸ਼ਨ ਜਾਰੀ #FarmersProtest  #parliamentsession #MonsoonSession #monsoonsession2021 #farmers #KisanAndolan #FarmLaws2020 #HarsimratKaurBadal #BSP    https://t.co/OXIrg1cvUT,pa,"['farmersprotest', 'parliamentsession', 'monsoonsession', 'monsoonsession2021', 'farmers', 'kisanandolan', 'farmlaws2020', 'harsimratkaurbadal', 'bsp']",[],852553470,852553470,ptcnews,ਪੀਟੀਸੀ ਨਿਊਜ਼ | PTC News,2,15,https://twitter.com/ptcnews/status/1425028960333668355,['https://youtu.be/UKJY7hIbmsg'],[],0,,False,1,0,0,,farmers protest,,,,,,,[],,,,
42,1425021643525550084,1425021643525550084,1628586610000.0,2021-08-10 14:40:10,+0530,,"#UPSC #CAPF AC entrance exam 2021 question paper asks for 200-word essay on alleged post-poll violence in #WestBenga, seeks aspirant’s views on farmers' protests.  #TMC hits out at #UPSC saying 'question paper was politicized'.  Tamal with analysis.  https://t.co/E7Jp5GjVkf",en,"['upsc', 'capf', 'westbenga', 'tmc', 'upsc']",[],240649814,240649814,TimesNow,TIMES NOW,2,14,https://twitter.com/TimesNow/status/1425021643525550084,[],[],1,https://pbs.twimg.com/amplify_video_thumb/1425020913481777154/img/AdMqVxqHs2WCHsA1.jpg,False,12,2,2,,farmers protest,,,,,,,[],,,,
43,1425021504937336832,1425021504937336832,1628586577000.0,2021-08-10 14:39:37,+0530,,जिस आंदोलन के महिलाओं की भागीदारी हो जाती है वह आंदोलन अपने आप में ऐतिहासिक हो जाता है।  किसान संसद की डोर कल महिला साथियों ने बखूबी निभाई व पूरे किसान आंदोलन में महिलाओं की भागीदारी अतुल्य हैं।   #FarmersProtest | #FarmersParliament  https://t.co/3KVJtTU6Wy,hi,"['farmersprotest', 'farmersparliament']",[],3132907921,3132907921,swaraj_abhiyan,Swaraj Abhiyan,2,14,https://twitter.com/swaraj_abhiyan/status/1425021504937336832,[],"['https://pbs.twimg.com/media/E8axgDZVUAAqn-d.jpg', 'https://pbs.twimg.com/media/E8axgZQVkAQNMQ_.jpg']",1,https://pbs.twimg.com/media/E8axgDZVUAAqn-d.jpg,False,29,2,9,,farmers protest,,,,,,,[],,,,
44,1425018678907531266,1425018678907531266,1628585903000.0,2021-08-10 14:28:23,+0530,,क्या भारतीय हॉकी टीम ने किसान आंदोलन के समर्थन में केंद्र सरकार की इनाम राशि को स्वीकार करने से किया इनकार? #IndianHockeyTeam #IndianHockey #FarmersProtest #PMModi #CentralGovt #FactCheck   https://t.co/N2acD34Sud,hi,"['indianhockeyteam', 'indianhockey', 'farmersprotest', 'pmmodi', 'centralgovt', 'factcheck']",[],1096058540031012866,1096058540031012866,NewscheckerIn,Newschecker,2,14,https://twitter.com/NewscheckerIn/status/1425018678907531266,['https://newschecker.in/hi/fact-check-hi/hockey-team-refused-award-money'],[],0,,False,2,0,3,,farmers protest,,,,,,,[],,,,
45,1425018381569204225,1425018381569204225,1628585832000.0,2021-08-10 14:27:12,+0530,,"जंतर-मंतर पर खत्म हुई किसान संसद, 15 अगस्त को तिरंगा रैली की तैयारी #JantarMantar #KisanSansad #FarmersProtest   https://t.co/gZkvecqtZr",hi,"['jantarmantar', 'kisansansad', 'farmersprotest']",[],42606652,42606652,aajtak,AajTak,2,14,https://twitter.com/aajtak/status/1425018381569204225,['https://www.aajtak.in/india/news/story/farmers-protest-updates-kisan-sansad-ends-jantar-mantar-sindhu-tikri-ghazipur-delhi-border-ntc-1306964-2021-08-10'],[],0,,False,81,6,7,,farmers protest,,,,,,,[],,,,
46,1425017909051461638,1425017909051461638,1628585719000.0,2021-08-10 14:25:19,+0530,,"#BREAKING: 25 अगस्त को BJP करेगी किसान सम्मलेन, सितम्बर को  करेगी गन्ना किसानों से संवाद    #UPElections #UPElection2022 #FarmersProtest  @kumarrgaurrav  https://t.co/6oAqbjzndJ",hi,"['breaking', 'upelections', 'upelection2022', 'farmersprotest']",[],34206701,34206701,news24tvchannel,News24,2,14,https://twitter.com/news24tvchannel/status/1425017909051461638,[],[],1,https://pbs.twimg.com/amplify_video_thumb/1425017641903673344/img/eSayaqJbhGHq709r.jpg,False,66,13,11,,farmers protest,,,,,,,[],,,,
47,1425017360641978377,1425017360641978377,1628585588000.0,2021-08-10 14:23:08,+0530,,कल 11 बजे देहरादून प्रेस क्लब 3 बजे नाहन में प्रेस वार्ता में रहूँगा।सांय 6 बजे चंडीगढ़ के मटका चौक पर चल रहे आंदोलन में शामिल रहूँगा। #FarmersProtest  @aajtak @ANI @news24tvchannel @BBCHindi @AbpGanga @PTI_News @OfficialBKU @AmarUjalaNews @thetribunechd @punjabkesari,hi,['farmersprotest'],[],831948775165923330,831948775165923330,RakeshTikaitBKU,Rakesh Tikait,2,14,https://twitter.com/RakeshTikaitBKU/status/1425017360641978377,[],[],0,,False,5160,132,907,,farmers protest,,,,,,,[],,,,
48,1425016026257784833,1425016026257784833,1628585270000.0,2021-08-10 14:17:50,+0530,,"मोदी सरकार कृषि कानून वापस लेने होंगे, किसानों के लिए 2024 दूर नहीं : @HarsimratBadal_   #FarmersProtest #FarmLaws  https://t.co/3ZejQk6Vac",hi,"['farmersprotest', 'farmlaws']",[],34206701,34206701,news24tvchannel,News24,2,14,https://twitter.com/news24tvchannel/status/1425016026257784833,[],[],1,https://pbs.twimg.com/amplify_video_thumb/1425014409546526720/img/w3tbe_6LoVPOxZ99.jpg,False,1039,27,176,,farmers protest,,,,,,,[],,,,
49,1425015549407285253,1425015549407285253,1628585157000.0,2021-08-10 14:15:57,+0530,,Farmers and tribals are protesting for their rights  Why our central government is not listening to them?  Tribal and farmers outfits in Jharkhand to protest in almost all the 24 districts of the states against central government.   #BJPMotto_KeepFarmersPoor  https://t.co/iY1qBR6RHM,en,['bjpmotto_keepfarmerspoor'],[],886647512,886647512,aviksahaindia,Avik Saha,2,14,https://twitter.com/aviksahaindia/status/1425015549407285253,[],['https://pbs.twimg.com/media/E8asFYjVoAMFpKY.jpg'],1,https://pbs.twimg.com/media/E8asFYjVoAMFpKY.jpg,False,13,0,6,,farmers protest,,,,,,,[],,,,
50,1425015031209480196,1425015031209480196,1628585033000.0,2021-08-10 14:13:53,+0530,,"Is Farmers Protest Politically Motivated, Views on Post Poll Violence in Bengal: Questions in UPSC CAPF Exam   https://t.co/vPvMA2dEtl",en,[],[],6509832,6509832,CNNnews18,News18,2,14,https://twitter.com/CNNnews18/status/1425015031209480196,['https://www.news18.com/news/education-career/is-farmers-protest-politically-motivated-views-on-post-poll-violence-in-bengal-questions-in-upsc-capf-exam-4066586.html'],[],0,,False,5,1,2,,farmers protest,,,,,,,[],,,,
51,1425014198858178562,1425014198858178562,1628584835000.0,2021-08-10 14:10:35,+0530,,"#UPSC #CAPF paper asked candidates to provide their views on #FarmersProtest, Bengal #postpoll violence, #oxygencrisis in Delhi    https://t.co/KCqWcN5jD4   @arnabindiatv",en,"['upsc', 'capf', 'farmersprotest', 'postpoll', 'oxygencrisis']",[],34245009,34245009,indiatvnews,India TV,2,14,https://twitter.com/indiatvnews/status/1425014198858178562,['https://www.indiatvnews.com/jobs/news-upsc-capf-question-paper-bengal-poll-violence-oxygen-crisis-in-delhi-controversy-upsc-gov-in-725601'],[],0,,False,6,1,4,,farmers protest,,,,,,,[],,,,
52,1425010160703991808,1425010160703991808,1628583872000.0,2021-08-10 13:54:32,+0530,,"परेशानी में किसान - सुनो ओलंपिक विजेता की जुबानी। कृषि बिल को वापस ले सरकार, जबरदस्ती थोपने से कोई इसे स्वीकार नहीं करेगा। सरकार भी हमने बनाई है,जो आती जाती रहती है, किसान देश का पेट भरता है,उसकी बात सुने सरकार-बजरंग पूनिया #BJPMotto_KeepFarmersPoor #FarmersProtest  https://t.co/O1DlTXX6xJ",hi,"['bjpmotto_keepfarmerspoor', 'farmersprotest']",[],892606329499525120,892606329499525120,DrArchanaINC,Dr. Archana Sharma,2,13,https://twitter.com/DrArchanaINC/status/1425010160703991808,[],[],1,https://pbs.twimg.com/ext_tw_video_thumb/1425009649560948736/pu/img/pPfZbFbiDmS_Nhgt.jpg,False,315,8,159,,farmers protest,,,,,,,[],,,,
53,1425004980910530563,1425004980910530563,1628582637000.0,2021-08-10 13:33:57,+0530,,"Punjab and Haryana High Court denies Anticipatory Bail to Man who allegedly raped farm law protester at Tikri Border.  Police and Law is working for safety of women, meanwhile SKM leaders are silent on the issue. #FarmersProtest #Haryana #TikriBorder #Court #Rape #KisanAndolan  https://t.co/wQIofuLcyo",en,"['farmersprotest', 'haryana', 'tikriborder', 'court', 'rape', 'kisanandolan']",[],195445588,195445588,raviranabjp,Ravi Rai Rana,2,13,https://twitter.com/raviranabjp/status/1425004980910530563,[],['https://pbs.twimg.com/media/E8aieEkVUAU_uZy.jpg'],1,https://pbs.twimg.com/media/E8aieEkVUAU_uZy.jpg,False,13,0,2,,farmers protest,,,,,,,[],,,,
54,1425001503610208259,1425001503610208259,1628581808000.0,2021-08-10 13:20:08,+0530,,"#UPSC में CAPF की परीक्षा में #FarmersProtest के राजनीतिकरण और बंगाल की चुनावी हिंसा पर पूछे गए सवाल, #TMC हुई नाराज  #TimesNowNavbharat यहां देखें:- Tata Sky-528 | Airtel-327 | Hathway-321 | DEN-899  @himanshdxt  https://t.co/TKUrllFtsK",hi,"['upsc', 'farmersprotest', 'tmc', 'timesnownavbharat']",[],927426236137201664,927426236137201664,TNNavbharat,Times Now Navbharat,2,13,https://twitter.com/TNNavbharat/status/1425001503610208259,[],[],1,https://pbs.twimg.com/media/E8ae7-1UUAMCeYA.jpg,False,19,0,15,,farmers protest,,,,,,,[],,,,
55,1424997014211731456,1424997014211731456,1628580738000.0,2021-08-10 13:02:18,+0530,,"""काले कृषि कानून वापस लो"" संसद परिसर में पंजाब के कांग्रेस सांसदो का विरोध प्रदर्शन .  #FarmersProtest @GurjeetSAujla @JasbirGillKSMP @DrAmarSinghINC   https://t.co/IKt40YyzbL",hi,['farmersprotest'],[],2281874448,2281874448,SevadalPB,Punjab Pradesh Congress Sevadal,2,13,https://twitter.com/SevadalPB/status/1424997014211731456,[],[],1,https://pbs.twimg.com/ext_tw_video_thumb/1424987659055730690/pu/img/-Pj27QV5eUzKAehf.jpg,False,25,1,16,,farmers protest,,,,,,,[],,,,
56,1424993059620675595,1424993059620675595,1628579795000.0,2021-08-10 12:46:35,+0530,,#StuntMasters   Government have no intention to repeal draconian #FarmLaws  They have ignored #FarmersProtest for 10 months.   Today at 2pm they want to discus the ‘agricultural situation’ in Rajya Sabha. No more empty words. No No more stunts in  #Parliament   REPEAL FARM LAWS.,en,"['stuntmasters', 'farmlaws', 'farmersprotest', 'parliament']",[],120965579,120965579,derekobrienmp,Derek O'Brien | ডেরেক ও'ব্রায়েন,2,12,https://twitter.com/derekobrienmp/status/1424993059620675595,[],[],0,,False,1064,45,311,,farmers protest,,,,,,,[],,,,
57,1424986029354856461,1424986029354856461,1628578119000.0,2021-08-10 12:18:39,+0530,,'The farmers' protest ... wrapped up with an all-women mock parliament session on Monday.  Around 200 women farmers participated in the mock parliament session -- '#MahilaSansad' -- who discussed the contentious farm laws.'  #FarmersProtest   https://t.co/L56ecRo7aR,en,"['mahilasansad', 'farmersprotest']",[],539322301,539322301,FiLiA_charity,FiLiA,2,12,https://twitter.com/FiLiA_charity/status/1424986029354856461,['https://www.indiatoday.in/india/story/farmers-wrap-up-jantar-mantar-protest-with-mahila-sansad-stir-to-continue-at-delhi-borders-1838893-2021-08-10'],[],0,,False,6,0,4,,farmers protest,,,,,,,[],,,,
58,1424985710189191170,1424985710189191170,1628578042000.0,2021-08-10 12:17:22,+0530,,"""Is the farmer's protest politically motivated?"" and ""an opinion piece on the post-election violence in West Bengal"" were some of the questions asked in UPSC in CAPF Assistant Commandants recruitment examination 2021.  @KamalikaSengupt reports.   https://t.co/sM1cP0FOEs",en,[],[],284920800,284920800,news18dotcom,News18.com,2,12,https://twitter.com/news18dotcom/status/1424985710189191170,['https://www.news18.com/news/education-career/is-farmers-protest-politically-motivated-views-on-post-poll-violence-in-bengal-questions-in-upsc-capf-exam-4066586.html'],[],0,,False,4,0,1,,farmers protest,,,,,,,[],,,,
59,1424984566922563588,1424984566922563588,1628577770000.0,2021-08-10 12:12:50,+0530,,"Over 200 women farmers were present, discussing the farm laws. DANISH PANDIT reports. #farmersprotest   https://t.co/MLucr1WmDL",en,['farmersprotest'],[],2262642157,2262642157,TheCitizen_in,The Citizen,2,12,https://twitter.com/TheCitizen_in/status/1424984566922563588,['https://www.thecitizen.in/index.php/en/NewsDetail/index/7/20741/In-Photos-Kisan-Mahila-Sansad-at-Jantar-Mantar?fbclid=IwAR1MZPKfEKXEp1Wv__luByRGeNz8RGfJyMLShKGWJXe_A57xqmg9th0KsX4'],[],0,,False,1,0,0,,farmers protest,,,,,,,[],,,,
