,id,conversation_id,created_at,date,timezone,place,tweet,language,hashtags,cashtags,user_id,user_id_str,username,name,day,hour,link,urls,photos,video,thumbnail,retweet,nlikes,nreplies,nretweets,quote_url,search,near,geo,source,user_rt_id,user_rt,retweet_id,reply_to,retweet_date,translate,trans_src,trans_dest
0,1425152533287161858,1425152533287161858,1628617816000.0,2021-08-10 23:20:16,+0530,,"Punjab CM Captain Amarinder Singh Meets Amit Shah, Demands Immediate Repeal of New Farm Laws  #Punjab #CaptainAmarindrSingh #AmitShah #NewFarmLaws #FarmersProtest   https://t.co/snY46pEClZ",en,"['punjab', 'captainamarindrsingh', 'amitshah', 'newfarmlaws', 'farmersprotest']",[],828841083257778176,828841083257778176,latestly,LatestLY,2,23,https://twitter.com/latestly/status/1425152533287161858,['https://www.latestly.com/agency-news/india-news-punjab-cm-meets-amit-shah-demands-immediate-repeal-of-new-farm-laws-2732465.html'],[],0,,False,0,0,1,,farmers protest,,,,,,,[],,,,
1,1425151181672824835,1425151181672824835,1628617494000.0,2021-08-10 23:14:54,+0530,,"अपना हक पाने में काफी खून पसीना लगता है प्रेम वेदना त्यागो, शासक हुंकारों से जगता है दिखला दो जग को तेरे लोहू में तेज रवानी है चट्टानों से भिड़ जाए तुझ मे वो अभय जवानी है #विजय_ढिल्लों #लड़ेगा_किसान_जीतेगा_किसान #FarmersProtest @OfficialBKU @RakeshTikaitBKU",hi,"['विजय_ढिल्लों', 'लड़ेगा_किसान_जीतेगा_किसान', 'farmersprotest']",[],443006491,443006491,DhillonVijay,Vijay Dhillon,2,23,https://twitter.com/DhillonVijay/status/1425151181672824835,[],[],0,,False,129,1,17,https://twitter.com/RakeshTikaitBKU/status/1425092197293064192,farmers protest,,,,,,,[],,,,
2,1425141953092472836,1425141953092472836,1628615294000.0,2021-08-10 22:38:14,+0530,,#Opposition MPs climbed on the officials' table and threw files when a discussion on #FarmersProtest was initiated in the #RajyaSabha | #MonsoonSession    https://t.co/iOkzAT0O1d,en,"['opposition', 'farmersprotest', 'rajyasabha', 'monsoonsession']",[],19897138,19897138,IndiaToday,IndiaToday,2,22,https://twitter.com/IndiaToday/status/1425141953092472836,['https://www.indiatoday.in/india/story/opposition-mp-climb-table-throw-files-rajya-sabha-discussion-farmers-protest-1839269-2021-08-10'],[],0,,False,24,5,4,,farmers protest,,,,,,,[],,,,
3,1425134628046655490,1425134628046655490,1628613547000.0,2021-08-10 22:09:07,+0530,,مہیلا کسان سنسد میں سرکار کے خلاف تحریک عدم اعتماد کو منظوری   https://t.co/bLZhkk7rf0  #MahilaKisan #kisansansad #FarmersProtest #farmersparliament,ur,"['mahilakisan', 'kisansansad', 'farmersprotest', 'farmersparliament']",[],887675246970417152,887675246970417152,TheWireUrdu,دی وائر اردو,2,22,https://twitter.com/TheWireUrdu/status/1425134628046655490,['http://thewireurdu.com/90589/mahila-kisan-sansad-passes-no-confidence-motion-against-govt/'],[],0,,False,6,0,1,,farmers protest,,,,,,,[],,,,
4,1425130510968229893,1425130510968229893,1628612566000.0,2021-08-10 21:52:46,+0530,,राकेश टिकैत बुधवार को बाबा लाभ सिंह की हौसला अफ़ज़ाई के लिए मटका चौक पहुंचेंगे   https://t.co/JPoH3GgyUQ #chandigarh #farmersprotest #rakeshtikait #punjab #राकेशटिकैत #पंजाब #चंडीगढ़,hi,"['chandigarh', 'farmersprotest', 'rakeshtikait', 'punjab', 'राकेशटिकैत', 'पंजाब', 'चंडीगढ़']",[],18186549,18186549,oneindiaHindi,Oneindia Hindi,2,21,https://twitter.com/oneindiaHindi/status/1425130510968229893,['https://hindi.oneindia.com/news/chandigarh/rakesh-tikait-will-reach-matka-chowk-on-wednesday-to-encourage-baba-labh-singh-633015.html'],[],0,,False,1,0,0,,farmers protest,,,,,,,[],,,,
5,1425130060051140611,1425130060051140611,1628612458000.0,2021-08-10 21:50:58,+0530,,"Uproar in Rajya Sabha: Opposition MPs Climb on Tables, Throw Files in the House During Proceedings on Farmers' Protest  #RajyaSabha #ParliamentMonsoonSession #FarmersProtest #Parliament   https://t.co/yxpiBi1wCU",en,"['rajyasabha', 'parliamentmonsoonsession', 'farmersprotest', 'parliament']",[],828841083257778176,828841083257778176,latestly,LatestLY,2,21,https://twitter.com/latestly/status/1425130060051140611,['https://www.latestly.com/agency-news/india-news-ugly-scenes-in-rajya-sabha-oppn-mps-climb-on-table-throw-files-2732164.html'],[],0,,False,1,0,0,,farmers protest,,,,,,,[],,,,
6,1425127298815037445,1425127298815037445,1628611800000.0,2021-08-10 21:40:00,+0530,,महिला किसान संसद में सरकार के ख़िलाफ़ पास किया गया अविश्वास प्रस्ताव   https://t.co/RurTyAD0ov  #MahilaKisan #kisansansad #FarmersProtest #farmersparliament #महिलाकिसान #किसानसंसद #किसानआंदोलन,hi,"['mahilakisan', 'kisansansad', 'farmersprotest', 'farmersparliament', 'महिलाकिसान', 'किसानसंसद', 'किसानआंदोलन']",[],817340591046414336,817340591046414336,thewirehindi,द वायर हिंदी,2,21,https://twitter.com/thewirehindi/status/1425127298815037445,['http://thewirehindi.com/181734/mahila-kisan-sansad-passes-no-confidence-motion-against-govt/'],[],0,,False,51,3,15,,farmers protest,,,,,,,[],,,,
7,1425115889414799372,1425115889414799372,1628609080000.0,2021-08-10 20:54:40,+0530,,"'Need to review and repeal farm laws ahead of Punjab Assembly polls': CM Amarinder Singh meets Amit Shah, urges to resolve farmers' protest  @capt_amarinder @AmitShah #FarmersProtest #FarmLaws #Punjab    https://t.co/X06Gg8HGTK",en,"['farmersprotest', 'farmlaws', 'punjab']",[],295693924,295693924,fpjindia,Free Press Journal,2,20,https://twitter.com/fpjindia/status/1425115889414799372,['https://www.freepressjournal.in/india/need-to-review-and-repeal-farm-laws-ahead-of-punjab-assembly-polls-cm-amarinder-singh-meets-amit-shah-urges-to-resolve-farmers-protest'],[],0,,False,0,0,0,,farmers protest,,,,,,,[],,,,
8,1425115193374232577,1425115193374232577,1628608914000.0,2021-08-10 20:51:54,+0530,,"कृषि कानून निरस्‍त कराने की मांग को लेकर सदन में विपक्षी सांसदों का ज़ोरदार हंगामा, कानून की प्रतियां लहराईं; लगाए 'जय जवान, जय किसान के नारे', देखें वीडियो  #MonsoonSession2021 #ParliamentMonsoonSession #FarmersProtest #FarmLaws  https://t.co/vphdcBY0Ed",hi,"['monsoonsession2021', 'parliamentmonsoonsession', 'farmersprotest', 'farmlaws']",[],3768666437,3768666437,NewsMobileHindi,NewsMobile Samachar,2,20,https://twitter.com/NewsMobileHindi/status/1425115193374232577,[],[],1,https://pbs.twimg.com/ext_tw_video_thumb/1425114810358779906/pu/img/vcr73U2DgO3GBKvN.jpg,False,2,0,0,,farmers protest,,,,,,,[],,,,
9,1425114165748801541,1425114165748801541,1628608669000.0,2021-08-10 20:47:49,+0530,,"राज्य सभा में किसानों के मुद्दे पर विपक्ष का भारी हंगामा।  काली पट्टी बांध कर आए कांग्रेस सांसद @nasirhussaininc, @deependershooda और @shaktisinhgohil. देखिए @patelanandk के साथ उनकी बातचीत  #ReporterDiary #FarmersProtest #RajyaSabha  https://t.co/NQQpLLgiSp",hi,"['reporterdiary', 'farmersprotest', 'rajyasabha']",[],42606652,42606652,aajtak,AajTak,2,20,https://twitter.com/aajtak/status/1425114165748801541,[],[],1,https://pbs.twimg.com/amplify_video_thumb/1425110518289870857/img/RYfPkTbJz37dOdpg.jpg,False,123,11,35,,farmers protest,,,,,,,[],,,,
10,1425113347964293122,1425113347964293122,1628608474000.0,2021-08-10 20:44:34,+0530,,"Parliament LIVE Updates: OBC Bill Passed In Lok Sabha, Both Houses Adjourned For The Day  #MonsoonSession2021 #ParliamentMonsoonSession #FarmersProtest #FarmLaws #OBCBill #OBC    https://t.co/GOqFyciq1f",en,"['monsoonsession2021', 'parliamentmonsoonsession', 'farmersprotest', 'farmlaws', 'obcbill', 'obc']",[],2262532860,2262532860,NewsMobileIndia,NewsMobile,2,20,https://twitter.com/NewsMobileIndia/status/1425113347964293122,['https://newsmobile.in/articles/2021/08/10/parliament-live-updates-obc-bill-passed-in-lok-sabha-both-houses-adjourned-for-the-day/'],[],0,,False,2,0,0,,farmers protest,,,,,,,[],,,,
11,1425113184235520004,1425103713480450067,1628608435000.0,2021-08-10 20:43:55,+0530,,"Punjab CM Capt Amarinder Singh urges Union HM Amit Shah to intervene to resolve farmers protest &amp; repeal Farm Laws to prevent inimical forces from exploiting their anger. Cites social, economic &amp; security implications of prolonged farmers’ agitation: Media Advisor to Punjab CM",en,[],[],134758540,134758540,timesofindia,The Times Of India,2,20,https://twitter.com/timesofindia/status/1425113184235520004,[],[],0,,False,52,1,3,,farmers protest,,,,,,,[],,,,
12,1425112082198917124,1425112082198917124,1628608172000.0,2021-08-10 20:39:32,+0530,,"🔲 #WATCH | #Delhi: Opposition MPs created ruckus, raised slogans of '#JaiJawan, #JaiKisan', demanding withdrawal of the three farm laws, in #RajyaSabha earlier today    (Video source: a parliamentarian)  #MonsoonSession2021 #ParliamentMonsoonSession #FarmersProtest #FarmLaws  https://t.co/VkDpYtJ1ps",en,"['watch', 'delhi', 'jaijawan', 'jaikisan', 'rajyasabha', 'monsoonsession2021', 'parliamentmonsoonsession', 'farmersprotest', 'farmlaws']",[],2262532860,2262532860,NewsMobileIndia,NewsMobile,2,20,https://twitter.com/NewsMobileIndia/status/1425112082198917124,[],[],1,https://pbs.twimg.com/ext_tw_video_thumb/1425111742300913664/pu/img/YA4mOLRZEN6cJNDm.jpg,False,2,0,1,,farmers protest,,,,,,,[],,,,
13,1425111698130698246,1425111698130698246,1628608080000.0,2021-08-10 20:38:00,+0530,,राज्य सभा में किसानों के मुद्दे पर विपक्षी दलों के हंगामे के बीच मेज़ पर चढ़ गए कांग्रेस सांसद प्रताप सिंह बाजवा (@partap_sbajwa) से डिप्टी एडिटर  @patelanandk की बातचीत  #ReporterDiary #FarmersProtest #RajyaSabha  https://t.co/f1ESu6xpuk,hi,"['reporterdiary', 'farmersprotest', 'rajyasabha']",[],42606652,42606652,aajtak,AajTak,2,20,https://twitter.com/aajtak/status/1425111698130698246,[],[],1,https://pbs.twimg.com/amplify_video_thumb/1425110517094440962/img/R9rHMq1MT9MqMq_o.jpg,False,125,39,21,,farmers protest,,,,,,,[],,,,
14,1425110151934226438,1425110151934226438,1628607712000.0,2021-08-10 20:31:52,+0530,,"BREAKING-NEWS   'Need to review and repeal farm laws ahead of Punjab Assembly polls': CM Amarinder Singh meets Amit Shah, urges to resolve farmers' protest  https://t.co/X06Gg8q62c",en,[],[],295693924,295693924,fpjindia,Free Press Journal,2,20,https://twitter.com/fpjindia/status/1425110151934226438,['https://www.freepressjournal.in/india/need-to-review-and-repeal-farm-laws-ahead-of-punjab-assembly-polls-cm-amarinder-singh-meets-amit-shah-urges-to-resolve-farmers-protest'],[],0,,False,0,0,0,,farmers protest,,,,,,,[],,,,
15,1425109821188050945,1425109821188050945,1628607633000.0,2021-08-10 20:30:33,+0530,,किसान विरोधी काले कानूनों के खिलाफ राज्यसभा में आम आदमी पार्टी के सांसद @SanjayAzadSln जी ने साथी सांसदों के साथ मिलकर जबरदस्त विरोध प्रदर्शन किया। #FarmersProtest  https://t.co/2yVmAVO84N,hi,['farmersprotest'],[],105990090,105990090,shals77,Capt Shalini Singh,2,20,https://twitter.com/shals77/status/1425109821188050945,[],[],1,https://pbs.twimg.com/ext_tw_video_thumb/1425109717744066567/pu/img/TaGmwYqEZMC27oSy.jpg,False,9,0,2,,farmers protest,,,,,,,[],,,,
16,1425103621373538305,1425103621373538305,1628606155000.0,2021-08-10 20:05:55,+0530,,They protest against the government for trying to push through a diluted debate on #farmers issue instead of going for a repeal of the three controversial #farm laws. | writes @SobhanaNair    https://t.co/ygbT3n4lgs,en,"['farmers', 'farm']",[],20751449,20751449,the_hindu,The Hindu,2,20,https://twitter.com/the_hindu/status/1425103621373538305,['https://trib.al/xZAagbP'],[],0,,False,67,2,5,,farmers protest,,,,,,,[],,,,
17,1425103555015360513,1425041243441008648,1628606139000.0,2021-08-10 20:05:39,+0530,,"Punjab CM Capt Amarinder Singh urges Union HM Amit Shah to intervene to resolve farmers protest &amp; repeal Farm Laws to prevent inimical forces from exploiting their anger. Cites social, economic &amp; security implications of prolonged farmers’ agitation: Media Advisor to Punjab CM",en,[],[],355989081,355989081,ANI,ANI,2,20,https://twitter.com/ANI/status/1425103555015360513,[],[],0,,False,394,10,26,,farmers protest,,,,,,,[],,,,
18,1425093293541634067,1425093293541634067,1628603692000.0,2021-08-10 19:24:52,+0530,,"Watch AAP Rajya Sabha MP Sri Sanjay Singh, registering his protest against the 3 farm laws &amp; harassment of Farmers by the Modi Govt during the Rajya Sabha session in the Parliament.   https://t.co/VwB6WgHLQl via @FacebookWatch",en,[],[],1344588571,1344588571,AAPOdisha,AAP Odisha 🇮🇳,2,19,https://twitter.com/AAPOdisha/status/1425093293541634067,['https://fb.watch/7iewgJVhzx/'],[],0,,False,3,2,5,,farmers protest,,,,,,,[],,,,
19,1425092197293064192,1425092197293064192,1628603431000.0,2021-08-10 19:20:31,+0530,,"देशभर में किसानों, युवाओं और नारी शक्ति को गांव की मिट्टी से जोड़ेंगे । रोटी को कार्पोरेट घरानों की तिजोरी में कैद नहीं होने देंगे । #लड़ेगा_किसान_जीतेगा_किसान #FarmersProtest",hi,"['लड़ेगा_किसान_जीतेगा_किसान', 'farmersprotest']",[],831948775165923330,831948775165923330,RakeshTikaitBKU,Rakesh Tikait,2,19,https://twitter.com/RakeshTikaitBKU/status/1425092197293064192,[],[],0,,False,18102,546,4060,,farmers protest,,,,,,,[],,,,
20,1425087623366909958,1425087623366909958,1628602340000.0,2021-08-10 19:02:20,+0530,,🔹ਦਿਨ-ਭਰ ਦੀਆਂ ਵੱਡੀਆਂ ਖ਼ਬਰਾਂ ਵੇਖਣ ਲਈ ਦੇਖੋ PTC Prime ਤਸਵੀਰਾਂ ? 🔹ਕਿੱਥੇ ਮੁੜ ਮੁਲਾਜ਼ਮਾਂ ‘ਤੇ ਵਰ੍ਹਿਆ ਪੁਲਿਸੀਆ ਡੰਡਾ ? 🔹ਅਮਿਤ ਸ਼ਾਹ ਨੂੰ ਕਿਉਂ ਮਿਲਣਗੇ ਕੈਪਟਨ? 🔹ਪੰਜਾਬ ਨੂੰ ‘ਚੈਂਪੀਅਨ ਪੁੱਤਰਾਂ’ ਦਾ ਇੰਤਜ਼ਾਰ #Drone #FarmersProtest #PTCPrime #Punjab    https://t.co/XKIAa8e3fd,pa,"['drone', 'farmersprotest', 'ptcprime', 'punjab']",[],852553470,852553470,ptcnews,ਪੀਟੀਸੀ ਨਿਊਜ਼ | PTC News,2,19,https://twitter.com/ptcnews/status/1425087623366909958,['https://fb.watch/7iemteDCWP/'],[],0,,False,0,0,0,,farmers protest,,,,,,,[],,,,
21,1425073800815599625,1425073800815599625,1628599045000.0,2021-08-10 18:07:25,+0530,,"‘ਲੋਕ ਸਭਾ ’ਚ ਖੇਤੀ ਕਾਨੂੰਨਾਂ ’ਤੇ ਚਰਚਾ ਹੋਵੇ, ਸੜਕਾਂ ’ਤੇ ਬੈਠੇ ਕਿਸਾਨਾਂ ਦੀਆਂ ਮੰਗਾਂ ਮੰਨੀਆਂ ਜਾਣ’  https://t.co/I2QnbhGfCd #AkaliDal #FarmLaws #LokSabha #FarmersProtest  https://t.co/zeq5QeBOp4",pa,"['akalidal', 'farmlaws', 'loksabha', 'farmersprotest']",[],222394250,222394250,JagbaniOnline,Jagbani,2,18,https://twitter.com/JagbaniOnline/status/1425073800815599625,['https://jagbani.punjabkesari.in/national/news/farm-laws-should-be-discussed-in-lok-sabha--akali-dal-1305948'],['https://pbs.twimg.com/media/E8bhEEfUUA8ZcOW.jpg'],1,https://pbs.twimg.com/media/E8bhEEfUUA8ZcOW.jpg,False,4,0,0,,farmers protest,,,,,,,[],,,,
22,1425073775888982016,1425073775888982016,1628599039000.0,2021-08-10 18:07:19,+0530,,"""अडानी के नौकर होश में आओ""  किसान का बेटा @SanjayAzadSln किसानों के हक़ के लिए संसद के भीतर पूरी बुलंदी से डटा हुआ है।  अन्नदाता का हक़ कोई अडानी नहीं छीन सकता है।   #FarmersProtest  https://t.co/IA9wD9Vqmr",hi,['farmersprotest'],[],1211261012344598530,1211261012344598530,upcyss,CYSS Uttar Pradesh,2,18,https://twitter.com/upcyss/status/1425073775888982016,[],[],1,https://pbs.twimg.com/ext_tw_video_thumb/1425073592547557390/pu/img/YYC2AklWYzqIyjfs.jpg,False,6,0,3,,farmers protest,,,,,,,[],,,,
23,1425067350747795457,1425067350747795457,1628597507000.0,2021-08-10 17:41:47,+0530,,ਅਕਾਲੀ ਦਲ ਤੇ ਕਾਂਗਰਸ ਦਾ ਹੋਇਆ ਗੱਠਜੋੜ! ਲੋਕ ਸਭਾ ਦੇ ਬਾਹਰ ਅਨੋਖਾ ਨਜ਼ਾਰਾ  #Punjab #FarmersProtest @Akali_Dal_ @HarsimratBadal_ @CMOPb @ZeePunjabHH    https://t.co/noHxUPRNQB,pa,"['punjab', 'farmersprotest']",[],2529715724,2529715724,ZeePunjabHH,Zee PHH,2,17,https://twitter.com/ZeePunjabHH/status/1425067350747795457,['https://zeenews.india.com/hindi/zeephh/politics/akali-dal-congress-alliance-strange-view-outside-the-lok-sabha/961933'],[],0,,False,2,1,0,,farmers protest,,,,,,,[],,,,
24,1425067253045813250,1425067253045813250,1628597484000.0,2021-08-10 17:41:24,+0530,,"Madhya Pradesh: Kamal Nath lambasts BJP over unemployment, floods and farmers' protests  https://t.co/CtKXVgGLF6",en,[],[],811972460560019456,811972460560019456,republic,Republic,2,17,https://twitter.com/republic/status/1425067253045813250,['https://www.republicworld.com/india-news/politics/madhya-pradesh-kamal-nath-lambasts-bjp-over-unemployment-floods-and-farmers-protests.html'],[],0,,False,16,4,1,,farmers protest,,,,,,,[],,,,
25,1425065815326351361,1425065815326351361,1628597141000.0,2021-08-10 17:35:41,+0530,,सामने पहाड़ हो सिंह की दहाड़ हो  तुम निडर डरो नहीं तुम निडर डटो वहीं  वीर तुम बढ़े चलो! धीर तुम बढ़े चलो!’ #FarmersProtest @INCHaryana @kumari_selja  https://t.co/cBeR2STmRW,hi,['farmersprotest'],[],931064268547530752,931064268547530752,VenuHPMC,𝙑𝙚𝙣𝙪 𝘼𝙜𝙜𝙖𝙧𝙬𝙖𝙡,2,17,https://twitter.com/VenuHPMC/status/1425065815326351361,[],['https://pbs.twimg.com/media/E8bZzkBWYAAVzT4.jpg'],1,https://pbs.twimg.com/media/E8bZzkBWYAAVzT4.jpg,False,10,0,3,,farmers protest,,,,,,,[],,,,
26,1425065306116984833,1425065306116984833,1628597020000.0,2021-08-10 17:33:40,+0530,,"यूपी चुनाव: इसी महीने लखनऊ में किसान पंचायत करेगी भाजपा, करीब 100 सीटें साधने का मास्टरप्लान  https://t.co/mLq3fbOCWG #farmer #uttarpradesh #yogiadityanath #bjp #lucknow #rakeshtikait #उत्तरप्रदेशविधानसभाचुनाव2022 #farmersprotest #uttarpradeshassemblyelection2022",hi,"['farmer', 'uttarpradesh', 'yogiadityanath', 'bjp', 'lucknow', 'rakeshtikait', 'उत्तरप्रदेशविधानसभाचुनाव2022', 'farmersprotest', 'uttarpradeshassemblyelection2022']",[],18186549,18186549,oneindiaHindi,Oneindia Hindi,2,17,https://twitter.com/oneindiaHindi/status/1425065306116984833,['https://hindi.oneindia.com/news/uttar-pradesh/bjp-will-do-kisan-panchayat-in-lucknow-this-month-masterplan-to-handle-about-100-western-up-seats-632978.html'],[],0,,False,5,0,0,,farmers protest,,,,,,,[],,,,
27,1425064634629951493,1425064634629951493,1628596859000.0,2021-08-10 17:30:59,+0530,,"ਖੇਤੀ ਕਾਨੂੰਨਾਂ ਦੇ ਵਿਰੋਧ ਵਿੱਚ ਅਕਾਲੀ ਤੇ ਕਾਂਗਰਸੀ ਸੰਸਦ ਮੈਂਬਰਾਂ ਨੇ ਇਕੱਠਿਆਂ ਸੰਸਦ ਦੇ ਬਾਹਰ ਬੈਨਰ ਲੈ ਕੇ ਪ੍ਰਦਰਸ਼ਨ ਕੀਤਾ, ਕੀ ਤੁਹਾਨੂੰ ਯਾਦ ਹੈ ਜਦੋਂ ਤੁਸੀਂ ਦੋਵੇਂ ਪਾਰਟੀਆਂ ਦੇ ਆਗੂਆਂ ਨੂੰ ਇਕੱਠਿਆਂ ਕਿਸੇ ਮੁੱਦੇ ’ਤੇ ਬੋਲਦਿਆਂ ਵੇਖਿਆ ਹੋਵੇ #FarmersProtest #Farmlaws  https://t.co/sgFAhn2PHd",pa,"['farmersprotest', 'farmlaws']",[],826091183491387394,826091183491387394,bbcnewspunjabi,BBC News Punjabi,2,17,https://twitter.com/bbcnewspunjabi/status/1425064634629951493,[],[],1,https://pbs.twimg.com/amplify_video_thumb/1425064352357433361/img/ckJcLnhSxeESwx7i.jpg,False,41,0,5,,farmers protest,,,,,,,[],,,,
28,1425062193339322371,1425062193339322371,1628596277000.0,2021-08-10 17:21:17,+0530,,"देश का अन्नदाता किसान 8 महीने से सड़कों पर है मोदी सरकार उन्हें आतंकवादी कहती है। आज किसान भाइयों के हक़ में संसद में उनकी आवाज़ बुलंद की।   “किसानो के ग़द्दार मुर्दाबाद “  “चर्चा का ड्रामा बंद करो,काला क़ानून वापस लो”  “ग़द्दारों गद्दी छोड़ो” “जय जवान जय किसान“  #FarmersProtest  https://t.co/Z4uXKEYvDc",hi,['farmersprotest'],[],328941811,328941811,SanjayAzadSln,Sanjay Singh AAP,2,17,https://twitter.com/SanjayAzadSln/status/1425062193339322371,[],[],1,https://pbs.twimg.com/ext_tw_video_thumb/1425062027194601473/pu/img/gxn0kNihs777_2ca.jpg,False,3455,312,1049,,farmers protest,,,,,,,[],,,,
29,1425058433250693125,1425058433250693125,1628595381000.0,2021-08-10 17:06:21,+0530,,BREAKING  Opposition MPs stage a Huge Protest in Rajya Sabha in Support of Farmers  AAP MP @SanjayAzadSln leads the Protest along with @DrSushilKrGupta  https://t.co/q9kWNiD5g4,en,[],[],281938187,281938187,ramkumarjha,Ram / राम 🇮🇳,2,17,https://twitter.com/ramkumarjha/status/1425058433250693125,[],[],1,https://pbs.twimg.com/ext_tw_video_thumb/1425058383762100228/pu/img/Ervjd-sMavRfq7em.jpg,False,3,0,2,,farmers protest,,,,,,,[],,,,
30,1425057670172610560,1425057670172610560,1628595199000.0,2021-08-10 17:03:19,+0530,,🔶 ਲੋਕਸਭਾ 'ਚ ਹਰਸਿਮਰਤ ਕੌਰ ਬਾਦਲ ਨੇ 'ਤਾਨਾਸ਼ਾਹੀ' ਸਰਕਾਰ ਖਿਲਾਫ ਦਿੱਤੀ ਧਮਾਕੇਦਾਰ ਸਪੀਚ   🔶 ਕਿਸਾਨਾਂ ਦੇ ਹੱਕਾਂ ਲਈ ਲੋਕ ਸਭਾ 'ਚ ਮੁੜ ਗਰਜੀ ਹਰਸਿਮਰਤ ਕੌਰ ਬਾਦਲ #FarmLaws2020 #FarmersProtest #KisanAndolan #Parliament @HarsimratBadal_    https://t.co/V5LJA08hZg,pa,"['farmlaws2020', 'farmersprotest', 'kisanandolan', 'parliament']",[],852553470,852553470,ptcnews,ਪੀਟੀਸੀ ਨਿਊਜ਼ | PTC News,2,17,https://twitter.com/ptcnews/status/1425057670172610560,['https://youtu.be/cjdLSJSBMHk'],[],0,,False,0,0,0,,farmers protest,,,,,,,[],,,,
31,1425056360354385920,1425056360354385920,1628594887000.0,2021-08-10 16:58:07,+0530,,"'Congress, TMC's attitude in Rajya Sabha dealt a major blow to democracy': Union Agri Min Narendra Singh Tomar; here's what happened  @nstomar #RajyaSabha #FarmLaws #FarmersProtest    https://t.co/TTVJ6EBRlu",en,"['rajyasabha', 'farmlaws', 'farmersprotest']",[],295693924,295693924,fpjindia,Free Press Journal,2,16,https://twitter.com/fpjindia/status/1425056360354385920,['https://www.freepressjournal.in/india/congress-tmcs-attitude-in-rajya-sabha-dealt-a-major-blow-to-democracy-union-agri-min-narendra-singh-tomar-heres-what-happened'],[],0,,False,0,0,0,,farmers protest,,,,,,,[],,,,
32,1425055959815127045,1425055959815127045,1628594791000.0,2021-08-10 16:56:31,+0530,,ವಿದ್ಯುತ್ ಖಾಸಗೀಕರಣ ವಿರೋಧಿಸಿ ರೈತರಿಂದ ಅರೆಬೆತ್ತಲೆ ಪ್ರತಿಭಟನೆ  #Belagavi #Bengaluru #FarmersProtest #ElectricityBill   https://t.co/ds548AKMnF,kn,"['belagavi', 'bengaluru', 'farmersprotest', 'electricitybill']",[],145540592,145540592,tv9kannada,TV9 Kannada,2,16,https://twitter.com/tv9kannada/status/1425055959815127045,['https://tv9kannada.com/karnataka/belagavi/bengaluru-and-belagavi-farmers-protest-opposing-privatisation-of-electricity-and-its-amendment-bill-2021-ggd-254188.html'],[],0,,False,19,3,1,,farmers protest,,,,,,,[],,,,
33,1425054363202985984,1425054363202985984,1628594411000.0,2021-08-10 16:50:11,+0530,,Punjab Congress' Members of Parliament continue their protest at Jantar Mantar against the three anti farmer laws continuously for 246 days.  https://t.co/Ej7DPzeW03,en,[],[],2940723738,2940723738,INCPunjab,Punjab Congress,2,16,https://twitter.com/INCPunjab/status/1425054363202985984,[],['https://pbs.twimg.com/media/E8bPA4-VEAwt9Vs.jpg'],1,https://pbs.twimg.com/media/E8bPA4-VEAwt9Vs.jpg,False,171,3,35,,farmers protest,,,,,,,[],,,,
