,id,date,tweet,hashtags,user_id,username,name,link,urls,nlikes,nretweets,nreplies
14,1409390801440759812,2021-06-28 11:28:46,Farmers; the Anndatas have been sleeping on roads frm past 7 long months Govt. must undrstand that the 3 Farm Bills are NOT IN THE INTEREST of Farmers Farmers won't go back until farm laws repealed. #KisanMareSarkarSoye,['kisanmaresarkarsoye'],3192953702,IYCBihar,Bihar Youth Congress,https://twitter.com/IYCBihar/status/1409390801440759812,[],6,5,2
15,1409390511920615424,2021-06-28 11:27:37,"Farmers in no plans to vacate Delhi protest sites. On one end, farmers hv been getting immense support worldwide. The othr side it is sad but true tht nation's govt. is anti-farmer &amp; in favor of black farm bills which are equal to Death Warrants fr farmers. #KisanMareSarkarSoye",['kisanmaresarkarsoye'],3192953702,IYCBihar,Bihar Youth Congress,https://twitter.com/IYCBihar/status/1409390511920615424,[],12,11,0
16,1409390241052389381,2021-06-28 11:26:33,3 Black Farm Bills cannot be called 'Reforms' Modi Govt. Is just walking ahead to benefit its crony supporters leading to a destruction of farmers' &amp; their livelihoods.? #KisanMareSarkarSoye,['kisanmaresarkarsoye'],3192953702,IYCBihar,Bihar Youth Congress,https://twitter.com/IYCBihar/status/1409390241052389381,[],5,5,0
17,1409390218583502854,2021-06-28 11:26:27,FARMERS WILL WIN DEFINITELY.  The end of the Modi government is near and it will begin with the repeal of the anti agricultural farm bills.  #KisanMareSarkarSoye,['kisanmaresarkarsoye'],3244378314,IYCWestBengal,WB Youth Congress,https://twitter.com/IYCWestBengal/status/1409390218583502854,[],2,2,0
18,1409385528865083392,2021-06-28 11:07:49,Thousands of landless agricultural workers lively hood is also on the stack due to these black bills. They are openly coming in support of farmers protest against the new farm laws.   #KisanMareSarkarSoye,['kisanmaresarkarsoye'],3286501752,DelhiPYC,Delhi Youth Congress,https://twitter.com/DelhiPYC/status/1409385528865083392,[],11,8,0
19,1409385365144670208,2021-06-28 11:07:10,Thousands of landless agricultural workers lively hood is also on the stack due to these black bills. They are openly coming in support of farmers protest against the new farm laws.   #KisanMareSarkarSoye,['kisanmaresarkarsoye'],3244378314,IYCWestBengal,WB Youth Congress,https://twitter.com/IYCWestBengal/status/1409385365144670208,[],4,2,0
