,id,conversation_id,created_at,date,timezone,place,tweet,language,hashtags,cashtags,user_id,user_id_str,username,name,day,hour,link,urls,photos,video,thumbnail,retweet,nlikes,nreplies,nretweets,quote_url,search,near,geo,source,user_rt_id,user_rt,retweet_id,reply_to,retweet_date,translate,trans_src,trans_dest
0,1461824104026320906,1461824104026320906,1637361000000.0,2021-11-20 04:00:00,+0530,,आगामी चुनावों के मद्देनज़र वापस लिए गए कृषि क़ानून: समाजवादी पार्टी   #किसानआंदोलन #किसान #कृषिकानून #नरेंद्रमोदी #सपा #अखिलेशयादव #FarmersProtest #Farmers #FarmLaws #NarendraModi #SP #AkhileshYadav   https://t.co/exx2oPUQXr,hi,"['किसानआंदोलन', 'किसान', 'कृषिकानून', 'नरेंद्रमोदी', 'सपा', 'अखिलेशयादव', 'farmersprotest', 'farmers', 'farmlaws', 'narendramodi', 'sp', 'akhileshyadav']",[],817340591046414336,817340591046414336,thewirehindi,द वायर हिंदी,6,04,https://twitter.com/thewirehindi/status/1461824104026320906,['http://thewirehindi.com/193703/fearing-farmers-modi-govt-is-withdrawing-agriculture-law-akhilesh-yadav/'],[],0,,False,109,0,15,,#farmersprotest,,,,,,,[],,,,
1,1461822347762036736,1461822347762036736,1637360581000.0,2021-11-20 03:53:01,+0530,,#Verified            #FarmersProtest  👉It's 3 am but overnight celebrations continue at Delhi's borders  👉Some LOCALS have kept shops open to celebrate with farmers  👉There is a separate dance floor after every 30 meters  🥳   👇  https://t.co/op6hRgUNk1,en,"['verified', 'farmersprotest']",[],79178279,79178279,saahilmenghani,Saahil Murli Menghani,6,03,https://twitter.com/saahilmenghani/status/1461822347762036736,[],[],1,https://pbs.twimg.com/amplify_video_thumb/1461818375668068354/img/yW6RjGF9YUyAkx1M.jpg,False,1284,14,265,,#farmersprotest,,,,,,,[],,,,
2,1461818013037043718,1461818013037043718,1637359548000.0,2021-11-20 03:35:48,+0530,,"THEY DID IT! The farmers WON. After a year of #farmersprotest- facing tear gas &amp; water cannons &amp; police brutality- India will repeal all 3 farming laws. This is monumental. As a daughter of Sikh farmers, THANK YOU to all who joined in solidarity:  https://t.co/FqPqCV8QTj  https://t.co/sbfzsAxIpT",en,['farmersprotest'],[],187966792,187966792,valariekaur,Valarie Kaur,6,03,https://twitter.com/valariekaur/status/1461818013037043718,['https://justice4women.org/indian-farmers-protest/'],[],1,https://pbs.twimg.com/ext_tw_video_thumb/1461817962931785737/pu/img/pghlxh0kna_eN8g4.jpg,False,33,0,7,,#farmersprotest,,,,,,,[],,,,
3,1461809004330455040,1461809004330455040,1637357400000.0,2021-11-20 03:00:00,+0530,,कृषि कानून को वापस लिए जाने पर सोनिया गांधी ने पीएम पर किया हमला #FarmLaws #FarmersProtest #SoniaGandhi #RE    https://t.co/3CX0LwPPHV,hi,"['farmlaws', 'farmersprotest', 'soniagandhi', 're']",[],42606652,42606652,aajtak,AajTak,6,03,https://twitter.com/aajtak/status/1461809004330455040,['https://www.aajtak.in/india/news/story/congress-president-sonia-gandhi-attacked-modi-government-over-the-decision-to-withdraw-agricultural-laws-ntc-1359646-2021-11-19?fbclid=IwAR35C-bD4Dvjldt9OrohOGuShzRSUP8DZZHiryrkgihL8TBzRMTqHHNco28'],[],0,,False,154,48,14,,#farmersprotest,,,,,,,[],,,,
4,1461808137137274887,1461808137137274887,1637357193000.0,2021-11-20 02:56:33,+0530,,சர்வாதிகாரமே தீர்வு - வேளாண் சட்டங்கள் வாபஸ் குறித்து கங்கனா ரணாவத் ஆவேசம்   https://t.co/2Yl6CVuyyn  #FarmersLaws #KanganaRanaut #FarmersProtest,ta,"['farmerslaws', 'kanganaranaut', 'farmersprotest']",[],128609455,128609455,maalaimalar,Maalai Malar News தமிழ்,6,02,https://twitter.com/maalaimalar/status/1461808137137274887,['https://www.maalaimalar.com/news/national/2021/11/20024430/3208164/Tamil-News-Kangana-Ranaut-reacts-to-farm-laws-repeal.vpf'],[],0,,False,2,0,1,,#farmersprotest,,,,,,,[],,,,
5,1461793908069789701,1461793908069789701,1637353801000.0,2021-11-20 02:00:01,+0530,,Success for the #FarmersProtest would suggest “that a determined opposition to the high-handedness of this government is possible ... that the democratic consent of those most affected by a law is still necessary for it to be made reality.”  https://t.co/ROZctmiyBY,en,['farmersprotest'],[],86478153,86478153,thecaravanindia,The Caravan,6,02,https://twitter.com/thecaravanindia/status/1461793908069789701,['http://bit.ly/3bvA8XS'],[],0,,False,26,0,8,,#farmersprotest,,,,,,,[],,,,
6,1461790814993014787,1461790814993014787,1637353063000.0,2021-11-20 01:47:43,+0530,,This feeling! 🎉🥳🎊 #FarmersProtest  https://t.co/EpMuch4Aso,en,['farmersprotest'],[],71129057,71129057,Monica_Gill1,Monica Gill,6,01,https://twitter.com/Monica_Gill1/status/1461790814993014787,[],[],1,https://pbs.twimg.com/ext_tw_video_thumb/1461790724760895492/pu/img/zudZdO_sj3257lse.jpg,False,407,19,69,,#farmersprotest,,,,,,,[],,,,
7,1461783705987526660,1461783705987526660,1637351368000.0,2021-11-20 01:19:28,+0530,,"Some memories with my proud my farmers  #FarmersProtest  #BJP Bent their knees before kissans ,  #Repeal laws by BJP doesn't means that we forget our martyrs who sacrificed their lives during protest  #Families of the deceased martys still waiting for them , irreparable loss  https://t.co/HVFzvdJcn3",en,"['farmersprotest', 'bjp', 'repeal', 'families']",[],945277073387528193,945277073387528193,sunnynsuijk,Sunny Parihar,6,01,https://twitter.com/sunnynsuijk/status/1461783705987526660,[],[],1,https://pbs.twimg.com/ext_tw_video_thumb/1461782470806806534/pu/img/8rpjS-zSMjgRkBfj.jpg,False,8,1,3,,#farmersprotest,,,,,,,[],,,,
8,1461783047418826763,1461783047418826763,1637351211000.0,2021-11-20 01:16:51,+0530,,At the same time we should also thank all those #journalists who kept on reporting on #FarmersProtest #किसानआंदोलन and were exposing the government .@sakshijoshii .@Saurabh_Unmute .@sandeep_news24 .@abhisar_sharma .@saahilmenghani .@ajitanjum .@umashankarsingh .@rohini_sgh n more,en,"['journalists', 'farmersprotest', 'किसानआंदोलन']",[],118409896,118409896,duttabhishek,Abhishek Dutt (अभिषेक दत्त),6,01,https://twitter.com/duttabhishek/status/1461783047418826763,[],[],0,,False,148,3,23,,#farmersprotest,,,,,,,[],,,,
9,1461778804624400394,1461778804624400394,1637350200000.0,2021-11-20 01:00:00,+0530,,"Archives I The protesting farmers know exactly what the laws are about. They have experienced what the procurement system is good for, what its failings are and what its absence can mean. #FarmersProtest   @HartoshSinghBal writes:  https://t.co/8HRbAhLDKj",en,['farmersprotest'],[],86478153,86478153,thecaravanindia,The Caravan,6,01,https://twitter.com/thecaravanindia/status/1461778804624400394,['http://bit.ly/3r8uYYa'],[],0,,False,19,1,12,,#farmersprotest,,,,,,,[],,,,
10,1461776322938740741,1461776322938740741,1637349608000.0,2021-11-20 00:50:08,+0530,,यहां किसानों को दोहरी राहत- कानून वापसी के ऐलान के बाद प्रशासन ने भी मान ली मांगें  https://t.co/NI9pDSmH7y  #HaryanaHindinews #HisarHindinews #FarmersProtest #FarmLawsRepealed #HansiProtest #  https://t.co/tJgyaGIeOZ,hi,"['haryanahindinews', 'hisarhindinews', 'farmersprotest', 'farmlawsrepealed', 'hansiprotest']",[],80304808,80304808,punjabkesari,Punjab Kesari,6,00,https://twitter.com/punjabkesari/status/1461776322938740741,['https://m.haryana.punjabkesari.in/haryana/news/double-relief-to-farmers-here-after-announcement-of-withdrawal-of-law-1494734?utm_source=twitterbot&utm_medium=social'],['https://pbs.twimg.com/media/FElF0c8WQAYPkqt.jpg'],1,https://pbs.twimg.com/media/FElF0c8WQAYPkqt.jpg,False,12,0,0,,#farmersprotest,,,,,,,[],,,,
11,1461775281014800384,1461775281014800384,1637349360000.0,2021-11-20 00:46:00,+0530,,पोटनिवडणुकांनी सणसणीत कान शेकवल्यामुळे..  शेठजींना ६ राज्यातल्या निवडणुका आठवल्या...  #FarmersProtest #FarmLawsRepealed,mr,"['farmersprotest', 'farmlawsrepealed']",[],1001096800562958337,1001096800562958337,BhaiJagtap1,Bhai Jagtap - भाई जगताप,6,00,https://twitter.com/BhaiJagtap1/status/1461775281014800384,[],[],0,,False,906,14,107,,#farmersprotest,,,,,,,[],,,,
12,1461772871085150209,1461772871085150209,1637348785000.0,2021-11-20 00:36:25,+0530,,ड्रीम गर्ल का योगदान भूल मत जाना.. #FarmLawsRepealed #FarmersProtest  https://t.co/kB9grlgkCr,hi,"['farmlawsrepealed', 'farmersprotest']",[],114984861,114984861,saintkishore,Sanjay Kishore,6,00,https://twitter.com/saintkishore/status/1461772871085150209,[],"['https://pbs.twimg.com/media/FElCrMWUUAIo6Mq.jpg', 'https://pbs.twimg.com/media/FElCrMXVcAAT2Qq.jpg']",1,https://pbs.twimg.com/media/FElCrMWUUAIo6Mq.jpg,False,74,1,4,,#farmersprotest,,,,,,,[],,,,
13,1461771514743767051,1461771514743767051,1637348462000.0,2021-11-20 00:31:02,+0530,,#FarmersProtest #Farmers #farmerswin விவசாயிகளின் ஓராண்டு போராட்டத்துக்கு கிடைத்த வெற்றி: 3 வேளாண் சட்டங்களும் வாபஸ்: பிரதமர் மோடி திடீர் அறிவிப்பு: மக்களிடம் மன்னிப்பு கேட்டார்  https://t.co/YkKjt3C6Cp,ta,"['farmersprotest', 'farmers', 'farmerswin']",[],107337499,107337499,DinakaranNews,Dinakaran,6,00,https://twitter.com/DinakaranNews/status/1461771514743767051,['https://www.dinakaran.com/news_detail.asp?Nid=721103'],[],0,,False,9,3,3,,#farmersprotest,,,,,,,[],,,,
14,1461769495253454851,1461769495253454851,1637347980000.0,2021-11-20 00:23:00,+0530,,"Explained: How will repeal of farm laws impact UP, Punjab polls?   https://t.co/yyOsXm6xqE #FarmersProtest",en,['farmersprotest'],[],18159588,18159588,Oneindia,Oneindia News,6,00,https://twitter.com/Oneindia/status/1461769495253454851,['http://www.oneindia.com/india/explained-how-will-repeal-of-farm-laws-impact-up-punjab-polls-3337915.html'],[],0,,False,0,0,0,,#farmersprotest,,,,,,,[],,,,
15,1461768197846228996,1461768197846228996,1637347671000.0,2021-11-20 00:17:51,+0530,,ቀዳማይ ሚኒስተር ህንዲ ናረንድራ ሞዲ፡ ሎሚ ዓርቢ ብቴለቪዥን እታ ሃገር ኣብ ዝሃብዎ ሓበሬታ፡ መንግስቶም ነቲ ሰፊሕ ተቓውሞ ዘኸተለ ሕጊ ሕርሻ ክስርዞ ምዃኑ ኣመልኪቶም።  https://t.co/zQea4wc96A #India #FarmersProtest,am,"['india', 'farmersprotest']",[],1219557044,1219557044,VOATigrigna,VOA Tigrigna,6,00,https://twitter.com/VOATigrigna/status/1461768197846228996,['https://bit.ly/3FA8CW6'],[],0,,False,1,0,0,,#farmersprotest,,,,,,,[],,,,
16,1461768018351034372,1461768018351034372,1637347628000.0,2021-11-20 00:17:08,+0530,,"The hopeful repeal of the farm laws is not a gift Indian farmers were given.  It’s a victory, that farmers across India worked tirelessly and peacefully to achieve.  Let's celebrate this victory and honour all the lives lost along the way. #FarmLawsRepealed #FarmersProtest",en,"['farmlawsrepealed', 'farmersprotest']",[],626138330,626138330,GurratanSingh,Gurratan Singh,6,00,https://twitter.com/GurratanSingh/status/1461768018351034372,[],[],0,,False,94,5,28,,#farmersprotest,,,,,,,[],,,,
17,1461764501414428672,1461764501414428672,1637346790000.0,2021-11-20 00:03:10,+0530,,#மண்டியிட்ட_மோடி #FarmersProtest  🔹Proud to be a part of this historic movement . 🔹The joy is as equal of india getting freedom from British. 🔹When modi ji #FarmLawsRepealed  @RahulGandhi with #Farmers  https://t.co/vCQNDtj7QQ,en,"['மண்டியிட்ட_மோடி', 'farmersprotest', 'farmlawsrepealed', 'farmers']",[],136948674,136948674,Hassan_tnpyc,JMH Aassan Maulaana #NammaVelachery,6,00,https://twitter.com/Hassan_tnpyc/status/1461764501414428672,[],"['https://pbs.twimg.com/media/FEk7CaIVcAAahaK.jpg', 'https://pbs.twimg.com/media/FEk7C5_VcAA_SoM.jpg', 'https://pbs.twimg.com/media/FEk7DdUUYAE3Xz9.jpg', 'https://pbs.twimg.com/media/FEk7D9FVEAM4x5S.jpg']",1,https://pbs.twimg.com/media/FEk7CaIVcAAahaK.jpg,False,50,0,16,,#farmersprotest,,,,,,,[],,,,
18,1461763707688480770,1461763707688480770,1637346600000.0,2021-11-20 00:00:00,+0530,,"Concertina wires, protest songs and tractors. In the last 15 months, India witnessed a protest like none the country had seen. @theotherbose helps us recall the iconic moments from the #FarmersProtest that shook #India.  #FarmLaws #FarmLawsRepealed   https://t.co/ACYNJUOVvv",en,"['farmersprotest', 'india', 'farmlaws', 'farmlawsrepealed']",[],22763833,22763833,Outlookindia,Outlook Magazine,6,00,https://twitter.com/Outlookindia/status/1461763707688480770,['https://www.outlookindia.com/website/story/india-news-of-concertina-wires-and-protest-songs-iconic-moments-from-farmer-agitation-that-shook-india/401655'],[],0,,False,4,0,0,,#farmersprotest,,,,,,,[],,,,
19,1461763705700589583,1461763705700589583,1637346600000.0,2021-11-20 00:00:00,+0530,,"कृषि क़ानून वापस लिए जाने को विपक्ष ने 'सरकार का अहंकार टूटना' बताया, कहा- किसानों की जीत   #किसान #कृषिकानून #नरेंद्रमोदी #किसानआंदोलन #संयुक्तकिसानमोर्चा #विपक्ष #Farmers #FarmLaws #NarendraModi #FarmersProtest #SKM #Opposition   https://t.co/xV7rju9JG3",hi,"['किसान', 'कृषिकानून', 'नरेंद्रमोदी', 'किसानआंदोलन', 'संयुक्तकिसानमोर्चा', 'विपक्ष', 'farmers', 'farmlaws', 'narendramodi', 'farmersprotest', 'skm', 'opposition']",[],817340591046414336,817340591046414336,thewirehindi,द वायर हिंदी,6,00,https://twitter.com/thewirehindi/status/1461763705700589583,['http://thewirehindi.com/193664/three-farm-laws-repealed-opposition-farmers-union-welcome-the-move/'],[],0,,False,91,0,13,,#farmersprotest,,,,,,,[],,,,
20,1461761948899364865,1461761948899364865,1637346181000.0,2021-11-19 23:53:01,+0530,,"Gold standard of flattery! 😂   After labeling farmers as terrorists and khalistanis for so long, this propagandist is thanking PM Narendra Modi for bowing down to them.  Great content here for @TheDeshBhakt, @MnshaP &amp; @newslaundry.  #FarmLawsRepealed #FarmersProtest #FarmLaws",en,"['farmlawsrepealed', 'farmersprotest', 'farmlaws']",[],783980891982790656,783980891982790656,Kanishka183,Kanishka Raj Singh,5,23,https://twitter.com/Kanishka183/status/1461761948899364865,[],[],0,,False,1,0,1,https://twitter.com/AmanChopra_/status/1461716905182568450,#farmersprotest,,,,,,,[],,,,
21,1461761624944128003,1461761624944128003,1637346104000.0,2021-11-19 23:51:44,+0530,,"The farmer, a native of Moradabad in Uttar Pradesh, shows his diary in which he has meticulously maintained details of all the protesters he has befriended in the past one year. #FarmLaws #FarmersProtest   https://t.co/lnlvzkol7k",en,"['farmlaws', 'farmersprotest']",[],19897138,19897138,IndiaToday,IndiaToday,5,23,https://twitter.com/IndiaToday/status/1461761624944128003,['https://www.indiatoday.in/india/story/will-miss-protest-site-which-witnessed-daily-hardship-say-farmers-ghazipur-border-1878792-2021-11-19'],[],0,,False,33,1,5,,#farmersprotest,,,,,,,[],,,,
22,1461758689971367939,1461758689971367939,1637345404000.0,2021-11-19 23:40:04,+0530,,"कानून वापसी पर आया कृषि मंत्री नरेंद्र तोमर का पहला बयान, जानें क्या कहा?  https://t.co/3hMIx47dm1  #AgricultureMinister #NarendraSinghTomar #agriculturelaw #narendramodi #pmmodi #farmersprotest  https://t.co/KSbIbcackV",hi,"['agricultureminister', 'narendrasinghtomar', 'agriculturelaw', 'narendramodi', 'pmmodi', 'farmersprotest']",[],80304808,80304808,punjabkesari,Punjab Kesari,5,23,https://twitter.com/punjabkesari/status/1461758689971367939,['https://m.punjabkesari.in/national/news/narendra-tomar-s-first-statement-came-on-the-return-of-the-law-1494761?utm_source=twitterbot&utm_medium=social'],['https://pbs.twimg.com/media/FEk1yGwVEAM7ncD.jpg'],1,https://pbs.twimg.com/media/FEk1yGwVEAM7ncD.jpg,False,4,1,0,,#farmersprotest,,,,,,,[],,,,
23,1461758412216168449,1461758412216168449,1637345338000.0,2021-11-19 23:38:58,+0530,,"PM Modi scraps three farm laws: Rollback with eye on UP, Punjab polls?   Watch #TTP with @PreetiChoudhry:  https://t.co/znJYXviwQ7 #India #Farmers #FarmLaws #FarmersProtest  https://t.co/BpxJT0Y81K",en,"['ttp', 'india', 'farmers', 'farmlaws', 'farmersprotest']",[],19897138,19897138,IndiaToday,IndiaToday,5,23,https://twitter.com/IndiaToday/status/1461758412216168449,['https://intdy.in/1snvgt'],[],1,https://pbs.twimg.com/amplify_video_thumb/1461750228860784646/img/WRqs5Jl_VGfRVc24.jpg,False,22,3,2,,#farmersprotest,,,,,,,[],,,,
24,1461758259384127488,1461753148259766273,1637345301000.0,2021-11-19 23:38:21,+0530,,Anyway today was worth it. SUCH a good day for India. #Farmers #FarmLawsRepealed #farmlawswithdrawn #FarmersProtest,en,"['farmers', 'farmlawsrepealed', 'farmlawswithdrawn', 'farmersprotest']",[],16343811,16343811,poojadesaid,Pooja Desai,5,23,https://twitter.com/poojadesaid/status/1461758259384127488,[],[],0,,False,2,0,0,,#farmersprotest,,,,,,,[],,,,
25,1461757248904908800,1461757248904908800,1637345060000.0,2021-11-19 23:34:20,+0530,,"#SocialList में आज - -कृषि कानून वापस, सरकार पर गुस्सा समर्थक #FarmersProtest  #FarmLawsRepealed  -शराबियों पर भरोसे का ऐसा नज़ारा देखा कभी? -पुजारी से गिरी मूर्ति, अस्पताल जा पहुंचे -भारतीय पक्षियों में दिलचस्पी रखने वालों का ठिकाना @ktakshish   https://t.co/pfCwFhLDj0",hi,"['sociallist', 'farmersprotest', 'farmlawsrepealed']",[],4057311554,4057311554,TheLallantop,The Lallantop,5,23,https://twitter.com/TheLallantop/status/1461757248904908800,['https://www.thelallantop.com/videos/farm-laws-repealed-by-pm-modi-how-social-media-reacts-on-this-news-discussed-in-social-list/'],[],0,,False,139,5,17,,#farmersprotest,,,,,,,[],,,,
26,1461753890311790593,1461753890311790593,1637344260000.0,2021-11-19 23:21:00,+0530,,"किसान आंदोलन ख़त्म होता नहीं दिख रहा. मोदी जी के इस फ़ैसले से ऐसे अराजनैतिक जन आंदोलन कम होंगे या उनमें पीएम के फ़ैसले ने नया जोश भर दिया है, जवाब आपका, सबसे अहम है लोकतंत्र में जन भावना का सम्मान लेकिन वह भी न्याय से परे नहीं.#FarmLawsRepealed  #Farmlaw #Farmlaw #FarmersProtest",hi,"['farmlawsrepealed', 'farmlaw', 'farmlaw', 'farmersprotest']",[],249174455,249174455,priyadarshibbc,राजेश प्रियदर्शी Rajesh Priyadarshi,5,23,https://twitter.com/priyadarshibbc/status/1461753890311790593,[],[],0,,False,19,1,1,,#farmersprotest,,,,,,,[],,,,
27,1461750934925557766,1461750934925557766,1637343555000.0,2021-11-19 23:09:15,+0530,,#IndiaChahtaHai 8pm (Friday 19/11/21) @ABPNews #FarmLaws #FarmLawsRepealed #FarmersProtest #Krishikanoon #PMModiSpeech #rakeshtikait #Tikait #Farmers मेरी राय से ज़्यादातर लोग सहमत हैं कि पीएम के कृषि कानून वापस लेने के बाद किसानों को भी आंदोलन वापस ले लेना चाहिये! 👇,hi,"['indiachahtahai', 'farmlaws', 'farmlawsrepealed', 'farmersprotest', 'krishikanoon', 'pmmodispeech', 'rakeshtikait', 'tikait', 'farmers']",[],71815077,71815077,awasthis,Sumit Awasthi,5,23,https://twitter.com/awasthis/status/1461750934925557766,[],[],0,,False,39,12,4,https://twitter.com/ABPNews/status/1461718579938676736,#farmersprotest,,,,,,,[],,,,
28,1461750875731365892,1461750875731365892,1637343541000.0,2021-11-19 23:09:01,+0530,,"ಕೃಷಿ ಕಾಯ್ದೆ ವಾಪಸ್ ಕೇಂದ್ರ ಸರ್ಕಾರಕ್ಕೆ ಆದ ಹಿನ್ನಡೆ, ಇದರ ಹಿಂದಿದೆಯಾ ರಾಜಕೀಯ ಲೆಕ್ಕಾಚಾರ? #FarmLawsRepealed #NarendraModi #FarmersProtest #Farmers   https://t.co/C0fqbK4mlc",kn,"['farmlawsrepealed', 'narendramodi', 'farmersprotest', 'farmers']",[],291585081,291585081,AsianetNewsSN,Asianet Suvarna News,5,23,https://twitter.com/AsianetNewsSN/status/1461750875731365892,['https://kannada.asianetnews.com/video/india-news/pm-modi-repeal-farm-laws-reasons-behind-implications-consequences-ckm-r2tybk'],[],0,,False,5,0,0,,#farmersprotest,,,,,,,[],,,,
29,1461749652659732484,1461749652659732484,1637343249000.0,2021-11-19 23:04:09,+0530,,"“They lathicharged us, tear gassed us, called us Khalistani, and now, just as the election is nearing, Modi decided he cares? I don’t buy it,"" says Mukhtyar Singh, a farmer.  #GroundReport by @NidhiSuresh_. #FarmersProtest #FarmLawsRepealed    https://t.co/rrn2Z8UB3O",en,"['groundreport', 'farmersprotest', 'farmlawsrepealed']",[],372677761,372677761,newslaundry,newslaundry,5,23,https://twitter.com/newslaundry/status/1461749652659732484,['https://www.newslaundry.com/2021/11/19/not-pms-care-but-poll-pressure-say-farm-protesters'],[],0,,False,213,4,61,,#farmersprotest,,,,,,,[],,,,
30,1461749637388267520,1461749637388267520,1637343246000.0,2021-11-19 23:04:06,+0530,,पंजाबी सिंगर #JassBajwa ने कृषि कानून वापस लेने पर क्या कहा? सुनिए  सब्सक्राइब करें #TimesNowNavbharat 👉: https://t.co/ogFsKf9YX1  #FarmLawsRepeal #FarmLaws @Ankit_Tyagi01 #NarendraModi #FarmersProtest  https://t.co/FPJGZr7HWy,hi,"['jassbajwa', 'timesnownavbharat', 'farmlawsrepeal', 'farmlaws', 'narendramodi', 'farmersprotest']",[],927426236137201664,927426236137201664,TNNavbharat,Times Now Navbharat,5,23,https://twitter.com/TNNavbharat/status/1461749637388267520,['https://bit.ly/TNNavbharatYouTube'],[],1,https://pbs.twimg.com/media/FEks6YRUcAABaEJ.jpg,False,9,0,1,,#farmersprotest,,,,,,,[],,,,
31,1461749306629636097,1461749306629636097,1637343167000.0,2021-11-19 23:02:47,+0530,,क्रांति थी इंकलाब था  ट्रैक्टर और ट्विटर दोनों पर सैलाब था   जीत से पहले कैसे पीछे हटते  #FarmersProtest,hi,['farmersprotest'],[],542670106,542670106,neuroayush,Ayush Sharma,5,23,https://twitter.com/neuroayush/status/1461749306629636097,[],[],0,,False,62,0,33,,#farmersprotest,,,,,,,[],,,,
32,1461748925874860033,1461748925874860033,1637343076000.0,2021-11-19 23:01:16,+0530,,ਕਿਸਾਨਾਂ ਦੀਆਂ  ਹੋਰ ਮੁੱਖ ਮੰਗਾਂ ਵੀ ਮੰਨੇ ਮੋਦੀ ਸਰਕਾਰ- ਭਾਰਤ ਭੁਸ਼ਣ ਆਸ਼ੂ  @BB__Ashu |  #PunjabCongress |   #Farmers #FarmersProtest #Farmlawsrepealed  https://t.co/2qH7eRMxv4,pa,"['punjabcongress', 'farmers', 'farmersprotest', 'farmlawsrepealed']",[],2529715724,2529715724,ZeePunjabHH,Zee PHH,5,23,https://twitter.com/ZeePunjabHH/status/1461748925874860033,[],[],1,https://pbs.twimg.com/amplify_video_thumb/1461748768282329088/img/4FjMC0O8VX8ENDPG.jpg,False,4,1,0,,#farmersprotest,,,,,,,[],,,,
33,1461748921441550339,1461748921441550339,1637343075000.0,2021-11-19 23:01:15,+0530,,#IndiaChahtaHai 8pm (Friday 19/11/21) @ABPNews #FarmLaws #FarmLawsRepealed #FarmersProtest #Krishikanoon #PMModiSpeech #rakeshtikait #Tikait #Farmers #AajKaShabad,en,"['indiachahtahai', 'farmlaws', 'farmlawsrepealed', 'farmersprotest', 'krishikanoon', 'pmmodispeech', 'rakeshtikait', 'tikait', 'farmers', 'aajkashabad']",[],71815077,71815077,awasthis,Sumit Awasthi,5,23,https://twitter.com/awasthis/status/1461748921441550339,[],[],0,,False,19,1,5,https://twitter.com/ABPNews/status/1461718230498639876,#farmersprotest,,,,,,,[],,,,
34,1461748823009607680,1461748823009607680,1637343052000.0,2021-11-19 23:00:52,+0530,,#IndiaChahtaHai 8pm (Friday 19/11/21) @ABPNews #FarmLaws #FarmLawsRepealed #FarmersProtest #Krishikanoon #PMModiSpeech #rakeshtikait #Tikait #Farmers #MaskUpIndia,en,"['indiachahtahai', 'farmlaws', 'farmlawsrepealed', 'farmersprotest', 'krishikanoon', 'pmmodispeech', 'rakeshtikait', 'tikait', 'farmers', 'maskupindia']",[],71815077,71815077,awasthis,Sumit Awasthi,5,23,https://twitter.com/awasthis/status/1461748823009607680,[],[],0,,False,16,0,2,https://twitter.com/ABPNews/status/1461715926533885953,#farmersprotest,,,,,,,[],,,,
